title,creator,date,description,aes_subjects,subject,publisher,contributing_departments,series,full_series_and_number,extent,identifier,format_original,type,format,rights,rightsstatement,language,filename,oclc_number,date_created,date_modified,cdm_url,cdmid,contentdm_file_name,contentdm_file_path,objectid
A Demand System Analysis With Emphasis On Container Size Of Fluid Milk,"Stockton, Matthew C.",2005-05,"A Censor Corrected Almost Ideal Demand System (CCAIDS) is used to study the price quantity relationships between white milk, carbonated soft drinks, bottled water, and fruit juice for various container sizes of each.",Livestock Production/Industries; Demand and Price Analysis; Research Methods/ Statistical Methods,Include individual industries including milk; cost benefit; Impact analysis,"University of Idaho, College of Agricultural and Life Sciences, Department of Agricultural Economics and Rural Sociology",Department of Agricultural Economics and Rural Sociology,Agricultural Economic Research Series,Agricultural Economic Research Series no. 05-01,87,aers05-01,document,text,application/pdf,"In Copyright – Educational Use Permitted. Digital reproduction rights assigned to University of Idaho Library by donor/contributing institution/source (as applicable). For more information, please contact University of Idaho Library Special Collections and Archives Department at libspec@uidaho.edu.",http://rightsstatements.org/vocab/InC-EDU/1.0/,eng,,,2020-08-26,2020-08-26,http://cdm17254.contentdm.oclc.org/cdm/ref/collection/agecon/id/0,0,37.pdf,/agecon/image/37.pdf,aers001
Implementing The Strategic Planning Process-A Study Of Pnw Agricultural Cooperatives,"Foltz, John; Feist, Tracey",1996-05,"Corporate America is continually planning. Businesses plan new strategies to capture market share, they analyze the importance of planning for a budget increase or perhaps they work towards increasing their research function. No matter how you look at it, planning is an important element for management to employ. In effect, planning provides the ways and means to prepare for change.",Farm Management; Community/Rural/Urban Development; Agribusiness,Farm corporations; regional development; decision-making,,Department of Agricultural Economics and Rural Sociology,Agricultural Economic Research Series,Agricultural Economic Research Series no. 96-02,40,aers96-02,document,text,application/pdf,"In Copyright – Educational Use Permitted. Digital reproduction rights assigned to University of Idaho Library by donor/contributing institution/source (as applicable). For more information, please contact University of Idaho Library Special Collections and Archives Department at libspec@uidaho.edu.",http://rightsstatements.org/vocab/InC-EDU/1.0/,eng,,,2020-08-26,2020-08-26,http://cdm17254.contentdm.oclc.org/cdm/ref/collection/agecon/id/1,1,131.pdf,/agecon/image/131.pdf,aers002
"A To Z Retained Ownership, Inc. 2000 Year-End Summary",University of Idaho Cooperative Extension System,2000,The primary goal of this educational program is to provide information to cow-calf producers on how their cattle perform through the feeding and carcass grading phases. This report presents the results of the eighth year of the retained ownership program.,Agribusiness ; Livestock Production/Industries; Productivity Analysis,cooperatives; cattle; agricultural productivity,University of Idaho Cooperative Extension System,,Agricultural Economic Extension Series,Agricultural Economic Extension Series no. 00-08,35,aees00-08,document,text,application/pdf,"In Copyright – Educational Use Permitted. Digital reproduction rights assigned to University of Idaho Library by donor/contributing institution/source (as applicable). For more information, please contact University of Idaho Library Special Collections and Archives Department at libspec@uidaho.edu.",http://rightsstatements.org/vocab/InC-EDU/1.0/,eng,,,2020-08-26,2020-08-26,http://cdm17254.contentdm.oclc.org/cdm/ref/collection/agecon/id/2,2,19.pdf,/agecon/image/19.pdf,aers003
"Economic Analysis Of Plans To Further Utilize Local Geothermal Resources In Lava Hot Springs, Idaho","Widner, Lindy; Rafferty, Kevin; Peterson, Steven; Nelson, James R.",2003-11-03,Much of the economic base of the community of Lava Hot Springs is associated with tourism. This tourism is tied to year-round spa activities based on local geothermal resources.,Resource /Energy Economics and Policy; Research Methods/ Statistical Methods; Community/Rural/Urban Development; Public Economics,renewable/non-renewable; natural resources; Impact analysis; regional economics; public finance,"The U.S. Department of Energy through the Idaho State Department of Water Resources-Energy Division, U.S. Economic Development Administration; University of Idaho",Department of Agricultural Economics and Rural Sociology,Agricultural Economic Extension Series,Agricultural Economic Extension Series no. 03-12,34,aees03-12,document,text,application/pdf,"In Copyright – Educational Use Permitted. Digital reproduction rights assigned to University of Idaho Library by donor/contributing institution/source (as applicable). For more information, please contact University of Idaho Library Special Collections and Archives Department at libspec@uidaho.edu.",http://rightsstatements.org/vocab/InC-EDU/1.0/,eng,,,2020-08-26,2020-08-26,http://cdm17254.contentdm.oclc.org/cdm/ref/collection/agecon/id/3,3,382.pdf,/agecon/image/382.pdf,aers004
Winter 2003 Idaho Commodity Outlook,"Patterson, Paul; Gray, Wilson",2003-01,The old marketing adage that 'the cure for high prices is high prices and the cure for low prices is low prices' certainly proved itself this past year in the dry bean markets.,Community/Rural/Urban Development; Crop Production/Industries; Community/Rural/Urban Development; Livestock Production/Industries,regional economics; Includes individual crops/industries; regional economics; Include individual industries including milk,"Department of Agricultural Economics and Rural Sociology, College of Agricultural and Life Sciences, University of Idaho",,Agricultural Economic Extension Series,Agricultural Economic Extension Series no. 03-01,70,aees03-01,document,text,application/pdf,"In Copyright – Educational Use Permitted. Digital reproduction rights assigned to University of Idaho Library by donor/contributing institution/source (as applicable). For more information, please contact University of Idaho Library Special Collections and Archives Department at libspec@uidaho.edu.",http://rightsstatements.org/vocab/InC-EDU/1.0/,eng,,,2020-08-26,2020-08-26,http://cdm17254.contentdm.oclc.org/cdm/ref/collection/agecon/id/4,4,198.pdf,/agecon/image/198.pdf,aers005
January 2000 Idaho Agricultural Outlook,"Rimbey, Neil R.; Patterson, Paul E.; Meyer, Neil L.; Gray, C. Wilson",2000-01,"This report will contain data on Hay Stocks on Farms for Idaho and other states, as of December 1, 1999.",Industrial Organization; Agribusiness ; Crop Production/Industries; Demand and Price Analysis,market economy; agricultural industries; Includes individual crops/industries; supply and demand,Department of Agricultural Economics and Rural Sociology University of Idaho,Department of Agricultural Economics and Rural Sociology,Agricultural Economic Extension Series,Agricultural Economic Extension Series no. 00-03,46,aees00-03,document,text,application/pdf,"In Copyright – Educational Use Permitted. Digital reproduction rights assigned to University of Idaho Library by donor/contributing institution/source (as applicable). For more information, please contact University of Idaho Library Special Collections and Archives Department at libspec@uidaho.edu.",http://rightsstatements.org/vocab/InC-EDU/1.0/,eng,,,2020-08-26,2020-08-26,http://cdm17254.contentdm.oclc.org/cdm/ref/collection/agecon/id/5,5,156.pdf,/agecon/image/156.pdf,aers006
Alternative U.S. Agricultural Policies Implications For Idaho Agriculture,"Meyer, Neil; Smathers, Robert",1990-09,"In the late 1800's, Idaho's economy was devoted mostly to mining and livestock. Demand from the mines and the 'free' forage on public lands encouraged large ranches and itinerant herds of cattle and sheep' Today, agriculture in Idaho has become one of the state's largest industries.",Agricultural and Food Policy; Research Methods/ Statistical Methods; Community/Rural/Urban Development; Production Economics,Agricultural policy; Impact analysis; Regional economics; general agricultural production,University of Idaho,Department Ag. Econ. and Rural Sociology,Agricultural Economic Extension Series,Agricultural Economic Extension Series no. 90-17,27,aees90-17,document,text,application/pdf,"In Copyright – Educational Use Permitted. Digital reproduction rights assigned to University of Idaho Library by donor/contributing institution/source (as applicable). For more information, please contact University of Idaho Library Special Collections and Archives Department at libspec@uidaho.edu.",http://rightsstatements.org/vocab/InC-EDU/1.0/,eng,,,2020-08-26,2020-08-26,http://cdm17254.contentdm.oclc.org/cdm/ref/collection/agecon/id/6,6,280.pdf,/agecon/image/280.pdf,aers007
"A Fiscal Impact Model For Teton County, Idaho: Coping With Growth","Cooke, Stephen",1997-03-24,"Different trends in Teton County, Idaho.",Community/Rural/Urban Development; Public Economics; Research Methods/ Statistical Methods,regional economics; fiscal; tax; models,,Department of Agricultural Economics and Rural Sociology,Agricultural Economic Research Series,Agricultural Economic Research Series no. 97-01,78,aers97-01,document,text,application/pdf,"In Copyright – Educational Use Permitted. Digital reproduction rights assigned to University of Idaho Library by donor/contributing institution/source (as applicable). For more information, please contact University of Idaho Library Special Collections and Archives Department at libspec@uidaho.edu.",http://rightsstatements.org/vocab/InC-EDU/1.0/,eng,,,2020-08-26,2020-08-26,http://cdm17254.contentdm.oclc.org/cdm/ref/collection/agecon/id/7,7,204.pdf,/agecon/image/204.pdf,aers008
"Summary Statistics For A Social Survey And Selected Other Data For Clark County, Idaho","Harp, Aaron",1998-06-18,Data from various sources have been used over the past 3 years for research and cooperative extension work in Clark County. The results of the social survey conducted in 1995 are presented here in the form of frequencies.,Research Methods/ Statistical Methods; Community/Rural/Urban Development; Consumer/Household Economics,survey structure; regional development; panel data; Consumer economics,"Department of Agricultural Economics and Rural Sociology, University of Idaho",,Agricultural Economic Extension Series,Agricultural Economic Extension Series no. 98-08,22,aees98-08,document,text,application/pdf,"In Copyright – Educational Use Permitted. Digital reproduction rights assigned to University of Idaho Library by donor/contributing institution/source (as applicable). For more information, please contact University of Idaho Library Special Collections and Archives Department at libspec@uidaho.edu.",http://rightsstatements.org/vocab/InC-EDU/1.0/,eng,,,2020-08-26,2020-08-26,http://cdm17254.contentdm.oclc.org/cdm/ref/collection/agecon/id/8,8,61.pdf,/agecon/image/61.pdf,aers009
Management Implications For Individual Idaho Wheat Growers,"Prigge, G. Ray",1975,"My topic for today is 'Management Implications for Individual Idaho Wheat Growers'. Dr. Schermerhorn has discussed the future environment that is likely to be faced by Idaho producers and in so doing, has discussed the broader industry-wide implications of various trends which we are now observing in agriculture.",Research Methods/ Statistical Methods; Crop Production/Industries; Marketing; Demand and Price Analysis,Impact analysis; Includes individual crops/industries; marketing; cost benefit,,Department of Agricultural Economics,Agricultural Economic Series,Agricultural Economic Series no. 176,9,aes176,document,text,application/pdf,"In Copyright – Educational Use Permitted. Digital reproduction rights assigned to University of Idaho Library by donor/contributing institution/source (as applicable). For more information, please contact University of Idaho Library Special Collections and Archives Department at libspec@uidaho.edu.",http://rightsstatements.org/vocab/InC-EDU/1.0/,eng,,,2020-08-26,2020-08-26,http://cdm17254.contentdm.oclc.org/cdm/ref/collection/agecon/id/9,9,84.pdf,/agecon/image/84.pdf,aers010
The Role Of Rural Industry In Urban Places In Southeastern Idaho,"Robinson, Hank; Meyer, Neil; Hamilton, Joel; Coupal, Roger",1991-12-17,"The fortunes of Idaho agriculture are effected by decisions made in Boise and Washington D.C. Decisions involving water use, grazing on public lands, the use of pesticides and fertilizers, land set asides, transportation, general economic development policy, and others can profoundly impact Idaho agriculture.",Resource /Energy Economics and Policy; Teaching/Communication/Extension/Profession; Community/Rural/Urban Development; Research Methods/ Statistical Methods,agricultural economics; rural development; Impact analysis; water,,,Agricultural Economic Extension Series,Agricultural Economic Extension Series no. 91-09,9,aees91-09,document,text,application/pdf,"In Copyright – Educational Use Permitted. Digital reproduction rights assigned to University of Idaho Library by donor/contributing institution/source (as applicable). For more information, please contact University of Idaho Library Special Collections and Archives Department at libspec@uidaho.edu.",http://rightsstatements.org/vocab/InC-EDU/1.0/,eng,,,2020-08-26,2020-08-26,http://cdm17254.contentdm.oclc.org/cdm/ref/collection/agecon/id/10,10,17.pdf,/agecon/image/17.pdf,aers011
"Financing Services For Residential, Commercial, And Agricultural Parcels: The Cases Of Kootenai And Bonneville Counties","Leighton, Martha; Meyer, Neil",1999-12,"Governments must obtain revenues to pay for the services they provide. These revenues come from a variety of sources including property taxation, fines and forfeitures levied on local populations, charges for permits or consolidated services, and redistribution of intergovernmental funds.",Public Economics; Consumer/Household Economics; Community/Rural/Urban Development,tax; public finance; income distribution; regional economics,"Department of Agricultural Economics and Rural Sociology, University of Idaho",Department of Agricultural Economics and Rural Sociology,Agricultural Economic Extension Series,Agricultural Economic Extension Series no. 99-19,46,aees99-19,document,text,application/pdf,"In Copyright – Educational Use Permitted. Digital reproduction rights assigned to University of Idaho Library by donor/contributing institution/source (as applicable). For more information, please contact University of Idaho Library Special Collections and Archives Department at libspec@uidaho.edu.",http://rightsstatements.org/vocab/InC-EDU/1.0/,eng,,,2020-08-26,2020-08-26,http://cdm17254.contentdm.oclc.org/cdm/ref/collection/agecon/id/11,11,46.pdf,/agecon/image/46.pdf,aers012
Fall 2001 Idaho Agricultural Outlook,"Gray, C. Wilson; Makus, Larry D.; Meyer, Neil L.; Patterson, Paul E.; Rimbey, Neil R.",2001-11,Idaho Edible Dry Bean Market Situation and Outlook for 2001-02,Research Methods/ Statistical Methods; Crop Production/Industries; Livestock Production/Industries; International Relations/Trade,Impact analysis; Includes individual crops/industries; Include individual industries including milk; trade,"Department of Agricultural Economics and Rural Sociology, College of Agricultural and Life Sciences, University of Idaho",,Agricultural Economic Extension Series,Agricultural Economic Extension Series no. 01-13,54,aees01-13,document,text,application/pdf,"In Copyright – Educational Use Permitted. Digital reproduction rights assigned to University of Idaho Library by donor/contributing institution/source (as applicable). For more information, please contact University of Idaho Library Special Collections and Archives Department at libspec@uidaho.edu.",http://rightsstatements.org/vocab/InC-EDU/1.0/,eng,,,2020-08-26,2020-08-26,http://cdm17254.contentdm.oclc.org/cdm/ref/collection/agecon/id/12,12,132.pdf,/agecon/image/132.pdf,aers013
"The Economics Of Natural, Free-Range Chicken Production In Idaho","Nelson, James R.; Smathers, Robert L.; Peterson, Steven",2003-08-11,"There seems to be a growing demand for 'natural' food products in Idaho, and elsewhere in the nation. Farmers markets and special 'natural' and organic food stores are prospering. Chain supermarkets are handling more and more 'natural' and organic items, and in some cases are opening special 'natural' and organic areas in their stores.",Livestock Production/Industries; Research Methods/ Statistical Methods; Community/Rural/Urban Development; Livestock Production/Industries,Include individual industries including milk; Impact analysis; regional economics; Include individual industries including milk,"College of Agricultural and Life Sciences, University of Idaho",Department of Agricultural Economics and Rural Sociology,Agricultural Economic Extension Series,Agricultural Economic Extension Series no. 03-09,10,aees03-09,document,text,application/pdf,"In Copyright – Educational Use Permitted. Digital reproduction rights assigned to University of Idaho Library by donor/contributing institution/source (as applicable). For more information, please contact University of Idaho Library Special Collections and Archives Department at libspec@uidaho.edu.",http://rightsstatements.org/vocab/InC-EDU/1.0/,eng,,,2020-08-26,2020-08-26,http://cdm17254.contentdm.oclc.org/cdm/ref/collection/agecon/id/13,13,334.pdf,/agecon/image/334.pdf,aers014
Break-Even Analysis,"Prigge, G. Ray",1977,Break-Even Analysis Cost of Operating A 12-Foot Swather vs. Custom Hire,Farm Management; Industrial Organization; Agricultural Finance,production costs; cost structures; farm finance; farm income,,,Agricultural Economic Extension Series,Agricultural Economic Extension Series no. 328,8,aees328,document,text,application/pdf,"In Copyright – Educational Use Permitted. Digital reproduction rights assigned to University of Idaho Library by donor/contributing institution/source (as applicable). For more information, please contact University of Idaho Library Special Collections and Archives Department at libspec@uidaho.edu.",http://rightsstatements.org/vocab/InC-EDU/1.0/,eng,,,2020-08-26,2020-08-26,http://cdm17254.contentdm.oclc.org/cdm/ref/collection/agecon/id/14,14,183.pdf,/agecon/image/183.pdf,aers015
1998 Crop Input Costs Summary For Idaho,"Patterson, Paul E.; Smathers, Robert L.",1999-01,"The objective of this publication is to provide producers, lenders, agribusinesses and University of Idaho researchers and Extension personnel with information needed to develop or modify traditional or alternative cost of production estimates. This publication contains operating input costs used in the production of crops in Idaho.",Demand and Price Analysis; Risk and Uncertainty; Teaching/Communication/Extension/Profession,cost benefit; agricultural economics; supply and demand; Probability,"Department of Agricultural Economics and Rural Sociology, University of Idaho",,Agricultural Economic Extension Series,Agricultural Economic Extension Series no. 99-03,17,aees99-03,document,text,application/pdf,"In Copyright – Educational Use Permitted. Digital reproduction rights assigned to University of Idaho Library by donor/contributing institution/source (as applicable). For more information, please contact University of Idaho Library Special Collections and Archives Department at libspec@uidaho.edu.",http://rightsstatements.org/vocab/InC-EDU/1.0/,eng,,,2020-08-26,2020-08-26,http://cdm17254.contentdm.oclc.org/cdm/ref/collection/agecon/id/15,15,161.pdf,/agecon/image/161.pdf,aers016
The 1996 One Percent Initiative Idaho Public School Override Levies Redistributed,"Cooke, Stephen",1996-10,What would happen to Idaho's public school funding if current local school money ($228 million) were returned to the school districts through the state funding formula? This is one of the questions facing the Idaho legislature from the 1996 One Percent Initiative if the state becomes responsible for all public school support. This study addresses that question.,Public Economics; Community/Rural/Urban Development; Demand and Price Analysis; Labor and Human Capital,schools; public finance; regional economics; elasticities; education,University of Idaho College of Agriculture,Department of Agricultural Economics and Rural Sociology,Agricultural Economic Research Series,Agricultural Economic Research Series no. 96-03,13,aers96-03,document,text,application/pdf,"In Copyright – Educational Use Permitted. Digital reproduction rights assigned to University of Idaho Library by donor/contributing institution/source (as applicable). For more information, please contact University of Idaho Library Special Collections and Archives Department at libspec@uidaho.edu.",http://rightsstatements.org/vocab/InC-EDU/1.0/,eng,,,2020-08-26,2020-08-26,http://cdm17254.contentdm.oclc.org/cdm/ref/collection/agecon/id/16,16,103.pdf,/agecon/image/103.pdf,aers017
Use Of A Computerized Feed Grain Analysis For Farm Business Management Extension Education,"Prigge, G. Ray",1978,A mail-in computerized analysis was used by farmers and others to evaluate the potential .additional returns (or losses) to be obtained by participating in the 1978 Wheat - Feed Program.,Demand and Price Analysis; Teaching/Communication/Extension/Profession,agricultural economics; cost benefit; supply and demand; teaching,,,Agricultural Economic Extension Series,Agricultural Economic Extension Series no. 363,1,aees363,document,text,application/pdf,"In Copyright – Educational Use Permitted. Digital reproduction rights assigned to University of Idaho Library by donor/contributing institution/source (as applicable). For more information, please contact University of Idaho Library Special Collections and Archives Department at libspec@uidaho.edu.",http://rightsstatements.org/vocab/InC-EDU/1.0/,eng,,,2020-08-26,2020-08-26,http://cdm17254.contentdm.oclc.org/cdm/ref/collection/agecon/id/17,17,366.pdf,/agecon/image/366.pdf,aers018
How Idaho Farmers View Agricultural And Food Policy Issues,"Meyer, Neil; Konn, Nancy",1984-10-31,"During May and June 1984, a sample of 1500 Idaho farmers/ranchers were mailed a questionnaire to find out their views on key agricultural and food policy issues that will be discussed and debated when Congress writes a new Agricultural and Food Act in 1985. This publication summarizes all the responses and divides them among farmers with different types of farming operations.",Farm Management; Agricultural and Food Policy; Agribusiness,decision-making; farm planning; Agricultural policy; food policy; agricultural industries,"Department of Agricultural Economics, Agricultural Experiment Station, Cooperative Extension Service, University of Idaho",,Agricultural Economic Extension Series,Agricultural Economic Extension Series no. 391,49,aees391,document,text,application/pdf,"In Copyright – Educational Use Permitted. Digital reproduction rights assigned to University of Idaho Library by donor/contributing institution/source (as applicable). For more information, please contact University of Idaho Library Special Collections and Archives Department at libspec@uidaho.edu.",http://rightsstatements.org/vocab/InC-EDU/1.0/,eng,,,2020-08-26,2020-08-26,http://cdm17254.contentdm.oclc.org/cdm/ref/collection/agecon/id/18,18,228.pdf,/agecon/image/228.pdf,aers019
P 4... Painting A Picture Of The Public Purse Idaho'S 19961% Initiative,"Meyer, N.; Cooke, Steve",1996-09,"When you want to explore the need for an educational program on a public decision important to your community or state, following the seven steps ensures program planning that will increase the likelihood of success.",Teaching/Communication/Extension/Profession,agricultural economics; teaching; writing; universities and colleges,,,Agricultural Economic Extension Series,Agricultural Economic Extension Series no. 96-09,42,aees96-09,document,text,application/pdf,"In Copyright – Educational Use Permitted. Digital reproduction rights assigned to University of Idaho Library by donor/contributing institution/source (as applicable). For more information, please contact University of Idaho Library Special Collections and Archives Department at libspec@uidaho.edu.",http://rightsstatements.org/vocab/InC-EDU/1.0/,eng,,,2020-08-26,2020-08-26,http://cdm17254.contentdm.oclc.org/cdm/ref/collection/agecon/id/19,19,267.pdf,/agecon/image/267.pdf,aers020
