title,creator,date,description,aes_subjects,subject,publisher,contributing_departments,series,full_series_and_number,extent,identifier,format_original,type,format,rights,rightsstatement,language,filename,oclc_number,date_created,date_modified,cdm_url,cdmid,contentdm_file_name,contentdm_file_path,objectid
2003-04 Long Range Planning Prices For Idaho Crops & Livestock,"Patterson, Paul E.; Gray, C. Wilson; Rimbey, Neil R.",2003-12,"Commodity prices can vary significantly within the marketing year as well as between years. Prices for many agricultural commodities tend to be lowest at harvest and strengthen throughout the year as the temporary imbalance between supply and demand changes. Some commodities follow well-established seasonal price patterns, while others are less predictable, more volatile and vary significantly from year-to-year as well as throughout the marketing year.",Farm Management; Crop Production/Industries; Livestock Production/Industries; Demand and Price Analysis,production costs; Includes individual crops/industries; Include individual industries including milk; price theory,"Department of Agricultural Economics and Rural Sociology, College of Agricultural and Life Sciences, University of Idaho",Department of Agricultural Economics and Rural Sociology,Agricultural Economic Extension Series,Agricultural Economic Extension Series no. 03-14,13,aees03-14,document,text,application/pdf,"In Copyright – Educational Use Permitted. Digital reproduction rights assigned to University of Idaho Library by donor/contributing institution/source (as applicable). For more information, please contact University of Idaho Library Special Collections and Archives Department at libspec@uidaho.edu.",http://rightsstatements.org/vocab/InC-EDU/1.0/,eng,,,2020-08-26,2020-08-26,http://cdm17254.contentdm.oclc.org/cdm/ref/collection/agecon/id/291,291,99.pdf,/agecon/image/99.pdf,aers292
2006-07 Long Range Planning Prices For Idaho Crops & Livestock,"Patterson, Paul E.; Gray, C. Wilson; Rimbey, Neil R.",2006-10,Commodity prices can vary significantly within the marketing year as well as between years. Prices for many agricultural commodities tend to be lowest at harvest and strengthen throughout the -year as the temporary imbalance between supply and demand changes.,Farm Management; Crop Production/Industries; Livestock Production/Industries; Demand and Price Analysis,production costs; Includes individual crops/industries; Include individual industries including milk; price theory; prices,"Department of Agricultural Economics and Rural Sociology, College of Agricultural and Life Sciences, University of Idaho",Department of Agricultural Economics and Rural Sociology,Agricultural Economic Extension Series,Agricultural Economic Extension Series no. 06-03,16,aees06-03,document,text,application/pdf,"In Copyright – Educational Use Permitted. Digital reproduction rights assigned to University of Idaho Library by donor/contributing institution/source (as applicable). For more information, please contact University of Idaho Library Special Collections and Archives Department at libspec@uidaho.edu.",http://rightsstatements.org/vocab/InC-EDU/1.0/,eng,,,2020-08-26,2020-08-26,http://cdm17254.contentdm.oclc.org/cdm/ref/collection/agecon/id/292,292,249.pdf,/agecon/image/249.pdf,aers293
2005-06 Long Range Planning Prices For Idaho Crops & Livestock,"Patterson, Paul E.; Gray, C. Wilson; Rimbey, Neil R.",2005-12,Commodity prices can vary significantly within the marketing year as well as between years.,Farm Management; Crop Production/Industries; Livestock Production/Industries; Demand and Price Analysis,production costs; Includes individual crops/industries; Include individual industries including milk; price theory; prices,"Department of Agricultural Economics and Rural Sociology, College of Agricultural and Life Sciences, University of Idaho",Department of Agricultural Economics and Rural Sociology,Agricultural Economic Extension Series,Agricultural Economic Extension Series no. 05-05,13,aees05-05,document,text,application/pdf,"In Copyright – Educational Use Permitted. Digital reproduction rights assigned to University of Idaho Library by donor/contributing institution/source (as applicable). For more information, please contact University of Idaho Library Special Collections and Archives Department at libspec@uidaho.edu.",http://rightsstatements.org/vocab/InC-EDU/1.0/,eng,,,2020-08-26,2020-08-26,http://cdm17254.contentdm.oclc.org/cdm/ref/collection/agecon/id/293,293,168.pdf,/agecon/image/168.pdf,aers294
The Role Of Agriculture And Other Natural Resource-Base Industries In Idaho'S Economy,"Robinson, Hank; Coupal, Roger; Meyer, Neil; Harris, Charles",1991-06-19,"In this bulletin the roles of key natural resource-based industries in Idaho's economy are evaluated. These sectors include agriculture, food processing, timber, recreation, and mining.",Resource /Energy Economics and Policy; Land Economics/Use; Production Economics,natural resources; land management; land use; general agricultural production,,,Agricultural Economic Extension Series,Agricultural Economic Extension Series no. 91-04,15,aees91-04,document,text,application/pdf,"In Copyright – Educational Use Permitted. Digital reproduction rights assigned to University of Idaho Library by donor/contributing institution/source (as applicable). For more information, please contact University of Idaho Library Special Collections and Archives Department at libspec@uidaho.edu.",http://rightsstatements.org/vocab/InC-EDU/1.0/,eng,,,2020-08-26,2020-08-26,http://cdm17254.contentdm.oclc.org/cdm/ref/collection/agecon/id/294,294,146.pdf,/agecon/image/146.pdf,aers295
Can Farmers Survive The Federal Farm Security Act?',"Michalson, Edgar L.",1994-02,"The title raises an interesting question that has several ramifications. First, how many farmers can afford to leave the farm program given the current unstable level of commodity prices? In the 1990 Food Security Act (FSA) all the economic benefits of the federal farm program are linked to conservation compliance. It seems more realistic to approach the topic of FSA survival by looking at the costs and benefits of participation. To do this the short-run and long-run economic impacts both on and off the farm have to be evaluated. FSA attempts to reduce the economic and environmental impacts of erosion by requiring farmers to use approved conservation practices on highly erodible lands. The way chosen to do this is to tie the farm program benefits to the use of a Soil Conservation Service approved conservation plan. The carrot used to make the pill easier to swallow is continuation of farm program benefits. The stick or penalty is the loss of all farm program benefits.",Agricultural and Food Policy; Demand and Price Analysis; Research Methods/ Statistical Methods; Land Economics/Use,Agricultural policy; cost benefit; panel data; land management,University of Idaho College of Agriculture,Department of Agricultural Economics,Agricultural Economic Research Series,Agricultural Economic Research Series no. 94-02,10,aers94-02,document,text,application/pdf,"In Copyright – Educational Use Permitted. Digital reproduction rights assigned to University of Idaho Library by donor/contributing institution/source (as applicable). For more information, please contact University of Idaho Library Special Collections and Archives Department at libspec@uidaho.edu.",http://rightsstatements.org/vocab/InC-EDU/1.0/,eng,,,2020-08-26,2020-08-26,http://cdm17254.contentdm.oclc.org/cdm/ref/collection/agecon/id/295,295,115.pdf,/agecon/image/115.pdf,aers296
Factors Influencing The Economic Impacts Of Establishing A Utility Grade For Wheat In The Pnw Region,"Foltz, John; Makus, Larry; Kropf, Jurgen",1995-06,Pacific Northwest grain firms were surveyed regarding a utility wheat grade. Respondents indicated less effort should be given to establishing a utility wheat grade relative to reducing unfair trade and other methods of improving service to importers. Smaller and very large operations felt they would incur significant problems with the program.,Productivity Analysis; Research Methods/ Statistical Methods; Community/Rural/Urban Development; Agricultural and Food Policy,agricultural productivity; Impact analysis; regional economics; Agricultural policy,,Department of Agricultural Economics and Rural Sociology,Agricultural Economic Research Series,Agricultural Economic Research Series no. 95-06,16,aers95-06,document,text,application/pdf,"In Copyright – Educational Use Permitted. Digital reproduction rights assigned to University of Idaho Library by donor/contributing institution/source (as applicable). For more information, please contact University of Idaho Library Special Collections and Archives Department at libspec@uidaho.edu.",http://rightsstatements.org/vocab/InC-EDU/1.0/,eng,,,2020-08-26,2020-08-26,http://cdm17254.contentdm.oclc.org/cdm/ref/collection/agecon/id/296,296,26.pdf,/agecon/image/26.pdf,aers297
An Economic Analysis Of U.S. Tariffs On Canadian Lumber Imports,"Wright, Khaliela S.",2002,The objective of this paper is to present a theoretical and empirical analysis of the effect that the new tariffs on Canadian lumber imports have had on the North American economies.,International Relations/Trade; Resource /Energy Economics and Policy; Demand and Price Analysis,tariffs; forests; cost benefit,"University of Idaho, College of Agricultural and Life Sciences, Department of Agricultural Economics and Rural Sociology",Department of Agricultural Economics and Rural Sociology,Agricultural Economic Research Series,Agricultural Economic Research Series no. 02-04,28,aers02-04,document,text,application/pdf,"In Copyright – Educational Use Permitted. Digital reproduction rights assigned to University of Idaho Library by donor/contributing institution/source (as applicable). For more information, please contact University of Idaho Library Special Collections and Archives Department at libspec@uidaho.edu.",http://rightsstatements.org/vocab/InC-EDU/1.0/,eng,,,2020-08-26,2020-08-26,http://cdm17254.contentdm.oclc.org/cdm/ref/collection/agecon/id/297,297,32.pdf,/agecon/image/32.pdf,aers298
Idaho Agricultural Outlook,"Nelson, James R.; Mitchell, John W.; Meyer, Neil L.; Guenthner, Joseph F.; Makus, Larry D.; Gray, C. Wilson; Patterson, Paul E.; Rimbey, Neil R.",1996,Agriculture is a critical part of the economic base of the State of Idaho.,Demand and Price Analysis; International Relations/Trade; Agribusiness ; Agricultural and Food Policy,Agricultural policy; agricultural industries; comparative advantage; cost benefit; supply and demand,"University of Idaho Cooperative Extension System, College of Agriculture",Department of Agricultural Economics and Rural Sociology,Agricultural Economic Extension Series,Agricultural Economic Extension Series no. 95-06,40,aees95-06,document,text,application/pdf,"In Copyright – Educational Use Permitted. Digital reproduction rights assigned to University of Idaho Library by donor/contributing institution/source (as applicable). For more information, please contact University of Idaho Library Special Collections and Archives Department at libspec@uidaho.edu.",http://rightsstatements.org/vocab/InC-EDU/1.0/,eng,,,2020-08-26,2020-08-26,http://cdm17254.contentdm.oclc.org/cdm/ref/collection/agecon/id/298,298,390.pdf,/agecon/image/390.pdf,aers299
A Brief Overview Of The Agricultural Labor Situation In Idaho,"Nelson, James R.",1990-07,"In the following pages of this paper some general information about Idaho crop agriculture is presented, including information about the various agricultural regions of the state, the commodities generally produced in these regions, and some discussion regarding the use of irrigation in each region.",Farm Management; Productivity Analysis; Land Economics/Use; Productivity Analysis,agricultural labor; agricultural productivity; irrigation; agricultural productivity,University of Idaho,Dept. Ag. Econ and Rural Sociology,Agricultural Economic Extension Series,Agricultural Economic Extension Series no. 90-15,14,aees90-15,document,text,application/pdf,"In Copyright – Educational Use Permitted. Digital reproduction rights assigned to University of Idaho Library by donor/contributing institution/source (as applicable). For more information, please contact University of Idaho Library Special Collections and Archives Department at libspec@uidaho.edu.",http://rightsstatements.org/vocab/InC-EDU/1.0/,eng,,,2020-08-26,2020-08-26,http://cdm17254.contentdm.oclc.org/cdm/ref/collection/agecon/id/299,299,65.pdf,/agecon/image/65.pdf,aers300
"Economic Analysis Health Care Alternatives Fremont County, Idaho","Meyer, Neil L.",1979,"Based on the population information made available, the following is an estimate of the potential physicians, nurse practitioners and hospital beds that Fremont County Idaho could support on a fee for service basis.",Health Economics and Policy; Demand and Price Analysis,cost benefit; Health; medical,University of Idaho,,Agricultural Economic Extension Series,Agricultural Economic Extension Series no. 355,9,aees355,document,text,application/pdf,"In Copyright – Educational Use Permitted. Digital reproduction rights assigned to University of Idaho Library by donor/contributing institution/source (as applicable). For more information, please contact University of Idaho Library Special Collections and Archives Department at libspec@uidaho.edu.",http://rightsstatements.org/vocab/InC-EDU/1.0/,eng,,,2020-08-26,2020-08-26,http://cdm17254.contentdm.oclc.org/cdm/ref/collection/agecon/id/300,300,246.pdf,/agecon/image/246.pdf,aers301
What Is Management?,"Early, John O.",1970,"In summing up the definitions, management can be defined for our purposes as the acts or art in the use of techniques to accomplish the goals of a particular business.",Marketing; Teaching/Communication/Extension/Profession,marketing; teaching; writing; extension,The University of Idaho,,Agricultural Economic Extension Series,Agricultural Economic Extension Series no. 105,5,aees105,document,text,application/pdf,"In Copyright – Educational Use Permitted. Digital reproduction rights assigned to University of Idaho Library by donor/contributing institution/source (as applicable). For more information, please contact University of Idaho Library Special Collections and Archives Department at libspec@uidaho.edu.",http://rightsstatements.org/vocab/InC-EDU/1.0/,eng,,,2020-08-26,2020-08-26,http://cdm17254.contentdm.oclc.org/cdm/ref/collection/agecon/id/301,301,255.pdf,/agecon/image/255.pdf,aers302
"Recent Economic Development Efforts In Benewah County, Idaho","Harp, Aaron J.; Meyer, Neil R.",1999-08-07,"In reviewing the economic development documents concerning St. Maries and Benewah County, one conclusion is obvious: an extraordinary amount of time and energy was expended on development questions over the last ten years. The documents listed in Table 1 are the outcome of these efforts and subject of this review.",Community/Rural/Urban Development; Public Economics,regional economics; public finance; urbanization,,,Agricultural Economic Extension Series,Agricultural Economic Extension Series no. 99-13,6,aees99-13,document,text,application/pdf,"In Copyright – Educational Use Permitted. Digital reproduction rights assigned to University of Idaho Library by donor/contributing institution/source (as applicable). For more information, please contact University of Idaho Library Special Collections and Archives Department at libspec@uidaho.edu.",http://rightsstatements.org/vocab/InC-EDU/1.0/,eng,,,2020-08-26,2020-08-26,http://cdm17254.contentdm.oclc.org/cdm/ref/collection/agecon/id/302,302,327.pdf,/agecon/image/327.pdf,aers303
"Community Economic Analysis Population, Income And Retail Sales Retail Leakage And Trade Area Capture For Elmore, Gooding And Camas Counties Of Idaho","Meyer, Neil; Coupal, Roger; Thomas, Jerry",1990-03,"Checking a community's or county's economic health involves looking at factors which have direct or indirect effects on local economic activity. Among the factors to be examined include trends in income, population, population composition, and retail sales.",Community/Rural/Urban Development; Marketing; Consumer/Household Economics,Regional economics; regional development; retail trade; income,University of Idaho,Department of Ag. Econ and Rural Sociology,Agricultural Economic Extension Series,Agricultural Economic Extension Series no. 90-06,30,aees90-06,document,text,application/pdf,"In Copyright – Educational Use Permitted. Digital reproduction rights assigned to University of Idaho Library by donor/contributing institution/source (as applicable). For more information, please contact University of Idaho Library Special Collections and Archives Department at libspec@uidaho.edu.",http://rightsstatements.org/vocab/InC-EDU/1.0/,eng,,,2020-08-26,2020-08-26,http://cdm17254.contentdm.oclc.org/cdm/ref/collection/agecon/id/303,303,59.pdf,/agecon/image/59.pdf,aers304
"A Social Assessment Of Valley County, Idaho.","Harp, Aaron J.; Thompson, James G.; Guaderrama, Marisa C.; Meyer, Neil L.",2000-10-29,Valley County experiences numerous social and economic changes that are common for rural Idaho counties. Social and economic changes are deeply connected and how communities in Valley County respond to them are determined to a great extent by the social situation.,Community/Rural/Urban Development; Research Methods/ Statistical Methods; Land Economics/Use,regional economics; methodology; Impact analysis; land use,,,Agricultural Economic Extension Series,Agricultural Economic Extension Series no. 00-13,28,aees00-13,document,text,application/pdf,"In Copyright – Educational Use Permitted. Digital reproduction rights assigned to University of Idaho Library by donor/contributing institution/source (as applicable). For more information, please contact University of Idaho Library Special Collections and Archives Department at libspec@uidaho.edu.",http://rightsstatements.org/vocab/InC-EDU/1.0/,eng,,,2020-08-26,2020-08-26,http://cdm17254.contentdm.oclc.org/cdm/ref/collection/agecon/id/304,304,365.pdf,/agecon/image/365.pdf,aers305
Publications And Graduate Theses In Agricultural Economics And Rural Sociology,"Sadeghi, Maria; Cole, Maxine",1993-01-01,"Department of Agricultural Economics and Rural Sociology Current Faculty Members and Areas of Emphasis, Publications, and Graduate Theses",Teaching/Communication/Extension/Profession; Labor and Human Capital,universities and colleges; education,"Department of Agricultural Economics and Rural Sociology, University of Idaho",,Agricultural Economic Extension Series,Agricultural Economic Extension Series no. 94-01,32,aees94-01,document,text,application/pdf,"In Copyright – Educational Use Permitted. Digital reproduction rights assigned to University of Idaho Library by donor/contributing institution/source (as applicable). For more information, please contact University of Idaho Library Special Collections and Archives Department at libspec@uidaho.edu.",http://rightsstatements.org/vocab/InC-EDU/1.0/,eng,,,2020-08-26,2020-08-26,http://cdm17254.contentdm.oclc.org/cdm/ref/collection/agecon/id/305,305,36.pdf,/agecon/image/36.pdf,aers306
Documentation For The Virginia Impact Projections Template,"Engel, Paula M.; Cooke, Stephen C.",1992-03-23,Local government leaders face difficult decisions concerning bow to provide sufficient quantity and quality services demanded by constituents with the lowest possible tax burden.,Research Methods/ Statistical Methods; Public Economics,fiscal; Impact analysis; tax,,Department of Agricultural Economics and Rural Sociology,Agricultural Economic Research Series,Agricultural Economic Research Series no. 92-01,136,aers92-01,document,text,application/pdf,"In Copyright – Educational Use Permitted. Digital reproduction rights assigned to University of Idaho Library by donor/contributing institution/source (as applicable). For more information, please contact University of Idaho Library Special Collections and Archives Department at libspec@uidaho.edu.",http://rightsstatements.org/vocab/InC-EDU/1.0/,eng,,,2020-08-26,2020-08-26,http://cdm17254.contentdm.oclc.org/cdm/ref/collection/agecon/id/306,306,50.pdf,/agecon/image/50.pdf,aers307
Marketing And Management Decisions Under Conditions Of Risk And Uncertainty,"Prigge, G. Ray",1976,Many Idaho farmers are finding it increasingly difficult to obtain a satisfactory return from the production and sale of their crop and livestock products.,Risk and Uncertainty; Marketing; Farm Management,risk management; uncertainty; marketing; farm management,,,Agricultural Economic Extension Series,Agricultural Economic Extension Series no. 325,20,aees325,document,text,application/pdf,"In Copyright – Educational Use Permitted. Digital reproduction rights assigned to University of Idaho Library by donor/contributing institution/source (as applicable). For more information, please contact University of Idaho Library Special Collections and Archives Department at libspec@uidaho.edu.",http://rightsstatements.org/vocab/InC-EDU/1.0/,eng,,,2020-08-26,2020-08-26,http://cdm17254.contentdm.oclc.org/cdm/ref/collection/agecon/id/307,307,9.pdf,/agecon/image/9.pdf,aers308
Painting A Picture Of The Public Purse: Taxing Property To Support Local Services In Extension District I In Idaho,"Cooke, Stephen C.; Meyer, Neil; Engel, Paula",1992-05-27,"Tax Revenues For Public Services in Benewah County, Idaho: 1991",Research Methods/ Statistical Methods; Public Economics,panel data; statistical methods; tax; public finance,,Department of Agricultural Economics and Rural Sociology,Agricultural Economic Extension Series,Agricultural Economic Extension Series no. 92-08,44,aees92-08,document,text,application/pdf,"In Copyright – Educational Use Permitted. Digital reproduction rights assigned to University of Idaho Library by donor/contributing institution/source (as applicable). For more information, please contact University of Idaho Library Special Collections and Archives Department at libspec@uidaho.edu.",http://rightsstatements.org/vocab/InC-EDU/1.0/,eng,,,2020-08-26,2020-08-26,http://cdm17254.contentdm.oclc.org/cdm/ref/collection/agecon/id/308,308,364.pdf,/agecon/image/364.pdf,aers309
Drought Management Strategies For Irrigated Agriculture,"Patterson, Paul E.; Walker, David J.; Hamilton, Joel R.",1982-05-08,"Interest in drought impacts and strategies to minimize these impacts follow a cycle that matches the occurrence of drought. The more severe and widespread the drought, the greater the interest.",Research Methods/ Statistical Methods; Land Economics/Use; Farm Management,Impact analysis; irrigation; decision-making; farm planning,,Department of Agricultural Economics,Agricultural Economic Research Series,Agricultural Economic Research Series no. 242,22,aers242,document,text,application/pdf,"In Copyright – Educational Use Permitted. Digital reproduction rights assigned to University of Idaho Library by donor/contributing institution/source (as applicable). For more information, please contact University of Idaho Library Special Collections and Archives Department at libspec@uidaho.edu.",http://rightsstatements.org/vocab/InC-EDU/1.0/,eng,,,2020-08-26,2020-08-26,http://cdm17254.contentdm.oclc.org/cdm/ref/collection/agecon/id/309,309,155.pdf,/agecon/image/155.pdf,aers310
"The Economic Base Of Idaho, 1993","Coupal, Roger",1997-02,The analysis presented here is a brief description of the economic base for the State of Idaho.,International Development; Research Methods/ Statistical Methods; Resource /Energy Economics and Policy,Economic development; agricultural development; statistical methods; panel data; natural resources,Department of Agricultural Economics and Rural Sociology,,Agricultural Economic Extension Series,Agricultural Economic Extension Series no. 97-02,8,aees97-02,document,text,application/pdf,"In Copyright – Educational Use Permitted. Digital reproduction rights assigned to University of Idaho Library by donor/contributing institution/source (as applicable). For more information, please contact University of Idaho Library Special Collections and Archives Department at libspec@uidaho.edu.",http://rightsstatements.org/vocab/InC-EDU/1.0/,eng,,,2020-08-26,2020-08-26,http://cdm17254.contentdm.oclc.org/cdm/ref/collection/agecon/id/310,310,316.pdf,/agecon/image/316.pdf,aers311
Cattle Market: Current Situation And Outlook,"Gray, C. Wilson",1996-09,The beef industry has had a history of cycles since numbers have been kept on cows.,Demand and Price Analysis; International Relations/Trade; Risk and Uncertainty,Business cycles; supply and demand; Foreign trade; Probability,,,Agricultural Economic Extension Series,Agricultural Economic Extension Series no. 96-10,23,aees96-10,document,text,application/pdf,"In Copyright – Educational Use Permitted. Digital reproduction rights assigned to University of Idaho Library by donor/contributing institution/source (as applicable). For more information, please contact University of Idaho Library Special Collections and Archives Department at libspec@uidaho.edu.",http://rightsstatements.org/vocab/InC-EDU/1.0/,eng,,,2020-08-26,2020-08-26,http://cdm17254.contentdm.oclc.org/cdm/ref/collection/agecon/id/311,311,209.pdf,/agecon/image/209.pdf,aers312
