title,author,reader,creator type,date,subject,description,location,lat long,grade-level,identifier,format,digital specifications,language,rights,standardized rights,type,contributing institution,full text,filename,oclc number,date created,date modified,reference url,cdmid,soundid,soundlink,contentdm file name,contentdm file path,objectid
Emperor Penguins,"Reynolds, Jill",Adrienne Vitullo,Teacher,2016,penguins; Antarctica,informational text about Emperor penguins,,,first,Emperor_Penguin,application/pdf,Born Digital Publication,eng,"Educational use includes non-commercial use of text and images in materials for teaching and research purposes. Digital reproduction rights granted by University of Idaho Library. For other uses beyond educational use, please contact University of Idaho Library Special Collections and Archives Department at libspec@uidaho.edu.",http://rightsstatements.org/vocab/InC-EDU/1.0/,Text,University of Idaho,"Emperor  Penguins  By: Jill Reynolds 2  Table of Contents  What are emperor  Penguins?…………………... 3  What do emperor penguins  look like?.................................4  Where do emperor penguins  live?.........................................7  What do emperor penguins  eat?..........................................9  DO emperor penguins lay  eggs?......................................11  Fun Facts………………….. 16  3  What are  Emperor  Penguins?  Emperor penguins are one of the  largest species of penguins. They  are a type  of bird that  does not  fly. These  penguins  are tough  and can  live in cold  climates.  4  What do emperor  penguins look  like?  Emperor penguins are  the tallest penguins. They  are about 4 feet fall. They  have yellow patches  around the neck and  ears. These penguins  have a thick waterproof  fur that covers their  bodies.  5  Emperor penguins weigh  about 50-100 pounds.  Their black and white fur  help hide them from  their predators.  6  Look at all the different  size of penguins!  7  Where do  Emperor  Penguins live?  Emperor penguins live in  Antarctica in the cold  weather. Their fur helps  keep them warm.  8  Did you know that  penguins travel in packs  to help them keep warm?  They take turns being  warm on the inside of  the circle.  9  What Do Emperor  Penguins Eat?  The emperor penguins eat krill,  squid, and other fish. The  penguins dive deep into the sea  to catch their food. They can  stay underwater for 18 minutes!  Their long and narrow beaks  help them hunt for their food.  10  Did you know that  emperor penguins eat  more than any other type  of penguin?  11  Do Emperor  Penguins Lay  Eggs?  The female penguin lays  one egg every winter.  Soon after, the male  penguin takes the egg and  sets it on his feet and  warms it with the body.  12  Male penguins do not eat  for 70 days when they are  taking care of the baby.  Once the egg hatches, the  female penguin returns  home and feeds and cares  for the chick.  13  The mother penguin has a  special pouch for the  chick between her legs.  This keeps the baby  penguin warm because  they do not have their  warm fur coat.  14  A yearly cycle for  penguins!  15  Baby chicks develop a call  so both parents can  recognize them. In just a  few short months, the  penguins head towards  the ocean and the chicks  are ready to hunt on their  own.  16  Fun Facts:  1. Emperor Penguins are only  found in Antarctica.  2. Colonies consist of thousands  of penguins.  3. They can  live up to  about 20  years old  4. Male  penguins  sleep for 20 hours a day when  they are hatching an egg.  5. They can swim up to 7 miles  per hour, but can only waddle  1.7 miles an hour.  17  Works Referenced  https://www.flickr.com/photos/cmichel67/1  1240188915  https://en.wikipedia.org/wiki/Emperor_pen  guin  http://tomclarkblog.blogspot.com/2011/06/  where-­‐am-­‐i-­‐lost-­‐emperor.html  http://www.joyelonlineshopping.com/pengu  ins/penguins_info.aspx  https://en.wikipedia.org/wiki/Emperor_pen  guin  https://upload.wikimedia.org/wikipedia/co  mmons/thumb/7/72/PENGUIN_LIFECYCLE_H  .JPG/1024px-­‐PENGUIN_LIFECYCLE_H.JPG  http://ourworldsview.com/wp-­‐  content/uploads/2012/08/Emperor-­‐  Penguin-­‐Stock-­‐Photo-­‐%C2%A9-­‐vladsilver-­‐  4194259.jpeg  https://vimeo.com/100761029  https://travelwild.com/resources/antarctica-­‐  18  wildlife/emperor-­‐penguin/  http://www.atozkidsstuff.com/penguins.htm  l  https://en.wikipedia.org/wiki/Emperor_pen  guin  https://pixabay.com/en/penguin-­‐baby-­‐  antarctic-­‐life-­‐animal-­‐429125/  https://www.reddit.com/r/babywildanimals/  comments/1u772g/baby_emperor_penguins  /  http://www.pixcove.com/emperor-­‐  penguins-­‐glacial-­‐life-­‐lifetime-­‐antarctic-­‐  wilderness-­‐animal-­‐physical-­‐natural-­‐ice-­‐  antarctica-­‐wild-­‐frost-­‐cold/  http://kids.nationalgeographic.com/anima  ls/emperor-penguin/#emperor-penguin-group-  snow.jpg  http://www.arkive.org/emperor-penguin/  aptenodytes-forsteri/  http://www.goodwp.com/animals/20032-  penguin-winter-snow-baby-penguins-  19  emperor-penguin.html  https://www.flickr.com/photos/cmichel6  7/11295790956  http://www.penguins-world.com/wp-content/  uploads/Emperor-colony.jpg  http://www.animalfactguide.com/animal-facts/  emperor-penguin/  http://www.penguinworld.com/types/em  peror.html  20  Common Core Standards  CCSS.ELA-LITERACY.RI.1.5  Know and use various text  features (e.g., headings, tables of  contents, glossaries, electronic  menus, icons) to locate key facts  or information in a text.  CCSS.ELA-LITERACY.RI.1.7  Use the illustrations and details in  a text to describe its key ideas.  CCSS.ELA-LITERACY.RI.1.8  Identify the reasons an author  gives to support points in a text.  CCSS.ELA-LITERACY.RI.1.10  With prompting and support, read  informational texts appropriately  complex for grade 1.  21  This e-book and any prints are  released under a CC BY 3.0  license by the author.  This means that you are free to  share, remix, transform, and build  upon this book as long as you give  appropriate credit to the original  author.  Included works (e.g., images and  other media) may have separate  licensing requirements, and this  release does not supersede or replace  those requirements.  This e-book template is provided  under a CC BY 3.0 license by the  22  University of Idaho College of  Education. If you use, share, remix,  or transform this template, you  should include this page at the end  of your book.",,,2016-09-22,2018-05-30,http://digital.lib.uidaho.edu:80/cdm/ref/collection/guidedread/id/215,215,220,221.mp3,216.pdf,/guidedread/image/216.pdf,guidedread024
Energy,"Merritt, Kelsy",Isla Rosewood,Teacher,2014,,Fifth grade level informational text about energy.,,,Fifth,Energy,application/pdf,Born Digital Publication,eng,"Educational use includes non-commercial use of text and images in materials for teaching and research purposes. Digital reproduction rights granted by University of Idaho Library. For other uses beyond educational use, please contact University of Idaho Library Special Collections and Archives Department at libspec@uidaho.edu.",http://rightsstatements.org/vocab/InC-EDU/1.0/,Text,University of Idaho,"1  Energy  By Kelsy Merritt  2  Table of Contents  What is Energy? 3  Potential Energy 4  Kinetic Energy 6  Glossary 8  Questions 9  Works Referenced 11  3  What is Energy?  Energy is the ability to do work. That means that something can move despite another force acting upon it. The force is often always called gravity.  There are different types of energy. These are called Potential Energy and Kinetic Energy. 4  What is Potential Energy?  Potential Energy is energy that is stored. Energy can be stored in many different ways.   Milk sitting in a carton is stored energy   A ball at the top of a throw is stored energy   Water sitting in a lake is stored energy  5  All of these different types of energy would “do work” if they were released.  6  What is Kinetic Energy?  Kinetic Energy is energy in motion. There are many different examples of energy in motion:   A rollercoaster   A car driving down the street   Moving bodies of water  7  Even though you can’t see electricity and the wind, they are moving! These are two more examples of kinetic energy.  8  Glossary  Energy: The ability to do work.  Potential Energy: Energy that is stored.  Kinetic Energy: Energy in motion.  Gravity: A force acting upon objects.  *rolling down a hill is a great example of kinetic energy  9  Questions:  What type of energy is it?  Place an X next to the correct type!  Potential  Kinetic  Driving your car down the street  Sledding down a hill  The water sitting in your cup  A ball at the top of its trajectory  A lake  The wind blowing through the trees  10  Works Referenced  Para (2005). Alternative Energies. Wikipedia. Retrieved from http://en.wikipedia.org/wiki/Renewable_energy. This resource is licensed under a CC BY 3.0 License.  (Used on page 1)  Tomas Fano (2014). Monday running motivation. Stridebox. Retrieved from http://stridebox.com/category/monday-running-motivation/. This resource is licensed under a CC BY-SA 3.0 License.  (Used on page 3)  Daily Mail Reporter (2014). Amazing camera ball lets you capture incredible 360-degree photos. Mail Online. Retrieved from http://www.dailymail.co.uk/news/article-2532221/Amazing-camera-ball-lets-capture-incredible-360-degree-photos-just-THROWING-air.html. This resource is in the public domain.  (Used on page 4)  Shambhala Rollercoaster by Flikr. User Mad Wraith. Use under Creative Commons Attribution 2.0 licensure.  (Used on page 6)  *All other images were released on public domain for reuse  11  Works Referenced Continued  ""Space Environment."" What Is Energy? Web. 8 Dec. 2014. &lt;http://www.qrg.northwestern.edu/projects/vss/docs/space-environment/1-what-is-energy.html&gt;.  Williams, Vallery, and Susan Gilbert. ""Kids Korner - What's It All About?"" Kids Korner - What's It All About? FPL. Web. 8 Dec. 2014. &lt;http://www.fplsafetyworld.com/?ver=kkblue&utilid=fplforkids&id=16168&gt;. 12  Common Core State Standards  RI.5.3 Explain the relationships or interactions between two or more individuals, events, ideas, or concepts in a historical, scientific, or technical text based on specific information in the text.  RI.5.4 Determine the meaning of general academic and domain-specific words and phrases in a text relevant to a grade 5 topic area.  RI.5.7 Draw on information from multiple print or digital sources, demonstrating the ability to locate an answer to a question quickly or to solve a problem.  13  This e-book and any prints are released under a CC BY 3.0 license by the author.  This means that you are free to share, remix, transform, and build upon this book as long as you give appropriate credit to the original author.  Included works (e.g., images and other media) may have separate licensing requirements, and this release does not supersede or replace those requirements.  This e-book template is provided under a CC BY 3.0 license by the University of Idaho College of Education. If you use, share, remix, or transform this template, you should include this page at the end of your book.",,,2015-02-23,2018-05-30,http://digital.lib.uidaho.edu:80/cdm/ref/collection/guidedread/id/162,162,194,195.mp3,163.pdf,/guidedread/image/163.pdf,guidedread025
Exploring Spain,Kate Wold,Adrienne Vitullo,Student,2017,Spain; Spanish,informational text about Spain,,,third,Exploring_Spain,application/pdf,Born Digital Publication,eng,"Educational use includes non-commercial use of text and images in materials for teaching and research purposes. Digital reproduction rights granted by University of Idaho Library. For other uses beyond educational use, please contact University of Idaho Library Special Collections and Archives Department at libspec@uidaho.edu.",http://rightsstatements.org/vocab/InC-EDU/1.0/,Text,University of Idaho,,,,2018-05-30,2018-05-30,http://digital.lib.uidaho.edu:80/cdm/ref/collection/guidedread/id/440,440,882,276.mp3,474.cpd,/guidedread/supp/440/index.pdf,guidedread026
Facts About Bread!,"VanDercar, Aubree",,Teacher,2016,,informational text about bread,,,,Bread,application/pdf,Born Digital Publication,eng,"Educational use includes non-commercial use of text and images in materials for teaching and research purposes. Digital reproduction rights granted by University of Idaho Library. For other uses beyond educational use, please contact University of Idaho Library Special Collections and Archives Department at libspec@uidaho.edu.",http://rightsstatements.org/vocab/InC-EDU/1.0/,Text,University of Idaho,"1  Facts About Bread!  By Aubree VanDercar  2  Table of Contents  Bread 3  How long has it been around? 4  How much bread do we eat? 5  Has it always been just food? 6  Bread in 1997 7  Breaking the Bread 8  The History of Sliced Bread 9  Kinds of Bread 10  Works Referenced 11  Common Core Standards 12  3  Bread  Bread is a favorite food for many, and is part  of the food pyramid as a grain.  There are many different kinds of bread!  (Public domain)  4  How long has it been around?  Bread has been around for thousands of  years. At least 12,000 years ago, Middle  Eastern countries had pita bread. Pita bread  pockets are created by using steam to puff up  the dough!  5  How much bread do we eat?  The average American consumes 53 pounds  of bread per year!  (Public domain)  6  Has it always been just food?  Bread was so important to Egyptians a long,  long time ago that it was used a currency, or  money!  (Public domain)  7  Bread in 1997  Kansas wheat farmers provided enough  wheat to make bread in 1997 to give everyone  on earth six loaves of bread – that’s 36.5  billion loaves of bread!  (Public domain)  8  Breaking the Bread  Bread is a universal sign of peace in many  cultures. It is one of the foods that people  from all sorts of backgrounds eat.  9  The History of Sliced Bread  You can thank a man named Otto  Rohwedder for sliced bread. He invented it in  1928 after working on it for 16 years.  (Public domain)  10  Kinds of Bread  There are over 100 different kinds of bread,  including pumpernickel, sourdough, wheat,  white, and more. What kind is your favorite?  (Public domain)  11  12  Works Referenced  “Who Knew Bread Was So Interesting: The Top 10 Bread Facts  You Probably Didn’t Know”. Damascus Bakeries. Web. 13  December 2015.  http://www.damascusbakery.com/2014/05/15/knew-bread-interesting-  top-10-bread-facts-probably-didnt-know/  “Fun Facts About Bread”. Why Eat Bread. Web. 13 December 2015.  http://whyeatbread.com/resources/fun-facts-about-bread/  “Do you ever wonder about bread? Fun Facts About Bread.”  Gubler, Rea. Southern Utah University. Web. 13 December  2015. https://www.suu.edu/faculty/gubler/pdf/BreadFacts.pdf  Images not under public domain:  ""Nablus souq pita 118 - Aug 2011"" by Guillaume Paumier - Own  work. Licensed under CC BY 3.0 via Commons  “Breaking bread, juice, dinner party, Broadview townhouse, Seattle,  Washington, USA” by Flickr user Wonderlane used under  Creative Commons Attribution 2.0 license  Note: Cover image is listed as public domain.  13  Common Core State  Standards  CCSS.ELA-LITERACY.RI.K.1  With prompting and support, ask and answer questions about key  details in a text.  CCSS.ELA-LITERACY.RI.K.2  With prompting and support, identify the main topic and retell  key details of a text.  CCSS.ELA-LITERACY.RI.K.3  With prompting and support, describe the connection between  two individuals, events, ideas, or pieces of information in a text.  14  This e-book and any prints are released under a CC BY 3.0  license by the author.  This means that you are free to share, remix, transform, and  build upon this book as long as you give appropriate credit to  the original author.  Included works (e.g., images and other media) may have separate  licensing requirements, and this release does not supersede or  replace those requirements.  This e-book template is provided under a CC BY 3.0 license by  the University of Idaho College of Education. If you use, share,  remix, or transform this template, you should include this page at  the end of your book.",,,2016-09-22,2018-05-30,http://digital.lib.uidaho.edu:80/cdm/ref/collection/guidedread/id/253,253,nullo,,254.pdf,/guidedread/image/254.pdf,guidedread027
Faith Ringgold,Jacklyn Himmelberger,Adrienne Vitullo,Student,2017,Faith Ringgold; author; illustrator; artist,informational text about Faith Ringgold,,,fifth,FaithRinggold,application/pdf,Born Digital Publication,eng,"Educational use includes non-commercial use of text and images in materials for teaching and research purposes. Digital reproduction rights granted by University of Idaho Library. For other uses beyond educational use, please contact University of Idaho Library Special Collections and Archives Department at libspec@uidaho.edu.",http://rightsstatements.org/vocab/InC-EDU/1.0/,Text,University of Idaho,,,,2018-05-30,2018-05-30,http://digital.lib.uidaho.edu:80/cdm/ref/collection/guidedread/id/461,461,891,285.mp3,495.cpd,/guidedread/supp/461/index.pdf,guidedread028
Farm Animals,"Allen, Michaela",Isla Rosewood,Teacher,2014,,First grade level informational text about farm animals.,,,First,FarmAnimals,application/pdf,Born Digital Publication,eng,"Educational use includes non-commercial use of text and images in materials for teaching and research purposes. Digital reproduction rights granted by University of Idaho Library. For other uses beyond educational use, please contact University of Idaho Library Special Collections and Archives Department at libspec@uidaho.edu.",http://rightsstatements.org/vocab/InC-EDU/1.0/,Text,University of Idaho,"1  Farm Animals  Michaela Allen  2  Table of Contents  Characteristics of Pigs………………………………………………………………..3  Types of Pigs………………………………………………………………………………7  Taking Care of Pigs……………………………………………………………………..8  Characteristics of Cattle………………………………………………………………9  Types of Cattle…………………………………………………………………………..11  Taking Care of Cattle………………………………………………………………….12  Glossary……………………………………………………………………………….13-14  Works Referenced……………………………………………………………………...15  3  Where do pigs live?  Pigs like to live in fenced in pens with a little barn or hut.  4  What do pigs eat?  Pigs eat just about anything. They like grain, vegetables, grass, and sometimes meat.  5  Mammals  Pigs are mammals, which means that they give birth to live young and have fur or hair on their bodies. Pigs give birth to litters of piglets. Litters are groups of pigs.  6  Different Breeds  There are different breeds of pigs. Breeds is another word for types of animals within the same species. Pigs can be different colors or look a little different but they are still pigs.  7  How do you take care of pigs?  Pigs need food, water, and shelter, or a place to live in order to survive. In the hot summer weather they need water to sit in to keep them cool. Pigs often rest in a mud hole to keep them cool during the summer months.  8  Cattle  What are cattle?  Cattle are similar animals within a group.  Where do cattle live?  Cattle like to live in large fields where they can eat grass. They also like to have barns to keep them out of cold weather.  9  What do cattle eat?  Cattle need food and water to survive. They eat grass, grain, and vegetables. Cattle need grass to help coat their stomachs before they eat grain. They also use the grass when they chew their cud. Cud is food that returns to the mouth from the stomach for more chewing.  10  Types of Cattle  Cow: A cow is a female cow.  Bull: A bull is a male cow.  Heifer: A heifer is a young female cow.  11  How to take care of cattle?  Cattle need food, water, and shelter just like any other animal. In the summer time they also need a cool shaded area so they do not get overheated.  Cattle also like having trees or posts in their pen so they can use them to scratch their backs.  12  Glossary  Barn: A large farm building used to store grain or hay; also can be used as a house for animals.  Ex: The pigs went to sleep in the barn to stay warm.  Mammal: Warm-blooded animals that give birth to live young.  Ex: Pigs and cattle are both mammals.  Litter: The group of young animals that are born to an animal at one time.  Ex: There were seven piglets in the pigs litter.  Breeds: Animals in a species that have similar qualities to that animal, but may look a little different in appearance.  Ex: There are many different breeds of pigs, however a lot of them look similar. 13  Shelter: A place that protects from bad weather or danger.  Ex: When the snow started to fall the shelter kept the cow warm and dry.  Cud: Food that returns from the stomach to the mouth for more chewing.  Ex: The cow had to chew her cud after she ate.  14  Works Referenced  Cattleman's Beef Board. (2014). Explore Beef - Fact Sheets. Retrieved from http://www.explorebeef.org/factsheets.aspx  Lincoln Park Zoo. (2001). Domestic Pig | Animal Fact Sheet | Lincoln Park Zoo. Retrieved from http://www.lpzoo.org/animals/factsheet/domestic-pig  All pictures were either personally taken by me or found on public domain.  15  Common Core State Standards  CCSS.ELA-LITERACY.RI.1.1 Ask and answer questions about key details in a text.  CCSS.ELA-LITERACY.RI.1.2 Identify the main topic and retell key details of a text.  CCSS.ELA-LITERACY.RI.1.3 Describe the connection between two individuals, events, ideas, or pieces of information in a text.  CCSS.ELA-LITERACY.RI.1.4 Ask and answer questions to help determine or clarify the meaning of words and phrases in a text.  CCSS.ELA-LITERACY.RI.1.5 Know and use various text features (e.g., headings, tables of contents, glossaries, electronic menus, icons) to locate key facts or information in a text.  16  This e-book and any prints are released under a CC BY 3.0 license by the author.  This means that you are free to share, remix, transform, and build upon this book as long as you give appropriate credit to the original author.  Included works (e.g., images and other media) may have separate licensing requirements, and this release does not supersede or replace those requirements.  This e-book template is provided under a CC BY 3.0 license by the University of Idaho College of Education. If you use, share, remix, or transform this template, you should include this page at the end of your book.",,,2015-02-23,2018-05-30,http://digital.lib.uidaho.edu:80/cdm/ref/collection/guidedread/id/160,160,187,188.mp3,161.pdf,/guidedread/image/161.pdf,guidedread029
Food Chains,Shelby Bergren,Adrienne Vitullo,Student,2017,Food chains; consumer; producer,informational text about food chains,,,second,FoodChains,application/pdf,Born Digital Publication,eng,"Educational use includes non-commercial use of text and images in materials for teaching and research purposes. Digital reproduction rights granted by University of Idaho Library. For other uses beyond educational use, please contact University of Idaho Library Special Collections and Archives Department at libspec@uidaho.edu.",http://rightsstatements.org/vocab/InC-EDU/1.0/,Text,University of Idaho,,,,2018-05-30,2018-05-30,http://digital.lib.uidaho.edu:80/cdm/ref/collection/guidedread/id/477,477,883,277.mp3,511.cpd,/guidedread/supp/477/index.pdf,guidedread030
Freedom to Read: All You Need to Know About Banned Books,Maria Haase,,Student,2017,banned books; censorship,informational text about banned books,,,third,BannedBooks,application/pdf,Born Digital Publication,eng,"Educational use includes non-commercial use of text and images in materials for teaching and research purposes. Digital reproduction rights granted by University of Idaho Library. For other uses beyond educational use, please contact University of Idaho Library Special Collections and Archives Department at libspec@uidaho.edu.",http://rightsstatements.org/vocab/InC-EDU/1.0/,Text,University of Idaho,,,,2018-05-30,2018-05-30,http://digital.lib.uidaho.edu:80/cdm/ref/collection/guidedread/id/491,491,897,291.mp3,525.cpd,/guidedread/supp/491/index.pdf,guidedread031
George Washington,Kaitlin Bode,Adrienne Vitullo,Student,2017,George Washington; president; America,informational text about George Washington,,,second,GeorgeWashington,application/pdf,Born Digital Publication,eng,"Educational use includes non-commercial use of text and images in materials for teaching and research purposes. Digital reproduction rights granted by University of Idaho Library. For other uses beyond educational use, please contact University of Idaho Library Special Collections and Archives Department at libspec@uidaho.edu.",http://rightsstatements.org/vocab/InC-EDU/1.0/,Text,University of Idaho,,,,2018-05-30,2018-05-30,http://digital.lib.uidaho.edu:80/cdm/ref/collection/guidedread/id/507,507,884,278.mp3,541.cpd,/guidedread/supp/507/index.pdf,guidedread032
