title,author,reader,creator type,date,subject,description,location,lat long,grade-level,identifier,format,digital specifications,language,rights,standardized rights,type,contributing institution,full text,filename,oclc number,date created,date modified,reference url,cdmid,soundid,soundlink,contentdm file name,contentdm file path,objectid
Labrador Retrievers,"Fowers, Brooke",Isla Rosewood,Teacher,2014,,First grade level informational text about dogs .,,,First,LabradorRetrievers,application/pdf,Born Digital Publication,eng,"Educational use includes non-commercial use of text and images in materials for teaching and research purposes. Digital reproduction rights granted by University of Idaho Library. For other uses beyond educational use, please contact University of Idaho Library Special Collections and Archives Department at libspec@uidaho.edu.",http://rightsstatements.org/vocab/InC-EDU/1.0/,Text,University of Idaho,"Labrador Retrievers  Brooke Fowers  “Take your pick: The sunny, smart, and hard-working Labrador Retriever is America's favorite dog.”- Dogtime.com 2  Table of Contents  Introduction  3  History  4  Appearance  5  Temperament  6  Colors of Labs  7  Types of Labs  8-9  Jobs of Labs  10-12  Labs in War  13  Play Time  14  Glossary  15-16  Questions  17 3  Introduction  Labrador Retrievers are also commonly known as “labs”.  Labrador Retrievers got their name from their first job. Their first job was to retrieve fish on the shores of Newfoundland for their owners.  Labrador Retrievers make very good family dogs and they love kids the most. They live to please their owners and love to make them happy.  They love to play and are very athletic dogs.  They are the most popular breed in the United States. 4  History  Labrador Retriever’s were originally called “St. John’s” because they were first found in St. John which is the capital of  Newfoundland in the early  1700’s.  While in Newfoundland, labs spent their days retrieving fist off the shores. In 1880 labs almost become extinct because the government created laws and raised the taxes.  In the 1920s labs came to the United States. The breed became popular after World War II and in the 1920s. 5  Appearance  Labs are large dogs. Their coats are short and very thick. Their coats are also water resistant. This helps them stay warm in cold water and cold  weather. They have  webbed feet as well that help them swim  just like ducks do.  The females and males look a little bit different.  This is what webbed feet look like.  Males  Females  Pounds  65-80  55-70  Height (inches tall)  22.5-24.5  21.5-23.5  These numbers above are just averages. Labs can be smaller or bigger than this. 6  Temperament  Labs are very kind dogs. They are great to be around. They are outgoing and love to have fun. They make great family dogs.  They have a very strong sense of smell that helps them with their daily tasks and their jobs.  They are known for their gentle mouths. Labs do a thing called soft mouth. They can even carry an egg in their mouth without breaking it!  It is known that females can be more independent than males. 7  Colors of Labs  There are three original colors of labs. That is black, yellow and chocolate (brown). They are others as well that a mix of the colors like red, white and charcoal. 8  Types of Labs  There are two types of labs. There are American (left blow) labs which are known for work dogs. Then there are English (right below) labs which are known for show dogs.  English labs are calmer tempered than American dogs. That is why American are used for working and English are used for shows.  9  Types of Labs  You can see the difference between American and English labs below.  American  English  Body  Big, stocky, block like, long chest, very solid,  short bodies from head to tail, runs slower  Skinny body, short chest, long bodies from  head to tail, runs faster  Head  Wide, top of head looks like  square, thicker face, short  muzzle  Skinny head, top of head looks  round, long  muzzle  Neck  Short, thick  Long, skinny  Tail  Thick, straight  Skinny, curls towards the end  Legs  Short  Long  Coat  Thick coat  Thin coat 10  Jobs of Labs  Labs are very smart and have very good noses so they are used for a lot of jobs.  Labs are used for hunting: they flush, point, and retrieve.  Flushing  11  Jobs of Labs  Labs are also used for tracking. When they track they use their nose to find whatever they are trained to find. Some are trained to find hurt people in earth quakes, hurricanes or even a burning house. They are also trained to find bombs or explosives to help keep people safe.  Disabled assistance is another job of labs. They do a lot from helping blind people get around and keeping them safe. Or they help cart people around who cannot walk or need help walking.  12  They also make great therapy dogs. They go into hospitals, retirement homes, nursing homes, and school to help adults and kids to feel better and safe.  Labs also make great friends and buddies for police officers. They stick by the police officers side and keep them safe from any danger. The police officer and its lab go through a lot of training together so they gain a lot of trust with one another.  13  Labs in War  Labs that were in the Vietnam War were the only dogs classified as “military working dogs”. There were 4,000 labs that helped in the Vietnam War. They helped the soldiers find where the enemies and dangers were. They helped find soldiers that were hurt and needed help. Mostly importantly they helped keep the soldiers safe.  14  Play Time  Labradors love to play. They need 30-60 minutes of exercise a day in order to stay healthy. If they do not get the exercise that they need they may become bored and chew things up.  Labs live to train and please their owners. There is a lot of training you can do with a lab. You can teach them to sit, lie down, roll over, and shake and so much more.  One of labs favorite things to do is play fetch. They also love to play with other dogs. 15  Glossary  Retrieve: to get or bring something  Newfoundland: large Canadian island off the east coast of the North American mainland  Coat: fur or hair covering an animal’s body  Water resistant: able to keep water off to a certain amount  Webbed feet: skin that connects between toes  Soft mouth: behavior that means to pick up, hold and carry very gently  Stocky: thick and heavy built Muzzle: 16  Flush: to find the game being hunted then running into the hiding place making them available for the hunter to shoot  Point: stopping and aiming its muzzle towards the game being looked for  Tracking: following a course or trail to an item or destination  Disabled assistance: those who need help physically, mentally or emotionally  Vietnam War: a war from 19-55-1975 that was fought by the United States against the Vietnamese 17  Questions  Question: Are labradors good swimmers? Answer: Yes! They have webbed toes that help them swim. They also use their tail to help them swim because it helps them steer them in the right direction.  Questions: What else do webbed feet help labs do besides swim?  Answer: They work pretty much as snowshoes as well. It keeps the snow from building up between their toes so that they can stay running on top of the snow. 18  Works Referenced  ""Labrador Retriever."" Dog Time: Find Your Wag. National Labrador Retriever Club, Inc., 1 Jan. 2011. Web. 13 Nov. 2014.  &lt;http://dogtime.com/dog-breeds/labrador-retriever&gt;.  ""Labrador Retrievers Drafted as Military Workig Dogs."" Just Labradors.  Offleash Media Inc., 1 Jan. 2011. Web. 13 Dec. 2014.  &lt;http://www.justlabradors.com/working-labradors/labrador-  retrievers-drafted-military-working-dogs&gt;.  ""Labrador Retriever Facts."" Just Labradors. Offleash Media Inc., 1 Jan.  2011. Web. 13 Dec. 2014. &lt;http://www.justlabradors.com/working- labradors/labrador-retrievers-drafted-military-working-dogs&gt;.  ""What Is the Difference Between American and English Labradors."" Labrador Training HQ. Labrador Training HQ, 1 Jan. 2014. Web. 13 Dec. 2014. &lt;http://www.labradortraininghq.com/labrador-breed- information/the-difference-between-american-and-english- labradors/&gt;. 19  Common Core State Standards  CCRA.R.1 Read closely to determine what the text says explicitly and to make logical inferences from it; cite specific textual evidence when writing or speaking to support conclusions drawn from the text.  CCRA.R.4 Interpret words and phrases as they are used in a text, including determining technical, connotative, and figurative meanings, and analyze how specific word choices shape meaning or tone. 20  This e-book and any prints are released under a CC BY 3.0 license by the author.  This means that you are free to share, remix, transform, and build upon this book as long as you give appropriate credit to the original author.  Included works (e.g., images and other media) may have separate licensing requirements, and this release does not supersede or replace those requirements.  This e-book template is provided under a CC BY 3.0 license by the University of Idaho College of Education. If you use, share, remix, or transform this template, you should include this page at the end of your book.",,,2015-02-23,2018-05-30,http://digital.lib.uidaho.edu:80/cdm/ref/collection/guidedread/id/167,167,184,185.mp3,168.pdf,/guidedread/image/168.pdf,guidedread049
Lewis and Clark,"Finley, Annie",Isla Rosewood,Teacher,2014,,Second grade level informational text about Lewis and Clark.,,,Second,LewisandClark,application/pdf,Born Digital Publication,eng,"Educational use includes non-commercial use of text and images in materials for teaching and research purposes. Digital reproduction rights granted by University of Idaho Library. For other uses beyond educational use, please contact University of Idaho Library Special Collections and Archives Department at libspec@uidaho.edu.",http://rightsstatements.org/vocab/InC-EDU/1.0/,Text,University of Idaho,"Lewis and Clark  Annie Finley  1 Table of Contents  Introduction 3  Biographies 4-­­5  Map of the Journey 6  Sacagawea 7  Timeline 8  Journals 9-­­10  Outcomes 11  Questions 12  Glossary 13-­­14  Media Attributions/Works Referenced 14-­­15  2 Introduction  President Thomas Jefferson purchased the Louisiana Territory from France in 1803. The President decided the territory needed to be explored. Thomas Jefferson hired Meriwether Lewis to be the captain of the Corps of Discovery expedition. The purpose of the expedition was to find a water route that linked the Columbia River to the Missouri River. Meriwether Lewis chose his friend William Clark to co-command the expedition. The explorers met many Native American tribes including the Shoshone, Mandan, Hidatsas, and many more. Lewis and Clark made maps and wrote about the plants and animals they found along the way. The expedition took about two years to complete.  3 Meriwether Lewis  Meriwether Lewis was born on August 18, 1774 in Virginia. President Thomas Jefferson asked Meriwether Lewis to be his personal secretary in 1801. He was also an explorer and a soldier. He met William Clark while serving in the military with him in 1795. When Meriwether Lewis returned home from the journey he was named the governor of the Louisiana Territory.  4 William Clark  William Clark was born on August 1, 1770 in Virginia. William Clark was an explorer and a soldier, which is similar to Meriwether Lewis. William Clark received a letter from Meriwether Lewis in 1803 asking him to share the command of an expedition. Meriwether Lewis made William Clark his co- commanding caption but the government did not recognize it.  5 Map of the Journey  The Journey  The expedition began on May 14, 1804 at Camp Wood in Ohio. They built Fort Mandan across the river from the main village of the Mandan and Hidatsas Native Americans. They stayed in Fort Mandan for the winter of 1804. Then they came to a fork in the river. Lewis and Clark believed the south fork was the Missouri river but the other men on the expedition thought it was the north fork. They followed the south fork and reached the three forks of the Missouri river in Montana. They continued southwest and reached the Columbia River on October 16, 1805.  6 Sacagawea  Sacagawea was a Shoshone Native American. She was married to Touissant Charbonneau, who was a French-Canadian trader. They were invited on Lewis and Clark’s expedition during their first winter. Sacagawea’s husband was an interpreter for the two explorers. They needed Sacagawea’s help to find the Shoshones because the Shoshones were believed to live at the headwaters of the Missouri River.  7 1770  1774  Timeline  August 1 – William Clark was born. August 18 – Meriwether Lewis was born.  1801  1803  March 6– President Jefferson asked Lewis to be his secretary.  Spring– President Jefferson asked Lewis to be the commander of the expedition. Lewis asked Clark to be the co-­‐commander. Clark accepts.  July 4 – President Jefferson announces the Louisiana Purchase.  Fall/Winter – Camp Wood is established.  1804 May 14 – The expedition begins.  November 4 – Sacagawea and her husband were hired on to the expedition.  December 24 – Fort Mandan is completed and the crew stays there for the winter.  1805 August 8 – Sacagawea recognizes Beaverhead  Rock near the Shoshones and the headwaters  of the Missouri River.  1806  1809  1812  1838  October 16 – They reach the Columbia River September 23 – Lewis and Clark return to St. Louis.  October 11 – Lewis dies.  December 20 – Sacagawea dies. 8  September 1 – Clark dies. Journals  Lewis and Clark both wrote detailed journal entries about the expedition. They wrote about the different plants and animals they had seen and also the different types of weather they experienced. These journals have given us insight on the expedition from the point of view of Lewis and Clark.  An entry from Meriwether Lewis-  May 20, 1804  “We set forward… to join my friend companion and fellow labourer Capt. William Clark, who had previously arrived at that place with the party destined for the discovery of the interior of the continent of North America… As I had determined to reach St. Charles this evening and knowing that there was now no time to be lost I set forward in the rain… and joined Capt. Clark, found the party in good health and sperits.”  9 Example of a Journal Entry  10 Outcomes  There were many outcomes of the expedition. The first one was diplomatic relations with Native Americans. Lewis and Clark traded goods and created useful relationships. William Clark drew detailed maps that named and noted rivers, creeks, significant points in the landscape, and where the explorers camped. They also found a water route that linked the Columbia and the Missouri rivers. Meriwether Lewis was named the governor of the Louisiana Territory and William Clark was appointed as the agent for Indian Affairs in the west. He later became he governor of the Missouri Territory.  11 Questions  Compare and contrast Meriwether Lewis and William Clark.  Describe the purpose of the expedition.  Discuss Sacagawea and her family’s important role in the expedition.  What outcome was most useful for William Clark for his future career?  12 Glossary  Diplomatic Relations: To conduct relationships between governments peacefully.  Expedition: A journey people go on with a purpose, which is generally exploration or scientific.  Explorer: A person that explores an unfamiliar area.  Government: The rules and people who make them for a group of people.  Governor: The head of a specific state.  Interpreter: A person who translates one language into another.  Purchased: Bought with money.  13 Secretary: A person who is hired to assist with keeping records, making appointments, etc.  Similar: Alike; has the same qualities.  Territory: An area of land that is rule by a government.  14 Media Attributions  “Sacagawea with Lewis and Clark at Three Forks.” Used by Wikipedia under the Wikimedia Commons.  “Meriwether Lewis.” Used by Wikipedia under the Wikimedia Commons.  “William Clark.” Used by Wikipedia under the Wikimedia Commons.  “The Route of Expedition.” Used by Wikipedia uploaded by user EncMstr.  “Sacagawea.” Edited from Sacagawea with Lewis and Clark at Three Forks.” Used by Wikipedia under the Wikimedia Commons.  “Timeline.” Created by author Annie Finley. “Journal.” Used by Wikipedia under the Wikimedia  Commons.  15 Works Referenced  “Meriwether Lewis.” Bio. A&E Television Networks.  2014. Web. 14 Dec. 2014.  Perry, Douglas. “Lewis & Clark Expedition.” National Archives and Records Administration. National Archives and Records Administration, n.d. Web. 14 Dec. 2014.  “William Clark.” Bio. A&E Television Networks.  2014. Web. 14 Dec. 2014.  “About Lewis & Clark Historic Trail.” Lewis and Clark’s Historic Trail. Lewis and Clark Historic Trial, n.d. Web. 14 Dec. 2014.  “National Geographic: Lewis & Clark The Journey Begins.” National Geographic: Lewis & Clark The Journey Begins. 1996. Web. 14 Dec. 2014.  16 Common Core State Standards  2.SS.4.3.2 Name historic and contemporary people who model characteristics of good citizenship. CCSS.ELA-‐‐Literacy.RI.2.1 Ask and answer such questions as who, what, where, when, why, and how to demonstrate understanding of key details in a text. CCSS.ELA-‐‐Literacy.RI.2.4 Determine the meaning of words and phrases in a text relevant to a grade 2 topic subject area.  CCSS.ELA-‐‐Literacy.RI.2.5 Know and use various text features (e.g., captions, bold print, subheadings, glossaries, indexes, electronic menus, icons) to locate key facts or information in a text efficiently.  CCSS.ELA-‐‐Literacy.RI.2.6 Identify the main purpose of  a text, including what the author wants to answer, explain, or describe.  17 This e-­­book and any prints are released under a CC BY 3.0 license by the author.  This means that you are free to share, remix, transform, and build upon this book as long as you give appropriate credit to the original author.  Included works (e.g., images and other media) may have separate licensing requirements, and this release does not supersede or replace those requirements.  This e-­­book template is provided under a CC BY 3.0 license by the University of Idaho College of Education. If you use, share, remix, or transform this template, you should include this page at the end of your book.  18",,,2015-02-23,2018-05-30,http://digital.lib.uidaho.edu:80/cdm/ref/collection/guidedread/id/168,168,188,189.mp3,169.pdf,/guidedread/image/169.pdf,guidedread050
Life on the Farm,"Wallen, Brianna",Adrienne Vitullo,Teacher,2016,farm animals,informational text about farms animals,,,first,Farm,application/pdf,Born Digital Publication,eng,"Educational use includes non-commercial use of text and images in materials for teaching and research purposes. Digital reproduction rights granted by University of Idaho Library. For other uses beyond educational use, please contact University of Idaho Library Special Collections and Archives Department at libspec@uidaho.edu.",http://rightsstatements.org/vocab/InC-EDU/1.0/,Text,University of Idaho,"1  Life on the Farm  By Brianna Wallen  Cover  Image  2  Table of Contents  Page 3…………………………………….Cows  Page 4…………………………………….Pigs  Page 5…………………………………….Chickens  Page 6…………………………………….Sheep  Page 7………………………………….Sheep Dogs  Page 8……………………………………Horses  Page 9……………………………………Goats  Page 10…………………………………..Llamas  Page 11…………………………………..Ducks  Page 12…………………………………..Barn Cats  Page 13……………………………...Animal Review  Page 14…………………………….Works Cited  Page 15………………….Common Core Standards  3  Cows  There are over 1 billion cows in the world.  A male cow is called a bull.  A female is called a cow.  A baby cow is called a calf.  Cows typically produce 6-7 gallons of milk  each day.  4  Pigs  A male pig is called a boar.  A female pig is called a gilt or sow.  A baby pig is called a piglet.  Pigs do not have sweat glands which is why  they roll in the mud to cool off.  5  Chickens  A male chicken is called a rooster.  A female chicken is called a hen.  A baby chicken is called a chick.  Chickens can typically lay only one egg per  day.  6  Sheep  A male sheep is called a ram.  A female sheep is called an ewe.  A baby sheep is called a lamb.  A sheep can produce 2-30 pounds of wool  each year.  7  Sheep dogs  Sheep dogs love to herd animals.  The most common types of herding dogs are  collies, shelties, shepherds, and Old English  sheepdogs.  8  Horses  A male horse is called a stallion.  A female horse is called a mare.  A baby horse is called a colt or filly.  There are over 350 breeds of horses and  ponies.  9  Goats  A male goat is called a buck or billy goat.  A female goat is called a doe or nanny.  A baby goat is called a kid.  Each kid is born with a unique call, which is  how their mother recognizes them.  10  Llamas  Male and female llamas are simply called  llamas.  A baby llama is called a cria.  Llamas often spit and hiss if angered.  11  Ducks  A male duck is called a drake.  A female duck is called a duck or hen.  A baby duck is called a duckling.  Ducks can live anywhere from 2-12 years.  12  Barn Cats  Barn cats love to help out on the farm by  catching mice and other rodents.  13  14  Works Referenced  “Red Barn” by Paul Langston  http://www.rainierleagueofarts.com/Paul%20Langston%20Art/slides/Red%20  Barn.html  “Brown Baby Cows” by Sinead Jenkins www.sineadjenkins.com/  “Chickens Hatching” https://i.ytimg.com/vi/k3N5vtauDQU/maxresdefault.jpg  Eggs by Tall Clover Farm http://tallcloverfarm.com/8709/avas-happily-au-naturel-easter-  eggs  “Herd of Dairy Cows on a farm in Illinois” by Anthony Stewart  http://www.allposters.com/-sp/Herd-of-Dairy-Cows-on-a-Farm-in-Illinois-  Posters_i4002966_.htm  Kentucky Horse Park http://www.kyhorsepark.com/  Piglets by Zoo Basel http://www.zooborns.com/zooborns/2010/12/zoo-basel-welcomes-  miniature-piglets.html  “Milk Feeding”  http://agritech.tnau.ac.in/animal_husbandry/ani_pig_care%20mgt.html  http://www.offthegridnews.com/how-to-2/why-dairy-goats-are-cheaper-and-more-practical-  than-dairy-cows/  http://www.sciencekids.co.nz/sciencefacts/animals/cow.html  http://www.sheep101.info/sheepandlambs.html  https://kidskonnect.com/animals/horse/  http://www.coolestone.com/media/13152/Adorable-Baby-Goats-Compilation/  http://livelyrun.com/from-the-farmer/goat-fun-facts/  a-z-animals.com  http://www.theflama.com/10-fascinating-facts-about-llamas-1448529082.html  http://m.deseretnews.com/photo/705390073  www.engadget.com  pekinducksforsale.blogspot.com  https://www.pinterest.com/carolinacotroba/dieren/  15  Common Core State  Standards  CCSS.ELA-LITERACY.RI.1.5  Know and use various text features (e.g., headings, tables of  contents, glossaries, electronic menus, icons) to locate key facts  or information in a text.  CCSS.ELA-LITERACY.RI.1.6  Distinguish between information provided by pictures or other  illustrations and information provided by the words in a text.  CCSS.ELA-LITERACY.RI.1.10  With prompting and support, read informational texts  appropriately complex for grade 1.  16  This e-book and any prints are released under a CC BY 3.0  license by the author.  This means that you are free to share, remix, transform, and  build upon this book as long as you give appropriate credit to  the original author.  Included works (e.g., images and other media) may have separate  licensing requirements, and this release does not supersede or  replace those requirements.  This e-book template is provided under a CC BY 3.0 license by  the University of Idaho College of Education. If you use, share,  remix, or transform this template, you should include this page at  the end of your book.",,,2016-09-22,2018-05-30,http://digital.lib.uidaho.edu:80/cdm/ref/collection/guidedread/id/223,223,225,226.mp3,224.pdf,/guidedread/image/224.pdf,guidedread051
Making Strides: A Brief Overview of Important Female Leaders in United States Politics,McKenna Nowak,Adrienne Vitullo,Student,2017,women; politics; government,informational text about women in government,,,fourth,WomenPolitics,application/pdf,Born Digital Publication,eng,"Educational use includes non-commercial use of text and images in materials for teaching and research purposes. Digital reproduction rights granted by University of Idaho Library. For other uses beyond educational use, please contact University of Idaho Library Special Collections and Archives Department at libspec@uidaho.edu.",http://rightsstatements.org/vocab/InC-EDU/1.0/,Text,University of Idaho,,,,2018-05-30,2018-05-30,http://digital.lib.uidaho.edu:80/cdm/ref/collection/guidedread/id/623,623,906,300.mp3,657.cpd,/guidedread/supp/623/index.pdf,guidedread052
Manatees,Alexis Suomi,Adrienne Vitullo,Student,2017,manatees; life cycle; habitat,informational text about manatees,,,third,Manatees,application/pdf,Born Digital Publication,eng,"Educational use includes non-commercial use of text and images in materials for teaching and research purposes. Digital reproduction rights granted by University of Idaho Library. For other uses beyond educational use, please contact University of Idaho Library Special Collections and Archives Department at libspec@uidaho.edu.",http://rightsstatements.org/vocab/InC-EDU/1.0/,Text,University of Idaho,,,,2018-05-30,2018-05-30,http://digital.lib.uidaho.edu:80/cdm/ref/collection/guidedread/id/643,643,886,280.mp3,677.cpd,/guidedread/supp/643/index.pdf,guidedread053
