title,author,reader,creator type,date,subject,description,location,lat long,grade-level,identifier,format,digital specifications,language,rights,standardized rights,type,contributing institution,full text,filename,oclc number,date created,date modified,reference url,cdmid,soundid,soundlink,contentdm file name,contentdm file path,objectid
A Nicaraguan Celebration,Anaheli Stegner,Adrienne Vitullo,Student,2017,Nicaragua; Griteria,informational text about Griteria,,,third,Nicaragua,application/pdf,Born Digital Publication,eng,"Educational use includes non-commercial use of text and images in materials for teaching and research purposes. Digital reproduction rights granted by University of Idaho Library. For other uses beyond educational use, please contact University of Idaho Library Special Collections and Archives Department at libspec@uidaho.edu.",http://rightsstatements.org/vocab/InC-EDU/1.0/,Text,University of Idaho,,,,2018-05-30,2018-05-30,http://digital.lib.uidaho.edu:80/cdm/ref/collection/guidedread/id/282,282,895,289.mp3,316.cpd,/guidedread/supp/282/index.pdf,guidedread001
Abraham Lincoln,Emily Stephens,,Student,2017,presidents; America,informational text about Abraham Lincoln,,,second,Abraham_Lincoln,application/pdf,Born Digital Publication,eng,"Educational use includes non-commercial use of text and images in materials for teaching and research purposes. Digital reproduction rights granted by University of Idaho Library. For other uses beyond educational use, please contact University of Idaho Library Special Collections and Archives Department at libspec@uidaho.edu.",http://rightsstatements.org/vocab/InC-EDU/1.0/,Text,University of Idaho,,,,2018-05-30,2018-05-30,http://digital.lib.uidaho.edu:80/cdm/ref/collection/guidedread/id/298,298,nullo,,332.cpd,/guidedread/supp/298/index.pdf,guidedread002
All About Rabbits,Tiffany Mayes,Adrienne Vitullo,Student,2017,rabbits; hares; mammals,informational text about rabbits,,,first,Rabbits,application/pdf,Born Digital Publication,eng,"Educational use includes non-commercial use of text and images in materials for teaching and research purposes. Digital reproduction rights granted by University of Idaho Library. For other uses beyond educational use, please contact University of Idaho Library Special Collections and Archives Department at libspec@uidaho.edu.",http://rightsstatements.org/vocab/InC-EDU/1.0/,Text,University of Idaho,,,,2018-05-30,2018-05-30,http://digital.lib.uidaho.edu:80/cdm/ref/collection/guidedread/id/316,316,892,286.mp3,350.cpd,/guidedread/supp/316/index.pdf,guidedread003
Amphibians,"Aune, Chantel",,Teacher,2014,amphibians,First-grade level informational text about amphibians,,,First,Amphibians,application/pdf,Born Digital Publication,eng,"Educational use includes non-commercial use of text and images in materials for teaching and research purposes. Digital reproduction rights granted by University of Idaho Library. For other uses beyond educational use, please contact University of Idaho Library Special Collections and Archives Department at libspec@uidaho.edu.",http://rightsstatements.org/vocab/InC-EDU/1.0/,Text,University of Idaho,,,,2014-11-11,2018-05-30,http://digital.lib.uidaho.edu:80/cdm/ref/collection/guidedread/id/145,145,nullo,,146.pdf,/guidedread/image/146.pdf,guidedread004
Beavers,"Babin, Acadia",Adrienne Vitullo,Teacher,2016,Beavers; habitat; wildlife; North America,informational text about beavers,,,third,Beaver,application/pdf,Born Digital Publication,eng,"Educational use includes non-commercial use of text and images in materials for teaching and research purposes. Digital reproduction rights granted by University of Idaho Library. For other uses beyond educational use, please contact University of Idaho Library Special Collections and Archives Department at libspec@uidaho.edu.",http://rightsstatements.org/vocab/InC-EDU/1.0/,Text,University of Idaho,"1  Beavers  By Acadia Babin  2  Table of Contents  What is a Beaver …3  Characteristics of Beavers …4  Beavers are mammals …5-7  Beavers Rely on Water …8  Beavers build dams out of wood …9-10  Beaver’s lodges …11  Beavers Can Cause Destruction …12  Where Can You Find a Beaver? …13  Glossary …14  Works Referenced …16-17  Common Core Standards …18  3  What  is  a  Beaver?  Beavers  are  considered  to  be  the  largest  rodent  in  North  America.  Someone  who  is  searching  for  a  beaver  can  find  one  in  Europe  or  North  America.  Their  names  match  where  you  might  spot  them.  The  beaver  found  in  North  America  is  named  a  North  American  Beaver  and  the  beaver  found  in  Europe  is  often  referred  to  as  a  European  Beaver.  Have  you  seen  a  beaver?  They  are  often  spotted  in  ponds,  rivers,  streams,  and  other  bodies  of  water.  4  Characteristics  of  Beavers  Beavers  are  mostly  awake  at  night.  This  makes  them  nocturnal.  A  beaver’s  hair  is  waterproof,  so  beavers  will  not  get  sick  from  the  different  water  temperatures.  A  beavers’  teeth  never  stop  growing,  but  beavers  eat  and  chew  on  wood  so  much  that  their  teeth  always  stay  the  same  size.  Beavers  use  their  tails  for  guiding  their  swimming  and  scaring  away  predators.  5  Beavers  are  Mammals  This  means  that  they  are  warm  blooded,  they  have  babies  like  humans,  and  they  have  hair  on  their  body.  6  Beaver  Families  Beavers  are  monogamous,  so  they  keep  one  mate  their  entire  life.  If  one  dies,  the  live  beaver  will  find  another  mate.  Female  beavers  are  only  pregnant  for  3  months.  These  baby  beavers  are  called  kits,  and  there  are  usually  1  to  4  kits  per  litter.  7  How  Long  Do  Beavers  Stay  with  Their  Families?  These  baby  kits  will  stay  with  their  family  for  about  two  years.  After  two  years,  the  maturing  beavers  will  make  their  own  home  a  few  kilometers  away.  Once  the  beaver  has  reached  the  age  of  3,  he  or  she  is  ready  to  make  their  own  family.  Beavers  are  very  protective  of  their  homes  and  families.  Each  beaver  can  live  10-­‐20  years.  When  do  beavers  leave  home?  8  Beavers  Rely  on  Water  Beavers  build  their  homes  in  water,  and  they  use  water  to  protect  themselves  from  predators.  A  beaver  has  a  special  respiratory  system  that  lets  him  hold  his  breath  for  up  to  15  minutes.  9  Beavers  Build  Dams  out  of  Wood  Beavers  use  trees  for  eating  and  making  dams.  Dams  are  many  pieces  of  wood  that  block  the  flow  of  water.  Beavers  are  unique  because  they  are  actually  able  to  eat  the  bark  of  trees.  This  is  convenient  because  beavers  can  have  a  meal  while  felling  a  tree  that  they  use  to  create  a  dam  or  lodge  to  live  in.  Building  in  the  middle  of  water  helps  protect  the  beavers  and  their  kits  from  other  animals.  10  This  is  a  beaver’s  dam.  Can  you  tell  that  one  side  of  the  water  is  higher  than  the  other  side?  This  is  because  the  dam  blocks  the  flow  of  water,  so  the  direction  that  the  body  of  water  is  flowing  from  will  be  higher  than  the  other  side.  People  have  used  beavers’  techniques  to  create  their  own  dams  to  give  power  to  cities  and  states.  Beavers  are  one  of  the  most  hard-­‐working  mammals.  11  Beavers  Live  in  Lodges  Beavers  live  in  lodges  that  are  built  out  of  trees.  Their  entrance  is  underneath  the  water.  Around  six  beavers  usually  share  one  lodge.  When  the  beaver  first  enters,  he  or  she  will  enter  a  den,  which  is  for  drying  off.  Then  there  is  a  second  den,  which  is  where  the  beavers  spend  most  of  their  time.  Because  of  the  way  beavers’  lodges  are  built,  they  can  easily  withstand  cold  temperatures.  Beavers  often  share  their  homes  with  other  creatures  such  as  muskrats.  The  extra  helpers  gather  food  and  keep  the  lodge  warm.  12  Beavers  Can  Cause  Destruction  Sometimes  beavers  cause  deforestation.  Deforestation  happens  when  beavers  strip  all  of  the  trees  in  an  area  of  their  wood.  Beavers  can  also  cause  flooding  because  when  they  build  their  dams  the  water  gets  too  high.  They  can  also  cause  droughts  when  the  water  gets  too  low,  which  prevents  water  from  getting  to  another  area.  Most  of  the  time  however,  beavers  prevent  this  from  happening.  Beavers  can  prevent  flooding  or  droughts.  13  Where  can  you  find  a  beaver?  In  a  desert?  No  In  a  swamp?  Yes  In  Antarctica?  No  In  a  river?  Yes  In  the  Tropics?  No  In  a  pond?  Yes  Far  from  Water?  No  In  a  stream?  Yes  In  Africa?  No  In  North  America?  Yes  14  Glossary  Deforestation: This is a forest with little to no  trees.  Den: A part of a beaver’s home.  Destruction: If something causes so much  damage that there is no repair.  Kits: Baby beavers.  Kilometers: A form of measurement, 5  kilometers is equal to about 3 miles.  Litter: A group of kits born at once.  Lodges: A beaver’s home.  Mate: A beaver’s “wife” or “husband”.  Maturing: To get older.  Monogamous: To stay with one mate.  Nocturnal: To be awake mostly at night.  Predators: Animals that hunt prey, or in this  case, beavers.  Rodent: Usually small mammals that include  rats and hamsters as well.  15  16  Works Referenced  ""Beaver."" Amazing Facts about Beavers | OneKind. Web. 20 Apr.  2016.  &lt;http://www.onekind.org/education/animals_a_z/beaver/  &gt;.  Holden, Josh. ""Castor Fiber (Eurasian Beaver)."" Animal  Diversity Web. Web. 20 Apr. 2016.  http://animaldiversity.org/accounts/Castor_fiber/.  17  Media Attributions  1. Photo credit: “hazel-beaver 1-7-15” by Point Defiance Zoo and  Aquarium available under a Creative Commons Attribution  License 2.0 http://www.pdza.org/beaver/  2. Photo Credit: “One of the famous Martinez Beavers”,  photographed by Cheryl Reynolds available under a Creative  Commons Attribution License 2.0  http://www.creekcats.com/birdblog/?p=237  3. Photo Credit: “Beaver- North American”  http://mnzoo.org/blog/animals/north-american-beaver/  4. Photo Credit: Photographed by Photo © Adam Welz  www.adamwelz.net http://lakeconesteenaturepark.com/2-7/  available under a Creative Commons Attribution License 2.0  5. Photo Credit: https://pannach-s1-beaver.wikispaces.com/  available under public domain  6. Photo Credit: http://mnzoo.org/blog/animals/north-american-  beaver/#prettyPhoto available under public domain.  7. Photo Credit: “Leave it to Beavers: Beaver Photos”  http://www.pbs.org/wnet/nature/leave-it-to-beavers-beaver-photos-  beavers-at-work/8858/#/section-0/9 by pbs available  under a Creative Commons Attribution 2.0  8. Photo Credit: “This Week’s Best Science Images” by Live  Science Staff http://www.livescience.com/11312-week-science-  images.html available under Creative Commons  Attribution License 2.0  9. Photo Credit: “Encyclopedia Britannica, Inc.”  http://www.britannica.com/animal/beaver available under  public domain.  10. Photo Credit: http://hbt-lako.blogspot.com/2013/10/a-hod-epitesz-  vagy-kartevo.html available under public domain.  18  Common Core State  Standards  CCSS.ELA-LITERACY.RI.3.1 Ask and answer  questions to demonstrate understanding of a text,  referring explicitly to the text as the basis for the  answers.  CCSS.ELA-LITERACY.RI.3.2  Determine the main idea of a text; recount the key  details and explain how they support the main idea.  CCSS.ELA-LITERACY.RI.3.7  Use information gained from illustrations (e.g., maps,  photographs) and the words in a text to demonstrate  understanding of the text (e.g., where, when, why,  and how key events occur).  19  This e-book and any prints are released under a CC BY 3.0  license by the author.  This means that you are free to share, remix, transform, and  build upon this book as long as you give appropriate credit to  the original author.  Included works (e.g., images and other media) may have separate  licensing requirements, and this release does not supersede or  replace those requirements.  This e-book template is provided under a CC BY 3.0 license by  the University of Idaho College of Education. If you use, share,  remix, or transform this template, you should include this page at  the end of your book.",,,2016-09-22,2018-05-30,http://digital.lib.uidaho.edu:80/cdm/ref/collection/guidedread/id/205,205,204,205.mp3,206.pdf,/guidedread/image/206.pdf,guidedread005
Bottlenose Dolphins,Courtney Wood,Adrienne Vitullo,Student,2017,dolphins,informational text about bottlenose dolphins,,,first,Dolphins,application/pdf,Born Digital Publication,eng,"Educational use includes non-commercial use of text and images in materials for teaching and research purposes. Digital reproduction rights granted by University of Idaho Library. For other uses beyond educational use, please contact University of Idaho Library Special Collections and Archives Department at libspec@uidaho.edu.",http://rightsstatements.org/vocab/InC-EDU/1.0/,Text,University of Idaho,,,,2018-05-30,2018-05-30,http://digital.lib.uidaho.edu:80/cdm/ref/collection/guidedread/id/334,334,879,273.mp3,368.cpd,/guidedread/supp/334/index.pdf,guidedread006
Chia Seeds,Madison Mayo,Adrienne Vitullo,Student,2017,chia seeds; nutrition,informational text about chia seeds,,,fourth,ChiaSeeds,application/pdf,Born Digital Publication,eng,"Educational use includes non-commercial use of text and images in materials for teaching and research purposes. Digital reproduction rights granted by University of Idaho Library. For other uses beyond educational use, please contact University of Idaho Library Special Collections and Archives Department at libspec@uidaho.edu.",http://rightsstatements.org/vocab/InC-EDU/1.0/,Text,University of Idaho,,,,2018-05-30,2018-05-30,http://digital.lib.uidaho.edu:80/cdm/ref/collection/guidedread/id/352,352,876,270.mp3,386.cpd,/guidedread/supp/352/index.pdf,guidedread007
Chinese Dragon Boat Festival,Manjuan He,Adrienne Vitullo,Student,2017,Chinese; tradition; dragon boat,informational text about the Chinese Dragon Boat Festival,,,second,Chinese_Dragon_Boat_Festival,application/pdf,Born Digital Publication,eng,"Educational use includes non-commercial use of text and images in materials for teaching and research purposes. Digital reproduction rights granted by University of Idaho Library. For other uses beyond educational use, please contact University of Idaho Library Special Collections and Archives Department at libspec@uidaho.edu.",http://rightsstatements.org/vocab/InC-EDU/1.0/,Text,University of Idaho,,,,2018-05-30,2018-05-30,http://digital.lib.uidaho.edu:80/cdm/ref/collection/guidedread/id/371,371,889,283.mp3,405.cpd,/guidedread/supp/371/index.pdf,guidedread008
Clouds,"Bain, Crystal",Isla Rosewood,Teacher,2014,,First grade level informational text about clouds.,,,First,Clouds,application/pdf,Born Digital Publication,eng,"Educational use includes non-commercial use of text and images in materials for teaching and research purposes. Digital reproduction rights granted by University of Idaho Library. For other uses beyond educational use, please contact University of Idaho Library Special Collections and Archives Department at libspec@uidaho.edu.",http://rightsstatements.org/vocab/InC-EDU/1.0/,Text,University of Idaho,"Clouds  By Crystal Bain  Table of Contents  What is a cloud? Page 3  Where are clouds? Page 4  Types of clouds Page 5-7  Our Solar System and clouds Page 8  Glossary Page 9  Questions Page 10 What are clouds?  A cloud is made of tiny water droplets that we can see in the sky. These droplets form together to create clouds.  There are millions of tons of water in a cloud.  Clouds form when water on Earth evaporates and  condenses up in the sky to reform water.  Fun Fact:  Clouds are white because the water droplets in it are so spread out that light is able to pass through it,  and gray clouds have too many water droplets for the light to get through.  Where are clouds?  Here are the different kinds of clouds and where they are in the troposphere. The troposphere is the region of the sky extending from the Earth’s surface to about 3-7 miles in the sky.  The clouds closer to the ground are made up of water droplets. The higher in the sky the cloud is it is made of ice crystals.  Fun Fact:  Snowflakes are made when ice crystals stick together.Types of Clouds  Cumulus Clouds  Cumulus clouds look puffy like cotton balls or whipped cream.  They are usually known as “fair-weather clouds.”  However, they can become thunderstorm clouds and then they are called Cumulonimbus.  Fun fact:  “The word cumulus means pile or heap.” Stratus Clouds  Stratus clouds look like blankets across the sky.  They are gray in color.  They make a light drizzle or mist of rain.  Fun Fact:  “The word stratus means layer.Cirrus Clouds  Cirrus clouds look thin and wispy. Instead of having water droplets, cirrus clouds have ice crystals. White cirrus clouds mean clear skies. Gray cirrus clouds mean rain or snow.  Fun Fact:  “The word cirrus means a curl or ringlet in some one’s hair.” Our Solar System and Clouds  There are a few other planets in our solar system that have clouds, but they are not made of water droplets.  Venus has sulfur dioxide in its clouds.  Jupiter and Saturn’s clouds are made up of ammonia.  Fun Fact:  Scientists have found that Jupiter and Saturn have formed water ice crystals in some clouds. Glossary:  Evaporation: where water becomes a gas because it is hot.  Condensation: where gas turns back into water because it is cold.  Sulfur Dioxide: a gas that smells like rotten eggs.  Ammonia: a gas that smells bad and is usually used in cleaning. Questions:  What is inside of a cloud?  How does a gray cloud differ from a white cloud?  What is the name of a type of cloud?  Facts:  Work Cited:  Smith, R. (2007). Cloud facts for kids. Science Kids. Retrieved from  http://www.sciencekids.co.nz/sciencefacts/weather/clouds.html  What are clouds? How are clouds formed? Cloud facts for kids. (2014). Kids Play and create.  Retreived from  http://www.kidsplayandcreate.com/what-are-clouds-how-are-clouds-formed-cloud-facts- for-kids/  Gannon, M. (12 September 2014). Discovery! First water ice clouds found beyond our solar system. Space.com. Retrieved from  http://m.space.com/27100-water-ice-clouds-beyond-solar-system.html  Images:  Heisler, K. (n/d). Common types of clouds in the troposphere. Cloud dance task. Retreived from http://users.manchester.edu/student/rsadams/WebQuest325/task.htm  Jastremski, M. (2004). The cloud appreciation society. Ingos England-Blog. Retrieved from  http://maricopa1.wordpress.com/2010/07/  Kevin. (August 18, 2011). Colorado Clouds Blog. Retrieved from  http://coclouds.com/277/stratus/2011-08-18/  HKPasseyStock. (2014). Cirrus Cloud 1. Deviantart. Retrieved from  http://hkpasseystock.deviantart.com/art/Cirrus-Clouds-1-171247223  Kerschberg, B. (2011). Data Security and the Imperative of Private Clouds. Forbes.  Retrieved from  http://www.forbes.com/sites/benkerschberg/2011/09/09/electronic-discovery-the-impe rative-of-private-clouds/  Grayzeck, E. (1979). Cloud tops. NSSDC Photo Gallery:Venus. Retrieved from  http://nssdc.gsfc.nasa.gov/photo_gallery/photogallery-venus.html Common Core State Standards  CCSS.ELA-LITERACY.RL.1.1  Ask and answer questions about key details in a text.  CCSS.ELA-LITERACY.RI.1.5  Know and use various text features (e.g., headings, tables of contents, glossaries, electronic menus, icons) to locate key facts or information in a text.  CCSS.ELA-LITERACY.RI.1.7  Use the illustrations and details in a text to describe its key ideas. This e-book and any prints are released under a CC BY 3.0 license by the author.  This means that you are free to share, remix, transform, and build upon this book as long as you give appropriate credit to the original author.  Included works (e.g., images and other media) may have separate licensing requirements, and this release does not supersede or replace those requirements.  This e-book template is provided under a CC BY 3.0 license by the University of Idaho College of Education. If you use, share, remix, or transform this template, you should include this page at the end of your book.",,,2015-02-23,2018-05-30,http://digital.lib.uidaho.edu:80/cdm/ref/collection/guidedread/id/157,157,198,199.mp3,158.pdf,/guidedread/image/158.pdf,guidedread009
