title,description,item information,postcard type,photographer,date,subject,location,state,publisher,publisher location,source,date is approximate,identifier,rights,standardized rights,original format,type,format,language,latitude,longitude,filename,oclc number,date created,date modified,reference url,cdm-id,contentdm file name,contentdm file path,object-id
"Vista House, Columbia River Highway, Oregon","Postcard is of the Crown Point Vista House, near the Columbia River Highway in Oregon. | Vista House - Crown Point. A state owned view point affording a magnificent view from one of the highest points reached by the Columbia River Highway. With sheer walls below a panoramic view is presented, reaching far down and up the river. Parking space for many cars.",,picture postcards,Angelus Studio,1937,viewpoint; overlooks; scenic byways; picture postcards,"Crown Point Vista House; Columbia River Highway, Portland",Oregon,Wesley Andrews,"Portland, OR","PG 107, Knowles Postcard Collection, University of Idaho Library Special Collections and Archives, http://www.lib.uidaho.edu/special-collections/",yes,Postcard_052,"Educational use includes non-commercial use of text and images in materials for teaching and research purposes. Digital reproduction rights granted by University of Idaho Library. For other uses beyond educational use, please contact University of Idaho Library Special Collections and Archives Department at libspec@uidaho.edu.",http://rightsstatements.org/vocab/InC-EDU/1.0/,"3.5 x 5.5625, Color",Image;StillImage,application/pdf,eng,45.539913,-122.244283,,,2013-01-15,2015-09-14,http://digital.lib.uidaho.edu:80/cdm/ref/collection/nwpostcards/id/183,183,47.pdf,/nwpostcards/image/47.pdf,nwpostcards183
Mount Adams,"Postcard is a view of Mount Adams from the Columbia River. | Columbia River Scenes, Oregon. Olde, Wortman & King, Portland. Hand-colored. Mount Adams.",,picture postcards,"Olds, Wortman & King",1920,mountains; rivers; trees; reflections (perceived properties); picture postcards,Mount Adams; Columbia River,Washington,"Olds, Wortman & King","Portland, OR","PG 107, Knowles Postcard Collection, University of Idaho Library Special Collections and Archives, http://www.lib.uidaho.edu/special-collections/",yes,Postcard_053,"Material determined to be in Public Domain based on date of publication. Material made available by the University of Idaho Library. For more information, please contact University of Idaho Library Special Collections and Archives Department at libspec@uidaho.edu.",https://creativecommons.org/publicdomain/mark/1.0/,"3.5 x 5.5, Color",Image;StillImage,application/pdf,eng,45.696438,-121.83049,,,2013-01-15,2015-09-14,http://digital.lib.uidaho.edu:80/cdm/ref/collection/nwpostcards/id/184,184,48.pdf,/nwpostcards/image/48.pdf,nwpostcards184
"General View of Ashland, Oregon","Postcard is a photograph overlooking Ashland, Oregon.",,photographic postcards,,1910,college towns; trees; overlooks; photographic postcards,Ashland,Oregon,Albertype Co.,"Brooklyn, NY","PG 107, Knowles Postcard Collection, University of Idaho Library Special Collections and Archives, http://www.lib.uidaho.edu/special-collections/",yes,Postcard_054,"Material determined to be in Public Domain based on date of publication. Material made available by the University of Idaho Library. For more information, please contact University of Idaho Library Special Collections and Archives Department at libspec@uidaho.edu.",https://creativecommons.org/publicdomain/mark/1.0/,"3.5625 x 5.5625, Black and white",Image;StillImage,application/pdf,eng,42.197821,-122.725462,,,2013-01-15,2015-09-14,http://digital.lib.uidaho.edu:80/cdm/ref/collection/nwpostcards/id/185,185,49.pdf,/nwpostcards/image/49.pdf,nwpostcards185
New Mechanafe (2),"Interior view of the Mechanafe restaurant in Boise, Idaho.  | The new Mechanafe. 100% waterless restaurant. It's electrical. It's beautiful. It's fascinating. It's mechanical. It's sanitary. It's novelty. It's progress. It's the show place of Idaho.",,photographic postcards,,1930,restaurants; automats (tm); indoor photography; interior views; dining; photographic postcards,Boise,Idaho,,,"PG 107, Knowles Postcard Collection, University of Idaho Library Special Collections and Archives, http://www.lib.uidaho.edu/special-collections/",yes,Postcard_005,"Educational use includes non-commercial use of text and images in materials for teaching and research purposes. Digital reproduction rights granted by University of Idaho Library. For other uses beyond educational use, please contact University of Idaho Library Special Collections and Archives Department at libspec@uidaho.edu.",http://rightsstatements.org/vocab/InC-EDU/1.0/,"3.5 x 5.5, Black and white",Image;StillImage,application/pdf,eng,43.616717,-116.202429,,,2013-01-15,2015-09-14,http://digital.lib.uidaho.edu:80/cdm/ref/collection/nwpostcards/id/186,186,5.pdf,/nwpostcards/image/5.pdf,nwpostcards186
"Court House, Eugene, Oregon","Postcard is of the old Lane County Courthouse in Eugene, Oregon. | Court House, Eugene, Oregon.",written message,picture postcards,,1920,public buildings; county courthouses; trees; picture postcards,Eugene; Lane County Courthouse,Oregon,Portland Post Card Co.,"Portland, OR","PG 107, Knowles Postcard Collection, University of Idaho Library Special Collections and Archives, http://www.lib.uidaho.edu/special-collections/",yes,Postcard_055,"Material determined to be in Public Domain based on date of publication. Material made available by the University of Idaho Library. For more information, please contact University of Idaho Library Special Collections and Archives Department at libspec@uidaho.edu.",https://creativecommons.org/publicdomain/mark/1.0/,"5.4375 x 3.4375, Color",Image;StillImage,application/pdf,eng,44.050987,-123.091263,,,2013-01-15,2015-09-14,http://digital.lib.uidaho.edu:80/cdm/ref/collection/nwpostcards/id/187,187,50.pdf,/nwpostcards/image/50.pdf,nwpostcards187
"Sigma Nu House, Eugene, Oregon","Postcard is of the old Sigma Nu House in Eugene, Oregon. This building was purchased by Northwest Christian University and torn down. The interior of this house was used for the Animal House (1978) film.","written message; postage applied; Postmark: 2/8/1908, Pilotock, OR; Destination: Mt. Carmel, PA",picture postcards,E. Schwarzschild?,1908,fraternity houses; student housing; trees; picture postcards,Eugene; University of Oregon; Northwest Christian University,Oregon,M. Rieder,"Los Angeles, CA","PG 107, Knowles Postcard Collection, University of Idaho Library Special Collections and Archives, http://www.lib.uidaho.edu/special-collections/",yes,Postcard_056,"Material determined to be in Public Domain based on date of publication. Material made available by the University of Idaho Library. For more information, please contact University of Idaho Library Special Collections and Archives Department at libspec@uidaho.edu.",https://creativecommons.org/publicdomain/mark/1.0/,"3.5 x 5.375, Color",Image;StillImage,application/pdf,eng,44.047783,-123.080719,,,2013-01-15,2015-09-14,http://digital.lib.uidaho.edu:80/cdm/ref/collection/nwpostcards/id/188,188,51.pdf,/nwpostcards/image/51.pdf,nwpostcards188
"Spokane County Court House, Spokane, Washington (2)","Postcard is of the Spokane County Courthouse in Spokane, Washington.","written message; postage applied; Postmark: 7/6/1941, Spokane, WA; Destination: Olmsted Falls, OH",picture postcards,,1941,public buildings; county courthouses; trees; picture postcards,Spokane; Spokane County Courthouse,Washington,John W. Graham & Co.,"Spokane, WA","PG 107, Knowles Postcard Collection, University of Idaho Library Special Collections and Archives, http://www.lib.uidaho.edu/special-collections/",yes,Postcard_034,"Educational use includes non-commercial use of text and images in materials for teaching and research purposes. Digital reproduction rights granted by University of Idaho Library. For other uses beyond educational use, please contact University of Idaho Library Special Collections and Archives Department at libspec@uidaho.edu.",http://rightsstatements.org/vocab/InC-EDU/1.0/,"3.5 x 5.5, Color",Image;StillImage,application/pdf,eng,47.66432,-117.428031,,,2013-01-15,2015-09-14,http://digital.lib.uidaho.edu:80/cdm/ref/collection/nwpostcards/id/189,189,52.pdf,/nwpostcards/image/52.pdf,nwpostcards189
"Gladiola Parade, Grants Pass, Oregon","Postcard is a photograph of a Gladiola Parade in Grants Pass, Oregon along Highway 99.","written message ; postage applied; Postmark: 8/30/1956, Grants Pass, OR; Destination: Portland, OR",photographic postcards,Glunz,1956,floats (vehicles); parades; highways; groups of people; photogaphic postcards,Grants Pass; Highway 99,Oregon,Mike Roberts,"Berkeley 2, CA","PG 107, Knowles Postcard Collection, University of Idaho Library Special Collections and Archives, http://www.lib.uidaho.edu/special-collections/",yes,Postcard_057,"Educational use includes non-commercial use of text and images in materials for teaching and research purposes. Digital reproduction rights granted by University of Idaho Library. For other uses beyond educational use, please contact University of Idaho Library Special Collections and Archives Department at libspec@uidaho.edu.",http://rightsstatements.org/vocab/InC-EDU/1.0/,"3.4375 x 5.4375, Color",Image;StillImage,application/pdf,eng,42.437497,-123.327971,,,2013-01-15,2015-09-14,http://digital.lib.uidaho.edu:80/cdm/ref/collection/nwpostcards/id/190,190,53.pdf,/nwpostcards/image/53.pdf,nwpostcards190
"New Rose City Park School, Portland, Oregon","Postcard is of a school in Portland, Oregon. It is labeled the ""New Rose City Park School,"" but is now called the Marysville School.",,picture postcards,,1930,community schools (institutions); elementary schools (buildings); historic buildings; picture postcards; flagpoles; flags,Portland; Marysville School,Oregon,Louis Scheiner,"Portland, OR","PG 107, Knowles Postcard Collection, University of Idaho Library Special Collections and Archives, http://www.lib.uidaho.edu/special-collections/",yes,Postcard_058,"Educational use includes non-commercial use of text and images in materials for teaching and research purposes. Digital reproduction rights granted by University of Idaho Library. For other uses beyond educational use, please contact University of Idaho Library Special Collections and Archives Department at libspec@uidaho.edu.",http://rightsstatements.org/vocab/InC-EDU/1.0/,"3.375 x 5.375, Color",Image;StillImage,application/pdf,eng,45.539222,-122.604644,,,2013-01-15,2015-09-14,http://digital.lib.uidaho.edu:80/cdm/ref/collection/nwpostcards/id/191,191,54.pdf,/nwpostcards/image/54.pdf,nwpostcards191
"Twelfth Street, Showing Rose Covered Homes, Portland, Oregon","Postcard is a photograph of rose bushes around houses in a neighborhood of Portland, Oregon. | Twelfth street, showing rose covered homes, Portland, Ore.",,photographic postcards,,1950,rose gardens; houses; trees; photographic postcards,Portland,Oregon,,,"PG 107, Knowles Postcard Collection, University of Idaho Library Special Collections and Archives, http://www.lib.uidaho.edu/special-collections/",yes,Postcard_059,"Educational use includes non-commercial use of text and images in materials for teaching and research purposes. Digital reproduction rights granted by University of Idaho Library. For other uses beyond educational use, please contact University of Idaho Library Special Collections and Archives Department at libspec@uidaho.edu.",http://rightsstatements.org/vocab/InC-EDU/1.0/,"3.375 x 5.375, Color",Image;StillImage,application/pdf,eng,45.549505,-122.653753,,,2013-01-15,2015-09-14,http://digital.lib.uidaho.edu:80/cdm/ref/collection/nwpostcards/id/192,192,55.pdf,/nwpostcards/image/55.pdf,nwpostcards192
"Multnomah Hotel, 600 Rooms, Portland, Oregon","Postcard is of the Multhomah Hotel in Portland, Oregon.",,picture postcards,,1920,hotels (public accommodations); buildings; men; women; automobiles; picture postcards,Portland,Oregon,E.C. Kropp Co.,"Milwaukee, WI","PG 107, Knowles Postcard Collection, University of Idaho Library Special Collections and Archives, http://www.lib.uidaho.edu/special-collections/",yes,Postcard_060,"Material determined to be in Public Domain based on date of publication. Material made available by the University of Idaho Library. For more information, please contact University of Idaho Library Special Collections and Archives Department at libspec@uidaho.edu.",https://creativecommons.org/publicdomain/mark/1.0/,"3.4375 x 5.4375, Color",Image;StillImage,application/pdf,eng,45.52181,-122.674911,,,2013-01-15,2015-09-14,http://digital.lib.uidaho.edu:80/cdm/ref/collection/nwpostcards/id/193,193,56.pdf,/nwpostcards/image/56.pdf,nwpostcards193
"Hotel Portland, Portland, Oregon (1)","Postcard is of the old Portland Hotel, which is no longer standing, in Portland, Oregon.",,picture postcards,,1910,hotels (public accommodations); buildings; men; horse-drawn vehicles; picture postcards,Portland,Oregon,Skidmore Drug Co.,"Portland, OR","PG 107, Knowles Postcard Collection, University of Idaho Library Special Collections and Archives, http://www.lib.uidaho.edu/special-collections/",yes,Postcard_061,"Material determined to be in Public Domain based on date of publication. Material made available by the University of Idaho Library. For more information, please contact University of Idaho Library Special Collections and Archives Department at libspec@uidaho.edu.",https://creativecommons.org/publicdomain/mark/1.0/,"3.4375 x 5.4375, Color",Image;StillImage,application/pdf,eng,45.51835,-122.678885,,,2013-01-15,2015-09-14,http://digital.lib.uidaho.edu:80/cdm/ref/collection/nwpostcards/id/194,194,57.pdf,/nwpostcards/image/57.pdf,nwpostcards194
"Hotel Portland, Portland, Oregon (2)","Postcard is of the old Portland Hotel in Portland, Oregon.",,picture postcards,,1920,hotels (public accommodations); buildings; men; horse-drawn vehicles; picture postcards,Portland,Oregon,Edward H. Mitchell,"San Francisco, CA","PG 107, Knowles Postcard Collection, University of Idaho Library Special Collections and Archives, http://www.lib.uidaho.edu/special-collections/",yes,Postcard_062,"Material determined to be in Public Domain based on date of publication. Material made available by the University of Idaho Library. For more information, please contact University of Idaho Library Special Collections and Archives Department at libspec@uidaho.edu.",https://creativecommons.org/publicdomain/mark/1.0/,"3.375 x 5.4375, Color",Image;StillImage,application/pdf,eng,45.51835,-122.678885,,,2013-01-15,2015-09-14,http://digital.lib.uidaho.edu:80/cdm/ref/collection/nwpostcards/id/195,195,58.pdf,/nwpostcards/image/58.pdf,nwpostcards195
Willamete River at Oregon City,"Postcard is a photograph of the Willamette River at Oregon City, Oregon with paper mills.  | The Willamette River at Oregon City, Oregon showing the paper mills, the city's main industry.",,photographic postcards,,1960,paper mills; rivers; logs; millraces; mills (buildings); trees; photographic postcards,Oregon City,Oregon,Frye & Smith Ltd.,"San Diego, CA","PG 107, Knowles Postcard Collection, University of Idaho Library Special Collections and Archives, http://www.lib.uidaho.edu/special-collections/",yes,Postcard_063,"Educational use includes non-commercial use of text and images in materials for teaching and research purposes. Digital reproduction rights granted by University of Idaho Library. For other uses beyond educational use, please contact University of Idaho Library Special Collections and Archives Department at libspec@uidaho.edu.",http://rightsstatements.org/vocab/InC-EDU/1.0/,"3.375 x 5.375, Color",Image;StillImage,application/pdf,eng,45.349387,-122.617739,,,2013-01-15,2015-09-14,http://digital.lib.uidaho.edu:80/cdm/ref/collection/nwpostcards/id/196,196,59.pdf,/nwpostcards/image/59.pdf,nwpostcards196
Gooding County Courthouse,"Photo postcard of the Gooding County Courthouse in Gooding, Idaho. The building is labeled ""Lincoln Inn.""",,photographic postcards,,1930,photographic postcards; public buildings; county courthouses; automobiles,Gooding,Idaho,,,"PG 107, Knowles Postcard Collection, University of Idaho Library Special Collections and Archives, http://www.lib.uidaho.edu/special-collections/",yes,Postcard_006,"Educational use includes non-commercial use of text and images in materials for teaching and research purposes. Digital reproduction rights granted by University of Idaho Library. For other uses beyond educational use, please contact University of Idaho Library Special Collections and Archives Department at libspec@uidaho.edu.",http://rightsstatements.org/vocab/InC-EDU/1.0/,"3.4375 x 5.4375, Black and white",Image;StillImage,application/pdf,eng,42.938792,-114.713108,,,2013-01-15,2015-09-14,http://digital.lib.uidaho.edu:80/cdm/ref/collection/nwpostcards/id/197,197,6.pdf,/nwpostcards/image/6.pdf,nwpostcards197
Lambert Gardens,"Postcard is of the Lambert Gardens, a rose garden in Portland, Oregon.  | Lambert Gardens, located at 5120 Southeast 28th Avenue, is one of the show places of Portland - long known as the City of Roses. Union Oil Company's Natural Color Scenes of he West. Tour the west this year with 76 gasoline.",,picture postcards,,1960,rose gardens; brick (clay product); shrubs; gardens; Rosa (genus); Rosaceae (family); picture postcards,Portland,Oregon,Union Oil Company,,"PG 107, Knowles Postcard Collection, University of Idaho Library Special Collections and Archives, http://www.lib.uidaho.edu/special-collections/",yes,Postcard_064,"Educational use includes non-commercial use of text and images in materials for teaching and research purposes. Digital reproduction rights granted by University of Idaho Library. For other uses beyond educational use, please contact University of Idaho Library Special Collections and Archives Department at libspec@uidaho.edu.",http://rightsstatements.org/vocab/InC-EDU/1.0/,"3.5625 x 5.5, Color",Image;StillImage,application/pdf,eng,45.486527,-122.636141,,,2013-01-15,2015-09-14,http://digital.lib.uidaho.edu:80/cdm/ref/collection/nwpostcards/id/198,198,60.pdf,/nwpostcards/image/60.pdf,nwpostcards198
Oregon State Capitol at Salem,"Postcard is of the Oregon State Capitol building in Salem, Oregon. | Oregon's new State Capitol built at a cost of $2,500,000, replaces the one destroyed by fire the night of April 25, 1935. A 2 foot bronze statue of The Pioneer by Sculptor Ulric H. Ellerhusen tops the Capitol dome.",,picture postcards,,1950,public buildings; capitols; trees; picture postcards; domes (architectural elements); statues,Salem,Oregon,E.C. Kropp Co.,"Milwaukee, WI","PG 107, Knowles Postcard Collection, University of Idaho Library Special Collections and Archives, http://www.lib.uidaho.edu/special-collections/",yes,Postcard_065,"Educational use includes non-commercial use of text and images in materials for teaching and research purposes. Digital reproduction rights granted by University of Idaho Library. For other uses beyond educational use, please contact University of Idaho Library Special Collections and Archives Department at libspec@uidaho.edu.",http://rightsstatements.org/vocab/InC-EDU/1.0/,"3.5625 x 5.5, Color",Image;StillImage,application/pdf,eng,44.940242,-123.030172,,,2013-01-15,2015-09-14,http://digital.lib.uidaho.edu:80/cdm/ref/collection/nwpostcards/id/199,199,61.pdf,/nwpostcards/image/61.pdf,nwpostcards199
"State Capitol, Salem, Oregon (1)","Postcard is a photograph of the Oregon State Capitol building in Salem, Oregon.  | State Capitol, Salem, Oregon, completed for occupancy in 1939, is of modern design and one of the newest state capitols buildings. The most decorative feature of the exterior is the fluted cylindrical dome.",,photographic postcards,,1960,public buildings; capitols; trees; photographic postcards; domes (architectural elements); statues; flagpoles; flags,Salem,Oregon,Union Oil Company,,"PG 107, Knowles Postcard Collection, University of Idaho Library Special Collections and Archives, http://www.lib.uidaho.edu/special-collections/",yes,Postcard_066,"Educational use includes non-commercial use of text and images in materials for teaching and research purposes. Digital reproduction rights granted by University of Idaho Library. For other uses beyond educational use, please contact University of Idaho Library Special Collections and Archives Department at libspec@uidaho.edu.",http://rightsstatements.org/vocab/InC-EDU/1.0/,"3.5 x 5.5, Color",Image;StillImage,application/pdf,eng,44.938404,-123.029059,,,2013-01-15,2015-09-14,http://digital.lib.uidaho.edu:80/cdm/ref/collection/nwpostcards/id/200,200,62.pdf,/nwpostcards/image/62.pdf,nwpostcards200
"Spokane County Court House, Spokane, Washington (3)","Postcard is of the Spokane County Courthouse in Spokane, Washington. | Spokane County Court House, Spokane, Washington. One of the few buildings that is truly old Norman architecture.",,picture postcards,,1950,public buildings; county courthouses; trees; picture postcards; flagpoles; flags,Spokane; Spokane County Courthouse,Washington,Keenan News Agency,"Spokane, WA","PG 107, Knowles Postcard Collection, University of Idaho Library Special Collections and Archives, http://www.lib.uidaho.edu/special-collections/",yes,Postcard_035,"Educational use includes non-commercial use of text and images in materials for teaching and research purposes. Digital reproduction rights granted by University of Idaho Library. For other uses beyond educational use, please contact University of Idaho Library Special Collections and Archives Department at libspec@uidaho.edu.",http://rightsstatements.org/vocab/InC-EDU/1.0/,"3.4375 x 5.4375, Color",Image;StillImage,application/pdf,eng,47.66432,-117.428031,,,2013-01-15,2015-09-14,http://digital.lib.uidaho.edu:80/cdm/ref/collection/nwpostcards/id/201,201,63.pdf,/nwpostcards/image/63.pdf,nwpostcards201
"Oregon State Capitol Building, Salem, Oregon","Postcard is a black and white photograph of the Oregon State Capitol building in Salem, Oregon.","written message; postage applied; Postmark: 10/22/1946, Portland, OR; Destination: Toledo, OH",photographic postcards,Sawyer Scenic Photos,1946,public buildings; capitols; trees; photographic postcards; domes (architectural elements); statues,Salem,Oregon,Sawyer Scenic Photos,"Portland, OR","PG 107, Knowles Postcard Collection, University of Idaho Library Special Collections and Archives, http://www.lib.uidaho.edu/special-collections/",yes,Postcard_067,"Educational use includes non-commercial use of text and images in materials for teaching and research purposes. Digital reproduction rights granted by University of Idaho Library. For other uses beyond educational use, please contact University of Idaho Library Special Collections and Archives Department at libspec@uidaho.edu.",http://rightsstatements.org/vocab/InC-EDU/1.0/,"3.5 x 5.4375, Black and white",Image;StillImage,application/pdf,eng,44.938316,-123.029189,,,2013-01-15,2015-09-14,http://digital.lib.uidaho.edu:80/cdm/ref/collection/nwpostcards/id/202,202,64.pdf,/nwpostcards/image/64.pdf,nwpostcards202
Tillamook County Court House,"Postcard is a photograph of the Tillamook County Courthouse in Tillamook, Oregon.  | Tillamook County Court House, Tillamook, Oregon, trading center of this prosperous dairy land.",,photographic postcards,,1960,public buildings; county courthouses; trees; photographic postcards; automobiles,Tillamook,Oregon,Frye & Smith Ltd.,"San Diego, CA","PG 107, Knowles Postcard Collection, University of Idaho Library Special Collections and Archives, http://www.lib.uidaho.edu/special-collections/",yes,Postcard_068,"Educational use includes non-commercial use of text and images in materials for teaching and research purposes. Digital reproduction rights granted by University of Idaho Library. For other uses beyond educational use, please contact University of Idaho Library Special Collections and Archives Department at libspec@uidaho.edu.",http://rightsstatements.org/vocab/InC-EDU/1.0/,"3.4375 x 5.375, Color",Image;StillImage,application/pdf,eng,45.456706,-123.8422,,,2013-01-15,2015-09-14,http://digital.lib.uidaho.edu:80/cdm/ref/collection/nwpostcards/id/203,203,65.pdf,/nwpostcards/image/65.pdf,nwpostcards203
Fort Stevens State Park,"Postcard is a photograph of Coffinbury Lake in Fort Stevens State Park, near Warrenton, Oregon.  | Fort Stevens State Park, Warrenton, Oregon. Beautiful Coffinbury Lake with Saddle Mountain in the background. This area offers excellent swimming, boating, camping and picnic facilities.",,photographic postcards,Earl Johnson,1970,lakes; mountains; trees; photographic postcards,Fort Stevens State Park; Warrenton,Oregon,Smith's Scenic Views,"Tacoma, WA","PG 107, Knowles Postcard Collection, University of Idaho Library Special Collections and Archives, http://www.lib.uidaho.edu/special-collections/",yes,Postcard_069,"Educational use includes non-commercial use of text and images in materials for teaching and research purposes. Digital reproduction rights granted by University of Idaho Library. For other uses beyond educational use, please contact University of Idaho Library Special Collections and Archives Department at libspec@uidaho.edu.",http://rightsstatements.org/vocab/InC-EDU/1.0/,"3.5 x 5.5, Color",Image;StillImage,application/pdf,eng,46.176889,-123.966082,,,2013-01-15,2015-09-14,http://digital.lib.uidaho.edu:80/cdm/ref/collection/nwpostcards/id/204,204,66.pdf,/nwpostcards/image/66.pdf,nwpostcards204
