title,description,item information,postcard type,photographer,date,subject,location,state,publisher,publisher location,source,date is approximate,identifier,rights,standardized rights,original format,type,format,language,latitude,longitude,filename,oclc number,date created,date modified,reference url,cdm-id,contentdm file name,contentdm file path,object-id
Washington harvest scene,"Postcard of a horse drawn combine harvesting grain in fields near Pullman, Washington.",,picture postcard,,1950,combines; fields (land); Equus caballus (species); men; picture postcards,Pullman,Washington,J.L. Robbins Co.,"Spokane, WA","PG 9, Postcard Collection, University of Idaho Library Special Collections and Archives, http://www.lib.uidaho.edu/special-collections/",yes,pg_9_16_03a,"Educational use includes non-commercial use of text and images in materials for teaching and research purposes. Digital reproduction rights granted by University of Idaho Library. For other uses beyond educational use, please contact University of Idaho Library Special Collections and Archives Department at libspec@uidaho.edu.",http://rightsstatements.org/vocab/InC-EDU/1.0/,"3.5x5.5, color postcard",Image;StillImage,image/jpg,eng,46.781607,-117.166371,,,2013-04-09,2015-09-14,http://digital.lib.uidaho.edu:80/cdm/ref/collection/nwpostcards/id/594,594,595.jp2,/nwpostcards/image/595.jp2,nwpostcards594
Combined harvester in eastern Washington,Postcard of a horse drawn combine harvesting grain in fields in Eastern Washington.,,picture postcard,,1930,combines; fields (land); Equus caballus (species); men; picture postcards,Colfax,Washington,Portland Post Card Co.,"Seattle, WA; Portland, OR","PG 9, Postcard Collection, University of Idaho Library Special Collections and Archives, http://www.lib.uidaho.edu/special-collections/",yes,pg_9_16_04a,"Material determined to be in Public Domain based on date of publication. Material made available by the University of Idaho Library. For more information, please contact University of Idaho Library Special Collections and Archives Department at libspec@uidaho.edu.",https://creativecommons.org/publicdomain/mark/1.0/,"3.5x5.5, color postcard",Image;StillImage,image/jpg,eng,46.846045,-117.460685,,,2013-04-09,2015-09-14,http://digital.lib.uidaho.edu:80/cdm/ref/collection/nwpostcards/id/595,595,596.jp2,/nwpostcards/image/596.jp2,nwpostcards595
"Six men peeling potatoes. Camp Lewis, Washington.",Postcard of men peeling potatoes at Camp Lewis in Washington state.,,photographic postcard,,1918,men; peelers; army camps; army housing; army bases; buckets (vessels); buildings; photographic postcards,Fort Lewis,Washington,,,"PG 9, Postcard Collection, University of Idaho Library Special Collections and Archives, http://www.lib.uidaho.edu/special-collections/",yes,pg_9_17_02,"Material determined to be in Public Domain based on date of publication. Material made available by the University of Idaho Library. For more information, please contact University of Idaho Library Special Collections and Archives Department at libspec@uidaho.edu.",https://creativecommons.org/publicdomain/mark/1.0/,"3.5x5.5, black and white postcard",Image;StillImage,image/jpg,eng,47.115847,-122.542752,,,2013-04-09,2015-09-14,http://digital.lib.uidaho.edu:80/cdm/ref/collection/nwpostcards/id/596,596,597.jp2,/nwpostcards/image/597.jp2,nwpostcards596
"Famous Lewiston Hill, Lewiston, Idaho.","Postcard of the hill and highway north of Lewiston, Idaho.",,photographic postcard,Ross Hall,1930,rivers; cities; bridges; highways; mountains; photographic postcards,Lewiston,Idaho,Ross Hall Studio,"Sandpoint, ID","PG 9, Postcard Collection, University of Idaho Library Special Collections and Archives, http://www.lib.uidaho.edu/special-collections/",yes,pg_9_17_03,"Educational use includes non-commercial use of text and images in materials for teaching and research purposes. Digital reproduction rights granted by University of Idaho Library. For other uses beyond educational use, please contact University of Idaho Library Special Collections and Archives Department at libspec@uidaho.edu.",http://rightsstatements.org/vocab/InC-EDU/1.0/,"3.5x5.5, black and white postcard",Image;StillImage,image/jpg,eng,46.397576,-116.991953,,,2013-04-09,2015-09-14,http://digital.lib.uidaho.edu:80/cdm/ref/collection/nwpostcards/id/597,597,598.jp2,/nwpostcards/image/598.jp2,nwpostcards597
"Lewiston Hill. North of Lewiston, Idaho","Postcard of Lewiston, Idaho and Clarkston, Washington and the confluence of the Clearwater and the Snake Rivers. | The Lewiston Hill on Hwy 95. The north-bound motorist leaves Lewiston and ascends 2000 feet over 11 miles of continuously winding road. The confluence of the Clearwater (left) and the Snake Rivers may be seen in the distance",,photographic postcard,,1970,rivers; cities; bridges; highways; mountains; automobiles; photographic postcards,Lewiston,Idaho,Ross Hall Studio,"Sandpoint, ID","PG 9, Postcard Collection, University of Idaho Library Special Collections and Archives, http://www.lib.uidaho.edu/special-collections/",yes,pg_9_17_03b,"Educational use includes non-commercial use of text and images in materials for teaching and research purposes. Digital reproduction rights granted by University of Idaho Library. For other uses beyond educational use, please contact University of Idaho Library Special Collections and Archives Department at libspec@uidaho.edu.",http://rightsstatements.org/vocab/InC-EDU/1.0/,"3.5x5.5, color postcard",Image;StillImage,image/jpg,eng,46.460824,-117.014888,,,2013-04-09,2015-09-14,http://digital.lib.uidaho.edu:80/cdm/ref/collection/nwpostcards/id/598,598,599.jp2,/nwpostcards/image/599.jp2,nwpostcards598
"Sheepherding wagon at base of Boulder Mountain near Sun Valley, Idaho.","Postcard of a sheepherding wagon at the base of Boulder Mountain near Sun Valley, Idaho. | Sheepherding wagon at base of Boulder Mountain near Sun Valley, Idaho.",,photographic postcard,D.M. Dorward,1970,Equus caballus (species); horse-drawn vehicles; trees; mountains; photographic postcards,Sun Valley,Idaho,D.M. Dorward,"Ketchum, ID","PG 9, Postcard Collection, University of Idaho Library Special Collections and Archives, http://www.lib.uidaho.edu/special-collections/",yes,pg_9_17_07a,"Educational use includes non-commercial use of text and images in materials for teaching and research purposes. Digital reproduction rights granted by University of Idaho Library. For other uses beyond educational use, please contact University of Idaho Library Special Collections and Archives Department at libspec@uidaho.edu.",http://rightsstatements.org/vocab/InC-EDU/1.0/,"4x6, color postcard",Image;StillImage,image/jpg,eng,43.812125,-114.520651,,,2013-04-09,2015-09-14,http://digital.lib.uidaho.edu:80/cdm/ref/collection/nwpostcards/id/599,599,600.jp2,/nwpostcards/image/600.jp2,nwpostcards599
"Devil's Elbow and Pacific & Idaho Northern Road, Idaho. Train.","Postcard of a train travelling around a sharp corner near Wallace, Idaho.",,photographic postcard,,1920,railroads;  trains (vehicle groupings); mountains; trees; rivers; photographic postcards,Wallace,Idaho,Wesley Andrews,"Baker, OR","PG 9, Postcard Collection, University of Idaho Library Special Collections and Archives, http://www.lib.uidaho.edu/special-collections/",yes,pg_9_17_05a,"Material determined to be in Public Domain based on date of publication. Material made available by the University of Idaho Library. For more information, please contact University of Idaho Library Special Collections and Archives Department at libspec@uidaho.edu.",https://creativecommons.org/publicdomain/mark/1.0/,"3.5x5.5, color postcard",Image;StillImage,image/jpg,eng,47.775726,-116.031302,,,2013-04-09,2015-09-14,http://digital.lib.uidaho.edu:80/cdm/ref/collection/nwpostcards/id/600,600,601.jp2,/nwpostcards/image/601.jp2,nwpostcards600
Camas Prairie freight train on trestle above Lapwai Canyon.,"Postcard of a train traveling on the Camas Prairie in Idaho. | The Camas Prairie freight emerges from a tunnel onto a winding trestle along a section of difficult roadbed. Below, in Lapwai Canyon between Lewiston and Grangeville, Idaho, Highway 95 can be viewed in a new, modern stretch of thoroughfare. This highway replaced the tortuous Winchester grade.",,photographic postcard,,1970,trestles (bridges); railroads; trains; trees; highways; mountains; photographic postcards,Lapwai,Idaho,Ross Hall Scenics,"Sandpoint, ID","PG 9, Postcard Collection, University of Idaho Library Special Collections and Archives, http://www.lib.uidaho.edu/special-collections/",yes,pg_9_17_10a,"Educational use includes non-commercial use of text and images in materials for teaching and research purposes. Digital reproduction rights granted by University of Idaho Library. For other uses beyond educational use, please contact University of Idaho Library Special Collections and Archives Department at libspec@uidaho.edu.",http://rightsstatements.org/vocab/InC-EDU/1.0/,"3.5x5.5, color postcard",Image;StillImage,image/jpg,eng,46.324127,-116.572694,,,2013-04-09,2015-09-14,http://digital.lib.uidaho.edu:80/cdm/ref/collection/nwpostcards/id/601,601,602.jp2,/nwpostcards/image/602.jp2,nwpostcards601
"Idaho National Guard Building, Moscow, Idaho. 124.","Postcard of the Idaho National Guard Building in Moscow, Idaho.",,photographic postcard,,1930,buildings; military buildings; photographic postcards,Moscow,Idaho,,,"PG 9, Postcard Collection, University of Idaho Library Special Collections and Archives, http://www.lib.uidaho.edu/special-collections/",yes,pg_9_17_11a,"Educational use includes non-commercial use of text and images in materials for teaching and research purposes. Digital reproduction rights granted by University of Idaho Library. For other uses beyond educational use, please contact University of Idaho Library Special Collections and Archives Department at libspec@uidaho.edu.",http://rightsstatements.org/vocab/InC-EDU/1.0/,"3.5x5.5, black and white postcard",Image;StillImage,image/jpg,eng,46.724528,-116.98511,,,2013-04-09,2015-09-14,http://digital.lib.uidaho.edu:80/cdm/ref/collection/nwpostcards/id/602,602,603.jp2,/nwpostcards/image/603.jp2,nwpostcards602
"Union Depot. Moscow, Idaho. 117.","Postcard of a train station in Moscow, Idaho.",,photographic postcard,,1930,buildings; railroads; railroad stations; pole lamps; photographic postcards,Moscow,Idaho,,,"PG 9, Postcard Collection, University of Idaho Library Special Collections and Archives, http://www.lib.uidaho.edu/special-collections/",yes,pg_9_17_12a,"Educational use includes non-commercial use of text and images in materials for teaching and research purposes. Digital reproduction rights granted by University of Idaho Library. For other uses beyond educational use, please contact University of Idaho Library Special Collections and Archives Department at libspec@uidaho.edu.",http://rightsstatements.org/vocab/InC-EDU/1.0/,"3.5x5.5, black and white postcard",Image;StillImage,image/jpg,eng,46.729573,-117.00571,,,2013-04-09,2015-09-14,http://digital.lib.uidaho.edu:80/cdm/ref/collection/nwpostcards/id/603,603,604.jp2,/nwpostcards/image/604.jp2,nwpostcards603
"Rocky Mountain Sheep. Sawtooth Mountains, Idaho","Postcard of Bighorn Sheep in the Sawtooth Mountains, Idaho.",,photographic postcard,Wesley Andrews?,1920,Ovis (genus); trees; mountains; rocks; photographic postcards,Sawtooth Mountains,Idaho,,,"PG 9, Postcard Collection, University of Idaho Library Special Collections and Archives, http://www.lib.uidaho.edu/special-collections/",yes,pg_9_17_13a,"Material determined to be in Public Domain based on date of publication. Material made available by the University of Idaho Library. For more information, please contact University of Idaho Library Special Collections and Archives Department at libspec@uidaho.edu.",https://creativecommons.org/publicdomain/mark/1.0/,"3.5x5.5, black and white postcard",Image;StillImage,image/jpg,eng,44.196174,-115.041289,,,2013-04-09,2015-09-14,http://digital.lib.uidaho.edu:80/cdm/ref/collection/nwpostcards/id/604,604,605.jp2,/nwpostcards/image/605.jp2,nwpostcards604
Elk bulls of the Sawtooth,Postcard of Elk Bulls in the Sawtooth Mountains in Idaho.,,photographic postcard,Wesley Andrews?,1930,Cervus Canadensis (species); trees; mountains; fields (land; photographic postcards,Sawtooth Mountains,Idaho,,,"PG 9, Postcard Collection, University of Idaho Library Special Collections and Archives, http://www.lib.uidaho.edu/special-collections/",yes,pg_9_17_14a,"Educational use includes non-commercial use of text and images in materials for teaching and research purposes. Digital reproduction rights granted by University of Idaho Library. For other uses beyond educational use, please contact University of Idaho Library Special Collections and Archives Department at libspec@uidaho.edu.",http://rightsstatements.org/vocab/InC-EDU/1.0/,"3.5x5.5, black and white postcard",Image;StillImage,image/jpg,eng,44.192513,-114.966609,,,2013-04-09,2015-09-14,http://digital.lib.uidaho.edu:80/cdm/ref/collection/nwpostcards/id/605,605,606.jp2,/nwpostcards/image/606.jp2,nwpostcards605
Bear grass in bloom in North Idaho,Postcard of Bear Grass blooming in the mountains of Idaho.,,photographic postcard,Ross Hall,1920,perennials; rocks; mountains; trees; photographic postcards,Bonners Ferry,Idaho,Ross Hall Studio,"Sandpoint, ID","PG 9, Postcard Collection, University of Idaho Library Special Collections and Archives, http://www.lib.uidaho.edu/special-collections/",yes,pg_9_17_15a,"Material determined to be in Public Domain based on date of publication. Material made available by the University of Idaho Library. For more information, please contact University of Idaho Library Special Collections and Archives Department at libspec@uidaho.edu.",https://creativecommons.org/publicdomain/mark/1.0/,"3.5x5.5, black and white postcard",Image;StillImage,image/jpg,eng,48.680449,-116.626961,,,2013-04-09,2015-09-14,http://digital.lib.uidaho.edu:80/cdm/ref/collection/nwpostcards/id/606,606,607.jp2,/nwpostcards/image/607.jp2,nwpostcards606
"Field of Camassia quamash (Camas) growing near Highway #21, Idaho Boise Basin route","Postcard of a field of Camas flowers in Idaho. | Wild Camas growing near Highway #21, Idaho Boise Basin route. The Nez Perce Indians made flour from the dried bulbs and also ate them after steaming them in a pit preheated with hot rocks covered with dirt and drenched with water. These same Indians gave a quantity of Camas flower to the half starved Lewis & Clark party as they emerged from the Lolo Trail (1805) on their way to the Pacific Ocean.",,photographic postcard,,1960,perennials; flowers; fields (land); mountains; photographic postcards,Grangeville,Idaho,H.W. Steward,"Boise, ID","PG 9, Postcard Collection, University of Idaho Library Special Collections and Archives, http://www.lib.uidaho.edu/special-collections/",yes,pg_9_17_16a,"Educational use includes non-commercial use of text and images in materials for teaching and research purposes. Digital reproduction rights granted by University of Idaho Library. For other uses beyond educational use, please contact University of Idaho Library Special Collections and Archives Department at libspec@uidaho.edu.",http://rightsstatements.org/vocab/InC-EDU/1.0/,"3.5x5.5, color postcard",Image;StillImage,image/jpg,eng,45.908226,-116.127427,,,2013-04-09,2015-09-14,http://digital.lib.uidaho.edu:80/cdm/ref/collection/nwpostcards/id/607,607,608.jp2,/nwpostcards/image/608.jp2,nwpostcards607
Unidentified home,Postcard of a man standing in front of an unidentified home.,,photographic postcard,,1920,houses; buildings; men; trees; photographic postcards,Moscow,Idaho,,,"PG 9, Postcard Collection, University of Idaho Library Special Collections and Archives, http://www.lib.uidaho.edu/special-collections/",yes,pg_9_17_17a,"Material determined to be in Public Domain based on date of publication. Material made available by the University of Idaho Library. For more information, please contact University of Idaho Library Special Collections and Archives Department at libspec@uidaho.edu.",https://creativecommons.org/publicdomain/mark/1.0/,"3.5x5.5, black and white postcard",Image;StillImage,image/jpg,eng,46.730116,-116.98761,,,2013-04-09,2015-09-14,http://digital.lib.uidaho.edu:80/cdm/ref/collection/nwpostcards/id/608,608,609.jp2,/nwpostcards/image/609.jp2,nwpostcards608
"World War I monument erected to memory of soldiers and sailors from Latah County. East City Park, Moscow, Idaho.","Postcard of a monument erected to the memory of the soldiers & sailors from Latah County, Idaho who gave their lives in the World War located in East City Park, Moscow, Idaho.",,photographic postcard,,1922,statues; parks; war memorials; trees; photographic postcards,Moscow,Idaho,,,"PG 9, Postcard Collection, University of Idaho Library Special Collections and Archives, http://www.lib.uidaho.edu/special-collections/",yes,pg_9_18_01,"Material determined to be in Public Domain based on date of publication. Material made available by the University of Idaho Library. For more information, please contact University of Idaho Library Special Collections and Archives Department at libspec@uidaho.edu.",https://creativecommons.org/publicdomain/mark/1.0/,"3.5x5.5, black and white postcard",Image;StillImage,image/jpg,eng,46.733026,-116.990587,,,2013-04-09,2015-09-14,http://digital.lib.uidaho.edu:80/cdm/ref/collection/nwpostcards/id/609,609,610.jp2,/nwpostcards/image/610.jp2,nwpostcards609
Spanish-American War Memorial. University of Idaho.,Postcard of a monument erected to the memory of the University of Idaho students who served in the Spanish-American War.,,picture postcard,,1920,statues; war memorials; universities (institutions); trees; picture postcards,Moscow,Idaho,Chas. E. Morris,"Chinook, MT","PG 9, Postcard Collection, University of Idaho Library Special Collections and Archives, http://www.lib.uidaho.edu/special-collections/",yes,pg_9_18_02,"Material determined to be in Public Domain based on date of publication. Material made available by the University of Idaho Library. For more information, please contact University of Idaho Library Special Collections and Archives Department at libspec@uidaho.edu.",https://creativecommons.org/publicdomain/mark/1.0/,"3.5x5.5, color postcard",Image;StillImage,image/jpg,eng,46.726424,-117.00962,,,2013-04-09,2015-09-14,http://digital.lib.uidaho.edu:80/cdm/ref/collection/nwpostcards/id/610,610,611.jp2,/nwpostcards/image/611.jp2,nwpostcards610
Sunshine Mine Disaster Memorial.,Postcard of the Sunshine Mine Disaster Memorial. | In honor of the 91 victims of the country's worst mine disaster (since 1917) plus all the living hardrock miners of the Coeur d'Alene Mining District.,,photographic postcard,Will Haskins,1973,statues; memorials; disasters; mining; photographic postcards,Kellogg,Idaho,Ross Hall Scenics,"Sandpoint, ID","PG 9, Postcard Collection, University of Idaho Library Special Collections and Archives, http://www.lib.uidaho.edu/special-collections/",yes,pg_9_18_03,"Educational use includes non-commercial use of text and images in materials for teaching and research purposes. Digital reproduction rights granted by University of Idaho Library. For other uses beyond educational use, please contact University of Idaho Library Special Collections and Archives Department at libspec@uidaho.edu.",http://rightsstatements.org/vocab/InC-EDU/1.0/,"4x6, color postcard",Image;StillImage,image/jpg,eng,47.528105,-116.04793,,,2013-04-09,2015-09-14,http://digital.lib.uidaho.edu:80/cdm/ref/collection/nwpostcards/id/611,611,612.jp2,/nwpostcards/image/612.jp2,nwpostcards611
"Masonic Temple, Lewiston, Idaho. Theatre.","Postcard of a Masonic building in Lewiston, Idaho.",,picture postcard,,1905,fraternal lodges; buildings; trees; utility poles; picture postcards,Lewiston,Idaho,Henry Fair,"Lewiston, ID","PG 9, Postcard Collection, University of Idaho Library Special Collections and Archives, http://www.lib.uidaho.edu/special-collections/",yes,pg_9_19_02a,"Material determined to be in Public Domain based on date of publication. Material made available by the University of Idaho Library. For more information, please contact University of Idaho Library Special Collections and Archives Department at libspec@uidaho.edu.",https://creativecommons.org/publicdomain/mark/1.0/,"3.5x5.5, color postcard",Image;StillImage,image/jpg,eng,46.419737,-117.022108,,,2013-04-09,2015-09-14,http://digital.lib.uidaho.edu:80/cdm/ref/collection/nwpostcards/id/612,612,613.jp2,/nwpostcards/image/613.jp2,nwpostcards612
Crowd at the Freshman-Sophomore fight (Hulme fight). University of Idaho.,"Postcard of a crowd at a freshman-sophomore fight on the University of Idaho campus in Moscow, Idaho.",written message,photographic postcard,,1916,students; universities (institutions); men; photographic postcards,Moscow,Idaho,,,"PG 9, Postcard Collection, University of Idaho Library Special Collections and Archives, http://www.lib.uidaho.edu/special-collections/",yes,pg_9_20_01h,"Material determined to be in Public Domain based on date of publication. Material made available by the University of Idaho Library. For more information, please contact University of Idaho Library Special Collections and Archives Department at libspec@uidaho.edu.",https://creativecommons.org/publicdomain/mark/1.0/,"3.5x5.5, black and white postcard",Image;StillImage,application/pdf,eng,46.726223,-117.016471,,,2013-04-09,2015-09-14,http://digital.lib.uidaho.edu:80/cdm/ref/collection/nwpostcards/id/613,613,614.pdf,/nwpostcards/image/614.pdf,nwpostcards613
"Pick-a-back"""" Relay, 9. University of Idaho.","Postcard of a game of """"pick-a-back"""" relay between freshman and sophomores at the University of Idaho campus in Moscow, Idaho.",written message,photographic postcard,,1915,piggyback; games; students; universities (institutions); photographic postcards,Moscow,Idaho,,,"PG 9, Postcard Collection, University of Idaho Library Special Collections and Archives, http://www.lib.uidaho.edu/special-collections/",yes,pg_9_20_01i,"Material determined to be in Public Domain based on date of publication. Material made available by the University of Idaho Library. For more information, please contact University of Idaho Library Special Collections and Archives Department at libspec@uidaho.edu.",https://creativecommons.org/publicdomain/mark/1.0/,"3.5x5.5, black and white postcard",Image;StillImage,application/pdf,eng,46.72512,-117.00962,,,2013-04-09,2015-09-14,http://digital.lib.uidaho.edu:80/cdm/ref/collection/nwpostcards/id/614,614,615.pdf,/nwpostcards/image/615.pdf,nwpostcards614
Football. University of Idaho. UofI wins from WSC 13-0.,Postcard of a football game between the University of Idaho and Washington State College in 1912.,,photographic postcard,,1912,football (sports); football fields; athletes; men; women; field sports; sports uniforms; universities (institutions); photographic postcards,Moscow,Idaho,,,"PG 9, Postcard Collection, University of Idaho Library Special Collections and Archives, http://www.lib.uidaho.edu/special-collections/",yes,pg_9_20_01a,"Material determined to be in Public Domain based on date of publication. Material made available by the University of Idaho Library. For more information, please contact University of Idaho Library Special Collections and Archives Department at libspec@uidaho.edu.",https://creativecommons.org/publicdomain/mark/1.0/,"3.5x5.5, black and white postcard",Image;StillImage,image/jpg,eng,46.726201,-117.017367,,,2013-04-09,2015-09-14,http://digital.lib.uidaho.edu:80/cdm/ref/collection/nwpostcards/id/615,615,616.jp2,/nwpostcards/image/616.jp2,nwpostcards615
"Logging camp, Collins, Idaho.","Postcard of a logging camp in Collins, Idaho.",,photographic postcard,,1913,lumber camps; men; children; snow; trees; photographic postcards,Collins,Idaho,,,"PG 9, Postcard Collection, University of Idaho Library Special Collections and Archives, http://www.lib.uidaho.edu/special-collections/",yes,pg_9_21_01a,"Material determined to be in Public Domain based on date of publication. Material made available by the University of Idaho Library. For more information, please contact University of Idaho Library Special Collections and Archives Department at libspec@uidaho.edu.",https://creativecommons.org/publicdomain/mark/1.0/,"3.5x5.5, black and white postcard",Image;StillImage,application/pdf,eng,43.201672,-112.391903,,,2013-04-09,2015-09-14,http://digital.lib.uidaho.edu:80/cdm/ref/collection/nwpostcards/id/616,616,617.pdf,/nwpostcards/image/617.pdf,nwpostcards616
Three first prize winners owned by the University of Idaho. Cattle.,Postcard of prize winning cows at the University of Idaho.,,photographic postcard,,1915,cattle; cattle barns; men; prizes; photographic postcards,Moscow,Idaho,Marcell Photo,"Moscow, ID","PG 9, Postcard Collection, University of Idaho Library Special Collections and Archives, http://www.lib.uidaho.edu/special-collections/",yes,pg_9_20_01b,"Material determined to be in Public Domain based on date of publication. Material made available by the University of Idaho Library. For more information, please contact University of Idaho Library Special Collections and Archives Department at libspec@uidaho.edu.",https://creativecommons.org/publicdomain/mark/1.0/,"3.5x5.5, black and white postcard",Image;StillImage,image/jpg,eng,46.730415,-117.026427,,,2013-04-09,2015-09-14,http://digital.lib.uidaho.edu:80/cdm/ref/collection/nwpostcards/id/617,617,618.jp2,/nwpostcards/image/618.jp2,nwpostcards617
