title,description,item information,postcard type,photographer,date,subject,location,state,publisher,publisher location,source,date is approximate,identifier,rights,standardized rights,original format,type,format,language,latitude,longitude,filename,oclc number,date created,date modified,reference url,cdm-id,contentdm file name,contentdm file path,object-id
"Shoshone Falls, Idaho","Postcard of Shoshone Falls near Twin Falls, Idaho. | Shoshone Falls, Idaho. Located near city of Twin Falls. They are 212 feet high and 1500 feet wide. Upper falls shown are (from left to right) Bridal Veil, Bride's Maid, The Two Graces (in center) and the Sentinel at extreme right and slightly above.",,picture postcard,Bisbee Photo,1930,waterfalls (natural bodies of water); buildings; rivers; canyons; picture postcards,Twin Falls,Idaho,"Wesley Andrews, Co.","Portland, OR","PG 9, Postcard Collection, University of Idaho Library Special Collections and Archives, http://www.lib.uidaho.edu/special-collections/",yes,pg_9_06_14a,"Educational use includes non-commercial use of text and images in materials for teaching and research purposes. Digital reproduction rights granted by University of Idaho Library. For other uses beyond educational use, please contact University of Idaho Library Special Collections and Archives Department at libspec@uidaho.edu.",http://rightsstatements.org/vocab/InC-EDU/1.0/,"3.5x5.5, color postcard",Image;StillImage,image/jpg,eng,42.593383,-114.404681,,,2013-04-09,2015-09-14,http://digital.lib.uidaho.edu:80/cdm/ref/collection/nwpostcards/id/389,389,390.jp2,/nwpostcards/image/390.jp2,nwpostcards389
"Salmon River Highway U.S. 93. Below Salmon, Idaho","Postcard of the Salmon River Highway below Salmon, Idaho.",,photographic postcard,Wesley Andrews?,1920,rivers; trees; highways; mountains; photographic postcards,Salmon,Idaho,,,"PG 9, Postcard Collection, University of Idaho Library Special Collections and Archives, http://www.lib.uidaho.edu/special-collections/",yes,pg_9_06_15a,"Material determined to be in Public Domain based on date of publication. Material made available by the University of Idaho Library. For more information, please contact University of Idaho Library Special Collections and Archives Department at libspec@uidaho.edu.",https://creativecommons.org/publicdomain/mark/1.0/,"3.5x5.5, black and white postcard",Image;StillImage,image/jpg,eng,44.95259,-113.955445,,,2013-04-09,2015-09-14,http://digital.lib.uidaho.edu:80/cdm/ref/collection/nwpostcards/id/390,390,391.jp2,/nwpostcards/image/391.jp2,nwpostcards390
"Salmon River below Salmon, Idaho. Shows U.S. 93.","Postcard of Salmon River below Salmon, Idaho.",,photographic postcard,Wesley Andrews?,1920,rivers; trees; highways; mountains; bridges; photographic postcards,Salmon,Idaho,,,"PG 9, Postcard Collection, University of Idaho Library Special Collections and Archives, http://www.lib.uidaho.edu/special-collections/",yes,pg_9_06_15b,"Material determined to be in Public Domain based on date of publication. Material made available by the University of Idaho Library. For more information, please contact University of Idaho Library Special Collections and Archives Department at libspec@uidaho.edu.",https://creativecommons.org/publicdomain/mark/1.0/,"3.5x5.5, black and white postcard",Image;StillImage,image/jpg,eng,44.984653,-113.947892,,,2013-04-09,2015-09-14,http://digital.lib.uidaho.edu:80/cdm/ref/collection/nwpostcards/id/391,391,392.jp2,/nwpostcards/image/392.jp2,nwpostcards391
Baron Lake and Monte Verita (Mt. Of Truth). Boise National Forest,"Postcard of Baron Lake and Monte Verita in Idaho. | Baron Lake and Monte Verita (Mt. of Truth) (The place to go is Idaho) The larger of the three Baron Lakes, located 17 miles from the Sawtooth Lodge by Pack Trail only. 1 mile from summit of the Sawtooth Mts. places it in one of the most beautiful settings imaginable. (Boise National Forest.)",,photographic postcard,H.W. Steward,1960,mountains; lakes; trees; photographic postcards,Baron Lakes,Idaho,H.W. Steward,"Boise, ID","PG 9, Postcard Collection, University of Idaho Library Special Collections and Archives, http://www.lib.uidaho.edu/special-collections/",yes,pg_9_06_16a,"Educational use includes non-commercial use of text and images in materials for teaching and research purposes. Digital reproduction rights granted by University of Idaho Library. For other uses beyond educational use, please contact University of Idaho Library Special Collections and Archives Department at libspec@uidaho.edu.",http://rightsstatements.org/vocab/InC-EDU/1.0/,"3.5x5.5, color postcard",Image;StillImage,image/jpg,eng,44.082761,-115.030335,,,2013-04-09,2015-09-14,http://digital.lib.uidaho.edu:80/cdm/ref/collection/nwpostcards/id/392,392,393.jp2,/nwpostcards/image/393.jp2,nwpostcards392
Redfish Lake. Sawtooth National Forest,"Postcard of Redfish Lake in the Sawtooth National Forest in Idaho. | Redfish Lake, Sawtooth National Forest. This lake is on U.S. 93 in the Sawtooth Mountain Range. Mt. Heyburn on the right is over 10,000 ft. elevation. Camping and lodge facilities are available.",,photographic postcard,Ernst Peterson,1970,lakes; mountains; trees; snow; photographic postcards,Redfish Lake,Idaho,N.W. Curio & Postcard Co.,"Boise, ID","PG 9, Postcard Collection, University of Idaho Library Special Collections and Archives, http://www.lib.uidaho.edu/special-collections/",yes,pg_9_06_19a,"Educational use includes non-commercial use of text and images in materials for teaching and research purposes. Digital reproduction rights granted by University of Idaho Library. For other uses beyond educational use, please contact University of Idaho Library Special Collections and Archives Department at libspec@uidaho.edu.",http://rightsstatements.org/vocab/InC-EDU/1.0/,"3.5x5.5, color postcard",Image;StillImage,image/jpg,eng,44.135653,-114.917536,,,2013-04-09,2015-09-14,http://digital.lib.uidaho.edu:80/cdm/ref/collection/nwpostcards/id/393,393,394.jp2,/nwpostcards/image/394.jp2,nwpostcards393
"Nigger Head Point, Coeur d'Alene Lake, Coeur d'Alene, Idaho. 114.","Postcard of """"Nigger Head Point,"""" renamed Arrowhead Point in the 1960s, on lake Coeur d'Alene Lake, near Coeur d'Alene, Idaho. | 114 Nigger Head Point, Coeur D'Alene Lake, Coeur D'Alene, Idaho.",,picture postcard,,1930,boats; boathouses; trees; lakes; mountains; picture postcards,Coeur d'Alene; Lake Coeru d'Alene,Idaho,John W. Graham & Co.,"Spokane, WA","PG 9, Postcard Collection, University of Idaho Library Special Collections and Archives, http://www.lib.uidaho.edu/special-collections/",yes,pg_9_06_01b,"Educational use includes non-commercial use of text and images in materials for teaching and research purposes. Digital reproduction rights granted by University of Idaho Library. For other uses beyond educational use, please contact University of Idaho Library Special Collections and Archives Department at libspec@uidaho.edu.",http://rightsstatements.org/vocab/InC-EDU/1.0/,"3.5x5.5, color postcard",Image;StillImage,image/jpg,eng,47.632299,-116.765145,,,2013-04-09,2015-09-14,http://digital.lib.uidaho.edu:80/cdm/ref/collection/nwpostcards/id/394,394,395.jp2,/nwpostcards/image/395.jp2,nwpostcards394
Lake Pend Oreille. North Idaho,"Postcard of Lake Pend Oreille in Northern Idaho. | Beautiful lake Pend Oreille, in North Idaho, is shown here framed between native fir and yellow pine. Syringa, Idaho's state flower, may be seen in the foreground.",,photographic postcard,,1970,lakes; mountains; trees; islands; Equus caballus (species); photographic postcards,Lake Pend Oreille,Idaho,Ross Hall Studio,"Sandpoint, ID","PG 9, Postcard Collection, University of Idaho Library Special Collections and Archives, http://www.lib.uidaho.edu/special-collections/",yes,pg_9_06_20a,"Educational use includes non-commercial use of text and images in materials for teaching and research purposes. Digital reproduction rights granted by University of Idaho Library. For other uses beyond educational use, please contact University of Idaho Library Special Collections and Archives Department at libspec@uidaho.edu.",http://rightsstatements.org/vocab/InC-EDU/1.0/,"3.5x5.5, color postcard",Image;StillImage,image/jpg,eng,48.253884,-116.306341,,,2013-04-09,2015-09-14,http://digital.lib.uidaho.edu:80/cdm/ref/collection/nwpostcards/id/395,395,396.jp2,/nwpostcards/image/396.jp2,nwpostcards395
Stanley Lake and Sawtooth Mountains. Idaho,Postcard of Stanley Lake and the Sawtooth Mountains in Idaho. | A favorite recreation and fishing spot in the Sawtooth Mountains.,,photographic postcard,U.S. Forest Service,1950,lakes; mountains; trees; photographic postcards,Stanley Lake; Stanley,Idaho,Brownell & Sons,"Idaho Falls, ID","PG 9, Postcard Collection, University of Idaho Library Special Collections and Archives, http://www.lib.uidaho.edu/special-collections/",yes,pg_9_06_21a,"Educational use includes non-commercial use of text and images in materials for teaching and research purposes. Digital reproduction rights granted by University of Idaho Library. For other uses beyond educational use, please contact University of Idaho Library Special Collections and Archives Department at libspec@uidaho.edu.",http://rightsstatements.org/vocab/InC-EDU/1.0/,"3.5x5.5, black and white postcard",Image;StillImage,image/jpg,eng,44.24795,-115.056514,,,2013-04-09,2015-09-14,http://digital.lib.uidaho.edu:80/cdm/ref/collection/nwpostcards/id/396,396,397.jp2,/nwpostcards/image/397.jp2,nwpostcards396
"Brundage Mountain, McCall, Idaho.","Postcard of the Brundage Mountain Resort near McCall, Idaho.",,photographic postcard,,1960,automobiles; buildings; mountains; trees; snow; men; women; skiing; ski runs; ski resorts; photographic postcards,McCall; Brundage Mountain Resort,Idaho,N.W. Curio & Postcard Co.,"Boise, ID","PG 9, Postcard Collection, University of Idaho Library Special Collections and Archives, http://www.lib.uidaho.edu/special-collections/",yes,pg_9_07_01,"Educational use includes non-commercial use of text and images in materials for teaching and research purposes. Digital reproduction rights granted by University of Idaho Library. For other uses beyond educational use, please contact University of Idaho Library Special Collections and Archives Department at libspec@uidaho.edu.",http://rightsstatements.org/vocab/InC-EDU/1.0/,"3.5x5.5, color postcard",Image;StillImage,image/jpg,eng,45.005555,-116.156475,,,2013-04-09,2015-09-14,http://digital.lib.uidaho.edu:80/cdm/ref/collection/nwpostcards/id/397,397,398.jp2,/nwpostcards/image/398.jp2,nwpostcards397
"Summer scene, swimming pool. Sun Valley Lodge.",Postcard of the Sun Valley Lodge swimming pool in the summer.,,photographic postcard,,1960,buildings; mountains; flowers (plants); swimming pools; ski resorts; photographic postcards,Sun Valley,Idaho,,,"PG 9, Postcard Collection, University of Idaho Library Special Collections and Archives, http://www.lib.uidaho.edu/special-collections/",yes,pg_9_07_02a,"Educational use includes non-commercial use of text and images in materials for teaching and research purposes. Digital reproduction rights granted by University of Idaho Library. For other uses beyond educational use, please contact University of Idaho Library Special Collections and Archives Department at libspec@uidaho.edu.",http://rightsstatements.org/vocab/InC-EDU/1.0/,"3.5x5.5, color postcard",Image;StillImage,image/jpg,eng,43.696091,-114.352404,,,2013-04-09,2015-09-14,http://digital.lib.uidaho.edu:80/cdm/ref/collection/nwpostcards/id/398,398,399.jp2,/nwpostcards/image/399.jp2,nwpostcards398
Portion of Challenger Inn. Sun Valley Village.,"Postcard of an inn at Sun Valley, Idaho.",,photographic postcard,,1960,buildings; Equus caballus (species); inns; ski resorts; horse-drawn vehicles; trees; mountains; ponds (water); photographic postcards,Sun Valley,Idaho,,,"PG 9, Postcard Collection, University of Idaho Library Special Collections and Archives, http://www.lib.uidaho.edu/special-collections/",yes,pg_9_07_02b,"Educational use includes non-commercial use of text and images in materials for teaching and research purposes. Digital reproduction rights granted by University of Idaho Library. For other uses beyond educational use, please contact University of Idaho Library Special Collections and Archives Department at libspec@uidaho.edu.",http://rightsstatements.org/vocab/InC-EDU/1.0/,"3.5x5.5, color postcard",Image;StillImage,image/jpg,eng,43.697196,-114.353413,,,2013-04-09,2015-09-14,http://digital.lib.uidaho.edu:80/cdm/ref/collection/nwpostcards/id/399,399,400.jp2,/nwpostcards/image/400.jp2,nwpostcards399
"The Lodge. Sun Valley, Idaho.","Postcard of the lodge at Sun Valley Resort in Sun Valley, Idaho.",,photographic postcard,,1950,buildings; ski resorts; trees; ponds (water); inns; mountains; photographic postcards,Sun Valley,Idaho,,,"PG 9, Postcard Collection, University of Idaho Library Special Collections and Archives, http://www.lib.uidaho.edu/special-collections/",yes,pg_9_07_02c,"Educational use includes non-commercial use of text and images in materials for teaching and research purposes. Digital reproduction rights granted by University of Idaho Library. For other uses beyond educational use, please contact University of Idaho Library Special Collections and Archives Department at libspec@uidaho.edu.",http://rightsstatements.org/vocab/InC-EDU/1.0/,"3.5x5.5, black and white postcard",Image;StillImage,image/jpg,eng,43.693872,-114.354598,,,2013-04-09,2015-09-14,http://digital.lib.uidaho.edu:80/cdm/ref/collection/nwpostcards/id/400,400,401.jp2,/nwpostcards/image/401.jp2,nwpostcards400
"Scenic View. Sun Valley, Idaho.","Postcard of the Sun Valley Resort in Sun Valley, Idaho with the main lodge building in the foreground. | With facilities and accommodations second to none, the famous Idaho resort, in its delightful mountain setting, ranks as one of the West's outstanding spots. Sun Valley itself, and the immense and beautiful area in which it is located add up to a byword in summer vacation topics.",,photographic postcard,,1980,buildings; ski resorts; trees; mountains; ponds (water); photographic postcards,Sun Valley,Idaho,,,"PG 9, Postcard Collection, University of Idaho Library Special Collections and Archives, http://www.lib.uidaho.edu/special-collections/",yes,pg_9_07_02d,"Educational use includes non-commercial use of text and images in materials for teaching and research purposes. Digital reproduction rights granted by University of Idaho Library. For other uses beyond educational use, please contact University of Idaho Library Special Collections and Archives Department at libspec@uidaho.edu.",http://rightsstatements.org/vocab/InC-EDU/1.0/,"6x9, color postcard",Image;StillImage,image/jpg,eng,43.686588,-114.365537,,,2013-04-09,2015-09-14,http://digital.lib.uidaho.edu:80/cdm/ref/collection/nwpostcards/id/401,401,402.jp2,/nwpostcards/image/402.jp2,nwpostcards401
"Flowers on balcony of the Willow Chalet. Sun Valley, Idaho","Postcard of flowers on a balcony at a ski resort in Sun Valley, Idaho. | Flowers on balcony of the Willow Chalet, Sun Valley, Idaho.",,photographic postcard,Lou Holliday,1970,buildings; ski resorts; flowers (plants); balconies; trees ; photographic postcards,Sun Valley,Idaho,Intermountain Tourists Supply,"Salt Lake City, UT","PG 9, Postcard Collection, University of Idaho Library Special Collections and Archives, http://www.lib.uidaho.edu/special-collections/",yes,pg_9_07_02e,"Educational use includes non-commercial use of text and images in materials for teaching and research purposes. Digital reproduction rights granted by University of Idaho Library. For other uses beyond educational use, please contact University of Idaho Library Special Collections and Archives Department at libspec@uidaho.edu.",http://rightsstatements.org/vocab/InC-EDU/1.0/,"3.5x5.5, color postcard",Image;StillImage,image/jpg,eng,43.696114,-114.353316,,,2013-04-09,2015-09-14,http://digital.lib.uidaho.edu:80/cdm/ref/collection/nwpostcards/id/402,402,403.jp2,/nwpostcards/image/403.jp2,nwpostcards402
Sailboats on Lake Coeur d'Alene.,"Postcard of sailboats on Lake Coeur d'Alene, Idaho. | Sailboats on Lake Coeur d'Alene, one of the best sailing waters in the Nation. Photo by Duane D. Davis. Driftwood beaches contrast the sleek craft of these landlocked mariners. Lake Coeur d'Alene hosts regional and national regattas in addition to its large, active local fleet. Skippers are attracted to this lake by the gentle prevailing breezes and lack of high wave action. Cape Coeur d'Alene, on the lake's eastern shore, marks the setting of this scene southeast of Coeur d'Alene, Idaho.",,photographic postcard,Duane D. Davis,1980,sailboats; boats; lakes; trees; mountains; clouds; driftwood; photographic postcards,Coeur d'Alene; Lake Coeru d'Alene,Idaho,Ross Hall Scenics,"Sandpoint, ID","PG 9, Postcard Collection, University of Idaho Library Special Collections and Archives, http://www.lib.uidaho.edu/special-collections/",yes,pg_9_06_01c,"Educational use includes non-commercial use of text and images in materials for teaching and research purposes. Digital reproduction rights granted by University of Idaho Library. For other uses beyond educational use, please contact University of Idaho Library Special Collections and Archives Department at libspec@uidaho.edu.",http://rightsstatements.org/vocab/InC-EDU/1.0/,"3.5x5.5, color postcard",Image;StillImage,image/jpg,eng,47.663364,-116.781431,,,2013-04-09,2015-09-14,http://digital.lib.uidaho.edu:80/cdm/ref/collection/nwpostcards/id/403,403,404.jp2,/nwpostcards/image/404.jp2,nwpostcards403
"Flower border around east wing of Challenger Inn. Sun Valley, Idaho","Postcard of flowers around an Inn in Sun Valley, Idaho.  | Flower border around east wing, Challenger Inn Sun Valley, Idaho.",,photographic postcard,Lou Holliday,1970,buildings; ski resorts; flowers (plants); inns; trees; mountains; photographic postcards,Sun Valley,Idaho,Intermountain Tourists Supply,"Salt Lake City, UT","PG 9, Postcard Collection, University of Idaho Library Special Collections and Archives, http://www.lib.uidaho.edu/special-collections/",yes,pg_9_07_02f,"Educational use includes non-commercial use of text and images in materials for teaching and research purposes. Digital reproduction rights granted by University of Idaho Library. For other uses beyond educational use, please contact University of Idaho Library Special Collections and Archives Department at libspec@uidaho.edu.",http://rightsstatements.org/vocab/InC-EDU/1.0/,"3.5x5.5, color postcard",Image;StillImage,image/jpg,eng,43.696118,-114.352431,,,2013-04-09,2015-09-14,http://digital.lib.uidaho.edu:80/cdm/ref/collection/nwpostcards/id/404,404,405.jp2,/nwpostcards/image/405.jp2,nwpostcards404
"Pansy Triangle near inn pool. Sun Valley, Idaho","Postcard of flowers at a ski resort in Sun Valley, Idaho. | Pansy triangle near inn pool, Sun Valley, Idaho",,photographic postcard,Lou Holliday,1970,flowers (plants); trees; gardens; photographic postcards,Sun Valley,Idaho,Intermountain Tourists Supply,"Salt Lake City, UT","PG 9, Postcard Collection, University of Idaho Library Special Collections and Archives, http://www.lib.uidaho.edu/special-collections/",yes,pg_9_07_02g,"Educational use includes non-commercial use of text and images in materials for teaching and research purposes. Digital reproduction rights granted by University of Idaho Library. For other uses beyond educational use, please contact University of Idaho Library Special Collections and Archives Department at libspec@uidaho.edu.",http://rightsstatements.org/vocab/InC-EDU/1.0/,"3.5x5.5, color postcard",Image;StillImage,image/jpg,eng,43.695928,-114.351594,,,2013-04-09,2015-09-14,http://digital.lib.uidaho.edu:80/cdm/ref/collection/nwpostcards/id/405,405,406.jp2,/nwpostcards/image/406.jp2,nwpostcards405
"Sun Valley, Idaho from nearby Penny Mountain",Postcard of the Sun Valley Resort from nearby Penny Mountain with horses and riders in the foreground. | Sun Valley from nearby Penny Mtn.,,photographic postcard,Lou Holliday,1980,Equus caballus (species); men; women; ski resorts; mountains; trees; buildings; automobiles; photographic postcards,Sun Valley,Idaho,Intermountain Tourists Supply,"Salt Lake City, UT","PG 9, Postcard Collection, University of Idaho Library Special Collections and Archives, http://www.lib.uidaho.edu/special-collections/",yes,pg_9_07_02h,"Educational use includes non-commercial use of text and images in materials for teaching and research purposes. Digital reproduction rights granted by University of Idaho Library. For other uses beyond educational use, please contact University of Idaho Library Special Collections and Archives Department at libspec@uidaho.edu.",http://rightsstatements.org/vocab/InC-EDU/1.0/,"3.5x5.5, color postcard",Image;StillImage,image/jpg,eng,43.688197,-114.361985,,,2013-04-09,2015-09-14,http://digital.lib.uidaho.edu:80/cdm/ref/collection/nwpostcards/id/406,406,407.jp2,/nwpostcards/image/407.jp2,nwpostcards406
"Open-air Olympic size ice rink at Sun Valley, Idaho","Postcard of an open-air ice rink at the Sun Valley Resort in Sun Valley, Idaho. | The open-air Olympic size ice rink at Sun Valley.",,photographic postcard,Lou Holliday,1960,ice skating rinks; men; women; children; buildings; ice skating; ski resorts; trees; photographic postcards,Sun Valley,Idaho,Intermountain Tourists Supply,"Salt Lake City, UT","PG 9, Postcard Collection, University of Idaho Library Special Collections and Archives, http://www.lib.uidaho.edu/special-collections/",yes,pg_9_07_02i,"Educational use includes non-commercial use of text and images in materials for teaching and research purposes. Digital reproduction rights granted by University of Idaho Library. For other uses beyond educational use, please contact University of Idaho Library Special Collections and Archives Department at libspec@uidaho.edu.",http://rightsstatements.org/vocab/InC-EDU/1.0/,"3.5x5.5, color postcard",Image;StillImage,image/jpg,eng,43.694152,-114.354427,,,2013-04-09,2015-09-14,http://digital.lib.uidaho.edu:80/cdm/ref/collection/nwpostcards/id/407,407,408.jp2,/nwpostcards/image/408.jp2,nwpostcards407
"Challenger Inn, Sun Valley","Postcard of an Inn at Sun Valley, Idaho.",,photographic postcard,Reeve,1940,inns; buildings; ponds (water); ducks (birds); automobiles; men; women; photographic postcards,Sun Valley,Idaho,,,"PG 9, Postcard Collection, University of Idaho Library Special Collections and Archives, http://www.lib.uidaho.edu/special-collections/",yes,pg_9_07_02j,"Educational use includes non-commercial use of text and images in materials for teaching and research purposes. Digital reproduction rights granted by University of Idaho Library. For other uses beyond educational use, please contact University of Idaho Library Special Collections and Archives Department at libspec@uidaho.edu.",http://rightsstatements.org/vocab/InC-EDU/1.0/,"3.5x5.5, black and white postcard",Image;StillImage,image/jpg,eng,43.696254,-114.353026,,,2013-04-09,2015-09-14,http://digital.lib.uidaho.edu:80/cdm/ref/collection/nwpostcards/id/408,408,409.jp2,/nwpostcards/image/409.jp2,nwpostcards408
"Big Wood River Valley and Boulder Mountains, near Sun Valley","Postcard of the Big Wood River Valley and Boulder Mountains near Sun Valley, Idaho.",,photographic postcard,,1940,roads; mountains; valleys; trees; photographic postcards,Sun Valley,Idaho,,,"PG 9, Postcard Collection, University of Idaho Library Special Collections and Archives, http://www.lib.uidaho.edu/special-collections/",yes,pg_9_07_02l,"Educational use includes non-commercial use of text and images in materials for teaching and research purposes. Digital reproduction rights granted by University of Idaho Library. For other uses beyond educational use, please contact University of Idaho Library Special Collections and Archives Department at libspec@uidaho.edu.",http://rightsstatements.org/vocab/InC-EDU/1.0/,"3.5x5.5, black and white postcard",Image;StillImage,image/jpg,eng,43.731569,-114.307473,,,2013-04-09,2015-09-14,http://digital.lib.uidaho.edu:80/cdm/ref/collection/nwpostcards/id/409,409,410.jp2,/nwpostcards/image/410.jp2,nwpostcards409
"Sun Valley, Idaho","Postcard of the Sun Valley Resort in Sun Valley, Idaho.",,photographic postcard,Reeve,1940,ski resorts; buildings; mountains; trees; photographic postcards,Sun Valley,Idaho,,,"PG 9, Postcard Collection, University of Idaho Library Special Collections and Archives, http://www.lib.uidaho.edu/special-collections/",yes,pg_9_07_02k,"Educational use includes non-commercial use of text and images in materials for teaching and research purposes. Digital reproduction rights granted by University of Idaho Library. For other uses beyond educational use, please contact University of Idaho Library Special Collections and Archives Department at libspec@uidaho.edu.",http://rightsstatements.org/vocab/InC-EDU/1.0/,"3.5x5.5, black and white postcard",Image;StillImage,image/jpg,eng,43.694268,-114.358667,,,2013-04-09,2015-09-14,http://digital.lib.uidaho.edu:80/cdm/ref/collection/nwpostcards/id/410,410,411.jp2,/nwpostcards/image/411.jp2,nwpostcards410
