title,opponent,abbreviation,sport,date,year,location,stadium,latitude,longitude,score,notes,identifier,original collection,digital collection,publisher,rights,standardized rights,format-original,format,type,duration,digital preservation filename,id number,disc number,youtube-id,reference url,cdm-id,object-id
"University of Idaho vs. Arizona State University (Football), 11/25/1950",Arizona State University,AzST,Football,1950-11-25,1950,"Tempe, AZ",Goodwin Stadium,33.423792,-111.932807,21 - 48 (L),,UG64-AzST1950-1_1,Original Collection consisted of a series of 16mm Film reels.  This collection was digitized and put on DVD by Graham Warger in 2011. The DVD collection is referred to as the Collection on Vandal Training and Scouting Films - nwda-db.orbiscascade.org/findaid/ark:/80444/xv56115,Vandal Video Collection - Vandal Training and Scouting Films http://www.lib.uidaho.edu/digital/vandalvideo/,University of Idaho Digital Initiatives http://www.lib.uidaho.edu/digital/,"Educational use includes non-commercial use of text and images in materials for teaching and research purposes. Digital reproduction permissions granted by University of Idaho Library. For other uses beyond educational use, please contact University of Idaho Library Special Collections and Archives Department at libspec@uidaho.edu and University of Idaho Athletic Department.",http://rightsstatements.org/page/InC-EDU/1.0/?language=en,16mm Film,video/avi,Image;MovingImage,0:36:42,UG64-AzST1950-1_1.avi,1_1,1,sHhk1eAgopU,http://digital.lib.uidaho.edu:80/cdm/ref/collection/vandalvideo/id/0,0,vandalvideo0
"University of Idaho vs. Boise State University (Football), 10/30/1982",Boise State University,"Boise, IDSt",Football,1982-10-30,1982,"Boise, ID",Bronco Stadium,43.602798,-116.195833,24 - 17 (W),"1982 & 1984 on same disc; Cliff: same b/w 16mm footage as the 1982 DVD but DVD froze up, scenes are out of order; 1984 game also 16mm b/w with no sound, not entire game: only special teams plays; probably made for the defensive coordinator and special teams coaches, no offensive plays.","UG64-Boise, IDSt1982-1_15a",Original Collection consisted of a series of 16mm Film reels.  This collection was digitized and put on DVD by Graham Warger in 2011. The DVD collection is referred to as the Collection on Vandal Training and Scouting Films - nwda-db.orbiscascade.org/findaid/ark:/80444/xv56115,Vandal Video Collection - Vandal Training and Scouting Films http://www.lib.uidaho.edu/digital/vandalvideo/,University of Idaho Digital Initiatives http://www.lib.uidaho.edu/digital/,"Educational use includes non-commercial use of text and images in materials for teaching and research purposes. Digital reproduction permissions granted by University of Idaho Library. For other uses beyond educational use, please contact University of Idaho Library Special Collections and Archives Department at libspec@uidaho.edu and University of Idaho Athletic Department.",http://rightsstatements.org/page/InC-EDU/1.0/?language=en,16mm Film,video/avi,Image;MovingImage,1:33:59,"UG64-Boise, IDSt1982-1_15a.avi",1_15a,15,5sEBw1E_9A4,http://digital.lib.uidaho.edu:80/cdm/ref/collection/vandalvideo/id/1,1,vandalvideo1
"University of Idaho vs. University of Southern California  (Football), 10/30/1925",University of Southern California,USC,Football,1925-10-30,1925,"Moscow, ID",Neale Stadium,46.726113,-117.015671,7 - 51 (L),"MG 23, Item 29",UG64-USC1925-1_102a,Original Collection consisted of a series of 16mm Film reels.  This collection was digitized and put on DVD by Graham Warger in 2011. The DVD collection is referred to as the Collection on Vandal Training and Scouting Films - nwda-db.orbiscascade.org/findaid/ark:/80444/xv56115,Vandal Video Collection - Vandal Training and Scouting Films http://www.lib.uidaho.edu/digital/vandalvideo/,University of Idaho Digital Initiatives http://www.lib.uidaho.edu/digital/,"Educational use includes non-commercial use of text and images in materials for teaching and research purposes. Digital reproduction permissions granted by University of Idaho Library. For other uses beyond educational use, please contact University of Idaho Library Special Collections and Archives Department at libspec@uidaho.edu and University of Idaho Athletic Department.",http://rightsstatements.org/page/InC-EDU/1.0/?language=en,16mm Film,video/avi,Image;MovingImage,0:22:12,UG64-USC1925-1_102a.avi,1_102a,102,CVXQ3X6Q8oU,http://digital.lib.uidaho.edu:80/cdm/ref/collection/vandalvideo/id/2,2,vandalvideo2
"University of Idaho vs. Washington State University (Football), 10/23/1954",Washington State University,WSU,Football,1954-10-23,1954,"Pullman, WA",Rodgers Field,46.731806,-117.160444,10 - 0 (W),,UG64-WSU1954-1_111,Original Collection consisted of a series of 16mm Film reels.  This collection was digitized and put on DVD by Graham Warger in 2011. The DVD collection is referred to as the Collection on Vandal Training and Scouting Films - nwda-db.orbiscascade.org/findaid/ark:/80444/xv56115,Vandal Video Collection - Vandal Training and Scouting Films http://www.lib.uidaho.edu/digital/vandalvideo/,University of Idaho Digital Initiatives http://www.lib.uidaho.edu/digital/,"Educational use includes non-commercial use of text and images in materials for teaching and research purposes. Digital reproduction permissions granted by University of Idaho Library. For other uses beyond educational use, please contact University of Idaho Library Special Collections and Archives Department at libspec@uidaho.edu and University of Idaho Athletic Department.",http://rightsstatements.org/page/InC-EDU/1.0/?language=en,16mm Film,video/avi,Image;MovingImage,0:40:37,UG64-WSU1954-1_111.avi,1_111,111,7NCJiBcBbyc,http://digital.lib.uidaho.edu:80/cdm/ref/collection/vandalvideo/id/3,3,vandalvideo3
"University of Idaho vs. University of Washington (Football), 09/24/1960",University of Washington,UWash,Football,1960-09-24,1960,"Seattle, WA",Husky Stadium,47.650278,-122.301667,12 - 41 (L),,UG64-UWash1960-1_115,Original Collection consisted of a series of 16mm Film reels.  This collection was digitized and put on DVD by Graham Warger in 2011. The DVD collection is referred to as the Collection on Vandal Training and Scouting Films - nwda-db.orbiscascade.org/findaid/ark:/80444/xv56115,Vandal Video Collection - Vandal Training and Scouting Films http://www.lib.uidaho.edu/digital/vandalvideo/,University of Idaho Digital Initiatives http://www.lib.uidaho.edu/digital/,"Educational use includes non-commercial use of text and images in materials for teaching and research purposes. Digital reproduction permissions granted by University of Idaho Library. For other uses beyond educational use, please contact University of Idaho Library Special Collections and Archives Department at libspec@uidaho.edu and University of Idaho Athletic Department.",http://rightsstatements.org/page/InC-EDU/1.0/?language=en,16mm Film,video/avi,Image;MovingImage,0:46:07,UG64-UWash1960-1_115.avi,1_115,115,f9Up3KJKvhM,http://digital.lib.uidaho.edu:80/cdm/ref/collection/vandalvideo/id/4,4,vandalvideo4
"University of Idaho vs. University of Washington (Basketball), 02/22/1958",University of Washington,UWash-bb,Basketball,1958-22-02,1958,"Moscow, ID",Memorial Gymnasium,46.726389,-117.018056,85 - 63 (W),,UG64-UWash-bb1905-1_119,Original Collection consisted of a series of 16mm Film reels.  This collection was digitized and put on DVD by Graham Warger in 2011. The DVD collection is referred to as the Collection on Vandal Training and Scouting Films - nwda-db.orbiscascade.org/findaid/ark:/80444/xv56115,Vandal Video Collection - Vandal Training and Scouting Films http://www.lib.uidaho.edu/digital/vandalvideo/,University of Idaho Digital Initiatives http://www.lib.uidaho.edu/digital/,"Educational use includes non-commercial use of text and images in materials for teaching and research purposes. Digital reproduction permissions granted by University of Idaho Library. For other uses beyond educational use, please contact University of Idaho Library Special Collections and Archives Department at libspec@uidaho.edu and University of Idaho Athletic Department.",http://rightsstatements.org/page/InC-EDU/1.0/?language=en,16mm Film,video/avi,Image;MovingImage,0:17:55,UG64-UWash-bb1905-1_119a.avi,1_119,119,UmSkhFIvYEo,http://digital.lib.uidaho.edu:80/cdm/ref/collection/vandalvideo/id/5,5,vandalvideo5
"University of Idaho vs. University of Washington (Basketball), 02/07/1958",University of Washington,UWash-bb,Basketball,1958-02-07,1958,"Seattle, WA",Hec Edmundson Pavilion,47.65212,-122.30223,49 - 56 (L),,UG64-UWash-bb1905-1_119,Original Collection consisted of a series of 16mm Film reels.  This collection was digitized and put on DVD by Graham Warger in 2011. The DVD collection is referred to as the Collection on Vandal Training and Scouting Films - nwda-db.orbiscascade.org/findaid/ark:/80444/xv56115,Vandal Video Collection - Vandal Training and Scouting Films http://www.lib.uidaho.edu/digital/vandalvideo/,University of Idaho Digital Initiatives http://www.lib.uidaho.edu/digital/,"Educational use includes non-commercial use of text and images in materials for teaching and research purposes. Digital reproduction permissions granted by University of Idaho Library. For other uses beyond educational use, please contact University of Idaho Library Special Collections and Archives Department at libspec@uidaho.edu and University of Idaho Athletic Department.",http://rightsstatements.org/page/InC-EDU/1.0/?language=en,16mm Film,video/avi,Image;MovingImage,0:08:34,UG64-UWash-bb1905-1_119b.avi,1_119,119,-9wFfSULMCs,http://digital.lib.uidaho.edu:80/cdm/ref/collection/vandalvideo/id/6,6,vandalvideo6
"University of Idaho vs. Washington State University (Football), 11/02/1940",Washington State University,WSU,Football,1940-11-02,1940,"Moscow, ID",Neale Stadium,46.726113,-117.015671,0 - 23 (L),,UG64-WSU1940-1_120,Original Collection consisted of a series of 16mm Film reels.  This collection was digitized and put on DVD by Graham Warger in 2011. The DVD collection is referred to as the Collection on Vandal Training and Scouting Films - nwda-db.orbiscascade.org/findaid/ark:/80444/xv56115,Vandal Video Collection - Vandal Training and Scouting Films http://www.lib.uidaho.edu/digital/vandalvideo/,University of Idaho Digital Initiatives http://www.lib.uidaho.edu/digital/,"Educational use includes non-commercial use of text and images in materials for teaching and research purposes. Digital reproduction permissions granted by University of Idaho Library. For other uses beyond educational use, please contact University of Idaho Library Special Collections and Archives Department at libspec@uidaho.edu and University of Idaho Athletic Department.",http://rightsstatements.org/page/InC-EDU/1.0/?language=en,16mm Film,video/avi,Image;MovingImage,0:35:00,UG64-WSU1940-1_120.avi,1_120,120,dYUIAwv2uTQ,http://digital.lib.uidaho.edu:80/cdm/ref/collection/vandalvideo/id/7,7,vandalvideo7
"University of Idaho vs. Washington State University (Football), 09/29/1945",Washington State University,WSU,Football,1945-09-29,1945,"Moscow, ID",Neale Stadium,46.726113,-117.015671,12 - 43 (L),,UG64-WSU1945-1_121a,Original Collection consisted of a series of 16mm Film reels.  This collection was digitized and put on DVD by Graham Warger in 2011. The DVD collection is referred to as the Collection on Vandal Training and Scouting Films - nwda-db.orbiscascade.org/findaid/ark:/80444/xv56115,Vandal Video Collection - Vandal Training and Scouting Films http://www.lib.uidaho.edu/digital/vandalvideo/,University of Idaho Digital Initiatives http://www.lib.uidaho.edu/digital/,"Educational use includes non-commercial use of text and images in materials for teaching and research purposes. Digital reproduction permissions granted by University of Idaho Library. For other uses beyond educational use, please contact University of Idaho Library Special Collections and Archives Department at libspec@uidaho.edu and University of Idaho Athletic Department.",http://rightsstatements.org/page/InC-EDU/1.0/?language=en,16mm Film,video/avi,Image;MovingImage,0:40:58,UG64-WSU1945-1_121.avi,1_121a,121,9oGkPj-9A5k,http://digital.lib.uidaho.edu:80/cdm/ref/collection/vandalvideo/id/8,8,vandalvideo8
"University of Idaho vs. Washington State University (Football), 10/15/1949",Washington State University,WSU,Football,1949-10-15,1949,"Moscow, ID",Neale Stadium,46.726113,-117.015671,13 - 35 (L),,UG64-WSU1949-1_124,Original Collection consisted of a series of 16mm Film reels.  This collection was digitized and put on DVD by Graham Warger in 2011. The DVD collection is referred to as the Collection on Vandal Training and Scouting Films - nwda-db.orbiscascade.org/findaid/ark:/80444/xv56115,Vandal Video Collection - Vandal Training and Scouting Films http://www.lib.uidaho.edu/digital/vandalvideo/,University of Idaho Digital Initiatives http://www.lib.uidaho.edu/digital/,"Educational use includes non-commercial use of text and images in materials for teaching and research purposes. Digital reproduction permissions granted by University of Idaho Library. For other uses beyond educational use, please contact University of Idaho Library Special Collections and Archives Department at libspec@uidaho.edu and University of Idaho Athletic Department.",http://rightsstatements.org/page/InC-EDU/1.0/?language=en,16mm Film,video/avi,Image;MovingImage,0:36:13,UG64-WSU1949-1_124.avi,1_124,124,PyGkWTjkPaw,http://digital.lib.uidaho.edu:80/cdm/ref/collection/vandalvideo/id/9,9,vandalvideo9
"University of Idaho vs. Washington State University (Football), 10/23/1954",Washington State University,WSU,Football,1954-10-23,1954,"Pullman, WA",Rodgers Field,46.731806,-117.160444,10 - 0 (W),,UG64-WSU1954-1_129,Original Collection consisted of a series of 16mm Film reels.  This collection was digitized and put on DVD by Graham Warger in 2011. The DVD collection is referred to as the Collection on Vandal Training and Scouting Films - nwda-db.orbiscascade.org/findaid/ark:/80444/xv56115,Vandal Video Collection - Vandal Training and Scouting Films http://www.lib.uidaho.edu/digital/vandalvideo/,University of Idaho Digital Initiatives http://www.lib.uidaho.edu/digital/,"Educational use includes non-commercial use of text and images in materials for teaching and research purposes. Digital reproduction permissions granted by University of Idaho Library. For other uses beyond educational use, please contact University of Idaho Library Special Collections and Archives Department at libspec@uidaho.edu and University of Idaho Athletic Department.",http://rightsstatements.org/page/InC-EDU/1.0/?language=en,16mm Film,video/avi,Image;MovingImage,0:39:29,UG64-WSU1954-1_129.avi,1_129,129,NPwn68iO89s,http://digital.lib.uidaho.edu:80/cdm/ref/collection/vandalvideo/id/10,10,vandalvideo10
"University of Idaho vs. Washington State University (Football), 11/01/1952",Washington State University,WSU,Football,1952-11-01,1952,"Pullman, WA",Rodgers Field,46.731806,-117.160444,6 - 36 (L),,UG64-WSU1952-1_127,Original Collection consisted of a series of 16mm Film reels.  This collection was digitized and put on DVD by Graham Warger in 2011. The DVD collection is referred to as the Collection on Vandal Training and Scouting Films - nwda-db.orbiscascade.org/findaid/ark:/80444/xv56115,Vandal Video Collection - Vandal Training and Scouting Films http://www.lib.uidaho.edu/digital/vandalvideo/,University of Idaho Digital Initiatives http://www.lib.uidaho.edu/digital/,"Educational use includes non-commercial use of text and images in materials for teaching and research purposes. Digital reproduction permissions granted by University of Idaho Library. For other uses beyond educational use, please contact University of Idaho Library Special Collections and Archives Department at libspec@uidaho.edu and University of Idaho Athletic Department.",http://rightsstatements.org/page/InC-EDU/1.0/?language=en,16mm Film,video/avi,Image;MovingImage,1:08:19,UG64-WSU1952-1_127.avi,1_127,127,gWVAWPez6xE,http://digital.lib.uidaho.edu:80/cdm/ref/collection/vandalvideo/id/11,11,vandalvideo11
"University of Idaho vs. Boise State University (Football), 09/11/1971",Boise State University,"Boise, IDSt",Football,1973-09-08,1973,"Boise, ID",Bronco Stadium,43.602798,-116.195833,14 - 42 (L),,"UG64-Boise, IDSt1973-1_4a",Original Collection consisted of a series of 16mm Film reels.  This collection was digitized and put on DVD by Graham Warger in 2011. The DVD collection is referred to as the Collection on Vandal Training and Scouting Films - nwda-db.orbiscascade.org/findaid/ark:/80444/xv56115,Vandal Video Collection - Vandal Training and Scouting Films http://www.lib.uidaho.edu/digital/vandalvideo/,University of Idaho Digital Initiatives http://www.lib.uidaho.edu/digital/,"Educational use includes non-commercial use of text and images in materials for teaching and research purposes. Digital reproduction permissions granted by University of Idaho Library. For other uses beyond educational use, please contact University of Idaho Library Special Collections and Archives Department at libspec@uidaho.edu and University of Idaho Athletic Department.",http://rightsstatements.org/page/InC-EDU/1.0/?language=en,16mm Film,video/avi,Image;MovingImage,0:58:05,"UG64-Boise, IDSt1973-1_4a.avi",1_4a,4,ivTBB7qhAxI,http://digital.lib.uidaho.edu:80/cdm/ref/collection/vandalvideo/id/12,12,vandalvideo12
"University of Idaho vs. Washington State University (Football), 10/15/1955",Washington State University,WSU,Football,1955-10-15,1955,"Moscow, ID",Neale Stadium,46.726113,-117.015671,0 - 9 (L),,UG64-WSU1955-1_130,Original Collection consisted of a series of 16mm Film reels.  This collection was digitized and put on DVD by Graham Warger in 2011. The DVD collection is referred to as the Collection on Vandal Training and Scouting Films - nwda-db.orbiscascade.org/findaid/ark:/80444/xv56115,Vandal Video Collection - Vandal Training and Scouting Films http://www.lib.uidaho.edu/digital/vandalvideo/,University of Idaho Digital Initiatives http://www.lib.uidaho.edu/digital/,"Educational use includes non-commercial use of text and images in materials for teaching and research purposes. Digital reproduction permissions granted by University of Idaho Library. For other uses beyond educational use, please contact University of Idaho Library Special Collections and Archives Department at libspec@uidaho.edu and University of Idaho Athletic Department.",http://rightsstatements.org/page/InC-EDU/1.0/?language=en,16mm Film,video/avi,Image;MovingImage,0:39:36,UG64-WSU1955-1_130.avi,1_130,130,9_ABMCJ3zKA,http://digital.lib.uidaho.edu:80/cdm/ref/collection/vandalvideo/id/13,13,vandalvideo13
"University of Idaho vs. Washington State University (Football), 10/11/1958",Washington State University,WSU,Football,1958-10-11,1958,"Moscow, ID",Neale Stadium,46.726113,-117.015671,0 - 8 (L),,UG64-WSU1958-1_133,Original Collection consisted of a series of 16mm Film reels.  This collection was digitized and put on DVD by Graham Warger in 2011. The DVD collection is referred to as the Collection on Vandal Training and Scouting Films - nwda-db.orbiscascade.org/findaid/ark:/80444/xv56115,Vandal Video Collection - Vandal Training and Scouting Films http://www.lib.uidaho.edu/digital/vandalvideo/,University of Idaho Digital Initiatives http://www.lib.uidaho.edu/digital/,"Educational use includes non-commercial use of text and images in materials for teaching and research purposes. Digital reproduction permissions granted by University of Idaho Library. For other uses beyond educational use, please contact University of Idaho Library Special Collections and Archives Department at libspec@uidaho.edu and University of Idaho Athletic Department.",http://rightsstatements.org/page/InC-EDU/1.0/?language=en,16mm Film,video/avi,Image;MovingImage,0:34:58,UG64-WSU1958-1_133.avi,1_133,133,RmcNYX_Q4Gs,http://digital.lib.uidaho.edu:80/cdm/ref/collection/vandalvideo/id/14,14,vandalvideo14
"University of Idaho vs. Washington State University (Football), 10/05/1946",Washington State University,WSU,Football,1946-10-05,1946,"Pullman, WA",Rodgers Field,46.731806,-117.160444,0 - 32 (L),,UG64-WSU1946-1_122,Original Collection consisted of a series of 16mm Film reels.  This collection was digitized and put on DVD by Graham Warger in 2011. The DVD collection is referred to as the Collection on Vandal Training and Scouting Films - nwda-db.orbiscascade.org/findaid/ark:/80444/xv56115,Vandal Video Collection - Vandal Training and Scouting Films http://www.lib.uidaho.edu/digital/vandalvideo/,University of Idaho Digital Initiatives http://www.lib.uidaho.edu/digital/,"Educational use includes non-commercial use of text and images in materials for teaching and research purposes. Digital reproduction permissions granted by University of Idaho Library. For other uses beyond educational use, please contact University of Idaho Library Special Collections and Archives Department at libspec@uidaho.edu and University of Idaho Athletic Department.",http://rightsstatements.org/page/InC-EDU/1.0/?language=en,16mm Film,video/avi,Image;MovingImage,0:35:44,UG64-WSU1946-1_122.avi,1_122,122,xTatL5zNOsQ,http://digital.lib.uidaho.edu:80/cdm/ref/collection/vandalvideo/id/15,15,vandalvideo15
"University of Idaho vs. Washington State University (Football), 11/16/1957",Washington State University,WSU,Football,1957-11-16,1957,"Pullman, WA",Rodgers Field,46.731806,-117.160444,13 - 21 (L),,UG64-WSU1957-1_132,Original Collection consisted of a series of 16mm Film reels.  This collection was digitized and put on DVD by Graham Warger in 2011. The DVD collection is referred to as the Collection on Vandal Training and Scouting Films - nwda-db.orbiscascade.org/findaid/ark:/80444/xv56115,Vandal Video Collection - Vandal Training and Scouting Films http://www.lib.uidaho.edu/digital/vandalvideo/,University of Idaho Digital Initiatives http://www.lib.uidaho.edu/digital/,"Educational use includes non-commercial use of text and images in materials for teaching and research purposes. Digital reproduction permissions granted by University of Idaho Library. For other uses beyond educational use, please contact University of Idaho Library Special Collections and Archives Department at libspec@uidaho.edu and University of Idaho Athletic Department.",http://rightsstatements.org/page/InC-EDU/1.0/?language=en,16mm Film,video/avi,Image;MovingImage,0:38:49,UG64-WSU1957-1_132.avi,1_132,132,7jfboQwCzGc,http://digital.lib.uidaho.edu:80/cdm/ref/collection/vandalvideo/id/16,16,vandalvideo16
"University of Idaho vs. Washington State University (Football), 11/10/1951",Washington State University,WSU,Football,1951-11-10,1951,"Moscow, ID",Neale Stadium,46.726113,-117.015671,6 - 9 (L),,UG64-WSU1951-1_126,Original Collection consisted of a series of 16mm Film reels.  This collection was digitized and put on DVD by Graham Warger in 2011. The DVD collection is referred to as the Collection on Vandal Training and Scouting Films - nwda-db.orbiscascade.org/findaid/ark:/80444/xv56115,Vandal Video Collection - Vandal Training and Scouting Films http://www.lib.uidaho.edu/digital/vandalvideo/,University of Idaho Digital Initiatives http://www.lib.uidaho.edu/digital/,"Educational use includes non-commercial use of text and images in materials for teaching and research purposes. Digital reproduction permissions granted by University of Idaho Library. For other uses beyond educational use, please contact University of Idaho Library Special Collections and Archives Department at libspec@uidaho.edu and University of Idaho Athletic Department.",http://rightsstatements.org/page/InC-EDU/1.0/?language=en,16mm Film,video/avi,Image;MovingImage,1:01:13,UG64-WSU1951-1_126.avi,1_126,126,Y6sSIIGNfR4,http://digital.lib.uidaho.edu:80/cdm/ref/collection/vandalvideo/id/17,17,vandalvideo17
"University of Idaho vs. Washington State University (Basketball), 01/03/1954",Washington State University,WSU-bb,Basketball,1954-01-03,1954,"Pullman, WA",Bohler Gymnasium,46.732783,-117.162173,50 - 49 (W),,UG64-WSU-bb1954-1_128,Original Collection consisted of a series of 16mm Film reels.  This collection was digitized and put on DVD by Graham Warger in 2011. The DVD collection is referred to as the Collection on Vandal Training and Scouting Films - nwda-db.orbiscascade.org/findaid/ark:/80444/xv56115,Vandal Video Collection - Vandal Training and Scouting Films http://www.lib.uidaho.edu/digital/vandalvideo/,University of Idaho Digital Initiatives http://www.lib.uidaho.edu/digital/,"Educational use includes non-commercial use of text and images in materials for teaching and research purposes. Digital reproduction permissions granted by University of Idaho Library. For other uses beyond educational use, please contact University of Idaho Library Special Collections and Archives Department at libspec@uidaho.edu and University of Idaho Athletic Department.",http://rightsstatements.org/page/InC-EDU/1.0/?language=en,16mm Film,video/avi,Image;MovingImage,0:38:25,UG64-WSU-bb1954-1_128.avi,1_128a,128,4iVdOr7anb0,http://digital.lib.uidaho.edu:80/cdm/ref/collection/vandalvideo/id/18,18,vandalvideo18
"University of Idaho vs. Washington State University (Football), 10/28/1950",Washington State University,WSU,Football,1950-10-28,1950,"Pullman, WA",Rodgers Field,46.731806,-117.160444,7 - 7 (L),,UG64-WSU1950-1_125,Original Collection consisted of a series of 16mm Film reels.  This collection was digitized and put on DVD by Graham Warger in 2011. The DVD collection is referred to as the Collection on Vandal Training and Scouting Films - nwda-db.orbiscascade.org/findaid/ark:/80444/xv56115,Vandal Video Collection - Vandal Training and Scouting Films http://www.lib.uidaho.edu/digital/vandalvideo/,University of Idaho Digital Initiatives http://www.lib.uidaho.edu/digital/,"Educational use includes non-commercial use of text and images in materials for teaching and research purposes. Digital reproduction permissions granted by University of Idaho Library. For other uses beyond educational use, please contact University of Idaho Library Special Collections and Archives Department at libspec@uidaho.edu and University of Idaho Athletic Department.",http://rightsstatements.org/page/InC-EDU/1.0/?language=en,16mm Film,video/avi,Image;MovingImage,0:26:14,UG64-WSU1950-1_125.avi,1_125,125,VzI6I0tksKw,http://digital.lib.uidaho.edu:80/cdm/ref/collection/vandalvideo/id/19,19,vandalvideo19
"University of Idaho vs. Washington State University (Football), 10/24/1959",Washington State University,WSU,Football,1959-10-24,1959,"Pullman, WA",Rodgers Field,46.731806,-117.160444,5 - 27 (L),,UG64-WSU1959-1_134,Original Collection consisted of a series of 16mm Film reels.  This collection was digitized and put on DVD by Graham Warger in 2011. The DVD collection is referred to as the Collection on Vandal Training and Scouting Films - nwda-db.orbiscascade.org/findaid/ark:/80444/xv56115,Vandal Video Collection - Vandal Training and Scouting Films http://www.lib.uidaho.edu/digital/vandalvideo/,University of Idaho Digital Initiatives http://www.lib.uidaho.edu/digital/,"Educational use includes non-commercial use of text and images in materials for teaching and research purposes. Digital reproduction permissions granted by University of Idaho Library. For other uses beyond educational use, please contact University of Idaho Library Special Collections and Archives Department at libspec@uidaho.edu and University of Idaho Athletic Department.",http://rightsstatements.org/page/InC-EDU/1.0/?language=en,16mm Film,video/avi,Image;MovingImage,0:36:05,UG64-WSU1959-1_134.avi,1_134,134,sDiy_LHqUfk,http://digital.lib.uidaho.edu:80/cdm/ref/collection/vandalvideo/id/20,20,vandalvideo20
"University of Idaho vs. Washington State University (Football), 10/06/1956",Washington State University,WSU,Football,1956-10-06,1956,"Moscow, ID",Neale Stadium,46.726113,-117.015671,19 - 33 (L),,UG64-WSU1956-1_131,Original Collection consisted of a series of 16mm Film reels.  This collection was digitized and put on DVD by Graham Warger in 2011. The DVD collection is referred to as the Collection on Vandal Training and Scouting Films - nwda-db.orbiscascade.org/findaid/ark:/80444/xv56115,Vandal Video Collection - Vandal Training and Scouting Films http://www.lib.uidaho.edu/digital/vandalvideo/,University of Idaho Digital Initiatives http://www.lib.uidaho.edu/digital/,"Educational use includes non-commercial use of text and images in materials for teaching and research purposes. Digital reproduction permissions granted by University of Idaho Library. For other uses beyond educational use, please contact University of Idaho Library Special Collections and Archives Department at libspec@uidaho.edu and University of Idaho Athletic Department.",http://rightsstatements.org/page/InC-EDU/1.0/?language=en,16mm Film,video/avi,Image;MovingImage,0:43:29,UG64-WSU1956-1_131.avi,1_131,131,KInwI_Ar8yM,http://digital.lib.uidaho.edu:80/cdm/ref/collection/vandalvideo/id/21,21,vandalvideo21
"University of Idaho vs. Washington State University (Football), 11/17/1962",Washington State University,WSU,Football,1962-11-17,1962,"Moscow, ID",Neale Stadium,46.726113,-117.015671,14 - 22 (L),,UG64-WSU1962-1_137,Original Collection consisted of a series of 16mm Film reels.  This collection was digitized and put on DVD by Graham Warger in 2011. The DVD collection is referred to as the Collection on Vandal Training and Scouting Films - nwda-db.orbiscascade.org/findaid/ark:/80444/xv56115,Vandal Video Collection - Vandal Training and Scouting Films http://www.lib.uidaho.edu/digital/vandalvideo/,University of Idaho Digital Initiatives http://www.lib.uidaho.edu/digital/,"Educational use includes non-commercial use of text and images in materials for teaching and research purposes. Digital reproduction permissions granted by University of Idaho Library. For other uses beyond educational use, please contact University of Idaho Library Special Collections and Archives Department at libspec@uidaho.edu and University of Idaho Athletic Department.",http://rightsstatements.org/page/InC-EDU/1.0/?language=en,16mm Film,video/avi,Image;MovingImage,0:27:28,UG64-WSU1962-1_137.avi,1_137,137,m2lChKbsS50,http://digital.lib.uidaho.edu:80/cdm/ref/collection/vandalvideo/id/22,22,vandalvideo22
"University of Idaho vs. Boise State University (Football), 11/04/1978",Boise State University,"Boise, IDSt",Football,1978-11-04,1978,"Boise, ID",Bronco Stadium,43.602798,-116.195833,10 - 48 (L),,"UG64-Boise, IDSt1978-1_11",Original Collection consisted of a series of 16mm Film reels.  This collection was digitized and put on DVD by Graham Warger in 2011. The DVD collection is referred to as the Collection on Vandal Training and Scouting Films - nwda-db.orbiscascade.org/findaid/ark:/80444/xv56115,Vandal Video Collection - Vandal Training and Scouting Films http://www.lib.uidaho.edu/digital/vandalvideo/,University of Idaho Digital Initiatives http://www.lib.uidaho.edu/digital/,"Educational use includes non-commercial use of text and images in materials for teaching and research purposes. Digital reproduction permissions granted by University of Idaho Library. For other uses beyond educational use, please contact University of Idaho Library Special Collections and Archives Department at libspec@uidaho.edu and University of Idaho Athletic Department.",http://rightsstatements.org/page/InC-EDU/1.0/?language=en,16mm Film,video/avi,Image;MovingImage,1:44:32,"UG64-Boise, IDSt1978-1_11.avi",1_11,11,sj9u54lipG8,http://digital.lib.uidaho.edu:80/cdm/ref/collection/vandalvideo/id/23,23,vandalvideo23
"University of Idaho vs. Washington State University (Football), 10/30/1948",Washington State University,WSU,Football,1948-10-30,1948,"Pullman, WA",Rodgers Field,46.731806,-117.160444,14 - 19 (L),,UG64-WSU1948-1_123,Original Collection consisted of a series of 16mm Film reels.  This collection was digitized and put on DVD by Graham Warger in 2011. The DVD collection is referred to as the Collection on Vandal Training and Scouting Films - nwda-db.orbiscascade.org/findaid/ark:/80444/xv56115,Vandal Video Collection - Vandal Training and Scouting Films http://www.lib.uidaho.edu/digital/vandalvideo/,University of Idaho Digital Initiatives http://www.lib.uidaho.edu/digital/,"Educational use includes non-commercial use of text and images in materials for teaching and research purposes. Digital reproduction permissions granted by University of Idaho Library. For other uses beyond educational use, please contact University of Idaho Library Special Collections and Archives Department at libspec@uidaho.edu and University of Idaho Athletic Department.",http://rightsstatements.org/page/InC-EDU/1.0/?language=en,16mm Film,video/avi,Image;MovingImage,0:36:47,UG64-WSU1948-1_123.avi,1_123,123,qHxbzTCmr1g,http://digital.lib.uidaho.edu:80/cdm/ref/collection/vandalvideo/id/24,24,vandalvideo24
"University of Idaho vs. Washington State University (Football), 10/14/1961",Washington State University,WSU,Football,1961-10-14,1961,"Pullman, WA",Rodgers Field,46.731806,-117.160444,0 - 34 (L),,UG64-WSU1961-1_135,Original Collection consisted of a series of 16mm Film reels.  This collection was digitized and put on DVD by Graham Warger in 2011. The DVD collection is referred to as the Collection on Vandal Training and Scouting Films - nwda-db.orbiscascade.org/findaid/ark:/80444/xv56115,Vandal Video Collection - Vandal Training and Scouting Films http://www.lib.uidaho.edu/digital/vandalvideo/,University of Idaho Digital Initiatives http://www.lib.uidaho.edu/digital/,"Educational use includes non-commercial use of text and images in materials for teaching and research purposes. Digital reproduction permissions granted by University of Idaho Library. For other uses beyond educational use, please contact University of Idaho Library Special Collections and Archives Department at libspec@uidaho.edu and University of Idaho Athletic Department.",http://rightsstatements.org/page/InC-EDU/1.0/?language=en,16mm Film,video/avi,Image;MovingImage,0:38:33,UG64-WSU1961-1_135.avi,1_135,135,_FCzd9rDxNw,http://digital.lib.uidaho.edu:80/cdm/ref/collection/vandalvideo/id/25,25,vandalvideo25
"University of Idaho vs. Washington State University (Basketball), 01/09/1962",Washington State University,WSU-bb,Basketball,1962-01-09,1962,"Pullman, WA",Bohler Gymnasium,46.732783,-117.162173,75 - 74 (W),1962: one reel,UG64-WSU-bb1962-1_136a,Original Collection consisted of a series of 16mm Film reels.  This collection was digitized and put on DVD by Graham Warger in 2011. The DVD collection is referred to as the Collection on Vandal Training and Scouting Films - nwda-db.orbiscascade.org/findaid/ark:/80444/xv56115,Vandal Video Collection - Vandal Training and Scouting Films http://www.lib.uidaho.edu/digital/vandalvideo/,University of Idaho Digital Initiatives http://www.lib.uidaho.edu/digital/,"Educational use includes non-commercial use of text and images in materials for teaching and research purposes. Digital reproduction permissions granted by University of Idaho Library. For other uses beyond educational use, please contact University of Idaho Library Special Collections and Archives Department at libspec@uidaho.edu and University of Idaho Athletic Department.",http://rightsstatements.org/page/InC-EDU/1.0/?language=en,16mm Film,video/avi,Image;MovingImage,1:06:14,UG64-WSU-bb1962-1_136.avi,1_136a,136,P4FxKU2y6go,http://digital.lib.uidaho.edu:80/cdm/ref/collection/vandalvideo/id/26,26,vandalvideo26
"University of Idaho vs. Washington State University (Football), 10/02/1965",Washington State University,WSU,Football,1965-10-02,1965,"Pullman, WA",Rodgers Field,46.731806,-117.160444,17 - 13 (W),missing reel,UG64-WSU1965-1_138,Original Collection consisted of a series of 16mm Film reels.  This collection was digitized and put on DVD by Graham Warger in 2011. The DVD collection is referred to as the Collection on Vandal Training and Scouting Films - nwda-db.orbiscascade.org/findaid/ark:/80444/xv56115,Vandal Video Collection - Vandal Training and Scouting Films http://www.lib.uidaho.edu/digital/vandalvideo/,University of Idaho Digital Initiatives http://www.lib.uidaho.edu/digital/,"Educational use includes non-commercial use of text and images in materials for teaching and research purposes. Digital reproduction permissions granted by University of Idaho Library. For other uses beyond educational use, please contact University of Idaho Library Special Collections and Archives Department at libspec@uidaho.edu and University of Idaho Athletic Department.",http://rightsstatements.org/page/InC-EDU/1.0/?language=en,16mm Film,video/avi,Image;MovingImage,0:20:59,UG64-WSU1965-1_138.avi,1_138,138,F1gCXbn0N3w,http://digital.lib.uidaho.edu:80/cdm/ref/collection/vandalvideo/id/27,27,vandalvideo27
"University of Idaho vs. Washington State University (Basketball), 12/21/1966",Washington State University,WSU,Basketball,1966-12-21,1966,"Moscow, ID",Memorial Gymnasium,46.726389,-117.01375,49 - 47 (W),,UG64-WSU1966-1_139,Original Collection consisted of a series of 16mm Film reels.  This collection was digitized and put on DVD by Graham Warger in 2011. The DVD collection is referred to as the Collection on Vandal Training and Scouting Films - nwda-db.orbiscascade.org/findaid/ark:/80444/xv56115,Vandal Video Collection - Vandal Training and Scouting Films http://www.lib.uidaho.edu/digital/vandalvideo/,University of Idaho Digital Initiatives http://www.lib.uidaho.edu/digital/,"Educational use includes non-commercial use of text and images in materials for teaching and research purposes. Digital reproduction permissions granted by University of Idaho Library. For other uses beyond educational use, please contact University of Idaho Library Special Collections and Archives Department at libspec@uidaho.edu and University of Idaho Athletic Department.",http://rightsstatements.org/page/InC-EDU/1.0/?language=en,16mm Film,video/avi,Image;MovingImage,0:33:28,UG64-WSU1966-1_139.avi,1_139,139,pJAUsbHxa8c,http://digital.lib.uidaho.edu:80/cdm/ref/collection/vandalvideo/id/28,28,vandalvideo28
"University of Idaho vs. Washington State University (Football), 10/22/1966",Washington State University,WSU,Football,1966-10-22,1966,"Moscow, ID",Neale Stadium,46.726113,-117.015671,7 - 14 (L),,UG64-WSU1966-1_140,Original Collection consisted of a series of 16mm Film reels.  This collection was digitized and put on DVD by Graham Warger in 2011. The DVD collection is referred to as the Collection on Vandal Training and Scouting Films - nwda-db.orbiscascade.org/findaid/ark:/80444/xv56115,Vandal Video Collection - Vandal Training and Scouting Films http://www.lib.uidaho.edu/digital/vandalvideo/,University of Idaho Digital Initiatives http://www.lib.uidaho.edu/digital/,"Educational use includes non-commercial use of text and images in materials for teaching and research purposes. Digital reproduction permissions granted by University of Idaho Library. For other uses beyond educational use, please contact University of Idaho Library Special Collections and Archives Department at libspec@uidaho.edu and University of Idaho Athletic Department.",http://rightsstatements.org/page/InC-EDU/1.0/?language=en,16mm Film,video/avi,Image;MovingImage,1:22:00,UG64-WSU1966-1_140.avi,1_140,140,DlLEBRIW7cs,http://digital.lib.uidaho.edu:80/cdm/ref/collection/vandalvideo/id/29,29,vandalvideo29
"University of Washington v. Washington State College (Football), 10/23/1926",University of Washington v. Washington State College,UWvsWSU,Football,1926-10-23,1926,"Seattle, WA",Husky Stadium,47.650278,-122.301667,UW: 6 - WSC: 9 (L),"MG 23, Item 29",UG64-UWvsWSU1926-1_102b,Original Collection consisted of a series of 16mm Film reels.  This collection was digitized and put on DVD by Graham Warger in 2011. The DVD collection is referred to as the Collection on Vandal Training and Scouting Films - nwda-db.orbiscascade.org/findaid/ark:/80444/xv56115,Vandal Video Collection - Vandal Training and Scouting Films http://www.lib.uidaho.edu/digital/vandalvideo/,University of Idaho Digital Initiatives http://www.lib.uidaho.edu/digital/,"Educational use includes non-commercial use of text and images in materials for teaching and research purposes. Digital reproduction permissions granted by University of Idaho Library. For other uses beyond educational use, please contact University of Idaho Library Special Collections and Archives Department at libspec@uidaho.edu and University of Idaho Athletic Department.",http://rightsstatements.org/page/InC-EDU/1.0/?language=en,16mm Film,video/avi,Image;MovingImage,0:11:05,UG64-UWvsWSU1926-1_102b.avi,1_102b,102,eqJUCcwIlKE,http://digital.lib.uidaho.edu:80/cdm/ref/collection/vandalvideo/id/30,30,vandalvideo30
"University of Idaho vs. University of Texas-El Paso (Football), 09/08/1973",University of Texas-El Paso,UTexElPaso,Football,1973-09-08,1973,"Moscow, ID",Idaho Stadium,46.726113,-117.015671,62 - 14 (W),Offense-Defense-Offense-Defense,UG64-UTexElPaso1973-1_105,Original Collection consisted of a series of 16mm Film reels.  This collection was digitized and put on DVD by Graham Warger in 2011. The DVD collection is referred to as the Collection on Vandal Training and Scouting Films - nwda-db.orbiscascade.org/findaid/ark:/80444/xv56115,Vandal Video Collection - Vandal Training and Scouting Films http://www.lib.uidaho.edu/digital/vandalvideo/,University of Idaho Digital Initiatives http://www.lib.uidaho.edu/digital/,"Educational use includes non-commercial use of text and images in materials for teaching and research purposes. Digital reproduction permissions granted by University of Idaho Library. For other uses beyond educational use, please contact University of Idaho Library Special Collections and Archives Department at libspec@uidaho.edu and University of Idaho Athletic Department.",http://rightsstatements.org/page/InC-EDU/1.0/?language=en,16mm Film,video/avi,Image;MovingImage,1:53:30,UG64-UTexElPaso1973-1_105.avi,1_105,105,6pPL3jfFPzY,http://digital.lib.uidaho.edu:80/cdm/ref/collection/vandalvideo/id/31,31,vandalvideo31
"University of Idaho vs. Washington State University (Football), 11/11/1967",Washington State University,WSU,Football,1967-11-11,1967,"Pullman, WA",Rodgers Field,46.731806,-117.160444,14 - 52 (L),,UG64-WSU1967-1_141,Original Collection consisted of a series of 16mm Film reels.  This collection was digitized and put on DVD by Graham Warger in 2011. The DVD collection is referred to as the Collection on Vandal Training and Scouting Films - nwda-db.orbiscascade.org/findaid/ark:/80444/xv56115,Vandal Video Collection - Vandal Training and Scouting Films http://www.lib.uidaho.edu/digital/vandalvideo/,University of Idaho Digital Initiatives http://www.lib.uidaho.edu/digital/,"Educational use includes non-commercial use of text and images in materials for teaching and research purposes. Digital reproduction permissions granted by University of Idaho Library. For other uses beyond educational use, please contact University of Idaho Library Special Collections and Archives Department at libspec@uidaho.edu and University of Idaho Athletic Department.",http://rightsstatements.org/page/InC-EDU/1.0/?language=en,16mm Film,video/avi,Image;MovingImage,0:33:11,UG64-WSU1967-1_141.avi,1_141,141,qTMzChR9sAM,http://digital.lib.uidaho.edu:80/cdm/ref/collection/vandalvideo/id/32,32,vandalvideo32
"University of Idaho vs. Washington State University (Basketball), 12/12/1969",Washington State University,WSU-bb,Basketball,1969-12-12,1969,"Pullman, WA",Bohler Gymnasium,46.732783,-117.162173,63 - 84 (L),,UG64-WSU-bb1969-1_144a,Original Collection consisted of a series of 16mm Film reels.  This collection was digitized and put on DVD by Graham Warger in 2011. The DVD collection is referred to as the Collection on Vandal Training and Scouting Films - nwda-db.orbiscascade.org/findaid/ark:/80444/xv56115,Vandal Video Collection - Vandal Training and Scouting Films http://www.lib.uidaho.edu/digital/vandalvideo/,University of Idaho Digital Initiatives http://www.lib.uidaho.edu/digital/,"Educational use includes non-commercial use of text and images in materials for teaching and research purposes. Digital reproduction permissions granted by University of Idaho Library. For other uses beyond educational use, please contact University of Idaho Library Special Collections and Archives Department at libspec@uidaho.edu and University of Idaho Athletic Department.",http://rightsstatements.org/page/InC-EDU/1.0/?language=en,16mm Film,video/avi,Image;MovingImage,0:54:57,UG64-WSU-bb1969-1_144.avi,1_144a,144,XhlFNG36cAg,http://digital.lib.uidaho.edu:80/cdm/ref/collection/vandalvideo/id/33,33,vandalvideo33
"University of Idaho vs. Boise State University (Football), 11/17/1984",Boise State University,"Boise, IDSt",Football,1984-11-17,1984,"Boise, ID",Bronco Stadium,43.602798,-116.195833,37 - 0 (W),,"UG64-Boise, IDSt1984-1_15b",Original Collection consisted of a series of 16mm Film reels.  This collection was digitized and put on DVD by Graham Warger in 2011. The DVD collection is referred to as the Collection on Vandal Training and Scouting Films - nwda-db.orbiscascade.org/findaid/ark:/80444/xv56115,Vandal Video Collection - Vandal Training and Scouting Films http://www.lib.uidaho.edu/digital/vandalvideo/,University of Idaho Digital Initiatives http://www.lib.uidaho.edu/digital/,"Educational use includes non-commercial use of text and images in materials for teaching and research purposes. Digital reproduction permissions granted by University of Idaho Library. For other uses beyond educational use, please contact University of Idaho Library Special Collections and Archives Department at libspec@uidaho.edu and University of Idaho Athletic Department.",http://rightsstatements.org/page/InC-EDU/1.0/?language=en,16mm Film,video/avi,Image;MovingImage,0:31:39,"UG64-Boise, IDSt1984-1_15b.avi",1_15b,15,XaDazNH8hQs,http://digital.lib.uidaho.edu:80/cdm/ref/collection/vandalvideo/id/34,34,vandalvideo34
"University of Idaho vs. Washington State University (Football), 09/19/1970",Washington State University,WSU,Football,1970-09-19,1970,"Spokane, WA",Joe Albi Stadium,47.705278,-117.482778,16 - 44 (L),,UG64-WSU1970-1_146,Original Collection consisted of a series of 16mm Film reels.  This collection was digitized and put on DVD by Graham Warger in 2011. The DVD collection is referred to as the Collection on Vandal Training and Scouting Films - nwda-db.orbiscascade.org/findaid/ark:/80444/xv56115,Vandal Video Collection - Vandal Training and Scouting Films http://www.lib.uidaho.edu/digital/vandalvideo/,University of Idaho Digital Initiatives http://www.lib.uidaho.edu/digital/,"Educational use includes non-commercial use of text and images in materials for teaching and research purposes. Digital reproduction permissions granted by University of Idaho Library. For other uses beyond educational use, please contact University of Idaho Library Special Collections and Archives Department at libspec@uidaho.edu and University of Idaho Athletic Department.",http://rightsstatements.org/page/InC-EDU/1.0/?language=en,16mm Film,video/avi,Image;MovingImage,0:40:02,UG64-WSU1970-1_146.avi,1_146,146,6DdXq3B0ENE,http://digital.lib.uidaho.edu:80/cdm/ref/collection/vandalvideo/id/35,35,vandalvideo35
"University of Idaho vs. Washington State University (Football), 10/07/1972",Washington State University,WSU,Football,1972-10-07,1972,"Pullman, WA",Martin Stadium,46.731806,-117.160444,14 - 35 (L),,UG64-WSU1972-1_147,Original Collection consisted of a series of 16mm Film reels.  This collection was digitized and put on DVD by Graham Warger in 2011. The DVD collection is referred to as the Collection on Vandal Training and Scouting Films - nwda-db.orbiscascade.org/findaid/ark:/80444/xv56115,Vandal Video Collection - Vandal Training and Scouting Films http://www.lib.uidaho.edu/digital/vandalvideo/,University of Idaho Digital Initiatives http://www.lib.uidaho.edu/digital/,"Educational use includes non-commercial use of text and images in materials for teaching and research purposes. Digital reproduction permissions granted by University of Idaho Library. For other uses beyond educational use, please contact University of Idaho Library Special Collections and Archives Department at libspec@uidaho.edu and University of Idaho Athletic Department.",http://rightsstatements.org/page/InC-EDU/1.0/?language=en,16mm Film,video/avi,Image;MovingImage,1:57:42,UG64-WSU1972-1_147.avi,1_147,147,Wa-Yz7J_P8w,http://digital.lib.uidaho.edu:80/cdm/ref/collection/vandalvideo/id/36,36,vandalvideo36
"University of Idaho vs. Washington State University (Football), 09/21/1974",Washington State University,WSU,Football,1974-09-21,1974,"Pullman, WA",Martin Stadium,46.731806,-117.160444,10 - 17 (L),,UG64-WSU1974-1_150,Original Collection consisted of a series of 16mm Film reels.  This collection was digitized and put on DVD by Graham Warger in 2011. The DVD collection is referred to as the Collection on Vandal Training and Scouting Films - nwda-db.orbiscascade.org/findaid/ark:/80444/xv56115,Vandal Video Collection - Vandal Training and Scouting Films http://www.lib.uidaho.edu/digital/vandalvideo/,University of Idaho Digital Initiatives http://www.lib.uidaho.edu/digital/,"Educational use includes non-commercial use of text and images in materials for teaching and research purposes. Digital reproduction permissions granted by University of Idaho Library. For other uses beyond educational use, please contact University of Idaho Library Special Collections and Archives Department at libspec@uidaho.edu and University of Idaho Athletic Department.",http://rightsstatements.org/page/InC-EDU/1.0/?language=en,16mm Film,video/avi,Image;MovingImage,0:28:09,UG64-WSU1974-1_150.avi,1_150,150,D_yKuXZGrHo,http://digital.lib.uidaho.edu:80/cdm/ref/collection/vandalvideo/id/37,37,vandalvideo37
"University of Idaho vs. Washington State University (Basketball), 01/18/1978",Washington State University,WSU-bb,Basketball,1978-01-18,1978,"Moscow, ID",Memorial Gymnasium,46.726389,-117.01375,67 - 69 (L),,UG64-WSU-bb1978-1_157,Original Collection consisted of a series of 16mm Film reels.  This collection was digitized and put on DVD by Graham Warger in 2011. The DVD collection is referred to as the Collection on Vandal Training and Scouting Films - nwda-db.orbiscascade.org/findaid/ark:/80444/xv56115,Vandal Video Collection - Vandal Training and Scouting Films http://www.lib.uidaho.edu/digital/vandalvideo/,University of Idaho Digital Initiatives http://www.lib.uidaho.edu/digital/,"Educational use includes non-commercial use of text and images in materials for teaching and research purposes. Digital reproduction permissions granted by University of Idaho Library. For other uses beyond educational use, please contact University of Idaho Library Special Collections and Archives Department at libspec@uidaho.edu and University of Idaho Athletic Department.",http://rightsstatements.org/page/InC-EDU/1.0/?language=en,16mm Film,video/avi,Image;MovingImage,0:33:24,UG64-WSU-bb1978-1_157.avi,1_157,157,U9O-ENEd7Aw,http://digital.lib.uidaho.edu:80/cdm/ref/collection/vandalvideo/id/38,38,vandalvideo38
"University of Idaho vs. Washington State University (Basketball), 01/27/1968",Washington State University,WSU-bb,Basketball,1968-01-27,1968,"Pullman, WA",Bohler Gymnasium,46.732783,-117.162173,62 - 87 (L),,UG64-WSU-bb1968-1_143b,Original Collection consisted of a series of 16mm Film reels.  This collection was digitized and put on DVD by Graham Warger in 2011. The DVD collection is referred to as the Collection on Vandal Training and Scouting Films - nwda-db.orbiscascade.org/findaid/ark:/80444/xv56115,Vandal Video Collection - Vandal Training and Scouting Films http://www.lib.uidaho.edu/digital/vandalvideo/,University of Idaho Digital Initiatives http://www.lib.uidaho.edu/digital/,"Educational use includes non-commercial use of text and images in materials for teaching and research purposes. Digital reproduction permissions granted by University of Idaho Library. For other uses beyond educational use, please contact University of Idaho Library Special Collections and Archives Department at libspec@uidaho.edu and University of Idaho Athletic Department.",http://rightsstatements.org/page/InC-EDU/1.0/?language=en,16mm Film,video/avi,Image;MovingImage,0:11:11,UG64-WSU-bb1968-1_143b.avi,1_143b,143,EeGTUcbblPM,http://digital.lib.uidaho.edu:80/cdm/ref/collection/vandalvideo/id/39,39,vandalvideo39
"University of Idaho vs. Washington State University (Football), 11/15/1975",Washington State University,WSU,Football,1975-11-15,1975,"Pullman, WA",Martin Stadium,46.731806,-117.160444,27 - 84 (L),,UG64-WSU1975-1_152,Original Collection consisted of a series of 16mm Film reels.  This collection was digitized and put on DVD by Graham Warger in 2011. The DVD collection is referred to as the Collection on Vandal Training and Scouting Films - nwda-db.orbiscascade.org/findaid/ark:/80444/xv56115,Vandal Video Collection - Vandal Training and Scouting Films http://www.lib.uidaho.edu/digital/vandalvideo/,University of Idaho Digital Initiatives http://www.lib.uidaho.edu/digital/,"Educational use includes non-commercial use of text and images in materials for teaching and research purposes. Digital reproduction permissions granted by University of Idaho Library. For other uses beyond educational use, please contact University of Idaho Library Special Collections and Archives Department at libspec@uidaho.edu and University of Idaho Athletic Department.",http://rightsstatements.org/page/InC-EDU/1.0/?language=en,16mm Film,video/avi,Image;MovingImage,0:37:38,UG64-WSU1975-1_152.avi,1_152,152,G4zEGuR4O_U,http://digital.lib.uidaho.edu:80/cdm/ref/collection/vandalvideo/id/40,40,vandalvideo40
"University of Idaho vs. Washington State University (Football), 11/12/1977",Washington State University,WSU,Football,1977-11-12,1977,"Pullman, WA",Martin Stadium,46.731806,-117.160444,17 - 45 (L),,UG64-WSU1977-1_156,Original Collection consisted of a series of 16mm Film reels.  This collection was digitized and put on DVD by Graham Warger in 2011. The DVD collection is referred to as the Collection on Vandal Training and Scouting Films - nwda-db.orbiscascade.org/findaid/ark:/80444/xv56115,Vandal Video Collection - Vandal Training and Scouting Films http://www.lib.uidaho.edu/digital/vandalvideo/,University of Idaho Digital Initiatives http://www.lib.uidaho.edu/digital/,"Educational use includes non-commercial use of text and images in materials for teaching and research purposes. Digital reproduction permissions granted by University of Idaho Library. For other uses beyond educational use, please contact University of Idaho Library Special Collections and Archives Department at libspec@uidaho.edu and University of Idaho Athletic Department.",http://rightsstatements.org/page/InC-EDU/1.0/?language=en,16mm Film,video/avi,Image;MovingImage,0:21:05,UG64-WSU1977-1_156.avi,1_156,156,l2EzzNwhXck,http://digital.lib.uidaho.edu:80/cdm/ref/collection/vandalvideo/id/41,41,vandalvideo41
"University of Idaho vs. Washington State University (Football), 11/15/1975",Washington State University,WSU,Football,1975-11-15,1975,"Pullman, WA",Martin Stadium,46.731806,-117.160444,27 - 84 (L),,UG64-WSU1975-1_151,Original Collection consisted of a series of 16mm Film reels.  This collection was digitized and put on DVD by Graham Warger in 2011. The DVD collection is referred to as the Collection on Vandal Training and Scouting Films - nwda-db.orbiscascade.org/findaid/ark:/80444/xv56115,Vandal Video Collection - Vandal Training and Scouting Films http://www.lib.uidaho.edu/digital/vandalvideo/,University of Idaho Digital Initiatives http://www.lib.uidaho.edu/digital/,"Educational use includes non-commercial use of text and images in materials for teaching and research purposes. Digital reproduction permissions granted by University of Idaho Library. For other uses beyond educational use, please contact University of Idaho Library Special Collections and Archives Department at libspec@uidaho.edu and University of Idaho Athletic Department.",http://rightsstatements.org/page/InC-EDU/1.0/?language=en,16mm Film,video/avi,Image;MovingImage,0:37:38,UG64-WSU1975-1_151.avi,1_151,151,SpLjq6ap-Hk,http://digital.lib.uidaho.edu:80/cdm/ref/collection/vandalvideo/id/42,42,vandalvideo42
"University of Idaho vs. Washington State University (Football), 10/02/1976",Washington State University,WSU,Football,1976-10-02,1976,"Pullman, WA",Martin Stadium,46.731806,-117.160444,6 - 45 (L),,UG64-WSU1976-1_154,Original Collection consisted of a series of 16mm Film reels.  This collection was digitized and put on DVD by Graham Warger in 2011. The DVD collection is referred to as the Collection on Vandal Training and Scouting Films - nwda-db.orbiscascade.org/findaid/ark:/80444/xv56115,Vandal Video Collection - Vandal Training and Scouting Films http://www.lib.uidaho.edu/digital/vandalvideo/,University of Idaho Digital Initiatives http://www.lib.uidaho.edu/digital/,"Educational use includes non-commercial use of text and images in materials for teaching and research purposes. Digital reproduction permissions granted by University of Idaho Library. For other uses beyond educational use, please contact University of Idaho Library Special Collections and Archives Department at libspec@uidaho.edu and University of Idaho Athletic Department.",http://rightsstatements.org/page/InC-EDU/1.0/?language=en,16mm Film,video/avi,Image;MovingImage,0:32:49,UG64-WSU1976-1_154.avi,1_154,154,__hpup-KzLQ,http://digital.lib.uidaho.edu:80/cdm/ref/collection/vandalvideo/id/43,43,vandalvideo43
"University of Idaho vs. Washington State University (Football), 10/07/1972",Washington State University,WSU,Football,1972-10-07,1972,"Pullman, WA",Martin Stadium,46.731806,-117.160444,14 - 35 (L),,UG64-WSU1972-1_148,Original Collection consisted of a series of 16mm Film reels.  This collection was digitized and put on DVD by Graham Warger in 2011. The DVD collection is referred to as the Collection on Vandal Training and Scouting Films - nwda-db.orbiscascade.org/findaid/ark:/80444/xv56115,Vandal Video Collection - Vandal Training and Scouting Films http://www.lib.uidaho.edu/digital/vandalvideo/,University of Idaho Digital Initiatives http://www.lib.uidaho.edu/digital/,"Educational use includes non-commercial use of text and images in materials for teaching and research purposes. Digital reproduction permissions granted by University of Idaho Library. For other uses beyond educational use, please contact University of Idaho Library Special Collections and Archives Department at libspec@uidaho.edu and University of Idaho Athletic Department.",http://rightsstatements.org/page/InC-EDU/1.0/?language=en,16mm Film,video/avi,Image;MovingImage,0:39:48,UG64-WSU1972-1_148.avi,1_148,148,GOPxVSl6rcE,http://digital.lib.uidaho.edu:80/cdm/ref/collection/vandalvideo/id/44,44,vandalvideo44
"University of Idaho vs. Boise State University (Football), 10/11/1975",Boise State University,"Boise, IDSt",Football,1975-10-11,1975,"Moscow, ID",Kibbie Dome,46.726113,-117.015671,31 - 31 (L),,"UG64-Boise, IDSt1975-1_6",Original Collection consisted of a series of 16mm Film reels.  This collection was digitized and put on DVD by Graham Warger in 2011. The DVD collection is referred to as the Collection on Vandal Training and Scouting Films - nwda-db.orbiscascade.org/findaid/ark:/80444/xv56115,Vandal Video Collection - Vandal Training and Scouting Films http://www.lib.uidaho.edu/digital/vandalvideo/,University of Idaho Digital Initiatives http://www.lib.uidaho.edu/digital/,"Educational use includes non-commercial use of text and images in materials for teaching and research purposes. Digital reproduction permissions granted by University of Idaho Library. For other uses beyond educational use, please contact University of Idaho Library Special Collections and Archives Department at libspec@uidaho.edu and University of Idaho Athletic Department.",http://rightsstatements.org/page/InC-EDU/1.0/?language=en,16mm Film,video/avi,Image;MovingImage,0:37:40,"UG64-Boise, IDSt1975-1_6.avi",1_6,6,97QczYjd2IE,http://digital.lib.uidaho.edu:80/cdm/ref/collection/vandalvideo/id/45,45,vandalvideo45
"University of Idaho vs. Washington State University (Basketball), 12/11/1970",Washington State University,WSU,Basketball,1970-12-11,1970,"Moscow, ID",Memorial Gymnasium,46.726389,-117.01375,67 - 74 (L),,UG64-WSU1970-1_145,Original Collection consisted of a series of 16mm Film reels.  This collection was digitized and put on DVD by Graham Warger in 2011. The DVD collection is referred to as the Collection on Vandal Training and Scouting Films - nwda-db.orbiscascade.org/findaid/ark:/80444/xv56115,Vandal Video Collection - Vandal Training and Scouting Films http://www.lib.uidaho.edu/digital/vandalvideo/,University of Idaho Digital Initiatives http://www.lib.uidaho.edu/digital/,"Educational use includes non-commercial use of text and images in materials for teaching and research purposes. Digital reproduction permissions granted by University of Idaho Library. For other uses beyond educational use, please contact University of Idaho Library Special Collections and Archives Department at libspec@uidaho.edu and University of Idaho Athletic Department.",http://rightsstatements.org/page/InC-EDU/1.0/?language=en,16mm Film,video/avi,Image;MovingImage,0:57:26,UG64-WSU1970-1_145.avi,1_145,145,joL9cwRIVTk,http://digital.lib.uidaho.edu:80/cdm/ref/collection/vandalvideo/id/46,46,vandalvideo46
"University of Idaho vs. Washington State University (Football), 09/29/1973",Washington State University,WSU,Football,1973-09-23,1973,"Pullman, WA",Martin Stadium,46.731806,-117.160444,24 - 51 (L),,UG64-WSU1973-1_149,Original Collection consisted of a series of 16mm Film reels.  This collection was digitized and put on DVD by Graham Warger in 2011. The DVD collection is referred to as the Collection on Vandal Training and Scouting Films - nwda-db.orbiscascade.org/findaid/ark:/80444/xv56115,Vandal Video Collection - Vandal Training and Scouting Films http://www.lib.uidaho.edu/digital/vandalvideo/,University of Idaho Digital Initiatives http://www.lib.uidaho.edu/digital/,"Educational use includes non-commercial use of text and images in materials for teaching and research purposes. Digital reproduction permissions granted by University of Idaho Library. For other uses beyond educational use, please contact University of Idaho Library Special Collections and Archives Department at libspec@uidaho.edu and University of Idaho Athletic Department.",http://rightsstatements.org/page/InC-EDU/1.0/?language=en,16mm Film,video/avi,Image;MovingImage,2:14:48,UG64-WSU1973-1_149.avi,1_149,149,f8rCEuvpkiQ,http://digital.lib.uidaho.edu:80/cdm/ref/collection/vandalvideo/id/47,47,vandalvideo47
"University of Idaho vs. Washington State University (Basketball), 01/03/1977",Washington State University,WSU-bb,Basketball,1977-01-03,1977,"Spokane, WA","Spokane, WA Coliseum",47.66642,-117.421562,66 - 80 (L),,UG64-WSU-bb1977-1_155,Original Collection consisted of a series of 16mm Film reels.  This collection was digitized and put on DVD by Graham Warger in 2011. The DVD collection is referred to as the Collection on Vandal Training and Scouting Films - nwda-db.orbiscascade.org/findaid/ark:/80444/xv56115,Vandal Video Collection - Vandal Training and Scouting Films http://www.lib.uidaho.edu/digital/vandalvideo/,University of Idaho Digital Initiatives http://www.lib.uidaho.edu/digital/,"Educational use includes non-commercial use of text and images in materials for teaching and research purposes. Digital reproduction permissions granted by University of Idaho Library. For other uses beyond educational use, please contact University of Idaho Library Special Collections and Archives Department at libspec@uidaho.edu and University of Idaho Athletic Department.",http://rightsstatements.org/page/InC-EDU/1.0/?language=en,16mm Film,video/avi,Image;MovingImage,1:11:29,UG64-WSU-bb1977-1_155.avi,1_155,155,q7FzxhqyHtY,http://digital.lib.uidaho.edu:80/cdm/ref/collection/vandalvideo/id/48,48,vandalvideo48
"University of Idaho vs. Washington State University (Football), 09/21/1968",Washington State University,WSU,Football,1968-09-21,1968,"Spokane, WA",Joe Albi Stadium,47.705278,-117.482778,7 - 14 (L),,UG64-WSU1968-1_142,Original Collection consisted of a series of 16mm Film reels.  This collection was digitized and put on DVD by Graham Warger in 2011. The DVD collection is referred to as the Collection on Vandal Training and Scouting Films - nwda-db.orbiscascade.org/findaid/ark:/80444/xv56115,Vandal Video Collection - Vandal Training and Scouting Films http://www.lib.uidaho.edu/digital/vandalvideo/,University of Idaho Digital Initiatives http://www.lib.uidaho.edu/digital/,"Educational use includes non-commercial use of text and images in materials for teaching and research purposes. Digital reproduction permissions granted by University of Idaho Library. For other uses beyond educational use, please contact University of Idaho Library Special Collections and Archives Department at libspec@uidaho.edu and University of Idaho Athletic Department.",http://rightsstatements.org/page/InC-EDU/1.0/?language=en,16mm Film,video/avi,Image;MovingImage,0:22:20,UG64-WSU1968-1_142.avi,1_142,142,jP6Aje_bMAo,http://digital.lib.uidaho.edu:80/cdm/ref/collection/vandalvideo/id/49,49,vandalvideo49
"University of Idaho vs. Washington State University (Football), 11/15/1975",Washington State University,WSU,Football,1975-11-15,1975,"Pullman, WA",Martin Stadium,46.731806,-117.160444,27 - 84 (L),,UG64-WSU1975-1_153,Original Collection consisted of a series of 16mm Film reels.  This collection was digitized and put on DVD by Graham Warger in 2011. The DVD collection is referred to as the Collection on Vandal Training and Scouting Films - nwda-db.orbiscascade.org/findaid/ark:/80444/xv56115,Vandal Video Collection - Vandal Training and Scouting Films http://www.lib.uidaho.edu/digital/vandalvideo/,University of Idaho Digital Initiatives http://www.lib.uidaho.edu/digital/,"Educational use includes non-commercial use of text and images in materials for teaching and research purposes. Digital reproduction permissions granted by University of Idaho Library. For other uses beyond educational use, please contact University of Idaho Library Special Collections and Archives Department at libspec@uidaho.edu and University of Idaho Athletic Department.",http://rightsstatements.org/page/InC-EDU/1.0/?language=en,16mm Film,video/avi,Image;MovingImage,1:30:15,UG64-WSU1975-1_153.avi,1_153,153,R3p_EL66m2I,http://digital.lib.uidaho.edu:80/cdm/ref/collection/vandalvideo/id/50,50,vandalvideo50
"University of Idaho vs. University of Washington (Football), 09/22/1956",University of Washington,UWash,Football,1956-09-22,1956,"Seattle, WA",Husky Stadium,47.650278,-122.301667,21 - 53 (L),,UG64-UWash1956-1_112,Original Collection consisted of a series of 16mm Film reels.  This collection was digitized and put on DVD by Graham Warger in 2011. The DVD collection is referred to as the Collection on Vandal Training and Scouting Films - nwda-db.orbiscascade.org/findaid/ark:/80444/xv56115,Vandal Video Collection - Vandal Training and Scouting Films http://www.lib.uidaho.edu/digital/vandalvideo/,University of Idaho Digital Initiatives http://www.lib.uidaho.edu/digital/,"Educational use includes non-commercial use of text and images in materials for teaching and research purposes. Digital reproduction permissions granted by University of Idaho Library. For other uses beyond educational use, please contact University of Idaho Library Special Collections and Archives Department at libspec@uidaho.edu and University of Idaho Athletic Department.",http://rightsstatements.org/page/InC-EDU/1.0/?language=en,16mm Film,video/avi,Image;MovingImage,0:50:06,UG64-UWash1956-1_112.avi,1_112,112,Uf59zppbRIo,http://digital.lib.uidaho.edu:80/cdm/ref/collection/vandalvideo/id/51,51,vandalvideo51
"University of Idaho vs. Washington State University (Football), 09/11/1982",Washington State University,WSU,Football,1982-09-11,1982,"Spokane, WA",Joe Albi Stadium,47.705278,-117.482778,14 - 34 (L),,UG64-WSU1982-1_158,Original Collection consisted of a series of 16mm Film reels.  This collection was digitized and put on DVD by Graham Warger in 2011. The DVD collection is referred to as the Collection on Vandal Training and Scouting Films - nwda-db.orbiscascade.org/findaid/ark:/80444/xv56115,Vandal Video Collection - Vandal Training and Scouting Films http://www.lib.uidaho.edu/digital/vandalvideo/,University of Idaho Digital Initiatives http://www.lib.uidaho.edu/digital/,"Educational use includes non-commercial use of text and images in materials for teaching and research purposes. Digital reproduction permissions granted by University of Idaho Library. For other uses beyond educational use, please contact University of Idaho Library Special Collections and Archives Department at libspec@uidaho.edu and University of Idaho Athletic Department.",http://rightsstatements.org/page/InC-EDU/1.0/?language=en,16mm Film,video/avi,Image;MovingImage,0:36:07,UG64-WSU1982-1_158.avi,1_158,158,Nk-DI-FvW2o,http://digital.lib.uidaho.edu:80/cdm/ref/collection/vandalvideo/id/52,52,vandalvideo52
"University of Idaho vs. Washington State University (Football), 09/02/1989",Washington State University,WSU,Football,1989-09-02,1989,"Pullman, WA",Martin Stadium,46.731806,-117.160444,7 - 41 (L),,UG64-WSU1989-1_159,Original Collection consisted of a series of 16mm Film reels.  This collection was digitized and put on DVD by Graham Warger in 2011. The DVD collection is referred to as the Collection on Vandal Training and Scouting Films - nwda-db.orbiscascade.org/findaid/ark:/80444/xv56115,Vandal Video Collection - Vandal Training and Scouting Films http://www.lib.uidaho.edu/digital/vandalvideo/,University of Idaho Digital Initiatives http://www.lib.uidaho.edu/digital/,"Educational use includes non-commercial use of text and images in materials for teaching and research purposes. Digital reproduction permissions granted by University of Idaho Library. For other uses beyond educational use, please contact University of Idaho Library Special Collections and Archives Department at libspec@uidaho.edu and University of Idaho Athletic Department.",http://rightsstatements.org/page/InC-EDU/1.0/?language=en,16mm Film,video/avi,Image;MovingImage,2:29:05,UG64-WSU1989-1_159.avi,1_159,159,hr5jRSgT35c,http://digital.lib.uidaho.edu:80/cdm/ref/collection/vandalvideo/id/53,53,vandalvideo53
"University of Idaho vs. University of Texas-El Paso (Football), 09/08/1973",University of Texas-El Paso,UTexElPaso,Football,1973-09-08,1973,"Moscow, ID",Idaho Stadium,46.726113,-117.015671,62 - 14 (W),,UG64-UTexElPaso1973-1_106,Original Collection consisted of a series of 16mm Film reels.  This collection was digitized and put on DVD by Graham Warger in 2011. The DVD collection is referred to as the Collection on Vandal Training and Scouting Films - nwda-db.orbiscascade.org/findaid/ark:/80444/xv56115,Vandal Video Collection - Vandal Training and Scouting Films http://www.lib.uidaho.edu/digital/vandalvideo/,University of Idaho Digital Initiatives http://www.lib.uidaho.edu/digital/,"Educational use includes non-commercial use of text and images in materials for teaching and research purposes. Digital reproduction permissions granted by University of Idaho Library. For other uses beyond educational use, please contact University of Idaho Library Special Collections and Archives Department at libspec@uidaho.edu and University of Idaho Athletic Department.",http://rightsstatements.org/page/InC-EDU/1.0/?language=en,16mm Film,video/avi,Image;MovingImage,1:33:20,UG64-UTexElPaso1973-1_106.avi,1_106,106,27Bz9Q08sHQ,http://digital.lib.uidaho.edu:80/cdm/ref/collection/vandalvideo/id/54,54,vandalvideo54
"University of Idaho vs. University of Texas-El Paso (Football), 09/08/1973",University of Texas-El Paso,UTexElPaso,Football,1973-09-08,1973,"Moscow, ID",Idaho Stadium,46.726113,-117.015671,62 - 14 (W),,UG64-UTexElPaso1973-1_107,Original Collection consisted of a series of 16mm Film reels.  This collection was digitized and put on DVD by Graham Warger in 2011. The DVD collection is referred to as the Collection on Vandal Training and Scouting Films - nwda-db.orbiscascade.org/findaid/ark:/80444/xv56115,Vandal Video Collection - Vandal Training and Scouting Films http://www.lib.uidaho.edu/digital/vandalvideo/,University of Idaho Digital Initiatives http://www.lib.uidaho.edu/digital/,"Educational use includes non-commercial use of text and images in materials for teaching and research purposes. Digital reproduction permissions granted by University of Idaho Library. For other uses beyond educational use, please contact University of Idaho Library Special Collections and Archives Department at libspec@uidaho.edu and University of Idaho Athletic Department.",http://rightsstatements.org/page/InC-EDU/1.0/?language=en,16mm Film,video/avi,Image;MovingImage,0:37:09,UG64-UTexElPaso1973-1_107.avi,1_107,107,YbP3rjZHggI,http://digital.lib.uidaho.edu:80/cdm/ref/collection/vandalvideo/id/55,55,vandalvideo55
"University of Idaho vs. Boise State University (Football), 09/11/1971",Boise State University,"Boise, IDSt",Football,1971-09-11,1971,"Boise, ID",Bronco Stadium,43.602798,-116.195833,14 - 42 (L),,"UG64-Boise, IDSt1971-1_3",Original Collection consisted of a series of 16mm Film reels.  This collection was digitized and put on DVD by Graham Warger in 2011. The DVD collection is referred to as the Collection on Vandal Training and Scouting Films - nwda-db.orbiscascade.org/findaid/ark:/80444/xv56115,Vandal Video Collection - Vandal Training and Scouting Films http://www.lib.uidaho.edu/digital/vandalvideo/,University of Idaho Digital Initiatives http://www.lib.uidaho.edu/digital/,"Educational use includes non-commercial use of text and images in materials for teaching and research purposes. Digital reproduction permissions granted by University of Idaho Library. For other uses beyond educational use, please contact University of Idaho Library Special Collections and Archives Department at libspec@uidaho.edu and University of Idaho Athletic Department.",http://rightsstatements.org/page/InC-EDU/1.0/?language=en,16mm Film,video/avi,Image;MovingImage,2:07:12,"UG64-Boise, IDSt1971-1_3.avi",1_3,3,8ceUofOkYN0,http://digital.lib.uidaho.edu:80/cdm/ref/collection/vandalvideo/id/56,56,vandalvideo56
"University of Idaho vs. Washington State University (Football), 10/15/1949",Washington State University,WSU,Football,1949-10-15,1949,"Moscow, ID",Neale Stadium,46.726113,-117.015671,13 - 35 (L),,UG64-WSU1949-1_110,Original Collection consisted of a series of 16mm Film reels.  This collection was digitized and put on DVD by Graham Warger in 2011. The DVD collection is referred to as the Collection on Vandal Training and Scouting Films - nwda-db.orbiscascade.org/findaid/ark:/80444/xv56115,Vandal Video Collection - Vandal Training and Scouting Films http://www.lib.uidaho.edu/digital/vandalvideo/,University of Idaho Digital Initiatives http://www.lib.uidaho.edu/digital/,"Educational use includes non-commercial use of text and images in materials for teaching and research purposes. Digital reproduction permissions granted by University of Idaho Library. For other uses beyond educational use, please contact University of Idaho Library Special Collections and Archives Department at libspec@uidaho.edu and University of Idaho Athletic Department.",http://rightsstatements.org/page/InC-EDU/1.0/?language=en,16mm Film,video/avi,Image;MovingImage,0:34:50,UG64-WSU1949-1_110.avi,1_110,110,DCLnOgnjq6Q,http://digital.lib.uidaho.edu:80/cdm/ref/collection/vandalvideo/id/57,57,vandalvideo57
"University of Idaho vs. Western Michigan University (Football), 11/18/1972",Western Michigan University,WestMich,Football,1972-11-18,1972,"Kalamazoo, MI",Waldo Stadium,42.285833,-85.601111,16 - 27 (L),,UG64-WestMich1972-1_160,Original Collection consisted of a series of 16mm Film reels.  This collection was digitized and put on DVD by Graham Warger in 2011. The DVD collection is referred to as the Collection on Vandal Training and Scouting Films - nwda-db.orbiscascade.org/findaid/ark:/80444/xv56115,Vandal Video Collection - Vandal Training and Scouting Films http://www.lib.uidaho.edu/digital/vandalvideo/,University of Idaho Digital Initiatives http://www.lib.uidaho.edu/digital/,"Educational use includes non-commercial use of text and images in materials for teaching and research purposes. Digital reproduction permissions granted by University of Idaho Library. For other uses beyond educational use, please contact University of Idaho Library Special Collections and Archives Department at libspec@uidaho.edu and University of Idaho Athletic Department.",http://rightsstatements.org/page/InC-EDU/1.0/?language=en,16mm Film,video/avi,Image;MovingImage,1:35:09,UG64-WestMich1972-1_160.avi,1_160,160,hCsB0HHo1oM,http://digital.lib.uidaho.edu:80/cdm/ref/collection/vandalvideo/id/58,58,vandalvideo58
"University of Idaho vs. Western Michigan University (Football), 11/18/1972",Western Michigan University,WestMich,Football,1972-11-18,1972,"Kalamazoo, MI",Waldo Stadium,42.285833,-85.601111,16 - 27 (L),,UG64-WestMich1972-1_161,Original Collection consisted of a series of 16mm Film reels.  This collection was digitized and put on DVD by Graham Warger in 2011. The DVD collection is referred to as the Collection on Vandal Training and Scouting Films - nwda-db.orbiscascade.org/findaid/ark:/80444/xv56115,Vandal Video Collection - Vandal Training and Scouting Films http://www.lib.uidaho.edu/digital/vandalvideo/,University of Idaho Digital Initiatives http://www.lib.uidaho.edu/digital/,"Educational use includes non-commercial use of text and images in materials for teaching and research purposes. Digital reproduction permissions granted by University of Idaho Library. For other uses beyond educational use, please contact University of Idaho Library Special Collections and Archives Department at libspec@uidaho.edu and University of Idaho Athletic Department.",http://rightsstatements.org/page/InC-EDU/1.0/?language=en,16mm Film,video/avi,Image;MovingImage,1:37:46,UG64-WestMich1972-1_161.avi,1_161,161,JnsmnqcYkVY,http://digital.lib.uidaho.edu:80/cdm/ref/collection/vandalvideo/id/59,59,vandalvideo59
"University of Idaho vs. Washington State University (Football), 10/11/1958",Washington State University,WSU,Football,1958-10-11,1958,"Moscow, ID",Neale Stadium,46.726113,-117.015671,0 - 8 (L),,UG64-WSU1958-1_113,Original Collection consisted of a series of 16mm Film reels.  This collection was digitized and put on DVD by Graham Warger in 2011. The DVD collection is referred to as the Collection on Vandal Training and Scouting Films - nwda-db.orbiscascade.org/findaid/ark:/80444/xv56115,Vandal Video Collection - Vandal Training and Scouting Films http://www.lib.uidaho.edu/digital/vandalvideo/,University of Idaho Digital Initiatives http://www.lib.uidaho.edu/digital/,"Educational use includes non-commercial use of text and images in materials for teaching and research purposes. Digital reproduction permissions granted by University of Idaho Library. For other uses beyond educational use, please contact University of Idaho Library Special Collections and Archives Department at libspec@uidaho.edu and University of Idaho Athletic Department.",http://rightsstatements.org/page/InC-EDU/1.0/?language=en,16mm Film,video/avi,Image;MovingImage,0:42:19,UG64-WSU1958-1_113.avi,1_113,113,GsV7IA3j_2s,http://digital.lib.uidaho.edu:80/cdm/ref/collection/vandalvideo/id/60,60,vandalvideo60
"University of Idaho vs. University of Washington (Football), 11/17/1945",University of Washington,UWash,Football,1945-11-17,1945,"Seattle, WA",Husky Stadium,47.650278,-122.301667,0 - 12 (L),,UG64-UWash1945-1_108,Original Collection consisted of a series of 16mm Film reels.  This collection was digitized and put on DVD by Graham Warger in 2011. The DVD collection is referred to as the Collection on Vandal Training and Scouting Films - nwda-db.orbiscascade.org/findaid/ark:/80444/xv56115,Vandal Video Collection - Vandal Training and Scouting Films http://www.lib.uidaho.edu/digital/vandalvideo/,University of Idaho Digital Initiatives http://www.lib.uidaho.edu/digital/,"Educational use includes non-commercial use of text and images in materials for teaching and research purposes. Digital reproduction permissions granted by University of Idaho Library. For other uses beyond educational use, please contact University of Idaho Library Special Collections and Archives Department at libspec@uidaho.edu and University of Idaho Athletic Department.",http://rightsstatements.org/page/InC-EDU/1.0/?language=en,16mm Film,video/avi,Image;MovingImage,0:34:10,UG64-UWash1945-1_108.avi,1_108,108,YBA51hnZkPI,http://digital.lib.uidaho.edu:80/cdm/ref/collection/vandalvideo/id/61,61,vandalvideo61
"University of Idaho vs. University of Washington (Football), 09/26/1959",University of Washington,UWash,Football,1959-09-26,1959,"Seattle, WA",Husky Stadium,47.650278,-122.301667,0 - 23 (L),,UG64-UWash1959-1_114,Original Collection consisted of a series of 16mm Film reels.  This collection was digitized and put on DVD by Graham Warger in 2011. The DVD collection is referred to as the Collection on Vandal Training and Scouting Films - nwda-db.orbiscascade.org/findaid/ark:/80444/xv56115,Vandal Video Collection - Vandal Training and Scouting Films http://www.lib.uidaho.edu/digital/vandalvideo/,University of Idaho Digital Initiatives http://www.lib.uidaho.edu/digital/,"Educational use includes non-commercial use of text and images in materials for teaching and research purposes. Digital reproduction permissions granted by University of Idaho Library. For other uses beyond educational use, please contact University of Idaho Library Special Collections and Archives Department at libspec@uidaho.edu and University of Idaho Athletic Department.",http://rightsstatements.org/page/InC-EDU/1.0/?language=en,16mm Film,video/avi,Image;MovingImage,0:42:16,UG64-UWash1959-1_114.avi,1_114,114,Fu4-_HTJePw,http://digital.lib.uidaho.edu:80/cdm/ref/collection/vandalvideo/id/62,62,vandalvideo62
"University of Idaho vs. University of Washington (Football), 10/26/1968",University of Washington,UWash,Football,1968-10-26,1968,"Seattle, WA",Husky Stadium,47.650278,-122.301667,7 - 37 (L),,UG64-UWash1968-1_118,Original Collection consisted of a series of 16mm Film reels.  This collection was digitized and put on DVD by Graham Warger in 2011. The DVD collection is referred to as the Collection on Vandal Training and Scouting Films - nwda-db.orbiscascade.org/findaid/ark:/80444/xv56115,Vandal Video Collection - Vandal Training and Scouting Films http://www.lib.uidaho.edu/digital/vandalvideo/,University of Idaho Digital Initiatives http://www.lib.uidaho.edu/digital/,"Educational use includes non-commercial use of text and images in materials for teaching and research purposes. Digital reproduction permissions granted by University of Idaho Library. For other uses beyond educational use, please contact University of Idaho Library Special Collections and Archives Department at libspec@uidaho.edu and University of Idaho Athletic Department.",http://rightsstatements.org/page/InC-EDU/1.0/?language=en,16mm Film,video/avi,Image;MovingImage,0:48:21,UG64-UWash1968-1_118.avi,1_118,118,7PsKNKbekNc,http://digital.lib.uidaho.edu:80/cdm/ref/collection/vandalvideo/id/63,63,vandalvideo63
"University of Idaho vs. Washington State University (Football), 10/14/1961",Washington State University,WSU,Football,1961-10-14,1961,"Pullman, WA",Rodgers Field,46.731806,-117.160444,0 - 34 (L),tape bad at beginning; start at program 5,UG64-WSU1961-1_116,Original Collection consisted of a series of 16mm Film reels.  This collection was digitized and put on DVD by Graham Warger in 2011. The DVD collection is referred to as the Collection on Vandal Training and Scouting Films - nwda-db.orbiscascade.org/findaid/ark:/80444/xv56115,Vandal Video Collection - Vandal Training and Scouting Films http://www.lib.uidaho.edu/digital/vandalvideo/,University of Idaho Digital Initiatives http://www.lib.uidaho.edu/digital/,"Educational use includes non-commercial use of text and images in materials for teaching and research purposes. Digital reproduction permissions granted by University of Idaho Library. For other uses beyond educational use, please contact University of Idaho Library Special Collections and Archives Department at libspec@uidaho.edu and University of Idaho Athletic Department.",http://rightsstatements.org/page/InC-EDU/1.0/?language=en,16mm Film,video/avi,Image;MovingImage,3:38:22,UG64-WSU1961-1_116.avi,1_116,116,HsTy4IrSe6Q,http://digital.lib.uidaho.edu:80/cdm/ref/collection/vandalvideo/id/64,64,vandalvideo64
"University of Idaho vs. University of Washington (Football), 11/20/1948",University of Washington,UWash,Football,1948-11-20,1948,"Seattle, WA",Husky Stadium,47.650278,-122.301667,7 - 34 (L),,UG64-UWash1948-1_109,Original Collection consisted of a series of 16mm Film reels.  This collection was digitized and put on DVD by Graham Warger in 2011. The DVD collection is referred to as the Collection on Vandal Training and Scouting Films - nwda-db.orbiscascade.org/findaid/ark:/80444/xv56115,Vandal Video Collection - Vandal Training and Scouting Films http://www.lib.uidaho.edu/digital/vandalvideo/,University of Idaho Digital Initiatives http://www.lib.uidaho.edu/digital/,"Educational use includes non-commercial use of text and images in materials for teaching and research purposes. Digital reproduction permissions granted by University of Idaho Library. For other uses beyond educational use, please contact University of Idaho Library Special Collections and Archives Department at libspec@uidaho.edu and University of Idaho Athletic Department.",http://rightsstatements.org/page/InC-EDU/1.0/?language=en,16mm Film,video/avi,Image;MovingImage,0:42:18,UG64-UWash1948-1_109.avi,1_109,109,1N145BlAquM,http://digital.lib.uidaho.edu:80/cdm/ref/collection/vandalvideo/id/65,65,vandalvideo65
"University of Idaho vs. University of Southern Colorado (Football), 09/10/1983",University of Southern Colorado,USoCol,Football,1983-09-10,1983,"Moscow, ID",Kibbie Dome,46.726113,-117.015671,43 - 28 (W),,UG64-USoCol1983-1_103,Original Collection consisted of a series of 16mm Film reels.  This collection was digitized and put on DVD by Graham Warger in 2011. The DVD collection is referred to as the Collection on Vandal Training and Scouting Films - nwda-db.orbiscascade.org/findaid/ark:/80444/xv56115,Vandal Video Collection - Vandal Training and Scouting Films http://www.lib.uidaho.edu/digital/vandalvideo/,University of Idaho Digital Initiatives http://www.lib.uidaho.edu/digital/,"Educational use includes non-commercial use of text and images in materials for teaching and research purposes. Digital reproduction permissions granted by University of Idaho Library. For other uses beyond educational use, please contact University of Idaho Library Special Collections and Archives Department at libspec@uidaho.edu and University of Idaho Athletic Department.",http://rightsstatements.org/page/InC-EDU/1.0/?language=en,16mm Film,video/avi,Image;MovingImage,0:19:27,UG64-USoCol1983-1_103.avi,1_103,103,ldWrnOBl3wo,http://digital.lib.uidaho.edu:80/cdm/ref/collection/vandalvideo/id/66,66,vandalvideo66
"University of Idaho vs. Boise State University (Football), 09/11/1971",Boise State University,"Boise, IDSt",Football,1971-09-11,1971,"Boise, ID",Bronco Stadium,43.602798,-116.195833,14 - 42 (L),,"UG64-Boise, IDSt1971-1_4b",Original Collection consisted of a series of 16mm Film reels.  This collection was digitized and put on DVD by Graham Warger in 2011. The DVD collection is referred to as the Collection on Vandal Training and Scouting Films - nwda-db.orbiscascade.org/findaid/ark:/80444/xv56115,Vandal Video Collection - Vandal Training and Scouting Films http://www.lib.uidaho.edu/digital/vandalvideo/,University of Idaho Digital Initiatives http://www.lib.uidaho.edu/digital/,"Educational use includes non-commercial use of text and images in materials for teaching and research purposes. Digital reproduction permissions granted by University of Idaho Library. For other uses beyond educational use, please contact University of Idaho Library Special Collections and Archives Department at libspec@uidaho.edu and University of Idaho Athletic Department.",http://rightsstatements.org/page/InC-EDU/1.0/?language=en,16mm Film,video/avi,Image;MovingImage,0:16:37,"UG64-Boise, IDSt1971-1_4b.avi",1_4b,4,DM8eDxtYXAY,http://digital.lib.uidaho.edu:80/cdm/ref/collection/vandalvideo/id/67,67,vandalvideo67
"University of Idaho vs. University of Texas (Football), 10/01/1949",University of Texas,UTex,Football,1949-10-01,1949,"Austin, TX",Texas Memorial Field,30.283611,-97.7325,7 - 56 (L),,UG64-UTex1949-1_104,Original Collection consisted of a series of 16mm Film reels.  This collection was digitized and put on DVD by Graham Warger in 2011. The DVD collection is referred to as the Collection on Vandal Training and Scouting Films - nwda-db.orbiscascade.org/findaid/ark:/80444/xv56115,Vandal Video Collection - Vandal Training and Scouting Films http://www.lib.uidaho.edu/digital/vandalvideo/,University of Idaho Digital Initiatives http://www.lib.uidaho.edu/digital/,"Educational use includes non-commercial use of text and images in materials for teaching and research purposes. Digital reproduction permissions granted by University of Idaho Library. For other uses beyond educational use, please contact University of Idaho Library Special Collections and Archives Department at libspec@uidaho.edu and University of Idaho Athletic Department.",http://rightsstatements.org/page/InC-EDU/1.0/?language=en,16mm Film,video/avi,Image;MovingImage,0:33:32,UG64-UTex1949-1_104.avi,1_104,104,lneocTgFTEU,http://digital.lib.uidaho.edu:80/cdm/ref/collection/vandalvideo/id/68,68,vandalvideo68
"University of Idaho vs. University of Washington (Football), 09/17/1966",University of Washington,UWash,Football,1966-09-17,1966,"Seattle, WA",Husky Stadium,47.650278,-122.301667,7 - 19 (L),,UG64-UWash1966-1_117,Original Collection consisted of a series of 16mm Film reels.  This collection was digitized and put on DVD by Graham Warger in 2011. The DVD collection is referred to as the Collection on Vandal Training and Scouting Films - nwda-db.orbiscascade.org/findaid/ark:/80444/xv56115,Vandal Video Collection - Vandal Training and Scouting Films http://www.lib.uidaho.edu/digital/vandalvideo/,University of Idaho Digital Initiatives http://www.lib.uidaho.edu/digital/,"Educational use includes non-commercial use of text and images in materials for teaching and research purposes. Digital reproduction permissions granted by University of Idaho Library. For other uses beyond educational use, please contact University of Idaho Library Special Collections and Archives Department at libspec@uidaho.edu and University of Idaho Athletic Department.",http://rightsstatements.org/page/InC-EDU/1.0/?language=en,16mm Film,video/avi,Image;MovingImage,1:34:12,UG64-UWash1966-1_117.avi,1_117,117,QmARnKnXg0k,http://digital.lib.uidaho.edu:80/cdm/ref/collection/vandalvideo/id/69,69,vandalvideo69
"University of Idaho vs. Boise State University (Football), 11/26/1977",Boise State University,"Boise, IDSt",Football,1977-11-26,1977,"Moscow, ID",Kibbie Dome,46.726113,-117.015671,14 - 44 (L),,"UG64-Boise, IDSt1977-1_8",Original Collection consisted of a series of 16mm Film reels.  This collection was digitized and put on DVD by Graham Warger in 2011. The DVD collection is referred to as the Collection on Vandal Training and Scouting Films - nwda-db.orbiscascade.org/findaid/ark:/80444/xv56115,Vandal Video Collection - Vandal Training and Scouting Films http://www.lib.uidaho.edu/digital/vandalvideo/,University of Idaho Digital Initiatives http://www.lib.uidaho.edu/digital/,"Educational use includes non-commercial use of text and images in materials for teaching and research purposes. Digital reproduction permissions granted by University of Idaho Library. For other uses beyond educational use, please contact University of Idaho Library Special Collections and Archives Department at libspec@uidaho.edu and University of Idaho Athletic Department.",http://rightsstatements.org/page/InC-EDU/1.0/?language=en,16mm Film,video/avi,Image;MovingImage,1:00:07,"UG64-Boise, IDSt1977-1_8.avi",1_8,8,0lTkAoCWPNA,http://digital.lib.uidaho.edu:80/cdm/ref/collection/vandalvideo/id/70,70,vandalvideo70
"University of Idaho vs. Boise State University (Football), 11/23/1985",Boise State University,"Boise, IDSt",Football,1985-11-23,1985,"Moscow, ID",Kibbie Dome,46.726113,-117.015671,44 - 27 (W),"Cliff: entire game and in order, 16mm b/w; surprised that athletic department still shooting and developing film in the earlys, by then almost everyone had a VHS camcorder.","UG64-Boise, IDSt1985-1_16",Original Collection consisted of a series of 16mm Film reels.  This collection was digitized and put on DVD by Graham Warger in 2011. The DVD collection is referred to as the Collection on Vandal Training and Scouting Films - nwda-db.orbiscascade.org/findaid/ark:/80444/xv56115,Vandal Video Collection - Vandal Training and Scouting Films http://www.lib.uidaho.edu/digital/vandalvideo/,University of Idaho Digital Initiatives http://www.lib.uidaho.edu/digital/,"Educational use includes non-commercial use of text and images in materials for teaching and research purposes. Digital reproduction permissions granted by University of Idaho Library. For other uses beyond educational use, please contact University of Idaho Library Special Collections and Archives Department at libspec@uidaho.edu and University of Idaho Athletic Department.",http://rightsstatements.org/page/InC-EDU/1.0/?language=en,16mm Film,video/avi,Image;MovingImage,1:31:13,"UG64-Boise, IDSt1985-1_16.avi",1_16,16,ZxwPIHj9_g4,http://digital.lib.uidaho.edu:80/cdm/ref/collection/vandalvideo/id/71,71,vandalvideo71
"University of Idaho vs. Boise State University (Football), 11/22/1986",Boise State University,"Boise, IDSt",Football,1986-11-22,1986,"Boise, ID",Bronco Stadium,43.602798,-116.195833,21 - 14 (W),"Cliff: first scene starts few minutes into game; second scene on the menu is start of game but only has defensive plays; last scene is kickoff and first part of game; thinks most of game is on DVD but is out of order and some parts are missing where only defensive plays were filmed, so if you are looking to watch the game from start to finish, you can't. 16mm b/w with no sound.","UG64-Boise, IDSt1986-1_17",Original Collection consisted of a series of 16mm Film reels.  This collection was digitized and put on DVD by Graham Warger in 2011. The DVD collection is referred to as the Collection on Vandal Training and Scouting Films - nwda-db.orbiscascade.org/findaid/ark:/80444/xv56115,Vandal Video Collection - Vandal Training and Scouting Films http://www.lib.uidaho.edu/digital/vandalvideo/,University of Idaho Digital Initiatives http://www.lib.uidaho.edu/digital/,"Educational use includes non-commercial use of text and images in materials for teaching and research purposes. Digital reproduction permissions granted by University of Idaho Library. For other uses beyond educational use, please contact University of Idaho Library Special Collections and Archives Department at libspec@uidaho.edu and University of Idaho Athletic Department.",http://rightsstatements.org/page/InC-EDU/1.0/?language=en,16mm Film,video/avi,Image;MovingImage,1:47:38,"UG64-Boise, IDSt1986-1_17.avi",1_17,17,ift9gV_vBoY,http://digital.lib.uidaho.edu:80/cdm/ref/collection/vandalvideo/id/72,72,vandalvideo72
"University of Idaho vs. Boise State University (Football), 10/11/1980",Boise State University,"Boise, IDSt",Football,1980-10-11,1980,"Boise, ID",Bronco Stadium,43.602798,-116.195833,21 - 44 (L),,"UG64-Boise, IDSt1980-1_13",Original Collection consisted of a series of 16mm Film reels.  This collection was digitized and put on DVD by Graham Warger in 2011. The DVD collection is referred to as the Collection on Vandal Training and Scouting Films - nwda-db.orbiscascade.org/findaid/ark:/80444/xv56115,Vandal Video Collection - Vandal Training and Scouting Films http://www.lib.uidaho.edu/digital/vandalvideo/,University of Idaho Digital Initiatives http://www.lib.uidaho.edu/digital/,"Educational use includes non-commercial use of text and images in materials for teaching and research purposes. Digital reproduction permissions granted by University of Idaho Library. For other uses beyond educational use, please contact University of Idaho Library Special Collections and Archives Department at libspec@uidaho.edu and University of Idaho Athletic Department.",http://rightsstatements.org/page/InC-EDU/1.0/?language=en,16mm Film,video/avi,Image;MovingImage,0:49:12,"UG64-Boise, IDSt1980-1_13",1_13,13,H1bZb7dAYsU,http://digital.lib.uidaho.edu:80/cdm/ref/collection/vandalvideo/id/73,73,vandalvideo73
"University of Idaho vs. Boise State University (Football), 11/21/1987",Boise State University,"Boise, IDSt",Football,1987-11-21,1987,"Moscow, ID",Kibbie Dome,46.726113,-117.015671,40 - 34 (W),"Cliff: 16mm b/w, no sound; entire game and in order.","UG64-Boise, IDSt1987-1_18",Original Collection consisted of a series of 16mm Film reels.  This collection was digitized and put on DVD by Graham Warger in 2011. The DVD collection is referred to as the Collection on Vandal Training and Scouting Films - nwda-db.orbiscascade.org/findaid/ark:/80444/xv56115,Vandal Video Collection - Vandal Training and Scouting Films http://www.lib.uidaho.edu/digital/vandalvideo/,University of Idaho Digital Initiatives http://www.lib.uidaho.edu/digital/,"Educational use includes non-commercial use of text and images in materials for teaching and research purposes. Digital reproduction permissions granted by University of Idaho Library. For other uses beyond educational use, please contact University of Idaho Library Special Collections and Archives Department at libspec@uidaho.edu and University of Idaho Athletic Department.",http://rightsstatements.org/page/InC-EDU/1.0/?language=en,16mm Film,video/avi,Image;MovingImage,1:45:00,"UG64-Boise, IDSt1987-1_18.avi",1_18,18,r4fkdCelfSw,http://digital.lib.uidaho.edu:80/cdm/ref/collection/vandalvideo/id/74,74,vandalvideo74
"University of Idaho vs. Ohio University (Football), 09/25/1976",Ohio University,Ohio,Football,1976-09-25,1976,"Athens, OH",Penden Stadium,39.321111,-82.102778,0 - 35 (L),,UG64-Ohio1976-1_40,Original Collection consisted of a series of 16mm Film reels.  This collection was digitized and put on DVD by Graham Warger in 2011. The DVD collection is referred to as the Collection on Vandal Training and Scouting Films - nwda-db.orbiscascade.org/findaid/ark:/80444/xv56115,Vandal Video Collection - Vandal Training and Scouting Films http://www.lib.uidaho.edu/digital/vandalvideo/,University of Idaho Digital Initiatives http://www.lib.uidaho.edu/digital/,"Educational use includes non-commercial use of text and images in materials for teaching and research purposes. Digital reproduction permissions granted by University of Idaho Library. For other uses beyond educational use, please contact University of Idaho Library Special Collections and Archives Department at libspec@uidaho.edu and University of Idaho Athletic Department.",http://rightsstatements.org/page/InC-EDU/1.0/?language=en,16mm Film,video/avi,Image;MovingImage,0:26:05,UG64-Ohio1976-1_40.avi,1_40,40,ixdiQ1uJfjw,http://digital.lib.uidaho.edu:80/cdm/ref/collection/vandalvideo/id/75,75,vandalvideo75
"University of Idaho vs. Oregon State University (Football), 11/03/1945",Oregon State University,OrST,Football,1945-11-03,1945,"Corvallis, OR",Bell Field,44.563,-123.279,0 - 34 (L),"yes, same score for 1945 and 1946 games",UG64-OrST1945-1_41,Original Collection consisted of a series of 16mm Film reels.  This collection was digitized and put on DVD by Graham Warger in 2011. The DVD collection is referred to as the Collection on Vandal Training and Scouting Films - nwda-db.orbiscascade.org/findaid/ark:/80444/xv56115,Vandal Video Collection - Vandal Training and Scouting Films http://www.lib.uidaho.edu/digital/vandalvideo/,University of Idaho Digital Initiatives http://www.lib.uidaho.edu/digital/,"Educational use includes non-commercial use of text and images in materials for teaching and research purposes. Digital reproduction permissions granted by University of Idaho Library. For other uses beyond educational use, please contact University of Idaho Library Special Collections and Archives Department at libspec@uidaho.edu and University of Idaho Athletic Department.",http://rightsstatements.org/page/InC-EDU/1.0/?language=en,16mm Film,video/avi,Image;MovingImage,0:19:06,UG64-OrST1945-1_41.avi,1_41,41,w_HAHx3UlYs,http://digital.lib.uidaho.edu:80/cdm/ref/collection/vandalvideo/id/76,76,vandalvideo76
"University of Idaho vs. Oregon State University (Football), 11/09/1946",Oregon State University,OrST,Football,1946-11-09,1946,"Corvallis, OR",Bell Field,44.563,-123.279,0 - 34 (L),"yes, same score for 1945 and 1946 games",UG64-OrST1946-1_42,Original Collection consisted of a series of 16mm Film reels.  This collection was digitized and put on DVD by Graham Warger in 2011. The DVD collection is referred to as the Collection on Vandal Training and Scouting Films - nwda-db.orbiscascade.org/findaid/ark:/80444/xv56115,Vandal Video Collection - Vandal Training and Scouting Films http://www.lib.uidaho.edu/digital/vandalvideo/,University of Idaho Digital Initiatives http://www.lib.uidaho.edu/digital/,"Educational use includes non-commercial use of text and images in materials for teaching and research purposes. Digital reproduction permissions granted by University of Idaho Library. For other uses beyond educational use, please contact University of Idaho Library Special Collections and Archives Department at libspec@uidaho.edu and University of Idaho Athletic Department.",http://rightsstatements.org/page/InC-EDU/1.0/?language=en,16mm Film,video/avi,Image;MovingImage,0:28:16,UG64-OrST1946-1_42.avi,1_42,42,6Khjxvy4riQ,http://digital.lib.uidaho.edu:80/cdm/ref/collection/vandalvideo/id/77,77,vandalvideo77
"University of Idaho vs. Boise State University (Football), 11/19/1988",Boise State University,"Boise, IDSt",Football,1988-11-19,1988,"Boise, ID",Bronco Stadium,43.602798,-116.195833,26 - 20 (W),"Cliff: 16mm b/w, no sound; DVD starts 12:46 into the 3rd quarter and the entire game is not on the DVD: just Idaho defense and special teams plays; second tab has plays starting at 10:39 of the first quarter.","UG64-Boise, IDSt1988-1_19",Original Collection consisted of a series of 16mm Film reels.  This collection was digitized and put on DVD by Graham Warger in 2011. The DVD collection is referred to as the Collection on Vandal Training and Scouting Films - nwda-db.orbiscascade.org/findaid/ark:/80444/xv56115,Vandal Video Collection - Vandal Training and Scouting Films http://www.lib.uidaho.edu/digital/vandalvideo/,University of Idaho Digital Initiatives http://www.lib.uidaho.edu/digital/,"Educational use includes non-commercial use of text and images in materials for teaching and research purposes. Digital reproduction permissions granted by University of Idaho Library. For other uses beyond educational use, please contact University of Idaho Library Special Collections and Archives Department at libspec@uidaho.edu and University of Idaho Athletic Department.",http://rightsstatements.org/page/InC-EDU/1.0/?language=en,16mm Film,video/avi,Image;MovingImage,0:44:54,"UG64-Boise, IDSt1988-1_19.avi",1_19,19,FxId6oYT41M,http://digital.lib.uidaho.edu:80/cdm/ref/collection/vandalvideo/id/78,78,vandalvideo78
"University of Idaho vs. Oregon State University (Football), 10/11/1947",Oregon State University,OrST,Football,1947-10-11,1947,"Moscow, ID",Neale Stadium,46.726113,-117.015671,6 - 33 (L),,UG64-OrST1947-1_43,Original Collection consisted of a series of 16mm Film reels.  This collection was digitized and put on DVD by Graham Warger in 2011. The DVD collection is referred to as the Collection on Vandal Training and Scouting Films - nwda-db.orbiscascade.org/findaid/ark:/80444/xv56115,Vandal Video Collection - Vandal Training and Scouting Films http://www.lib.uidaho.edu/digital/vandalvideo/,University of Idaho Digital Initiatives http://www.lib.uidaho.edu/digital/,"Educational use includes non-commercial use of text and images in materials for teaching and research purposes. Digital reproduction permissions granted by University of Idaho Library. For other uses beyond educational use, please contact University of Idaho Library Special Collections and Archives Department at libspec@uidaho.edu and University of Idaho Athletic Department.",http://rightsstatements.org/page/InC-EDU/1.0/?language=en,16mm Film,video/avi,Image;MovingImage,0:35:58,UG64-OrST1947-1_43.avi,1_43,43,i4f-yHZi4kg,http://digital.lib.uidaho.edu:80/cdm/ref/collection/vandalvideo/id/79,79,vandalvideo79
"University of Idaho vs. Oregon State University (Football), 11/11/1950",Oregon State University,OrST,Football,1950-11-11,1950,"Corvallis, OR",Bell Field,44.563,-123.279,19 - 34 (L),,UG64-OrST1950-1_46,Original Collection consisted of a series of 16mm Film reels.  This collection was digitized and put on DVD by Graham Warger in 2011. The DVD collection is referred to as the Collection on Vandal Training and Scouting Films - nwda-db.orbiscascade.org/findaid/ark:/80444/xv56115,Vandal Video Collection - Vandal Training and Scouting Films http://www.lib.uidaho.edu/digital/vandalvideo/,University of Idaho Digital Initiatives http://www.lib.uidaho.edu/digital/,"Educational use includes non-commercial use of text and images in materials for teaching and research purposes. Digital reproduction permissions granted by University of Idaho Library. For other uses beyond educational use, please contact University of Idaho Library Special Collections and Archives Department at libspec@uidaho.edu and University of Idaho Athletic Department.",http://rightsstatements.org/page/InC-EDU/1.0/?language=en,16mm Film,video/avi,Image;MovingImage,0:42:01,UG64-OrST1950-1_46.avi,1_46,46,f7eWhAPzpcc,http://digital.lib.uidaho.edu:80/cdm/ref/collection/vandalvideo/id/80,80,vandalvideo80
"University of Idaho vs. Oregon State University (Football), 11/15/1952",Oregon State University,OrST,Football,1952-11-15,1952,"Corvallis, OR",Bell Field,44.563,-123.279,27 - 6 (W),,UG64-OrST1952-1_48,Original Collection consisted of a series of 16mm Film reels.  This collection was digitized and put on DVD by Graham Warger in 2011. The DVD collection is referred to as the Collection on Vandal Training and Scouting Films - nwda-db.orbiscascade.org/findaid/ark:/80444/xv56115,Vandal Video Collection - Vandal Training and Scouting Films http://www.lib.uidaho.edu/digital/vandalvideo/,University of Idaho Digital Initiatives http://www.lib.uidaho.edu/digital/,"Educational use includes non-commercial use of text and images in materials for teaching and research purposes. Digital reproduction permissions granted by University of Idaho Library. For other uses beyond educational use, please contact University of Idaho Library Special Collections and Archives Department at libspec@uidaho.edu and University of Idaho Athletic Department.",http://rightsstatements.org/page/InC-EDU/1.0/?language=en,16mm Film,video/avi,Image;MovingImage,0:35:09,UG64-OrST1952-1_48.avi,1_48,48,GyBwLacDDT4,http://digital.lib.uidaho.edu:80/cdm/ref/collection/vandalvideo/id/81,81,vandalvideo81
"University of Idaho vs. Oregon State University (Football), 09/07/1985",Oregon State University,OrST,Football,1985-09-07,1985,"Corvallis, OR",Parker Stadium,44.559444,-123.281389,28 - 43 (L),,UG64-OrST1985-1_59,Original Collection consisted of a series of 16mm Film reels.  This collection was digitized and put on DVD by Graham Warger in 2011. The DVD collection is referred to as the Collection on Vandal Training and Scouting Films - nwda-db.orbiscascade.org/findaid/ark:/80444/xv56115,Vandal Video Collection - Vandal Training and Scouting Films http://www.lib.uidaho.edu/digital/vandalvideo/,University of Idaho Digital Initiatives http://www.lib.uidaho.edu/digital/,"Educational use includes non-commercial use of text and images in materials for teaching and research purposes. Digital reproduction permissions granted by University of Idaho Library. For other uses beyond educational use, please contact University of Idaho Library Special Collections and Archives Department at libspec@uidaho.edu and University of Idaho Athletic Department.",http://rightsstatements.org/page/InC-EDU/1.0/?language=en,16mm Film,video/avi,Image;MovingImage,0:38:18,UG64-OrST1985-1_59.avi,1_59,59,z0ko2EmGkUY,http://digital.lib.uidaho.edu:80/cdm/ref/collection/vandalvideo/id/82,82,vandalvideo82
"University of Idaho vs. Oregon State University (Football), 10/24/1953",Oregon State University,OrST,Football,1953-10-24,1953,"Moscow, ID",Neale Stadium,46.726113,-117.015671,0 - 19 (L),,UG64-OrST1953-1_49,Original Collection consisted of a series of 16mm Film reels.  This collection was digitized and put on DVD by Graham Warger in 2011. The DVD collection is referred to as the Collection on Vandal Training and Scouting Films - nwda-db.orbiscascade.org/findaid/ark:/80444/xv56115,Vandal Video Collection - Vandal Training and Scouting Films http://www.lib.uidaho.edu/digital/vandalvideo/,University of Idaho Digital Initiatives http://www.lib.uidaho.edu/digital/,"Educational use includes non-commercial use of text and images in materials for teaching and research purposes. Digital reproduction permissions granted by University of Idaho Library. For other uses beyond educational use, please contact University of Idaho Library Special Collections and Archives Department at libspec@uidaho.edu and University of Idaho Athletic Department.",http://rightsstatements.org/page/InC-EDU/1.0/?language=en,16mm Film,video/avi,Image;MovingImage,0:43:16,UG64-OrST1953-1_49.avi,1_49,49,sjIhVfLaJ8I,http://digital.lib.uidaho.edu:80/cdm/ref/collection/vandalvideo/id/83,83,vandalvideo83
"University of Idaho vs. Boise State University (Football), 09/08/1973",Boise State University,"Boise, IDSt",Football,1973-09-08,1973,"Moscow, ID",Idaho Stadium,46.726113,-117.015671,24 - 47 (L),,"UG64-Boise, IDSt1973-1_5",Original Collection consisted of a series of 16mm Film reels.  This collection was digitized and put on DVD by Graham Warger in 2011. The DVD collection is referred to as the Collection on Vandal Training and Scouting Films - nwda-db.orbiscascade.org/findaid/ark:/80444/xv56115,Vandal Video Collection - Vandal Training and Scouting Films http://www.lib.uidaho.edu/digital/vandalvideo/,University of Idaho Digital Initiatives http://www.lib.uidaho.edu/digital/,"Educational use includes non-commercial use of text and images in materials for teaching and research purposes. Digital reproduction permissions granted by University of Idaho Library. For other uses beyond educational use, please contact University of Idaho Library Special Collections and Archives Department at libspec@uidaho.edu and University of Idaho Athletic Department.",http://rightsstatements.org/page/InC-EDU/1.0/?language=en,16mm Film,video/avi,Image;MovingImage,0:35:48,"UG64-Boise, IDSt1973-1_5.avi",1_5,5,fMgNQYD5WzM,http://digital.lib.uidaho.edu:80/cdm/ref/collection/vandalvideo/id/84,84,vandalvideo84
"University of Idaho vs. Oregon State University (Football), 11/17/1956",Oregon State University,OrST,Football,1956-11-17,1956,"Moscow, ID",Neale Stadium,46.726113,-117.015671,10 - 14 (L),,UG64-OrST1956-1_51,Original Collection consisted of a series of 16mm Film reels.  This collection was digitized and put on DVD by Graham Warger in 2011. The DVD collection is referred to as the Collection on Vandal Training and Scouting Films - nwda-db.orbiscascade.org/findaid/ark:/80444/xv56115,Vandal Video Collection - Vandal Training and Scouting Films http://www.lib.uidaho.edu/digital/vandalvideo/,University of Idaho Digital Initiatives http://www.lib.uidaho.edu/digital/,"Educational use includes non-commercial use of text and images in materials for teaching and research purposes. Digital reproduction permissions granted by University of Idaho Library. For other uses beyond educational use, please contact University of Idaho Library Special Collections and Archives Department at libspec@uidaho.edu and University of Idaho Athletic Department.",http://rightsstatements.org/page/InC-EDU/1.0/?language=en,16mm Film,video/avi,Image;MovingImage,0:33:05,UG64-OrST1956-1_51.avi,1_51,51,iPTOtqAGYus,http://digital.lib.uidaho.edu:80/cdm/ref/collection/vandalvideo/id/85,85,vandalvideo85
"University of Idaho vs. Oregon State University (Football), 09/18/1948",Oregon State University,OrST,Football,1948-09-18,1948,"Corvallis, OR",Bell Field,44.563,-123.279,12 - 27 (L),,UG64-OrST1948-1_44,Original Collection consisted of a series of 16mm Film reels.  This collection was digitized and put on DVD by Graham Warger in 2011. The DVD collection is referred to as the Collection on Vandal Training and Scouting Films - nwda-db.orbiscascade.org/findaid/ark:/80444/xv56115,Vandal Video Collection - Vandal Training and Scouting Films http://www.lib.uidaho.edu/digital/vandalvideo/,University of Idaho Digital Initiatives http://www.lib.uidaho.edu/digital/,"Educational use includes non-commercial use of text and images in materials for teaching and research purposes. Digital reproduction permissions granted by University of Idaho Library. For other uses beyond educational use, please contact University of Idaho Library Special Collections and Archives Department at libspec@uidaho.edu and University of Idaho Athletic Department.",http://rightsstatements.org/page/InC-EDU/1.0/?language=en,16mm Film,video/avi,Image;MovingImage,1:11:31,UG64-OrST1948-1_44.avi,1_44,44,Fbyn7dn9xNs,http://digital.lib.uidaho.edu:80/cdm/ref/collection/vandalvideo/id/86,86,vandalvideo86
"University of Idaho vs. Oregon State University (Football), 10/17/1959",Oregon State University,OrST,Football,1959-10-17,1959,"Corvallis, OR",Parker Stadium,44.559444,-123.281389,18 - 66 (L),,UG64-OrST1959-1_54,Original Collection consisted of a series of 16mm Film reels.  This collection was digitized and put on DVD by Graham Warger in 2011. The DVD collection is referred to as the Collection on Vandal Training and Scouting Films - nwda-db.orbiscascade.org/findaid/ark:/80444/xv56115,Vandal Video Collection - Vandal Training and Scouting Films http://www.lib.uidaho.edu/digital/vandalvideo/,University of Idaho Digital Initiatives http://www.lib.uidaho.edu/digital/,"Educational use includes non-commercial use of text and images in materials for teaching and research purposes. Digital reproduction permissions granted by University of Idaho Library. For other uses beyond educational use, please contact University of Idaho Library Special Collections and Archives Department at libspec@uidaho.edu and University of Idaho Athletic Department.",http://rightsstatements.org/page/InC-EDU/1.0/?language=en,16mm Film,video/avi,Image;MovingImage,0:45:38,UG64-OrST1959-1_54.avi,1_54,54,y_eBWM6qBYk,http://digital.lib.uidaho.edu:80/cdm/ref/collection/vandalvideo/id/87,87,vandalvideo87
"University of Idaho vs. Oregon State University (Football), 10/12/1957",Oregon State University,OrST,Football,1957-10-12,1957,"Corvallis, OR",Parker Stadium,44.559444,-123.281389,0 - 20 (L),,UG64-OrST1957-1_52,Original Collection consisted of a series of 16mm Film reels.  This collection was digitized and put on DVD by Graham Warger in 2011. The DVD collection is referred to as the Collection on Vandal Training and Scouting Films - nwda-db.orbiscascade.org/findaid/ark:/80444/xv56115,Vandal Video Collection - Vandal Training and Scouting Films http://www.lib.uidaho.edu/digital/vandalvideo/,University of Idaho Digital Initiatives http://www.lib.uidaho.edu/digital/,"Educational use includes non-commercial use of text and images in materials for teaching and research purposes. Digital reproduction permissions granted by University of Idaho Library. For other uses beyond educational use, please contact University of Idaho Library Special Collections and Archives Department at libspec@uidaho.edu and University of Idaho Athletic Department.",http://rightsstatements.org/page/InC-EDU/1.0/?language=en,16mm Film,video/avi,Image;MovingImage,0:48:16,UG64-OrST1957-1_52.avi,1_52,52,p-SsqPLI0GU,http://digital.lib.uidaho.edu:80/cdm/ref/collection/vandalvideo/id/88,88,vandalvideo88
"University of Idaho vs. Oregon State University (Football), 11/05/1949",Oregon State University,OrST,Football,1949-11-05,1949,"Moscow, ID",Neale Stadium,46.726113,-117.015671,25 - 35 (L),,UG64-OrST1949-1_45,Original Collection consisted of a series of 16mm Film reels.  This collection was digitized and put on DVD by Graham Warger in 2011. The DVD collection is referred to as the Collection on Vandal Training and Scouting Films - nwda-db.orbiscascade.org/findaid/ark:/80444/xv56115,Vandal Video Collection - Vandal Training and Scouting Films http://www.lib.uidaho.edu/digital/vandalvideo/,University of Idaho Digital Initiatives http://www.lib.uidaho.edu/digital/,"Educational use includes non-commercial use of text and images in materials for teaching and research purposes. Digital reproduction permissions granted by University of Idaho Library. For other uses beyond educational use, please contact University of Idaho Library Special Collections and Archives Department at libspec@uidaho.edu and University of Idaho Athletic Department.",http://rightsstatements.org/page/InC-EDU/1.0/?language=en,16mm Film,video/avi,Image;MovingImage,0:36:55,UG64-OrST1949-1_45.avi,1_45,45,mVR7O3H21zc,http://digital.lib.uidaho.edu:80/cdm/ref/collection/vandalvideo/id/89,89,vandalvideo89
"University of Idaho vs. Oregon State University (Football), 10/18/1958",Oregon State University,OrST,Football,1958-10-18,1958,"Moscow, ID",Neale Stadium,46.726113,-117.015671,6 - 20 (L),,UG64-OrST1958-1_53,Original Collection consisted of a series of 16mm Film reels.  This collection was digitized and put on DVD by Graham Warger in 2011. The DVD collection is referred to as the Collection on Vandal Training and Scouting Films - nwda-db.orbiscascade.org/findaid/ark:/80444/xv56115,Vandal Video Collection - Vandal Training and Scouting Films http://www.lib.uidaho.edu/digital/vandalvideo/,University of Idaho Digital Initiatives http://www.lib.uidaho.edu/digital/,"Educational use includes non-commercial use of text and images in materials for teaching and research purposes. Digital reproduction permissions granted by University of Idaho Library. For other uses beyond educational use, please contact University of Idaho Library Special Collections and Archives Department at libspec@uidaho.edu and University of Idaho Athletic Department.",http://rightsstatements.org/page/InC-EDU/1.0/?language=en,16mm Film,video/avi,Image;MovingImage,0:31:43,UG64-OrST1958-1_53.avi,1_53,53,JDj0bQmY-5Y,http://digital.lib.uidaho.edu:80/cdm/ref/collection/vandalvideo/id/90,90,vandalvideo90
"University of Idaho vs. Oregon State University (Football), 10/15/1960",Oregon State University,OrST,Football,1960-10-15,1960,"Moscow, ID",Neale Stadium,46.726113,-117.015671,8 - 28 (L),,UG64-OrST1960-1_55,Original Collection consisted of a series of 16mm Film reels.  This collection was digitized and put on DVD by Graham Warger in 2011. The DVD collection is referred to as the Collection on Vandal Training and Scouting Films - nwda-db.orbiscascade.org/findaid/ark:/80444/xv56115,Vandal Video Collection - Vandal Training and Scouting Films http://www.lib.uidaho.edu/digital/vandalvideo/,University of Idaho Digital Initiatives http://www.lib.uidaho.edu/digital/,"Educational use includes non-commercial use of text and images in materials for teaching and research purposes. Digital reproduction permissions granted by University of Idaho Library. For other uses beyond educational use, please contact University of Idaho Library Special Collections and Archives Department at libspec@uidaho.edu and University of Idaho Athletic Department.",http://rightsstatements.org/page/InC-EDU/1.0/?language=en,16mm Film,video/avi,Image;MovingImage,0:36:35,UG64-OrST1960-1_55.avi,1_55,55,DmWp7bp-Iz8,http://digital.lib.uidaho.edu:80/cdm/ref/collection/vandalvideo/id/91,91,vandalvideo91
"University of Idaho vs. Oregon State University (Football), 10/06/1951",Oregon State University,OrST,Football,1951-10-06,1951,"Spokane, WA",Memorial Stadium,47.705278,-117.482778,6 - 34 (L),,UG64-OrST1951-1_47,Original Collection consisted of a series of 16mm Film reels.  This collection was digitized and put on DVD by Graham Warger in 2011. The DVD collection is referred to as the Collection on Vandal Training and Scouting Films - nwda-db.orbiscascade.org/findaid/ark:/80444/xv56115,Vandal Video Collection - Vandal Training and Scouting Films http://www.lib.uidaho.edu/digital/vandalvideo/,University of Idaho Digital Initiatives http://www.lib.uidaho.edu/digital/,"Educational use includes non-commercial use of text and images in materials for teaching and research purposes. Digital reproduction permissions granted by University of Idaho Library. For other uses beyond educational use, please contact University of Idaho Library Special Collections and Archives Department at libspec@uidaho.edu and University of Idaho Athletic Department.",http://rightsstatements.org/page/InC-EDU/1.0/?language=en,16mm Film,video/avi,Image;MovingImage,0:33:53,UG64-OrST1951-1_47.avi,1_47,47,4iMJatBu3Go,http://digital.lib.uidaho.edu:80/cdm/ref/collection/vandalvideo/id/92,92,vandalvideo92
"University of Idaho vs. Oregon State University (Football), 09/29/1984",Oregon State University,OrST,Football,1984-09-29,1984,"Moscow, ID",Kibbie Dome,46.726113,-117.015671,41 - 22 (W),,UG64-OrST1984-1_58,Original Collection consisted of a series of 16mm Film reels.  This collection was digitized and put on DVD by Graham Warger in 2011. The DVD collection is referred to as the Collection on Vandal Training and Scouting Films - nwda-db.orbiscascade.org/findaid/ark:/80444/xv56115,Vandal Video Collection - Vandal Training and Scouting Films http://www.lib.uidaho.edu/digital/vandalvideo/,University of Idaho Digital Initiatives http://www.lib.uidaho.edu/digital/,"Educational use includes non-commercial use of text and images in materials for teaching and research purposes. Digital reproduction permissions granted by University of Idaho Library. For other uses beyond educational use, please contact University of Idaho Library Special Collections and Archives Department at libspec@uidaho.edu and University of Idaho Athletic Department.",http://rightsstatements.org/page/InC-EDU/1.0/?language=en,16mm Film,video/avi,Image;MovingImage,2:27:53,UG64-OrST1984-1_58.avi,1_58,58,SR3PvCR346A,http://digital.lib.uidaho.edu:80/cdm/ref/collection/vandalvideo/id/93,93,vandalvideo93
"University of Idaho vs. Oregon State University (Football), 10/07/1961",Oregon State University,OrST,Football,1961-10-07,1961,"Corvallis, OR",Parker Stadium,44.559444,-123.281389,6 - 44 (L),,UG64-OrST1961-1_56,Original Collection consisted of a series of 16mm Film reels.  This collection was digitized and put on DVD by Graham Warger in 2011. The DVD collection is referred to as the Collection on Vandal Training and Scouting Films - nwda-db.orbiscascade.org/findaid/ark:/80444/xv56115,Vandal Video Collection - Vandal Training and Scouting Films http://www.lib.uidaho.edu/digital/vandalvideo/,University of Idaho Digital Initiatives http://www.lib.uidaho.edu/digital/,"Educational use includes non-commercial use of text and images in materials for teaching and research purposes. Digital reproduction permissions granted by University of Idaho Library. For other uses beyond educational use, please contact University of Idaho Library Special Collections and Archives Department at libspec@uidaho.edu and University of Idaho Athletic Department.",http://rightsstatements.org/page/InC-EDU/1.0/?language=en,16mm Film,video/avi,Image;MovingImage,1:12:50,UG64-OrST1961-1_56.avi,1_56,56,VgYEabcaz8c,http://digital.lib.uidaho.edu:80/cdm/ref/collection/vandalvideo/id/94,94,vandalvideo94
"University of Idaho vs. Boise State University (Football), 10/13/1979",Boise State University,"Boise, IDSt",Football,1979-10-13,1979,"Moscow, ID",Kibbie Dome,46.726113,-117.015671,17 - 41 (L),,"UG64-Boise, IDSt1979-1_12",Original Collection consisted of a series of 16mm Film reels.  This collection was digitized and put on DVD by Graham Warger in 2011. The DVD collection is referred to as the Collection on Vandal Training and Scouting Films - nwda-db.orbiscascade.org/findaid/ark:/80444/xv56115,Vandal Video Collection - Vandal Training and Scouting Films http://www.lib.uidaho.edu/digital/vandalvideo/,University of Idaho Digital Initiatives http://www.lib.uidaho.edu/digital/,"Educational use includes non-commercial use of text and images in materials for teaching and research purposes. Digital reproduction permissions granted by University of Idaho Library. For other uses beyond educational use, please contact University of Idaho Library Special Collections and Archives Department at libspec@uidaho.edu and University of Idaho Athletic Department.",http://rightsstatements.org/page/InC-EDU/1.0/?language=en,16mm Film,video/avi,Image;MovingImage,2:05:12,"UG64-Boise, IDSt1979-1_12.avi",1_12,12,wbj1u09RiB0,http://digital.lib.uidaho.edu:80/cdm/ref/collection/vandalvideo/id/95,95,vandalvideo95
"University of Idaho vs. Oregon State University (Football), 10/16/1965",Oregon State University,OrST,Football,1965-10-16,1965,"Boise, ID",Bronco Stadium,43.602798,-116.195833,14 - 16 (L),start at program 2,UG64-OrST1965-1_57,Original Collection consisted of a series of 16mm Film reels.  This collection was digitized and put on DVD by Graham Warger in 2011. The DVD collection is referred to as the Collection on Vandal Training and Scouting Films - nwda-db.orbiscascade.org/findaid/ark:/80444/xv56115,Vandal Video Collection - Vandal Training and Scouting Films http://www.lib.uidaho.edu/digital/vandalvideo/,University of Idaho Digital Initiatives http://www.lib.uidaho.edu/digital/,"Educational use includes non-commercial use of text and images in materials for teaching and research purposes. Digital reproduction permissions granted by University of Idaho Library. For other uses beyond educational use, please contact University of Idaho Library Special Collections and Archives Department at libspec@uidaho.edu and University of Idaho Athletic Department.",http://rightsstatements.org/page/InC-EDU/1.0/?language=en,16mm Film,video/avi,Image;MovingImage,0:54:48,UG64-OrST1965-1_57.avi,1_57,57,4HIRjSkaIhc,http://digital.lib.uidaho.edu:80/cdm/ref/collection/vandalvideo/id/96,96,vandalvideo96
"University of Idaho vs. Oregon State University (Football), 09/25/1954",Oregon State University,OrST,Football,1954-09-25,1954,"Corvallis, OR",Parker Stadium,44.559444,-123.281389,0 - 13 (L),,UG64-OrST1954-1_50,Original Collection consisted of a series of 16mm Film reels.  This collection was digitized and put on DVD by Graham Warger in 2011. The DVD collection is referred to as the Collection on Vandal Training and Scouting Films - nwda-db.orbiscascade.org/findaid/ark:/80444/xv56115,Vandal Video Collection - Vandal Training and Scouting Films http://www.lib.uidaho.edu/digital/vandalvideo/,University of Idaho Digital Initiatives http://www.lib.uidaho.edu/digital/,"Educational use includes non-commercial use of text and images in materials for teaching and research purposes. Digital reproduction permissions granted by University of Idaho Library. For other uses beyond educational use, please contact University of Idaho Library Special Collections and Archives Department at libspec@uidaho.edu and University of Idaho Athletic Department.",http://rightsstatements.org/page/InC-EDU/1.0/?language=en,16mm Film,video/avi,Image;MovingImage,0:44:34,UG64-OrST1954-1_50.avi,1_50,50,r0xBke7QKjE,http://digital.lib.uidaho.edu:80/cdm/ref/collection/vandalvideo/id/97,97,vandalvideo97
"University of Idaho vs. Ohio University (Football), 09/16/1972",Ohio University,Ohio,Football,1972-09-16,1972,"Moscow, ID",Idaho Stadium,46.726113,-117.015671,17 - 14 (W),,UG64-Ohio1972-1_38,Original Collection consisted of a series of 16mm Film reels.  This collection was digitized and put on DVD by Graham Warger in 2011. The DVD collection is referred to as the Collection on Vandal Training and Scouting Films - nwda-db.orbiscascade.org/findaid/ark:/80444/xv56115,Vandal Video Collection - Vandal Training and Scouting Films http://www.lib.uidaho.edu/digital/vandalvideo/,University of Idaho Digital Initiatives http://www.lib.uidaho.edu/digital/,"Educational use includes non-commercial use of text and images in materials for teaching and research purposes. Digital reproduction permissions granted by University of Idaho Library. For other uses beyond educational use, please contact University of Idaho Library Special Collections and Archives Department at libspec@uidaho.edu and University of Idaho Athletic Department.",http://rightsstatements.org/page/InC-EDU/1.0/?language=en,16mm Film,video/avi,Image;MovingImage,0:38:27,UG64-Ohio1972-1_38.avi,1_38,38,oUpmUtN1a9Y,http://digital.lib.uidaho.edu:80/cdm/ref/collection/vandalvideo/id/98,98,vandalvideo98
"University of Idaho vs. Oregon State University (Football), 09/07/1985",Oregon State University,OrST,Football,1985-09-07,1985,"Corvallis, OR",Parker Stadium,44.559444,-123.281389,28 - 43 (L),,UG64-OrST1985-1_60,Original Collection consisted of a series of 16mm Film reels.  This collection was digitized and put on DVD by Graham Warger in 2011. The DVD collection is referred to as the Collection on Vandal Training and Scouting Films - nwda-db.orbiscascade.org/findaid/ark:/80444/xv56115,Vandal Video Collection - Vandal Training and Scouting Films http://www.lib.uidaho.edu/digital/vandalvideo/,University of Idaho Digital Initiatives http://www.lib.uidaho.edu/digital/,"Educational use includes non-commercial use of text and images in materials for teaching and research purposes. Digital reproduction permissions granted by University of Idaho Library. For other uses beyond educational use, please contact University of Idaho Library Special Collections and Archives Department at libspec@uidaho.edu and University of Idaho Athletic Department.",http://rightsstatements.org/page/InC-EDU/1.0/?language=en,16mm Film,video/avi,Image;MovingImage,0:38:18,UG64-OrST1985-1_60.avi,1_60,60,u-ccfZ2Sm0w,http://digital.lib.uidaho.edu:80/cdm/ref/collection/vandalvideo/id/99,99,vandalvideo99
"University of Idaho vs. Stanford University (Football), 09/28/1946",Stanford University,Stan,Football,1946-09-28,1946,"Palo Alto, CA",Stanford Stadium,37.434444,-122.161111,0 - 45 (L),,UG64-Stan1946-1_61,Original Collection consisted of a series of 16mm Film reels.  This collection was digitized and put on DVD by Graham Warger in 2011. The DVD collection is referred to as the Collection on Vandal Training and Scouting Films - nwda-db.orbiscascade.org/findaid/ark:/80444/xv56115,Vandal Video Collection - Vandal Training and Scouting Films http://www.lib.uidaho.edu/digital/vandalvideo/,University of Idaho Digital Initiatives http://www.lib.uidaho.edu/digital/,"Educational use includes non-commercial use of text and images in materials for teaching and research purposes. Digital reproduction permissions granted by University of Idaho Library. For other uses beyond educational use, please contact University of Idaho Library Special Collections and Archives Department at libspec@uidaho.edu and University of Idaho Athletic Department.",http://rightsstatements.org/page/InC-EDU/1.0/?language=en,16mm Film,video/avi,Image;MovingImage,0:37:59,UG64-Stan1946-1_61.avi,1_61,61,qiAT_VPtA2o,http://digital.lib.uidaho.edu:80/cdm/ref/collection/vandalvideo/id/100,100,vandalvideo100
"University of Idaho vs. Stanford University (Football), 11/12/1949",Stanford University,Stan,Football,1949-11-12,1949,"Palo Alto, CA",Stanford Stadium,37.434444,-122.161111,0 - 63 (L),,UG64-Stan1949-1_62,Original Collection consisted of a series of 16mm Film reels.  This collection was digitized and put on DVD by Graham Warger in 2011. The DVD collection is referred to as the Collection on Vandal Training and Scouting Films - nwda-db.orbiscascade.org/findaid/ark:/80444/xv56115,Vandal Video Collection - Vandal Training and Scouting Films http://www.lib.uidaho.edu/digital/vandalvideo/,University of Idaho Digital Initiatives http://www.lib.uidaho.edu/digital/,"Educational use includes non-commercial use of text and images in materials for teaching and research purposes. Digital reproduction permissions granted by University of Idaho Library. For other uses beyond educational use, please contact University of Idaho Library Special Collections and Archives Department at libspec@uidaho.edu and University of Idaho Athletic Department.",http://rightsstatements.org/page/InC-EDU/1.0/?language=en,16mm Film,video/avi,Image;MovingImage,0:31:23,UG64-Stan1949-1_62.avi,1_62,62,Tc9xzqaAIr8,http://digital.lib.uidaho.edu:80/cdm/ref/collection/vandalvideo/id/101,101,vandalvideo101
"University of Idaho vs. Boise State University (Football), 11/23/1991",Boise State University,"Boise, IDSt",Football,1991-11-23,1991,"Moscow, ID",Kibbie Dome,46.726113,-117.015671,28 - 24 (W),End zone version,"UG64-Boise, IDSt1991-1_22",Original Collection consisted of a series of 16mm Film reels.  This collection was digitized and put on DVD by Graham Warger in 2011. The DVD collection is referred to as the Collection on Vandal Training and Scouting Films - nwda-db.orbiscascade.org/findaid/ark:/80444/xv56115,Vandal Video Collection - Vandal Training and Scouting Films http://www.lib.uidaho.edu/digital/vandalvideo/,University of Idaho Digital Initiatives http://www.lib.uidaho.edu/digital/,"Educational use includes non-commercial use of text and images in materials for teaching and research purposes. Digital reproduction permissions granted by University of Idaho Library. For other uses beyond educational use, please contact University of Idaho Library Special Collections and Archives Department at libspec@uidaho.edu and University of Idaho Athletic Department.",http://rightsstatements.org/page/InC-EDU/1.0/?language=en,16mm Film,video/avi,Image;MovingImage,1:59:23,"UG64-Boise, IDSt1991-1_22.avi",1_22,22,vRkNv0MIfxw,http://digital.lib.uidaho.edu:80/cdm/ref/collection/vandalvideo/id/102,102,vandalvideo102
"University of Idaho vs. Central Michigan University  (Football), 09/13/1986",Central Michigan University,CentMI,Football,1986-09-13,1986,"Mount Pleasant, MI",Kelly/Shorts Stadium,43.5775,-84.770833,21 - 34 (L),,UG64-CentMI1986-1_32,Original Collection consisted of a series of 16mm Film reels.  This collection was digitized and put on DVD by Graham Warger in 2011. The DVD collection is referred to as the Collection on Vandal Training and Scouting Films - nwda-db.orbiscascade.org/findaid/ark:/80444/xv56115,Vandal Video Collection - Vandal Training and Scouting Films http://www.lib.uidaho.edu/digital/vandalvideo/,University of Idaho Digital Initiatives http://www.lib.uidaho.edu/digital/,"Educational use includes non-commercial use of text and images in materials for teaching and research purposes. Digital reproduction permissions granted by University of Idaho Library. For other uses beyond educational use, please contact University of Idaho Library Special Collections and Archives Department at libspec@uidaho.edu and University of Idaho Athletic Department.",http://rightsstatements.org/page/InC-EDU/1.0/?language=en,16mm Film,video/avi,Image;MovingImage,1:01:09,UG64-CentMI1986-1_32.avi,1_32,32,6cFFjqqF1IM,http://digital.lib.uidaho.edu:80/cdm/ref/collection/vandalvideo/id/103,103,vandalvideo103
"University of Idaho vs. Stanford University (Basketball), 03/01/1957",Stanford University,Stan-bb,Basketball,1957-03-01,1957,"Moscow, ID",Memorial Gymnasium,46.726389,-117.018056,60 - 57 (W),,UG64-Stan-bb1957-1_63a,Original Collection consisted of a series of 16mm Film reels.  This collection was digitized and put on DVD by Graham Warger in 2011. The DVD collection is referred to as the Collection on Vandal Training and Scouting Films - nwda-db.orbiscascade.org/findaid/ark:/80444/xv56115,Vandal Video Collection - Vandal Training and Scouting Films http://www.lib.uidaho.edu/digital/vandalvideo/,University of Idaho Digital Initiatives http://www.lib.uidaho.edu/digital/,"Educational use includes non-commercial use of text and images in materials for teaching and research purposes. Digital reproduction permissions granted by University of Idaho Library. For other uses beyond educational use, please contact University of Idaho Library Special Collections and Archives Department at libspec@uidaho.edu and University of Idaho Athletic Department.",http://rightsstatements.org/page/InC-EDU/1.0/?language=en,16mm Film,video/avi,Image;MovingImage,0:32:08,UG64-Stan-bb1957-1_63.avi,1_63a,63,7Y6IS4E_iK4,http://digital.lib.uidaho.edu:80/cdm/ref/collection/vandalvideo/id/104,104,vandalvideo104
"University of Idaho vs. University of Arizona (Football), 10/01/1955",University of Arizona,AzU,Football,1955-10-01,1955,"Tucson, AZ",Arizona Stadium,32.228889,-110.948889,14 - 47 (L),,UG64-AzU1955-1_66,Original Collection consisted of a series of 16mm Film reels.  This collection was digitized and put on DVD by Graham Warger in 2011. The DVD collection is referred to as the Collection on Vandal Training and Scouting Films - nwda-db.orbiscascade.org/findaid/ark:/80444/xv56115,Vandal Video Collection - Vandal Training and Scouting Films http://www.lib.uidaho.edu/digital/vandalvideo/,University of Idaho Digital Initiatives http://www.lib.uidaho.edu/digital/,"Educational use includes non-commercial use of text and images in materials for teaching and research purposes. Digital reproduction permissions granted by University of Idaho Library. For other uses beyond educational use, please contact University of Idaho Library Special Collections and Archives Department at libspec@uidaho.edu and University of Idaho Athletic Department.",http://rightsstatements.org/page/InC-EDU/1.0/?language=en,16mm Film,video/avi,Image;MovingImage,0:32:49,UG64-AzU1955-1_66.avi,1_66,66,p9mV0109VtI,http://digital.lib.uidaho.edu:80/cdm/ref/collection/vandalvideo/id/105,105,vandalvideo105
"University of Idaho vs. Boise State University (Football), 11/04/1978",Boise State University,"Boise, IDSt",Football,1978-11-04,1978,"Boise, ID",Bronco Stadium,43.602798,-116.195833,10 - 48 (L),,"UG64-Boise, IDSt1978-1_10",Original Collection consisted of a series of 16mm Film reels.  This collection was digitized and put on DVD by Graham Warger in 2011. The DVD collection is referred to as the Collection on Vandal Training and Scouting Films - nwda-db.orbiscascade.org/findaid/ark:/80444/xv56115,Vandal Video Collection - Vandal Training and Scouting Films http://www.lib.uidaho.edu/digital/vandalvideo/,University of Idaho Digital Initiatives http://www.lib.uidaho.edu/digital/,"Educational use includes non-commercial use of text and images in materials for teaching and research purposes. Digital reproduction permissions granted by University of Idaho Library. For other uses beyond educational use, please contact University of Idaho Library Special Collections and Archives Department at libspec@uidaho.edu and University of Idaho Athletic Department.",http://rightsstatements.org/page/InC-EDU/1.0/?language=en,16mm Film,video/avi,Image;MovingImage,0:45:24,"UG64-Boise, IDSt1978-1_10.avi",1_10,10,b2F0UuyDQAU,http://digital.lib.uidaho.edu:80/cdm/ref/collection/vandalvideo/id/106,106,vandalvideo106
"University of Idaho vs. University of Arizona (Football), 11/05/1960",University of Arizona,AzU,Football,1960-11-05,1960,"Tucson, AZ",Arizona Stadium,32.228889,-110.948889,3 - 32 (L),,UG64-AzU1960-1_69,Original Collection consisted of a series of 16mm Film reels.  This collection was digitized and put on DVD by Graham Warger in 2011. The DVD collection is referred to as the Collection on Vandal Training and Scouting Films - nwda-db.orbiscascade.org/findaid/ark:/80444/xv56115,Vandal Video Collection - Vandal Training and Scouting Films http://www.lib.uidaho.edu/digital/vandalvideo/,University of Idaho Digital Initiatives http://www.lib.uidaho.edu/digital/,"Educational use includes non-commercial use of text and images in materials for teaching and research purposes. Digital reproduction permissions granted by University of Idaho Library. For other uses beyond educational use, please contact University of Idaho Library Special Collections and Archives Department at libspec@uidaho.edu and University of Idaho Athletic Department.",http://rightsstatements.org/page/InC-EDU/1.0/?language=en,16mm Film,video/avi,Image;MovingImage,0:41:04,UG64-AzU1960-1_69.avi,1_69,69,yFNgAtK8HR0,http://digital.lib.uidaho.edu:80/cdm/ref/collection/vandalvideo/id/107,107,vandalvideo107
"University of Idaho vs. University of Arizona (Football), 10/25/1958",University of Arizona,AzU,Football,1958-10-25,1958,"Tucson, AZ",Arizona Stadium,32.228889,-110.948889,24 - 16 (W),,UG64-AzU1958-1_68,Original Collection consisted of a series of 16mm Film reels.  This collection was digitized and put on DVD by Graham Warger in 2011. The DVD collection is referred to as the Collection on Vandal Training and Scouting Films - nwda-db.orbiscascade.org/findaid/ark:/80444/xv56115,Vandal Video Collection - Vandal Training and Scouting Films http://www.lib.uidaho.edu/digital/vandalvideo/,University of Idaho Digital Initiatives http://www.lib.uidaho.edu/digital/,"Educational use includes non-commercial use of text and images in materials for teaching and research purposes. Digital reproduction permissions granted by University of Idaho Library. For other uses beyond educational use, please contact University of Idaho Library Special Collections and Archives Department at libspec@uidaho.edu and University of Idaho Athletic Department.",http://rightsstatements.org/page/InC-EDU/1.0/?language=en,16mm Film,video/avi,Image;MovingImage,0:32:46,UG64-AzU1958-1_68.avi,1_68,68,-mDB49ssKjU,http://digital.lib.uidaho.edu:80/cdm/ref/collection/vandalvideo/id/108,108,vandalvideo108
"University of Idaho vs. University of Arizona (Football), 11/17/1951",University of Arizona,AzU,Football,1951-11-17,1951,"Tucson, AZ",Arizona Stadium,32.228889,-110.948889,6 - 13 (L),,UG64-AzU1951-1_64,Original Collection consisted of a series of 16mm Film reels.  This collection was digitized and put on DVD by Graham Warger in 2011. The DVD collection is referred to as the Collection on Vandal Training and Scouting Films - nwda-db.orbiscascade.org/findaid/ark:/80444/xv56115,Vandal Video Collection - Vandal Training and Scouting Films http://www.lib.uidaho.edu/digital/vandalvideo/,University of Idaho Digital Initiatives http://www.lib.uidaho.edu/digital/,"Educational use includes non-commercial use of text and images in materials for teaching and research purposes. Digital reproduction permissions granted by University of Idaho Library. For other uses beyond educational use, please contact University of Idaho Library Special Collections and Archives Department at libspec@uidaho.edu and University of Idaho Athletic Department.",http://rightsstatements.org/page/InC-EDU/1.0/?language=en,16mm Film,video/avi,Image;MovingImage,0:27:26,UG64-AzU1951-1_64.avi,1_64,64,7s73vffnu8Y,http://digital.lib.uidaho.edu:80/cdm/ref/collection/vandalvideo/id/109,109,vandalvideo109
"University of Idaho vs. University of Arizona (Football), 10/16/1954",University of Arizona,AzU,Football,1954-10-16,1954,"Tucson, AZ",Arizona Stadium,32.228889,-110.948889,13 - 35 (L),,UG64-AzU1954-1_65,Original Collection consisted of a series of 16mm Film reels.  This collection was digitized and put on DVD by Graham Warger in 2011. The DVD collection is referred to as the Collection on Vandal Training and Scouting Films - nwda-db.orbiscascade.org/findaid/ark:/80444/xv56115,Vandal Video Collection - Vandal Training and Scouting Films http://www.lib.uidaho.edu/digital/vandalvideo/,University of Idaho Digital Initiatives http://www.lib.uidaho.edu/digital/,"Educational use includes non-commercial use of text and images in materials for teaching and research purposes. Digital reproduction permissions granted by University of Idaho Library. For other uses beyond educational use, please contact University of Idaho Library Special Collections and Archives Department at libspec@uidaho.edu and University of Idaho Athletic Department.",http://rightsstatements.org/page/InC-EDU/1.0/?language=en,16mm Film,video/avi,Image;MovingImage,0:36:51,UG64-AzU1954-1_65.avi,1_65,65,0S-CXCX2zps,http://digital.lib.uidaho.edu:80/cdm/ref/collection/vandalvideo/id/110,110,vandalvideo110
"University of Idaho vs. University of California-Los Angeles, CA (Basketball), 01/06/1957","University of California-Los Angeles, CA",UCLA-bb,Basketball,1957-01-06,1957,"Los Angeles, CA",Men's Gym,34.07158,-118.444086,73 - 92 (L),,UG64-UCLA-bb1957-1_74a,Original Collection consisted of a series of 16mm Film reels.  This collection was digitized and put on DVD by Graham Warger in 2011. The DVD collection is referred to as the Collection on Vandal Training and Scouting Films - nwda-db.orbiscascade.org/findaid/ark:/80444/xv56115,Vandal Video Collection - Vandal Training and Scouting Films http://www.lib.uidaho.edu/digital/vandalvideo/,University of Idaho Digital Initiatives http://www.lib.uidaho.edu/digital/,"Educational use includes non-commercial use of text and images in materials for teaching and research purposes. Digital reproduction permissions granted by University of Idaho Library. For other uses beyond educational use, please contact University of Idaho Library Special Collections and Archives Department at libspec@uidaho.edu and University of Idaho Athletic Department.",http://rightsstatements.org/page/InC-EDU/1.0/?language=en,16mm Film,video/avi,Image;MovingImage,0:32:49,UG64-UCLA-bb1957-1_74.avi,1_74a,74,ypXlvBjIwrc,http://digital.lib.uidaho.edu:80/cdm/ref/collection/vandalvideo/id/111,111,vandalvideo111
"University of Idaho vs. University of Arizona (Football), 11/03/1962",University of Arizona,AzU,Football,1962-11-03,1962,"Tucson, AZ",Arizona Stadium,32.228889,-110.948889,14 - 12 (W),,UG64-AzU1962-1_70,Original Collection consisted of a series of 16mm Film reels.  This collection was digitized and put on DVD by Graham Warger in 2011. The DVD collection is referred to as the Collection on Vandal Training and Scouting Films - nwda-db.orbiscascade.org/findaid/ark:/80444/xv56115,Vandal Video Collection - Vandal Training and Scouting Films http://www.lib.uidaho.edu/digital/vandalvideo/,University of Idaho Digital Initiatives http://www.lib.uidaho.edu/digital/,"Educational use includes non-commercial use of text and images in materials for teaching and research purposes. Digital reproduction permissions granted by University of Idaho Library. For other uses beyond educational use, please contact University of Idaho Library Special Collections and Archives Department at libspec@uidaho.edu and University of Idaho Athletic Department.",http://rightsstatements.org/page/InC-EDU/1.0/?language=en,16mm Film,video/avi,Image;MovingImage,0:37:59,UG64-AzU1962-1_70.avi,1_70,70,4x2KwAJ_ge0,http://digital.lib.uidaho.edu:80/cdm/ref/collection/vandalvideo/id/112,112,vandalvideo112
"University of Idaho vs. University of California-Berkeley, CA (Basketball), 12/02/1967","University of California-Berkeley, CA",CalBerk-bb,Basketball,1967-12-02,1967,"Berkeley, CA",Haas Pavilion,37.869394,-122.262194,,,UG64-CalBerk-bb1967-1_72,Original Collection consisted of a series of 16mm Film reels.  This collection was digitized and put on DVD by Graham Warger in 2011. The DVD collection is referred to as the Collection on Vandal Training and Scouting Films - nwda-db.orbiscascade.org/findaid/ark:/80444/xv56115,Vandal Video Collection - Vandal Training and Scouting Films http://www.lib.uidaho.edu/digital/vandalvideo/,University of Idaho Digital Initiatives http://www.lib.uidaho.edu/digital/,"Educational use includes non-commercial use of text and images in materials for teaching and research purposes. Digital reproduction permissions granted by University of Idaho Library. For other uses beyond educational use, please contact University of Idaho Library Special Collections and Archives Department at libspec@uidaho.edu and University of Idaho Athletic Department.",http://rightsstatements.org/page/InC-EDU/1.0/?language=en,16mm Film,video/avi,Image;MovingImage,1:06:30,UG64-CalBerk-bb1967-1_72.avi,1_72,72,3P0clwpQX4U,http://digital.lib.uidaho.edu:80/cdm/ref/collection/vandalvideo/id/113,113,vandalvideo113
"University of Idaho vs. University of Arizona (Football), 10/01/1955",University of Arizona,AzU,Football,1955-10-01,1955,"Tucson, AZ",Arizona Stadium,32.228889,-110.948889,14 - 47 (L),,UG64-AzU1955-1_67,Original Collection consisted of a series of 16mm Film reels.  This collection was digitized and put on DVD by Graham Warger in 2011. The DVD collection is referred to as the Collection on Vandal Training and Scouting Films - nwda-db.orbiscascade.org/findaid/ark:/80444/xv56115,Vandal Video Collection - Vandal Training and Scouting Films http://www.lib.uidaho.edu/digital/vandalvideo/,University of Idaho Digital Initiatives http://www.lib.uidaho.edu/digital/,"Educational use includes non-commercial use of text and images in materials for teaching and research purposes. Digital reproduction permissions granted by University of Idaho Library. For other uses beyond educational use, please contact University of Idaho Library Special Collections and Archives Department at libspec@uidaho.edu and University of Idaho Athletic Department.",http://rightsstatements.org/page/InC-EDU/1.0/?language=en,16mm Film,video/avi,Image;MovingImage,0:32:46,UG64-AzU1955-1_67.avi,1_67,67,tv5lxOT6Kzk,http://digital.lib.uidaho.edu:80/cdm/ref/collection/vandalvideo/id/114,114,vandalvideo114
"University of Idaho vs. University of Nevada, Las Vegas, NV (Football), 11/05/1977","University of Nevada, Las Vegas, NV",UNLV,Football,1977-11-05,1977,"Moscow, ID",Kibbie Dome,46.726113,-117.015671,21 - 35 (L),,UG64-UNLV1977-1_78,Original Collection consisted of a series of 16mm Film reels.  This collection was digitized and put on DVD by Graham Warger in 2011. The DVD collection is referred to as the Collection on Vandal Training and Scouting Films - nwda-db.orbiscascade.org/findaid/ark:/80444/xv56115,Vandal Video Collection - Vandal Training and Scouting Films http://www.lib.uidaho.edu/digital/vandalvideo/,University of Idaho Digital Initiatives http://www.lib.uidaho.edu/digital/,"Educational use includes non-commercial use of text and images in materials for teaching and research purposes. Digital reproduction permissions granted by University of Idaho Library. For other uses beyond educational use, please contact University of Idaho Library Special Collections and Archives Department at libspec@uidaho.edu and University of Idaho Athletic Department.",http://rightsstatements.org/page/InC-EDU/1.0/?language=en,16mm Film,video/avi,Image;MovingImage,0:52:57,UG64-UNLV1977-1_78.avi,1_78,78,xszJQVKF2M8,http://digital.lib.uidaho.edu:80/cdm/ref/collection/vandalvideo/id/115,115,vandalvideo115
"University of Idaho vs. University of California-Berkeley, CA (Basketball), 02/15/1956","University of California-Berkeley, CA",CalBerk-bb,Basketball,1956-02-15,1956,"Moscow, ID",Memorial Gymnasium,46.726389,-117.018056,54 - 91 (L),,UG64-CalBerk-bb1956-1_73a,Original Collection consisted of a series of 16mm Film reels.  This collection was digitized and put on DVD by Graham Warger in 2011. The DVD collection is referred to as the Collection on Vandal Training and Scouting Films - nwda-db.orbiscascade.org/findaid/ark:/80444/xv56115,Vandal Video Collection - Vandal Training and Scouting Films http://www.lib.uidaho.edu/digital/vandalvideo/,University of Idaho Digital Initiatives http://www.lib.uidaho.edu/digital/,"Educational use includes non-commercial use of text and images in materials for teaching and research purposes. Digital reproduction permissions granted by University of Idaho Library. For other uses beyond educational use, please contact University of Idaho Library Special Collections and Archives Department at libspec@uidaho.edu and University of Idaho Athletic Department.",http://rightsstatements.org/page/InC-EDU/1.0/?language=en,16mm Film,video/avi,Image;MovingImage,0:38:43,UG64-CalBerk-bb1956-1_73.avi,1_73a,73,M7jWyqDczrI,http://digital.lib.uidaho.edu:80/cdm/ref/collection/vandalvideo/id/116,116,vandalvideo116
"University of Idaho vs. Boise State University (Football), 09/11/1976",Boise State University,"Boise, IDSt",Football,1976-09-11,1976,"Boise, ID",Bronco Stadium,43.602798,-116.195833,16 - 9 (W),,"UG64-Boise, IDSt1976-1_7",Original Collection consisted of a series of 16mm Film reels.  This collection was digitized and put on DVD by Graham Warger in 2011. The DVD collection is referred to as the Collection on Vandal Training and Scouting Films - nwda-db.orbiscascade.org/findaid/ark:/80444/xv56115,Vandal Video Collection - Vandal Training and Scouting Films http://www.lib.uidaho.edu/digital/vandalvideo/,University of Idaho Digital Initiatives http://www.lib.uidaho.edu/digital/,"Educational use includes non-commercial use of text and images in materials for teaching and research purposes. Digital reproduction permissions granted by University of Idaho Library. For other uses beyond educational use, please contact University of Idaho Library Special Collections and Archives Department at libspec@uidaho.edu and University of Idaho Athletic Department.",http://rightsstatements.org/page/InC-EDU/1.0/?language=en,16mm Film,video/avi,Image;MovingImage,0:17:13,"UG64-Boise, IDSt1976-1_7.avi",1_7,7,y35na9hjL0g,http://digital.lib.uidaho.edu:80/cdm/ref/collection/vandalvideo/id/117,117,vandalvideo117
"University of Idaho vs. University of Nevada, Las Vegas, NV (Football), 11/05/1977","University of Nevada, Las Vegas, NV",UNLV,Football,1977-11-05,1977,"Moscow, ID",Kibbie Dome,46.726113,-117.015671,21 - 35 (L),,UG64-UNLV1977-1_79,Original Collection consisted of a series of 16mm Film reels.  This collection was digitized and put on DVD by Graham Warger in 2011. The DVD collection is referred to as the Collection on Vandal Training and Scouting Films - nwda-db.orbiscascade.org/findaid/ark:/80444/xv56115,Vandal Video Collection - Vandal Training and Scouting Films http://www.lib.uidaho.edu/digital/vandalvideo/,University of Idaho Digital Initiatives http://www.lib.uidaho.edu/digital/,"Educational use includes non-commercial use of text and images in materials for teaching and research purposes. Digital reproduction permissions granted by University of Idaho Library. For other uses beyond educational use, please contact University of Idaho Library Special Collections and Archives Department at libspec@uidaho.edu and University of Idaho Athletic Department.",http://rightsstatements.org/page/InC-EDU/1.0/?language=en,16mm Film,video/avi,Image;MovingImage,1:43:14,UG64-UNLV1977-1_79.avi,1_79,79,1NdNSw6OIJc,http://digital.lib.uidaho.edu:80/cdm/ref/collection/vandalvideo/id/118,118,vandalvideo118
"University of Idaho vs. University of Arizona (Football), 11/07/1964",University of Arizona,AzU,Football,1964-11-07,1964,"Tucson, AZ",Arizona Stadium,32.228889,-110.948889,7 - 14 (L),,UG64-AzU1964-1_71,Original Collection consisted of a series of 16mm Film reels.  This collection was digitized and put on DVD by Graham Warger in 2011. The DVD collection is referred to as the Collection on Vandal Training and Scouting Films - nwda-db.orbiscascade.org/findaid/ark:/80444/xv56115,Vandal Video Collection - Vandal Training and Scouting Films http://www.lib.uidaho.edu/digital/vandalvideo/,University of Idaho Digital Initiatives http://www.lib.uidaho.edu/digital/,"Educational use includes non-commercial use of text and images in materials for teaching and research purposes. Digital reproduction permissions granted by University of Idaho Library. For other uses beyond educational use, please contact University of Idaho Library Special Collections and Archives Department at libspec@uidaho.edu and University of Idaho Athletic Department.",http://rightsstatements.org/page/InC-EDU/1.0/?language=en,16mm Film,video/avi,Image;MovingImage,1:54:28,UG64-AzU1964-1_71.avi,1_71,71,ANCJ3xh5Ebg,http://digital.lib.uidaho.edu:80/cdm/ref/collection/vandalvideo/id/119,119,vandalvideo119
"University of Idaho vs. University of Kentucky (Basketball), 12/17/1955",University of Kentucky,UKen-bb,Basketball,1955-12-17,1955,"Lexington, KY",Memorial Coliseum,38.03943,-84.500388,49 - 91 (L),,UG64-UKen-bb1955-1_77,Original Collection consisted of a series of 16mm Film reels.  This collection was digitized and put on DVD by Graham Warger in 2011. The DVD collection is referred to as the Collection on Vandal Training and Scouting Films - nwda-db.orbiscascade.org/findaid/ark:/80444/xv56115,Vandal Video Collection - Vandal Training and Scouting Films http://www.lib.uidaho.edu/digital/vandalvideo/,University of Idaho Digital Initiatives http://www.lib.uidaho.edu/digital/,"Educational use includes non-commercial use of text and images in materials for teaching and research purposes. Digital reproduction permissions granted by University of Idaho Library. For other uses beyond educational use, please contact University of Idaho Library Special Collections and Archives Department at libspec@uidaho.edu and University of Idaho Athletic Department.",http://rightsstatements.org/page/InC-EDU/1.0/?language=en,16mm Film,video/avi,Image;MovingImage,0:24:00,UG64-UKen-bb1955-1_77.avi,1_77,77,h_8tbvbSWlk,http://digital.lib.uidaho.edu:80/cdm/ref/collection/vandalvideo/id/120,120,vandalvideo120
"University of University of Idaho football highlights (Football), 1976",University of Idaho football highlights,Uidaho,Football,1976-05-29,1976,"Moscow, ID and other locales",Kibbie Dome and other stadiums,46.726113,-117.015671,,,UG64-Uidaho1905-1_76,Original Collection consisted of a series of 16mm Film reels.  This collection was digitized and put on DVD by Graham Warger in 2011. The DVD collection is referred to as the Collection on Vandal Training and Scouting Films - nwda-db.orbiscascade.org/findaid/ark:/80444/xv56115,Vandal Video Collection - Vandal Training and Scouting Films http://www.lib.uidaho.edu/digital/vandalvideo/,University of Idaho Digital Initiatives http://www.lib.uidaho.edu/digital/,"Educational use includes non-commercial use of text and images in materials for teaching and research purposes. Digital reproduction permissions granted by University of Idaho Library. For other uses beyond educational use, please contact University of Idaho Library Special Collections and Archives Department at libspec@uidaho.edu and University of Idaho Athletic Department.",http://rightsstatements.org/page/InC-EDU/1.0/?language=en,16mm Film,video/avi,Image;MovingImage,0:26:09,UG64-Uidaho1905-1_76.avi,1_76,76,05-z6Jpft50,http://digital.lib.uidaho.edu:80/cdm/ref/collection/vandalvideo/id/121,121,vandalvideo121
"University of Idaho vs. University of Hawaii (Football), 09/24/1977",University of Hawaii,Hawaii,Football,1977-09-24,1977,"Honolulu, HI",Aloha Stadium,21.372778,-157.93,26 - 45 (L),,UG64-Hawaii1977-1_75,Original Collection consisted of a series of 16mm Film reels.  This collection was digitized and put on DVD by Graham Warger in 2011. The DVD collection is referred to as the Collection on Vandal Training and Scouting Films - nwda-db.orbiscascade.org/findaid/ark:/80444/xv56115,Vandal Video Collection - Vandal Training and Scouting Films http://www.lib.uidaho.edu/digital/vandalvideo/,University of Idaho Digital Initiatives http://www.lib.uidaho.edu/digital/,"Educational use includes non-commercial use of text and images in materials for teaching and research purposes. Digital reproduction permissions granted by University of Idaho Library. For other uses beyond educational use, please contact University of Idaho Library Special Collections and Archives Department at libspec@uidaho.edu and University of Idaho Athletic Department.",http://rightsstatements.org/page/InC-EDU/1.0/?language=en,16mm Film,video/avi,Image;MovingImage,0:23:49,UG64-Hawaii1977-1_75.avi,1_75,75,spzbnxNSKVw,http://digital.lib.uidaho.edu:80/cdm/ref/collection/vandalvideo/id/122,122,vandalvideo122
"University of Idaho vs. Boise State University (Football), 11/17/1990",Boise State University,"Boise, IDSt",Football,1990-11-17,1990,"Boise, ID",Bronco Stadium,43.602798,-116.195833,21 - 14 (W),"Cliff: color, shot on VHS video and starts 4:18 into the first quarter, not entire game; camera operator focuses on the offensive and defensive line play and does not follow the football as the play unfolds; there is a fight at the end of the game between a Boise State player and a Vandal fan or member of the coaching staff.","UG64-Boise, IDSt1990-1_20",Original Collection consisted of a series of 16mm Film reels.  This collection was digitized and put on DVD by Graham Warger in 2011. The DVD collection is referred to as the Collection on Vandal Training and Scouting Films - nwda-db.orbiscascade.org/findaid/ark:/80444/xv56115,Vandal Video Collection - Vandal Training and Scouting Films http://www.lib.uidaho.edu/digital/vandalvideo/,University of Idaho Digital Initiatives http://www.lib.uidaho.edu/digital/,"Educational use includes non-commercial use of text and images in materials for teaching and research purposes. Digital reproduction permissions granted by University of Idaho Library. For other uses beyond educational use, please contact University of Idaho Library Special Collections and Archives Department at libspec@uidaho.edu and University of Idaho Athletic Department.",http://rightsstatements.org/page/InC-EDU/1.0/?language=en,16mm Film,video/avi,Image;MovingImage,1:03:23,"UG64-Boise, IDSt1990-1_20.avi",1_20,20,4scCAjtmESU,http://digital.lib.uidaho.edu:80/cdm/ref/collection/vandalvideo/id/123,123,vandalvideo123
"University of Idaho vs. Boise State University (Football), 11/23/1996",Boise State University,"Boise, IDSt",Football,1996-11-23,1996,"Boise, ID",Bronco Stadium,43.602798,-116.195833,64 - 19 (W),,"UG64-Boise, IDSt1996-1_21",Original Collection consisted of a series of 16mm Film reels.  This collection was digitized and put on DVD by Graham Warger in 2011. The DVD collection is referred to as the Collection on Vandal Training and Scouting Films - nwda-db.orbiscascade.org/findaid/ark:/80444/xv56115,Vandal Video Collection - Vandal Training and Scouting Films http://www.lib.uidaho.edu/digital/vandalvideo/,University of Idaho Digital Initiatives http://www.lib.uidaho.edu/digital/,"Educational use includes non-commercial use of text and images in materials for teaching and research purposes. Digital reproduction permissions granted by University of Idaho Library. For other uses beyond educational use, please contact University of Idaho Library Special Collections and Archives Department at libspec@uidaho.edu and University of Idaho Athletic Department.",http://rightsstatements.org/page/InC-EDU/1.0/?language=en,16mm Film,video/avi,Image;MovingImage,1:40:21,"UG64-Boise, IDSt1996-1_21.avi",1_21,21,wyBVklBJyx0,http://digital.lib.uidaho.edu:80/cdm/ref/collection/vandalvideo/id/124,124,vandalvideo124
"University of Idaho vs. Boise State University (Football), 11/23/1991",Boise State University,"Boise, IDSt",Football,1991-11-23,1991,"Moscow, ID",Kibbie Dome,46.726113,-117.015671,28 - 24 (W),Tight version,"UG64-Boise, IDSt1991-1_24",Original Collection consisted of a series of 16mm Film reels.  This collection was digitized and put on DVD by Graham Warger in 2011. The DVD collection is referred to as the Collection on Vandal Training and Scouting Films - nwda-db.orbiscascade.org/findaid/ark:/80444/xv56115,Vandal Video Collection - Vandal Training and Scouting Films http://www.lib.uidaho.edu/digital/vandalvideo/,University of Idaho Digital Initiatives http://www.lib.uidaho.edu/digital/,"Educational use includes non-commercial use of text and images in materials for teaching and research purposes. Digital reproduction permissions granted by University of Idaho Library. For other uses beyond educational use, please contact University of Idaho Library Special Collections and Archives Department at libspec@uidaho.edu and University of Idaho Athletic Department.",http://rightsstatements.org/page/InC-EDU/1.0/?language=en,16mm Film,video/avi,Image;MovingImage,1:46:42,"UG64-Boise, IDSt1991-1_24.avi",1_24,24,CKhw5BC9TTY,http://digital.lib.uidaho.edu:80/cdm/ref/collection/vandalvideo/id/125,125,vandalvideo125
"University of Idaho vs. Boise State University (Football), 11/21/1992",Boise State University,"Boise, IDSt",Football,1992-11-21,1992,"Boise, ID",Bronco Stadium,43.602798,-116.195833,62 - 16 (W),Wide version,"UG64-Boise, IDSt1992-1_25",Original Collection consisted of a series of 16mm Film reels.  This collection was digitized and put on DVD by Graham Warger in 2011. The DVD collection is referred to as the Collection on Vandal Training and Scouting Films - nwda-db.orbiscascade.org/findaid/ark:/80444/xv56115,Vandal Video Collection - Vandal Training and Scouting Films http://www.lib.uidaho.edu/digital/vandalvideo/,University of Idaho Digital Initiatives http://www.lib.uidaho.edu/digital/,"Educational use includes non-commercial use of text and images in materials for teaching and research purposes. Digital reproduction permissions granted by University of Idaho Library. For other uses beyond educational use, please contact University of Idaho Library Special Collections and Archives Department at libspec@uidaho.edu and University of Idaho Athletic Department.",http://rightsstatements.org/page/InC-EDU/1.0/?language=en,16mm Film,video/avi,Image;MovingImage,1:34:49,"UG64-Boise, IDSt1992-1_25.avi",1_25,25,vubear4JMOY,http://digital.lib.uidaho.edu:80/cdm/ref/collection/vandalvideo/id/126,126,vandalvideo126
"University of Idaho vs. University of Nevada, Las Vegas, NV (Football), 10/07/1978","University of Nevada, Las Vegas, NV",UNLV,Football,1978-10-07,1978,"Las Vegas, NV","Las Vegas, NV Silver Bowl",36.086389,-115.016667,14 - 53 (L),Offense-Defense-Offense-Defense,UG64-UNLV1978-1_80,Original Collection consisted of a series of 16mm Film reels.  This collection was digitized and put on DVD by Graham Warger in 2011. The DVD collection is referred to as the Collection on Vandal Training and Scouting Films - nwda-db.orbiscascade.org/findaid/ark:/80444/xv56115,Vandal Video Collection - Vandal Training and Scouting Films http://www.lib.uidaho.edu/digital/vandalvideo/,University of Idaho Digital Initiatives http://www.lib.uidaho.edu/digital/,"Educational use includes non-commercial use of text and images in materials for teaching and research purposes. Digital reproduction permissions granted by University of Idaho Library. For other uses beyond educational use, please contact University of Idaho Library Special Collections and Archives Department at libspec@uidaho.edu and University of Idaho Athletic Department.",http://rightsstatements.org/page/InC-EDU/1.0/?language=en,16mm Film,video/avi,Image;MovingImage,1:46:10,UG64-UNLV1978-1_80.avi,1_80,80,kfCGEqWkJBc,http://digital.lib.uidaho.edu:80/cdm/ref/collection/vandalvideo/id/127,127,vandalvideo127
"University of Idaho vs. Boise State University (Football), 11/26/1977",Boise State University,"Boise, IDSt",Football,1977-11-26,1977,"Moscow, ID",Kibbie Dome,46.726113,-117.015671,14 - 44 (L),,"UG64-Boise, IDSt1977-1_9",Original Collection consisted of a series of 16mm Film reels.  This collection was digitized and put on DVD by Graham Warger in 2011. The DVD collection is referred to as the Collection on Vandal Training and Scouting Films - nwda-db.orbiscascade.org/findaid/ark:/80444/xv56115,Vandal Video Collection - Vandal Training and Scouting Films http://www.lib.uidaho.edu/digital/vandalvideo/,University of Idaho Digital Initiatives http://www.lib.uidaho.edu/digital/,"Educational use includes non-commercial use of text and images in materials for teaching and research purposes. Digital reproduction permissions granted by University of Idaho Library. For other uses beyond educational use, please contact University of Idaho Library Special Collections and Archives Department at libspec@uidaho.edu and University of Idaho Athletic Department.",http://rightsstatements.org/page/InC-EDU/1.0/?language=en,16mm Film,video/avi,Image;MovingImage,0:25:09,"UG64-Boise, IDSt1977-1_9.avi",1_9,9,AgENIfWRSXE,http://digital.lib.uidaho.edu:80/cdm/ref/collection/vandalvideo/id/128,128,vandalvideo128
"University of Idaho vs. University of Nevada, Las Vegas, NV (Football), 10/07/1978","University of Nevada, Las Vegas, NV",UNLV,Football,1978-10-07,1978,"Las Vegas, NV","Las Vegas, NV Silver Bowl",36.086389,-115.016667,14 - 53 (L),,UG64-UNLV1978-1_81,Original Collection consisted of a series of 16mm Film reels.  This collection was digitized and put on DVD by Graham Warger in 2011. The DVD collection is referred to as the Collection on Vandal Training and Scouting Films - nwda-db.orbiscascade.org/findaid/ark:/80444/xv56115,Vandal Video Collection - Vandal Training and Scouting Films http://www.lib.uidaho.edu/digital/vandalvideo/,University of Idaho Digital Initiatives http://www.lib.uidaho.edu/digital/,"Educational use includes non-commercial use of text and images in materials for teaching and research purposes. Digital reproduction permissions granted by University of Idaho Library. For other uses beyond educational use, please contact University of Idaho Library Special Collections and Archives Department at libspec@uidaho.edu and University of Idaho Athletic Department.",http://rightsstatements.org/page/InC-EDU/1.0/?language=en,16mm Film,video/avi,Image;MovingImage,0:44:45,UG64-UNLV1978-1_81.avi,1_81,81,s2R5CfNJ-tE,http://digital.lib.uidaho.edu:80/cdm/ref/collection/vandalvideo/id/129,129,vandalvideo129
"University of Idaho vs. University of Northern Illinois (Football), 09/20/1969",University of Northern Illinois,UNoIll,Football,1969-09-20,1969,"Dekalb, IL",Huskie Stadium,41.933889,-88.777778,30 - 47 (L),,UG64-UNoIll1969-1_82,Original Collection consisted of a series of 16mm Film reels.  This collection was digitized and put on DVD by Graham Warger in 2011. The DVD collection is referred to as the Collection on Vandal Training and Scouting Films - nwda-db.orbiscascade.org/findaid/ark:/80444/xv56115,Vandal Video Collection - Vandal Training and Scouting Films http://www.lib.uidaho.edu/digital/vandalvideo/,University of Idaho Digital Initiatives http://www.lib.uidaho.edu/digital/,"Educational use includes non-commercial use of text and images in materials for teaching and research purposes. Digital reproduction permissions granted by University of Idaho Library. For other uses beyond educational use, please contact University of Idaho Library Special Collections and Archives Department at libspec@uidaho.edu and University of Idaho Athletic Department.",http://rightsstatements.org/page/InC-EDU/1.0/?language=en,16mm Film,video/avi,Image;MovingImage,1:20:25,UG64-UNoIll1969-1_82.avi,1_82,82,IAPnTCZ3SKI,http://digital.lib.uidaho.edu:80/cdm/ref/collection/vandalvideo/id/130,130,vandalvideo130
"University of Idaho vs. University of Idaho State University (Basketball), 02/11/1978",Idaho State University,IdST-bb,Basketball,1978-02-11,1978,"Moscow, ID",Memorial Gymnasium,46.726389,-117.018056,84 - 82 (W),,UG64-IdST-bb1978-1_36,Original Collection consisted of a series of 16mm Film reels.  This collection was digitized and put on DVD by Graham Warger in 2011. The DVD collection is referred to as the Collection on Vandal Training and Scouting Films - nwda-db.orbiscascade.org/findaid/ark:/80444/xv56115,Vandal Video Collection - Vandal Training and Scouting Films http://www.lib.uidaho.edu/digital/vandalvideo/,University of Idaho Digital Initiatives http://www.lib.uidaho.edu/digital/,"Educational use includes non-commercial use of text and images in materials for teaching and research purposes. Digital reproduction permissions granted by University of Idaho Library. For other uses beyond educational use, please contact University of Idaho Library Special Collections and Archives Department at libspec@uidaho.edu and University of Idaho Athletic Department.",http://rightsstatements.org/page/InC-EDU/1.0/?language=en,16mm Film,video/avi,Image;MovingImage,0:33:06,UG64-IdST-bb1978-1_36.avi,1_36,36,YKPSoMf_kIk,http://digital.lib.uidaho.edu:80/cdm/ref/collection/vandalvideo/id/131,131,vandalvideo131
"University of Idaho vs. Boise State University (Football), 11/22/1997",Boise State University,"Boise, IDSt",Football,1997-11-22,1997,"Moscow, ID",Kibbie Dome,46.726113,-117.015671,23 - 30 (L),Special plays version,"UG64-Boise, IDSt1997-1_31",Original Collection consisted of a series of 16mm Film reels.  This collection was digitized and put on DVD by Graham Warger in 2011. The DVD collection is referred to as the Collection on Vandal Training and Scouting Films - nwda-db.orbiscascade.org/findaid/ark:/80444/xv56115,Vandal Video Collection - Vandal Training and Scouting Films http://www.lib.uidaho.edu/digital/vandalvideo/,University of Idaho Digital Initiatives http://www.lib.uidaho.edu/digital/,"Educational use includes non-commercial use of text and images in materials for teaching and research purposes. Digital reproduction permissions granted by University of Idaho Library. For other uses beyond educational use, please contact University of Idaho Library Special Collections and Archives Department at libspec@uidaho.edu and University of Idaho Athletic Department.",http://rightsstatements.org/page/InC-EDU/1.0/?language=en,16mm Film,video/avi,Image;MovingImage,1:55:54,"UG64-Boise, IDSt1977-1_31.avi",1_31,31,Ycs4WDCM1Bo,http://digital.lib.uidaho.edu:80/cdm/ref/collection/vandalvideo/id/132,132,vandalvideo132
"University of Idaho vs. Ohio University (Football), 09/16/1972",Ohio University,Ohio,Football,1972-09-16,1972,"Moscow, ID",Idaho Stadium,46.726113,-117.015671,17 - 14 (W),,UG64-Ohio1972-1_37,Original Collection consisted of a series of 16mm Film reels.  This collection was digitized and put on DVD by Graham Warger in 2011. The DVD collection is referred to as the Collection on Vandal Training and Scouting Films - nwda-db.orbiscascade.org/findaid/ark:/80444/xv56115,Vandal Video Collection - Vandal Training and Scouting Films http://www.lib.uidaho.edu/digital/vandalvideo/,University of Idaho Digital Initiatives http://www.lib.uidaho.edu/digital/,"Educational use includes non-commercial use of text and images in materials for teaching and research purposes. Digital reproduction permissions granted by University of Idaho Library. For other uses beyond educational use, please contact University of Idaho Library Special Collections and Archives Department at libspec@uidaho.edu and University of Idaho Athletic Department.",http://rightsstatements.org/page/InC-EDU/1.0/?language=en,16mm Film,video/avi,Image;MovingImage,0:38:27,UG64-Ohio1972-1_37.avi,1_37,37,isBqfp87hHE,http://digital.lib.uidaho.edu:80/cdm/ref/collection/vandalvideo/id/133,133,vandalvideo133
"University of Idaho vs. Boise State University (Football), 11/20/1993",Boise State University,"Boise, IDSt",Football,1993-11-20,1993,"Moscow, ID",Kibbie Dome,46.726113,-117.015671,49 - 16 (W),Wide version,"UG64-Boise, IDSt1993-1_27",Original Collection consisted of a series of 16mm Film reels.  This collection was digitized and put on DVD by Graham Warger in 2011. The DVD collection is referred to as the Collection on Vandal Training and Scouting Films - nwda-db.orbiscascade.org/findaid/ark:/80444/xv56115,Vandal Video Collection - Vandal Training and Scouting Films http://www.lib.uidaho.edu/digital/vandalvideo/,University of Idaho Digital Initiatives http://www.lib.uidaho.edu/digital/,"Educational use includes non-commercial use of text and images in materials for teaching and research purposes. Digital reproduction permissions granted by University of Idaho Library. For other uses beyond educational use, please contact University of Idaho Library Special Collections and Archives Department at libspec@uidaho.edu and University of Idaho Athletic Department.",http://rightsstatements.org/page/InC-EDU/1.0/?language=en,16mm Film,video/avi,Image;MovingImage,1:24:02,"UG64-Boise, IDSt1993-1_27.avi",1_27,27,W5M9v1HLd4w,http://digital.lib.uidaho.edu:80/cdm/ref/collection/vandalvideo/id/134,134,vandalvideo134
"University of Idaho vs. Ohio University (Football), 09/25/1976",Ohio University,Ohio,Football,1976-09-25,1976,"Athens, OH",Penden Stadium,39.321111,-82.102778,0 - 35 (L),,UG64-Ohio1976-1_39,Original Collection consisted of a series of 16mm Film reels.  This collection was digitized and put on DVD by Graham Warger in 2011. The DVD collection is referred to as the Collection on Vandal Training and Scouting Films - nwda-db.orbiscascade.org/findaid/ark:/80444/xv56115,Vandal Video Collection - Vandal Training and Scouting Films http://www.lib.uidaho.edu/digital/vandalvideo/,University of Idaho Digital Initiatives http://www.lib.uidaho.edu/digital/,"Educational use includes non-commercial use of text and images in materials for teaching and research purposes. Digital reproduction permissions granted by University of Idaho Library. For other uses beyond educational use, please contact University of Idaho Library Special Collections and Archives Department at libspec@uidaho.edu and University of Idaho Athletic Department.",http://rightsstatements.org/page/InC-EDU/1.0/?language=en,16mm Film,video/avi,Image;MovingImage,0:26:05,UG64-Ohio1976-1_39.avi,1_39,39,5YbreG6sIoE,http://digital.lib.uidaho.edu:80/cdm/ref/collection/vandalvideo/id/135,135,vandalvideo135
"University of Idaho vs. Central Michigan University  (Football), 09/12/1987",Central Michigan University,CentMI,Football,1987-09-12,1987,"Moscow, ID",Kibbie Dome,46.726113,-117.015671,18 - 30 (L),,UG64-CentMI1987-1_34,Original Collection consisted of a series of 16mm Film reels.  This collection was digitized and put on DVD by Graham Warger in 2011. The DVD collection is referred to as the Collection on Vandal Training and Scouting Films - nwda-db.orbiscascade.org/findaid/ark:/80444/xv56115,Vandal Video Collection - Vandal Training and Scouting Films http://www.lib.uidaho.edu/digital/vandalvideo/,University of Idaho Digital Initiatives http://www.lib.uidaho.edu/digital/,"Educational use includes non-commercial use of text and images in materials for teaching and research purposes. Digital reproduction permissions granted by University of Idaho Library. For other uses beyond educational use, please contact University of Idaho Library Special Collections and Archives Department at libspec@uidaho.edu and University of Idaho Athletic Department.",http://rightsstatements.org/page/InC-EDU/1.0/?language=en,16mm Film,video/avi,Image;MovingImage,1:27:01,UG64-CentMI1987-1_34.avi,1_34,34,Dhn1NIu-2pY,http://digital.lib.uidaho.edu:80/cdm/ref/collection/vandalvideo/id/136,136,vandalvideo136
"University of Idaho vs. Boise State University (Football), 11/23/1991",Boise State University,"Boise, IDSt",Football,1991-11-23,1991,"Moscow, ID",Kibbie Dome,46.726113,-117.015671,28 - 24 (W),Wide version,"UG64-Boise, IDSt1991-1_23",Original Collection consisted of a series of 16mm Film reels.  This collection was digitized and put on DVD by Graham Warger in 2011. The DVD collection is referred to as the Collection on Vandal Training and Scouting Films - nwda-db.orbiscascade.org/findaid/ark:/80444/xv56115,Vandal Video Collection - Vandal Training and Scouting Films http://www.lib.uidaho.edu/digital/vandalvideo/,University of Idaho Digital Initiatives http://www.lib.uidaho.edu/digital/,"Educational use includes non-commercial use of text and images in materials for teaching and research purposes. Digital reproduction permissions granted by University of Idaho Library. For other uses beyond educational use, please contact University of Idaho Library Special Collections and Archives Department at libspec@uidaho.edu and University of Idaho Athletic Department.",http://rightsstatements.org/page/InC-EDU/1.0/?language=en,16mm Film,video/avi,Image;MovingImage,2:34:40,"UG64-Boise, IDSt1991-1_23.avi",1_23,23,KYJRPLUCn4g,http://digital.lib.uidaho.edu:80/cdm/ref/collection/vandalvideo/id/137,137,vandalvideo137
"University of Idaho vs. Boise State University (Football), 11/21/1992",Boise State University,"Boise, IDSt",Football,1992-11-21,1992,"Boise, ID",Bronco Stadium,43.602798,-116.195833,62 - 16 (W),Tight version,"UG64-Boise, IDSt1992-1_26",Original Collection consisted of a series of 16mm Film reels.  This collection was digitized and put on DVD by Graham Warger in 2011. The DVD collection is referred to as the Collection on Vandal Training and Scouting Films - nwda-db.orbiscascade.org/findaid/ark:/80444/xv56115,Vandal Video Collection - Vandal Training and Scouting Films http://www.lib.uidaho.edu/digital/vandalvideo/,University of Idaho Digital Initiatives http://www.lib.uidaho.edu/digital/,"Educational use includes non-commercial use of text and images in materials for teaching and research purposes. Digital reproduction permissions granted by University of Idaho Library. For other uses beyond educational use, please contact University of Idaho Library Special Collections and Archives Department at libspec@uidaho.edu and University of Idaho Athletic Department.",http://rightsstatements.org/page/InC-EDU/1.0/?language=en,16mm Film,video/avi,Image;MovingImage,1:14:43,"UG64-Boise, IDSt1992-1_26.avi",1_26,26,V6CqFcp3GvE,http://digital.lib.uidaho.edu:80/cdm/ref/collection/vandalvideo/id/138,138,vandalvideo138
"University of Idaho vs. Arizona State University (Football), 10/13/1956",Arizona State University,AzST,Football,1956-10-13,1956,"Moscow, ID",Neale Stadium,46.726113,-117.015671,0 - 41 (L),,UG64-AzST1956-1_2,Original Collection consisted of a series of 16mm Film reels.  This collection was digitized and put on DVD by Graham Warger in 2011. The DVD collection is referred to as the Collection on Vandal Training and Scouting Films - nwda-db.orbiscascade.org/findaid/ark:/80444/xv56115,Vandal Video Collection - Vandal Training and Scouting Films http://www.lib.uidaho.edu/digital/vandalvideo/,University of Idaho Digital Initiatives http://www.lib.uidaho.edu/digital/,"Educational use includes non-commercial use of text and images in materials for teaching and research purposes. Digital reproduction permissions granted by University of Idaho Library. For other uses beyond educational use, please contact University of Idaho Library Special Collections and Archives Department at libspec@uidaho.edu and University of Idaho Athletic Department.",http://rightsstatements.org/page/InC-EDU/1.0/?language=en,16mm Film,video/avi,Image;MovingImage,0:33:23,UG64-AzST1956-1_2.avi,1_2,2,8Gs8B_FhqAg,http://digital.lib.uidaho.edu:80/cdm/ref/collection/vandalvideo/id/139,139,vandalvideo139
"University of Idaho vs. Central Michigan University  (Football), 09/13/1986",Central Michigan University,CentMI,Football,1986-09-13,1986,"Mount Pleasant, MI",Kelly/Shorts Stadium,43.5775,-84.770833,21 - 34 (L),,UG64-CentMI1986-1_33,Original Collection consisted of a series of 16mm Film reels.  This collection was digitized and put on DVD by Graham Warger in 2011. The DVD collection is referred to as the Collection on Vandal Training and Scouting Films - nwda-db.orbiscascade.org/findaid/ark:/80444/xv56115,Vandal Video Collection - Vandal Training and Scouting Films http://www.lib.uidaho.edu/digital/vandalvideo/,University of Idaho Digital Initiatives http://www.lib.uidaho.edu/digital/,"Educational use includes non-commercial use of text and images in materials for teaching and research purposes. Digital reproduction permissions granted by University of Idaho Library. For other uses beyond educational use, please contact University of Idaho Library Special Collections and Archives Department at libspec@uidaho.edu and University of Idaho Athletic Department.",http://rightsstatements.org/page/InC-EDU/1.0/?language=en,16mm Film,video/avi,Image;MovingImage,5:58:39,UG64-CentMI1986-1_33.avi,1_33,33,qfe-Jm3d0_o,http://digital.lib.uidaho.edu:80/cdm/ref/collection/vandalvideo/id/140,140,vandalvideo140
"University of Idaho vs. University of Northern Illinois (Football), 09/20/1969",University of Northern Illinois,UNoIll,Football,1969-09-20,1969,"Dekalb, IL",Huskie Stadium,41.933889,-88.777778,30 - 47 (L),,UG64-UNoIll1969-1_83,Original Collection consisted of a series of 16mm Film reels.  This collection was digitized and put on DVD by Graham Warger in 2011. The DVD collection is referred to as the Collection on Vandal Training and Scouting Films - nwda-db.orbiscascade.org/findaid/ark:/80444/xv56115,Vandal Video Collection - Vandal Training and Scouting Films http://www.lib.uidaho.edu/digital/vandalvideo/,University of Idaho Digital Initiatives http://www.lib.uidaho.edu/digital/,"Educational use includes non-commercial use of text and images in materials for teaching and research purposes. Digital reproduction permissions granted by University of Idaho Library. For other uses beyond educational use, please contact University of Idaho Library Special Collections and Archives Department at libspec@uidaho.edu and University of Idaho Athletic Department.",http://rightsstatements.org/page/InC-EDU/1.0/?language=en,16mm Film,video/avi,Image;MovingImage,1:40:16,UG64-UNoIll1969-1_83.avi,1_83,83,4EH8ON5lfIY,http://digital.lib.uidaho.edu:80/cdm/ref/collection/vandalvideo/id/141,141,vandalvideo141
"University of Idaho vs. University of Oregon (Football), 10/29/1966",University of Oregon,UOre,Football,1966-10-29,1966,"Boise, ID",Bronco Stadium,43.602798,-116.195833,7 - 28 (L),,UG64-UOre1966-1_92,Original Collection consisted of a series of 16mm Film reels.  This collection was digitized and put on DVD by Graham Warger in 2011. The DVD collection is referred to as the Collection on Vandal Training and Scouting Films - nwda-db.orbiscascade.org/findaid/ark:/80444/xv56115,Vandal Video Collection - Vandal Training and Scouting Films http://www.lib.uidaho.edu/digital/vandalvideo/,University of Idaho Digital Initiatives http://www.lib.uidaho.edu/digital/,"Educational use includes non-commercial use of text and images in materials for teaching and research purposes. Digital reproduction permissions granted by University of Idaho Library. For other uses beyond educational use, please contact University of Idaho Library Special Collections and Archives Department at libspec@uidaho.edu and University of Idaho Athletic Department.",http://rightsstatements.org/page/InC-EDU/1.0/?language=en,16mm Film,video/avi,Image;MovingImage,1:14:34,UG64-UOre1966-1_92.avi,1_92,92,s9AR5V4e5lc,http://digital.lib.uidaho.edu:80/cdm/ref/collection/vandalvideo/id/142,142,vandalvideo142
"University of Idaho vs. University of Northern Illinois (Football), 11/22/1975",University of Northern Illinois,UNoIll,Football,1975-11-22,1975,"Moscow, ID",Kibbie Dome,46.726113,-117.015671,25 - 24 (W),,UG64-UNoIll1975-1_86,Original Collection consisted of a series of 16mm Film reels.  This collection was digitized and put on DVD by Graham Warger in 2011. The DVD collection is referred to as the Collection on Vandal Training and Scouting Films - nwda-db.orbiscascade.org/findaid/ark:/80444/xv56115,Vandal Video Collection - Vandal Training and Scouting Films http://www.lib.uidaho.edu/digital/vandalvideo/,University of Idaho Digital Initiatives http://www.lib.uidaho.edu/digital/,"Educational use includes non-commercial use of text and images in materials for teaching and research purposes. Digital reproduction permissions granted by University of Idaho Library. For other uses beyond educational use, please contact University of Idaho Library Special Collections and Archives Department at libspec@uidaho.edu and University of Idaho Athletic Department.",http://rightsstatements.org/page/InC-EDU/1.0/?language=en,16mm Film,video/avi,Image;MovingImage,2:55:16,UG64-UNoIll1975-1_86.avi,1_86,86,MiZuqnIsZXQ,http://digital.lib.uidaho.edu:80/cdm/ref/collection/vandalvideo/id/143,143,vandalvideo143
"University of Idaho vs. University of Oregon (Football), 10/09/1948",University of Oregon,UOre,Football,1948-10-09,1948,"Moscow, ID",Neale Stadium,46.726113,-117.015671,8 - 15 (L),,UG64-UOre1948-1_90,Original Collection consisted of a series of 16mm Film reels.  This collection was digitized and put on DVD by Graham Warger in 2011. The DVD collection is referred to as the Collection on Vandal Training and Scouting Films - nwda-db.orbiscascade.org/findaid/ark:/80444/xv56115,Vandal Video Collection - Vandal Training and Scouting Films http://www.lib.uidaho.edu/digital/vandalvideo/,University of Idaho Digital Initiatives http://www.lib.uidaho.edu/digital/,"Educational use includes non-commercial use of text and images in materials for teaching and research purposes. Digital reproduction permissions granted by University of Idaho Library. For other uses beyond educational use, please contact University of Idaho Library Special Collections and Archives Department at libspec@uidaho.edu and University of Idaho Athletic Department.",http://rightsstatements.org/page/InC-EDU/1.0/?language=en,16mm Film,video/avi,Image;MovingImage,0:30:42,UG64-UOre1948-1_90.avi,1_90,90,l3UCmLXUhOY,http://digital.lib.uidaho.edu:80/cdm/ref/collection/vandalvideo/id/144,144,vandalvideo144
"University of Idaho vs. University of Oregon (Football), 10/19/1968",University of Oregon,UOre,Football,1968-10-19,1968,"Eugene, OR",Autzen Stadium,44.058333,-123.068611,8 - 23 (L),Disc 1,UG64-UOre1968-1_93,Original Collection consisted of a series of 16mm Film reels.  This collection was digitized and put on DVD by Graham Warger in 2011. The DVD collection is referred to as the Collection on Vandal Training and Scouting Films - nwda-db.orbiscascade.org/findaid/ark:/80444/xv56115,Vandal Video Collection - Vandal Training and Scouting Films http://www.lib.uidaho.edu/digital/vandalvideo/,University of Idaho Digital Initiatives http://www.lib.uidaho.edu/digital/,"Educational use includes non-commercial use of text and images in materials for teaching and research purposes. Digital reproduction permissions granted by University of Idaho Library. For other uses beyond educational use, please contact University of Idaho Library Special Collections and Archives Department at libspec@uidaho.edu and University of Idaho Athletic Department.",http://rightsstatements.org/page/InC-EDU/1.0/?language=en,16mm Film,video/avi,Image;MovingImage,0:16:27,UG64-UOre1968-1_93.avi,1_93,93,RT1Vy0Bv2Ow,http://digital.lib.uidaho.edu:80/cdm/ref/collection/vandalvideo/id/145,145,vandalvideo145
"University of Idaho vs. University of Northern Illinois (Football), 10/14/1972",University of Northern Illinois,UNoIll,Football,1972-10-14,1972,"Moscow, ID",Idaho Stadium,46.726113,-117.015671,31 - 13 (W),,UG64-UNoIll1972-1_84,Original Collection consisted of a series of 16mm Film reels.  This collection was digitized and put on DVD by Graham Warger in 2011. The DVD collection is referred to as the Collection on Vandal Training and Scouting Films - nwda-db.orbiscascade.org/findaid/ark:/80444/xv56115,Vandal Video Collection - Vandal Training and Scouting Films http://www.lib.uidaho.edu/digital/vandalvideo/,University of Idaho Digital Initiatives http://www.lib.uidaho.edu/digital/,"Educational use includes non-commercial use of text and images in materials for teaching and research purposes. Digital reproduction permissions granted by University of Idaho Library. For other uses beyond educational use, please contact University of Idaho Library Special Collections and Archives Department at libspec@uidaho.edu and University of Idaho Athletic Department.",http://rightsstatements.org/page/InC-EDU/1.0/?language=en,16mm Film,video/avi,Image;MovingImage,2:31:40,UG64-UNoIll1972-1_84.avi,1_84,84,kO_kxFLtLok,http://digital.lib.uidaho.edu:80/cdm/ref/collection/vandalvideo/id/146,146,vandalvideo146
"University of Idaho vs. University of Northern Illinois (Football), 11/16/1974",University of Northern Illinois,UNoIll,Football,1974-11-16,1974,"Dekalb, IL",Huskie Stadium,41.933889,-88.777778,21 - 27 (L),,UG64-UNoIll1974-1_85,Original Collection consisted of a series of 16mm Film reels.  This collection was digitized and put on DVD by Graham Warger in 2011. The DVD collection is referred to as the Collection on Vandal Training and Scouting Films - nwda-db.orbiscascade.org/findaid/ark:/80444/xv56115,Vandal Video Collection - Vandal Training and Scouting Films http://www.lib.uidaho.edu/digital/vandalvideo/,University of Idaho Digital Initiatives http://www.lib.uidaho.edu/digital/,"Educational use includes non-commercial use of text and images in materials for teaching and research purposes. Digital reproduction permissions granted by University of Idaho Library. For other uses beyond educational use, please contact University of Idaho Library Special Collections and Archives Department at libspec@uidaho.edu and University of Idaho Athletic Department.",http://rightsstatements.org/page/InC-EDU/1.0/?language=en,16mm Film,video/avi,Image;MovingImage,1:40:17,UG64-UNoIll1974-1_85.avi,1_85,85,JqYSPkcJLMI,http://digital.lib.uidaho.edu:80/cdm/ref/collection/vandalvideo/id/147,147,vandalvideo147
"University of Idaho vs. University of Oregon (Football), 11/05/1938",University of Oregon,UOre,Football,1938-11-05,1938,"Eugene, OR",Hayward Field,44.04225,-123.07067,6 - 19 (L),,UG64-UOre1938-1_87,Original Collection consisted of a series of 16mm Film reels.  This collection was digitized and put on DVD by Graham Warger in 2011. The DVD collection is referred to as the Collection on Vandal Training and Scouting Films - nwda-db.orbiscascade.org/findaid/ark:/80444/xv56115,Vandal Video Collection - Vandal Training and Scouting Films http://www.lib.uidaho.edu/digital/vandalvideo/,University of Idaho Digital Initiatives http://www.lib.uidaho.edu/digital/,"Educational use includes non-commercial use of text and images in materials for teaching and research purposes. Digital reproduction permissions granted by University of Idaho Library. For other uses beyond educational use, please contact University of Idaho Library Special Collections and Archives Department at libspec@uidaho.edu and University of Idaho Athletic Department.",http://rightsstatements.org/page/InC-EDU/1.0/?language=en,16mm Film,video/avi,Image;MovingImage,0:28:34,UG64-UOre1938-1_87.avi,1_87,87,fBiGxvcwRkI,http://digital.lib.uidaho.edu:80/cdm/ref/collection/vandalvideo/id/148,148,vandalvideo148
"University of Idaho vs. University of the Pacific (Football), 10/17/1970",University of the Pacific,UPac,Football,1970-10-17,1970,"Pullman, WA",Autzen Stadium,44.058333,-123.068611,10 - 17 (L),,UG64-UPac1970-1_97,Original Collection consisted of a series of 16mm Film reels.  This collection was digitized and put on DVD by Graham Warger in 2011. The DVD collection is referred to as the Collection on Vandal Training and Scouting Films - nwda-db.orbiscascade.org/findaid/ark:/80444/xv56115,Vandal Video Collection - Vandal Training and Scouting Films http://www.lib.uidaho.edu/digital/vandalvideo/,University of Idaho Digital Initiatives http://www.lib.uidaho.edu/digital/,"Educational use includes non-commercial use of text and images in materials for teaching and research purposes. Digital reproduction permissions granted by University of Idaho Library. For other uses beyond educational use, please contact University of Idaho Library Special Collections and Archives Department at libspec@uidaho.edu and University of Idaho Athletic Department.",http://rightsstatements.org/page/InC-EDU/1.0/?language=en,16mm Film,video/avi,Image;MovingImage,1:31:39,UG64-UPac1970-1_97.avi,1_97,97,BKDblJkPZ7I,http://digital.lib.uidaho.edu:80/cdm/ref/collection/vandalvideo/id/149,149,vandalvideo149
"University of Idaho vs. Boise State University (Football), 10/30/1982",Boise State University,"Boise, IDSt",Football,1982-10-30,1982,"Boise, ID",Bronco Stadium,43.602798,-116.195833,24 - 17 (W),"Cliff : b/w 16mm, no audio, entire game, shot by athletic dept for scouting and game analysis","UG64-Boise, IDSt1982-1_14",Original Collection consisted of a series of 16mm Film reels.  This collection was digitized and put on DVD by Graham Warger in 2011. The DVD collection is referred to as the Collection on Vandal Training and Scouting Films - nwda-db.orbiscascade.org/findaid/ark:/80444/xv56115,Vandal Video Collection - Vandal Training and Scouting Films http://www.lib.uidaho.edu/digital/vandalvideo/,University of Idaho Digital Initiatives http://www.lib.uidaho.edu/digital/,"Educational use includes non-commercial use of text and images in materials for teaching and research purposes. Digital reproduction permissions granted by University of Idaho Library. For other uses beyond educational use, please contact University of Idaho Library Special Collections and Archives Department at libspec@uidaho.edu and University of Idaho Athletic Department.",http://rightsstatements.org/page/InC-EDU/1.0/?language=en,16mm Film,video/avi,Image;MovingImage,1:44:50,"UG64-Boise, IDSt1982-1_14.avi",1_14,14,RvEyWQ5H3bQ,http://digital.lib.uidaho.edu:80/cdm/ref/collection/vandalvideo/id/150,150,vandalvideo150
"University of Idaho vs. University of Oregon (Football), 10/31/1959",University of Oregon,UOre,Football,1959-10-31,1959,"Moscow, ID",Neale Stadium,46.726113,-117.015671,7 - 45 (L),,UG64-UOre1959-1_91,Original Collection consisted of a series of 16mm Film reels.  This collection was digitized and put on DVD by Graham Warger in 2011. The DVD collection is referred to as the Collection on Vandal Training and Scouting Films - nwda-db.orbiscascade.org/findaid/ark:/80444/xv56115,Vandal Video Collection - Vandal Training and Scouting Films http://www.lib.uidaho.edu/digital/vandalvideo/,University of Idaho Digital Initiatives http://www.lib.uidaho.edu/digital/,"Educational use includes non-commercial use of text and images in materials for teaching and research purposes. Digital reproduction permissions granted by University of Idaho Library. For other uses beyond educational use, please contact University of Idaho Library Special Collections and Archives Department at libspec@uidaho.edu and University of Idaho Athletic Department.",http://rightsstatements.org/page/InC-EDU/1.0/?language=en,16mm Film,video/avi,Image;MovingImage,1:20:04,UG64-UOre1959-1_91.avi,1_91,91,3ajaTVyKUpA,http://digital.lib.uidaho.edu:80/cdm/ref/collection/vandalvideo/id/151,151,vandalvideo151
"University of Idaho vs. University of the Pacific (Football), 10/28/1972",University of the Pacific,UPac,Football,1972-10-28,1972,"Moscow, ID",Idaho Stadium,46.732066,-117.160364,7 - 22 (L),1-2-3-4,UG64-UPac1972-1_99,Original Collection consisted of a series of 16mm Film reels.  This collection was digitized and put on DVD by Graham Warger in 2011. The DVD collection is referred to as the Collection on Vandal Training and Scouting Films - nwda-db.orbiscascade.org/findaid/ark:/80444/xv56115,Vandal Video Collection - Vandal Training and Scouting Films http://www.lib.uidaho.edu/digital/vandalvideo/,University of Idaho Digital Initiatives http://www.lib.uidaho.edu/digital/,"Educational use includes non-commercial use of text and images in materials for teaching and research purposes. Digital reproduction permissions granted by University of Idaho Library. For other uses beyond educational use, please contact University of Idaho Library Special Collections and Archives Department at libspec@uidaho.edu and University of Idaho Athletic Department.",http://rightsstatements.org/page/InC-EDU/1.0/?language=en,16mm Film,video/avi,Image;MovingImage,1:34:27,UG64-UPac1972-1_99.avi,1_99,99,uymgltLGg4M,http://digital.lib.uidaho.edu:80/cdm/ref/collection/vandalvideo/id/152,152,vandalvideo152
"University of Idaho vs. University of Oregon (Football), 11/01/1947",University of Oregon,UOre,Football,1947-11-01,1947,"Eugene, OR",Hayward Field,44.04225,-123.07067,7 - 34 (L),,UG64-UOre1947-1_89,Original Collection consisted of a series of 16mm Film reels.  This collection was digitized and put on DVD by Graham Warger in 2011. The DVD collection is referred to as the Collection on Vandal Training and Scouting Films - nwda-db.orbiscascade.org/findaid/ark:/80444/xv56115,Vandal Video Collection - Vandal Training and Scouting Films http://www.lib.uidaho.edu/digital/vandalvideo/,University of Idaho Digital Initiatives http://www.lib.uidaho.edu/digital/,"Educational use includes non-commercial use of text and images in materials for teaching and research purposes. Digital reproduction permissions granted by University of Idaho Library. For other uses beyond educational use, please contact University of Idaho Library Special Collections and Archives Department at libspec@uidaho.edu and University of Idaho Athletic Department.",http://rightsstatements.org/page/InC-EDU/1.0/?language=en,16mm Film,video/avi,Image;MovingImage,0:32:55,UG64-UOre1947-1_89.avi,1_89,89,puf3LS9HhTM,http://digital.lib.uidaho.edu:80/cdm/ref/collection/vandalvideo/id/153,153,vandalvideo153
"University of Idaho vs. University of Oregon (Football), 11/01/1969",University of Oregon,UOre,Football,1969-11-01,1969,"Eugene, OR",Autzen Stadium,44.058333,-123.068611,14 - 58 (L),,UG64-UOre1969-1_95,Original Collection consisted of a series of 16mm Film reels.  This collection was digitized and put on DVD by Graham Warger in 2011. The DVD collection is referred to as the Collection on Vandal Training and Scouting Films - nwda-db.orbiscascade.org/findaid/ark:/80444/xv56115,Vandal Video Collection - Vandal Training and Scouting Films http://www.lib.uidaho.edu/digital/vandalvideo/,University of Idaho Digital Initiatives http://www.lib.uidaho.edu/digital/,"Educational use includes non-commercial use of text and images in materials for teaching and research purposes. Digital reproduction permissions granted by University of Idaho Library. For other uses beyond educational use, please contact University of Idaho Library Special Collections and Archives Department at libspec@uidaho.edu and University of Idaho Athletic Department.",http://rightsstatements.org/page/InC-EDU/1.0/?language=en,16mm Film,video/avi,Image;MovingImage,1:33:50,UG64-UOre1969-1_95.avi,1_95,95,hD6E73Ftnys,http://digital.lib.uidaho.edu:80/cdm/ref/collection/vandalvideo/id/154,154,vandalvideo154
"University of Idaho vs. University of Oregon (Football), 10/17/1970",University of Oregon,UOre,Football,1970-10-17,1970,"Eugene, OR",Autzen Stadium,44.058333,-123.068611,13 - 49 (L),,UG64-UOre1970-1_96,Original Collection consisted of a series of 16mm Film reels.  This collection was digitized and put on DVD by Graham Warger in 2011. The DVD collection is referred to as the Collection on Vandal Training and Scouting Films - nwda-db.orbiscascade.org/findaid/ark:/80444/xv56115,Vandal Video Collection - Vandal Training and Scouting Films http://www.lib.uidaho.edu/digital/vandalvideo/,University of Idaho Digital Initiatives http://www.lib.uidaho.edu/digital/,"Educational use includes non-commercial use of text and images in materials for teaching and research purposes. Digital reproduction permissions granted by University of Idaho Library. For other uses beyond educational use, please contact University of Idaho Library Special Collections and Archives Department at libspec@uidaho.edu and University of Idaho Athletic Department.",http://rightsstatements.org/page/InC-EDU/1.0/?language=en,16mm Film,video/avi,Image;MovingImage,1:33:32,UG64-UOre1970-1_96.avi,1_96,96,jGtKhMOehpg,http://digital.lib.uidaho.edu:80/cdm/ref/collection/vandalvideo/id/155,155,vandalvideo155
"University of Idaho vs. University of Oregon (Football), 10/26/1946",University of Oregon,UOre,Football,1946-10-26,1946,"Moscow, ID",Neale Stadium,46.726113,-117.015671,13 - 26 (L),,UG64-UOre1946-1_88,Original Collection consisted of a series of 16mm Film reels.  This collection was digitized and put on DVD by Graham Warger in 2011. The DVD collection is referred to as the Collection on Vandal Training and Scouting Films - nwda-db.orbiscascade.org/findaid/ark:/80444/xv56115,Vandal Video Collection - Vandal Training and Scouting Films http://www.lib.uidaho.edu/digital/vandalvideo/,University of Idaho Digital Initiatives http://www.lib.uidaho.edu/digital/,"Educational use includes non-commercial use of text and images in materials for teaching and research purposes. Digital reproduction permissions granted by University of Idaho Library. For other uses beyond educational use, please contact University of Idaho Library Special Collections and Archives Department at libspec@uidaho.edu and University of Idaho Athletic Department.",http://rightsstatements.org/page/InC-EDU/1.0/?language=en,16mm Film,video/avi,Image;MovingImage,0:44:14,UG64-UOre1946-1_88.avi,1_88,88,IVUAaxiFHNo,http://digital.lib.uidaho.edu:80/cdm/ref/collection/vandalvideo/id/156,156,vandalvideo156
"University of Idaho vs. University of Oregon (Football), 10/19/1968",University of Oregon,UOre,Football,1968-10-19,1968,"Eugene, OR",Autzen Stadium,44.058333,-123.068611,8 - 23 (L),Disc 2,UG64-UOre1968-1_94,Original Collection consisted of a series of 16mm Film reels.  This collection was digitized and put on DVD by Graham Warger in 2011. The DVD collection is referred to as the Collection on Vandal Training and Scouting Films - nwda-db.orbiscascade.org/findaid/ark:/80444/xv56115,Vandal Video Collection - Vandal Training and Scouting Films http://www.lib.uidaho.edu/digital/vandalvideo/,University of Idaho Digital Initiatives http://www.lib.uidaho.edu/digital/,"Educational use includes non-commercial use of text and images in materials for teaching and research purposes. Digital reproduction permissions granted by University of Idaho Library. For other uses beyond educational use, please contact University of Idaho Library Special Collections and Archives Department at libspec@uidaho.edu and University of Idaho Athletic Department.",http://rightsstatements.org/page/InC-EDU/1.0/?language=en,16mm Film,video/avi,Image;MovingImage,0:20:22,UG64-UOre1968-1_94.avi,1_94,94,c-YD5x_s3bI,http://digital.lib.uidaho.edu:80/cdm/ref/collection/vandalvideo/id/157,157,vandalvideo157
"University of Idaho vs. University of the Pacific (Football), 10/28/1972",University of the Pacific,UPac,Football,1972-10-28,1972,"Moscow, ID",Idaho Stadium,46.726113,-117.015671,7 - 22 (L),,UG64-UPac1972-1_98,Original Collection consisted of a series of 16mm Film reels.  This collection was digitized and put on DVD by Graham Warger in 2011. The DVD collection is referred to as the Collection on Vandal Training and Scouting Films - nwda-db.orbiscascade.org/findaid/ark:/80444/xv56115,Vandal Video Collection - Vandal Training and Scouting Films http://www.lib.uidaho.edu/digital/vandalvideo/,University of Idaho Digital Initiatives http://www.lib.uidaho.edu/digital/,"Educational use includes non-commercial use of text and images in materials for teaching and research purposes. Digital reproduction permissions granted by University of Idaho Library. For other uses beyond educational use, please contact University of Idaho Library Special Collections and Archives Department at libspec@uidaho.edu and University of Idaho Athletic Department.",http://rightsstatements.org/page/InC-EDU/1.0/?language=en,16mm Film,video/avi,Image;MovingImage,1:34:25,UG64-UPac1972-1_98.avi,1_98,98,ZKpXn7qSaIk,http://digital.lib.uidaho.edu:80/cdm/ref/collection/vandalvideo/id/158,158,vandalvideo158
"University of Idaho vs. University of the Pacific (Football), 10/28/1972",University of the Pacific,UPac,Football,1972-10-28,1972,"Moscow, ID",Idaho Stadium,46.726113,-117.015671,7 - 22 (L),,UG64-UPac1972-1_100,Original Collection consisted of a series of 16mm Film reels.  This collection was digitized and put on DVD by Graham Warger in 2011. The DVD collection is referred to as the Collection on Vandal Training and Scouting Films - nwda-db.orbiscascade.org/findaid/ark:/80444/xv56115,Vandal Video Collection - Vandal Training and Scouting Films http://www.lib.uidaho.edu/digital/vandalvideo/,University of Idaho Digital Initiatives http://www.lib.uidaho.edu/digital/,"Educational use includes non-commercial use of text and images in materials for teaching and research purposes. Digital reproduction permissions granted by University of Idaho Library. For other uses beyond educational use, please contact University of Idaho Library Special Collections and Archives Department at libspec@uidaho.edu and University of Idaho Athletic Department.",http://rightsstatements.org/page/InC-EDU/1.0/?language=en,16mm Film,video/avi,Image;MovingImage,1:14:46,UG64-UPac1972-1_100.avi,1_100,100,mHcaxoShZZQ,http://digital.lib.uidaho.edu:80/cdm/ref/collection/vandalvideo/id/159,159,vandalvideo159
"University of Idaho vs. University of the Pacific (Football), 09/17/1977",University of the Pacific,UPac,Football,1977-09-17,1977,"Moscow, ID",Kibbie Dome,46.726113,-117.015671,21 - 31 (L),,UG64-UPac1977-1_101,Original Collection consisted of a series of 16mm Film reels.  This collection was digitized and put on DVD by Graham Warger in 2011. The DVD collection is referred to as the Collection on Vandal Training and Scouting Films - nwda-db.orbiscascade.org/findaid/ark:/80444/xv56115,Vandal Video Collection - Vandal Training and Scouting Films http://www.lib.uidaho.edu/digital/vandalvideo/,University of Idaho Digital Initiatives http://www.lib.uidaho.edu/digital/,"Educational use includes non-commercial use of text and images in materials for teaching and research purposes. Digital reproduction permissions granted by University of Idaho Library. For other uses beyond educational use, please contact University of Idaho Library Special Collections and Archives Department at libspec@uidaho.edu and University of Idaho Athletic Department.",http://rightsstatements.org/page/InC-EDU/1.0/?language=en,16mm Film,video/avi,Image;MovingImage,0:21:15,UG64-UPac1977-1_101.avi,1_101,101,TCzCFuwXvUg,http://digital.lib.uidaho.edu:80/cdm/ref/collection/vandalvideo/id/160,160,vandalvideo160
"University of Idaho vs. Boise State University (Football), 11/18/1995",Boise State University,"Boise, IDSt",Football,1995-11-18,1995,"Moscow, ID",Kibbie Dome,46.726113,-117.015671,33 - 13 (W),Idaho-Boise State: offense only; assorted Idaho practices,"UG64-Boise, IDSt1995-1_28",Original Collection consisted of a series of 16mm Film reels.  This collection was digitized and put on DVD by Graham Warger in 2011. The DVD collection is referred to as the Collection on Vandal Training and Scouting Films - nwda-db.orbiscascade.org/findaid/ark:/80444/xv56115,Vandal Video Collection - Vandal Training and Scouting Films http://www.lib.uidaho.edu/digital/vandalvideo/,University of Idaho Digital Initiatives http://www.lib.uidaho.edu/digital/,"Educational use includes non-commercial use of text and images in materials for teaching and research purposes. Digital reproduction permissions granted by University of Idaho Library. For other uses beyond educational use, please contact University of Idaho Library Special Collections and Archives Department at libspec@uidaho.edu and University of Idaho Athletic Department.",http://rightsstatements.org/page/InC-EDU/1.0/?language=en,16mm Film,video/avi,Image;MovingImage,3:04:06,"UG64-Boise, IDSt1995-1_28.avi",1_28,28,yDU6sw6xyRc,http://digital.lib.uidaho.edu:80/cdm/ref/collection/vandalvideo/id/161,161,vandalvideo161
"University of Idaho vs. Boise State University (Football), 11/22/1997",Boise State University,"Boise, IDSt",Football,1997-11-22,1997,"Moscow, ID",Kibbie Dome,46.726113,-117.015671,23 - 30 (L),Wide version,"UG64-Boise, IDSt1997-1_30",Original Collection consisted of a series of 16mm Film reels.  This collection was digitized and put on DVD by Graham Warger in 2011. The DVD collection is referred to as the Collection on Vandal Training and Scouting Films - nwda-db.orbiscascade.org/findaid/ark:/80444/xv56115,Vandal Video Collection - Vandal Training and Scouting Films http://www.lib.uidaho.edu/digital/vandalvideo/,University of Idaho Digital Initiatives http://www.lib.uidaho.edu/digital/,"Educational use includes non-commercial use of text and images in materials for teaching and research purposes. Digital reproduction permissions granted by University of Idaho Library. For other uses beyond educational use, please contact University of Idaho Library Special Collections and Archives Department at libspec@uidaho.edu and University of Idaho Athletic Department.",http://rightsstatements.org/page/InC-EDU/1.0/?language=en,16mm Film,video/avi,Image;MovingImage,2:11:37,"UG64-Boise, IDSt1997-1_30.avi",1_30,30,fd47I9gI1WI,http://digital.lib.uidaho.edu:80/cdm/ref/collection/vandalvideo/id/162,162,vandalvideo162
"University of Idaho vs. Boise State University (Football), 11/22/1997",Boise State University,"Boise, IDSt",Football,1997-11-22,1997,"Moscow, ID",Kibbie Dome,46.726113,-117.015671,23 - 30 (L),End zone version,"UG64-Boise, IDSt1997-1_29",Original Collection consisted of a series of 16mm Film reels.  This collection was digitized and put on DVD by Graham Warger in 2011. The DVD collection is referred to as the Collection on Vandal Training and Scouting Films - nwda-db.orbiscascade.org/findaid/ark:/80444/xv56115,Vandal Video Collection - Vandal Training and Scouting Films http://www.lib.uidaho.edu/digital/vandalvideo/,University of Idaho Digital Initiatives http://www.lib.uidaho.edu/digital/,"Educational use includes non-commercial use of text and images in materials for teaching and research purposes. Digital reproduction permissions granted by University of Idaho Library. For other uses beyond educational use, please contact University of Idaho Library Special Collections and Archives Department at libspec@uidaho.edu and University of Idaho Athletic Department.",http://rightsstatements.org/page/InC-EDU/1.0/?language=en,16mm Film,video/avi,Image;MovingImage,1:57:03,"UG64-Boise, IDSt1997-1_29.avi",1_29,29,ZXkMHrWgfrw,http://digital.lib.uidaho.edu:80/cdm/ref/collection/vandalvideo/id/163,163,vandalvideo163
University of Idaho Football highlights 1995,University of Idaho football highlights,Uidaho,Football,1995-11-18,1995,"Moscow, ID",Neale Stadium,46.726813,-117.015671,Varies,,"UG64-Boise, IDSt1995-1_28",Original Collection consisted of a series of 16mm Film reels.  This collection was digitized and put on DVD by Graham Warger in 2011. The DVD collection is referred to as the Collection on Vandal Training and Scouting Films - nwda-db.orbiscascade.org/findaid/ark:/80444/xv56115,Vandal Video Collection - Vandal Training and Scouting Films http://www.lib.uidaho.edu/digital/vandalvideo/,University of Idaho Digital Initiatives http://www.lib.uidaho.edu/digital/,"Educational use includes non-commercial use of text and images in materials for teaching and research purposes. Digital reproduction permissions granted by University of Idaho Library. For other uses beyond educational use, please contact University of Idaho Library Special Collections and Archives Department at libspec@uidaho.edu and University of Idaho Athletic Department.",http://rightsstatements.org/page/InC-EDU/1.0/?language=en,16mm Film,video/avi,Image;MovingImage,3:04:06,"UG64-Boise, IDSt1995-1_28.avi",,28,EZ769396l9w,http://digital.lib.uidaho.edu:80/cdm/ref/collection/vandalvideo/id/164,164,vandalvideo164
"Idaho vs Farragut Navy (Football), 10/13/1945",Farragut Navy,FN,Football,1945-10-13,1945,"Moscow, ID",Neale Stadium,46.726713,-117.015671,7-18 (L),,UG64-Faragut194.avi,Original Collection consisted of a series of 16mm Film reels.  This collection was digitized and put on DVD by Graham Warger in 2011. The DVD collection is referred to as the Collection on Vandal Training and Scouting Films - nwda-db.orbiscascade.org/finda,Vandal Video Collection - Vandal Training and Scouting Films http://www.lib.uidaho.edu/digital/vandalvideo/,University of Idaho Digital Initiatives http://www.lib.uidaho.edu/digital/,"Educational use includes non-commercial use of text and images in materials for teaching and research purposes. Digital reproduction permissions granted by University of Idaho Library. For other uses beyond educational use, please contact University of Idaho Library Special Collections and Archives Department at libspec@uidaho.edu and University of Idaho Athletic Department.",http://rightsstatements.org/page/InC-EDU/1.0/?language=en,16mm Film,video/avi,Image;MovingImage,0:35:02,UG64-Faragut194.avi,163,163,Jxb8jtGBd9U,http://digital.lib.uidaho.edu:80/cdm/ref/collection/vandalvideo/id/165,165,vandalvideo165
"Idaho vs Idaho State University (Football), 09/02/1962",Idaho State University,IDST,Football,1962-09-02,1962,"Moscow, ID",Neale Stadium,46.726913,-117.015671,9-6 (W),,UG64-ISU1962.avi,Original Collection consisted of a series of 16mm Film reels.  This collection was digitized and put on DVD by Graham Warger in 2011. The DVD collection is referred to as the Collection on Vandal Training and Scouting Films - nwda-db.orbiscascade.org/finda,Vandal Video Collection - Vandal Training and Scouting Films http://www.lib.uidaho.edu/digital/vandalvideo/,University of Idaho Digital Initiatives http://www.lib.uidaho.edu/digital/,"Educational use includes non-commercial use of text and images in materials for teaching and research purposes. Digital reproduction permissions granted by University of Idaho Library. For other uses beyond educational use, please contact University of Idaho Library Special Collections and Archives Department at libspec@uidaho.edu and University of Idaho Athletic Department.",http://rightsstatements.org/page/InC-EDU/1.0/?language=en,16mm Film,video/avi,Image;MovingImage,0:27:47,UG64-ISU1962.avi,162,162,Q4lOky1lMWs,http://digital.lib.uidaho.edu:80/cdm/ref/collection/vandalvideo/id/166,166,vandalvideo166